Sheet: scene
A1: 场景id | B1: 场景名称 | C1: 场景类型 | D1: 场景是否开服启动 | E1: 是否为多进程场景 | F1: 场景文件夹 | G1: 逻辑场景文件夹 | H1: 场景宽 | I1: 场景长 | J1: 小地图路径 | K1: 小地图宽 | L1: 小地图高 | M1: 场景等级 | N1: 允许传入 | O1: 允许传送 | P1: 组队模式 | Q1: 允许自动战斗 | R1: 允许在该地图进行智能挂机 | S1: 允许在该地图开启智能挂机（默认是） | T1: 允许在该地图开启一键整备（默认是）（快速买药同） | U1: 地图显示模式 | W1: 地图等级 | X1: 随机天气列表 | Y1: 受全服多倍经验影响 | Z1: 退出副本返回点 | AA1: 进入副本血量回满 | AB1: 场景标准人数 | AC1: 最大分线数 | AD1: 传送离开地图时的警告信息 | AE1: 传送离开地图时的警告消息 | AF1: 场景事件 | AG1: 切场景获得buff列表 | AH1: 登录场景获得buff列表 | AI1: 团体ai类型 | AJ1: 完成副本显示提示 | AK1: 完成副本立即退出 | AL1: 死亡处理
A2: scene_id | B2: name | C2: sceneType | D2: initFlag | E2: mapExt | F2: sceneFile | G2: logicScene | H2: sceneW | I2: sceneH | J2: thumbnailPath | K2: thumbnailW | L2: thumbnailH | M2: sceneLevel | N2: transfer | O2: fly | P2: teamMode | Q2: autoFight | R2: intelligentFight | S2: startIntelligentFight | T2: startYJZB | U2: view_type | V2: 如果对应的场景需要划定安全区，则会利用到logic配置，相关的logic配置需要程序手写。规定logic的配置在指定文件夹下，并且名称与场景名文件夹保持相同，即不需要额外的配置。 | X2: randomWeatherList | Y2: exp_ratio_influence | Z2: back_place | AA2: fill_hp | AB2: format_player_count | AC2: line_max_count | AD2: warn | AE2: warnMsg | AF2: incident | AG2: changeSceneBuff | AH2: loginSceneBuff | AI2: group_type | AJ2: finishedMessage | AK2: finishedExit | AL2: dead
A3: 2001 | B3: 试炼祭坛 | C3: 活动场景 | D3: 0 | E3: 单进程 | F3: danrentiaozhan | G3: 2001 | H3: 60 | I3: 60 | J3: tab_map2.dt_jinghulindi | K3: =16*RC[-3]/3 -> 320 | L3: =16*RC[-3]/3 -> 320 | M3: 1 | N3: 否 | O3: 是 | P3: 0 | Q3: 是 | R3: 否 | S3: 否 | T3: 否 | U3: 2 | W3: 0 | Y3: 否 | AD3: 退出副本将导致副本失败，是否退出? | AE3: warnPG | AF3: 否 | AG3: [10412] | AH3: [10412] | AI3: normal | AL3: ignore
A4: 2000 | B4: 虚空之桥 | C4: 剧情副本 | D4: 0 | E4: 多进程 | F4: xukongzhiqiao | G4: 2000 | H4: 150 | I4: 150 | J4: vfs://piassets/ui/img/map/dt_xukongzhiqiao.png | K4: =16*RC[-3]/3 -> 800 | L4: =16*RC[-3]/3 -> 800 | M4: 1 | N4: 否 | O4: 否 | P4: 2#1111 | Q4: 是 | R4: 否 | S4: 否 | T4: 否 | U4: 2 | W4: 0 | Z4: {3000,{81,0,15}} | AF4: 否 | AG4: [10412,10413] | AH4: [10412,10413] | AI4: normal
A5: 3000 | B5: 神佑之地 | C5: 主场景 | D5: 1 | E5: 多进程 | F5: shenyouzhidi | G5: 3000 | H5: 270 | I5: 240 | J5: vfs://piassets/ui/img/dituguanli/xiaoditu/dt_luandou.png | K5: =16*RC[-3]/3 -> 1440 | L5: =16*RC[-3]/3 -> 1280 | M5: 1 | N5: 是 | O5: 否 | P5: 2#1111 | Q5: 是 | R5: 否 | S5: 否 | T5: 否 | U5: 2 | W5: 0 | AB5: 500 | AC5: 6 | AF5: 否 | AG5: [10412] | AH5: [10412] | AI5: normal
A6: 30001 | B6: 神佑之地 | C6: 剧情副本 | D6: 0 | E6: 多进程 | F6: shenyouzhidi | G6: 30001 | H6: 270 | I6: 240 | J6: vfs://piassets/ui/img/dituguanli/xiaoditu/dt_luandou.png | K6: 1440 | L6: 1280 | M6: 1 | N6: 否 | O6: 否 | P6: 2#1111 | Q6: 是 | R6: 否 | S6: 否 | T6: 否 | U6: 2 | W6: 0 | Z6: {3000,{25,0,190}} | AF6: 否 | AG6: [10413] | AH6: [10412,10413] | AI6: normal | AK6: 1
A7: 30002 | B7: 神佑之地 | C7: 剧情副本 | D7: 0 | E7: 多进程 | F7: shenyouzhidi | G7: 30002 | H7: 270 | I7: 240 | J7: vfs://piassets/ui/img/dituguanli/xiaoditu/dt_luandou.png | K7: 1440 | L7: 1280 | M7: 1 | N7: 否 | O7: 否 | P7: 2#1111 | Q7: 是 | R7: 否 | S7: 否 | T7: 否 | U7: 2 | W7: 0 | Z7: {3000,{136,0,164}} | AF7: 否 | AG7: [10413] | AH7: [10412,10413] | AI7: normal | AK7: 1
A8: 30003 | B8: 神佑之地 | C8: 剧情副本 | D8: 0 | E8: 多进程 | F8: shenyouzhidi | G8: 30003 | H8: 270 | I8: 240 | J8: vfs://piassets/ui/img/dituguanli/xiaoditu/dt_luandou.png | K8: 1440 | L8: 1280 | M8: 1 | N8: 否 | O8: 否 | P8: 2#1111 | Q8: 是 | R8: 否 | S8: 否 | T8: 否 | U8: 2 | W8: 0 | Z8: {3000,{230,0,135}} | AF8: 否 | AG8: [10413] | AH8: [10412,10413] | AI8: normal | AK8: 1
A9: 30004 | B9: 神佑之地 | C9: 剧情副本 | D9: 0 | E9: 多进程 | F9: shenyouzhidi | G9: 30004 | H9: 270 | I9: 240 | J9: vfs://piassets/ui/img/dituguanli/xiaoditu/dt_luandou.png | K9: 1440 | L9: 1280 | M9: 1 | N9: 否 | O9: 否 | P9: 2#1111 | Q9: 是 | R9: 否 | S9: 否 | T9: 否 | U9: 2 | W9: 0 | Z9: {3000,{222,0,139}} | AF9: 否 | AG9: [10413] | AH9: [10412,10413] | AI9: normal | AK9: 1
A10: 30005 | B10: 神佑之地 | C10: 剧情副本 | D10: 0 | E10: 多进程 | F10: shenyouzhidi | G10: 30005 | H10: 270 | I10: 240 | J10: vfs://piassets/ui/img/dituguanli/xiaoditu/dt_luandou.png | K10: 1440 | L10: 1280 | M10: 1 | N10: 否 | O10: 否 | P10: 2#1111 | Q10: 是 | R10: 否 | S10: 否 | T10: 否 | U10: 2 | W10: 0 | Z10: {3000,{217,0,135}} | AF10: 否 | AG10: [10413] | AH10: [10412,10413] | AI10: normal | AK10: 1
A11: 5001 | B11: 乱斗场 | C11: 活动场景 | D11: 0 | E11: 单进程 | F11: luandouchang | G11: 5001 | H11: 60 | I11: 60 | J11: vfs://piassets/ui/img/dituguanli/xiaoditu/dt_luandou.png | K11: =16*RC[-3]/3 -> 320 | L11: =16*RC[-3]/3 -> 320 | M11: 1 | N11: 否 | O11: 是 | P11: 2#1111 | Q11: 否 | R11: 否 | T11: 否 | U11: 2 | W11: 0 | Y11: 否 | Z11: {1003,{30,0,100}} | AF11: 否 | AG11: [10412] | AH11: [10412] | AI11: normal | AL11: wrestle
A12: 5002 | B12: 暴风战区 | C12: 跨服场景 | D12: 0 | E12: 多进程 | F12: 30kuafufuben | G12: 5002 | H12: 270 | I12: 240 | J12: vfs://piassets/ui/img/dituguanli/xiaoditu/dt_luandou.png | K12: =16*RC[-3]/3 -> 1440 | L12: =16*RC[-3]/3 -> 1280 | M12: 28 | N12: 否 | O12: 是 | P12: 2#1100 | Q12: 是 | R12: 否 | T12: 否 | U12: 2 | W12: 0 | Y12: 否 | Z12: {3001,{176,10,171}} | AB12: 100 | AC12: 5 | AF12: 是 | AG12: [10412] | AH12: [10412] | AI12: normal
A13: 5003 | B13: 暴风战区 | C13: 跨服场景 | D13: 0 | E13: 多进程 | F13: baofengzhanqu | G13: 5003 | H13: 210 | I13: 180 | J13: vfs://piassets/ui/img/dituguanli/xiaoditu/dt_luandou.png | K13: =16*RC[-3]/3 -> 1120 | L13: =16*RC[-3]/3 -> 960 | M13: 30 | N13: 否 | O13: 是 | P13: 2#1100 | Q13: 是 | R13: 否 | T13: 否 | U13: 2 | W13: 0 | Y13: 否 | Z13: {3001,{176,10,171}} | AB13: 100 | AC13: 5 | AF13: 是 | AG13: [10412] | AH13: [10412] | AI13: normal
A14: 3001 | B14: 圣光城 | C14: 主场景 | D14: 1 | E14: 多进程 | F14: zhucheng | G14: 3001 | H14: 300 | I14: 300 | J14: vfs://piassets/ui/img/dituguanli/xiaoditu/dt_luandou.png | K14: =16*RC[-3]/3 -> 1600 | L14: =16*RC[-3]/3 -> 1600 | M14: 1 | N14: 是 | O14: 是 | P14: 2#1111 | Q14: 是 | R14: 否 | U14: 1 | W14: 1 | X14: [{60,default},{15,rain},{5,thunderStorm},{5,fog}] | AB14: 500 | AC14: 4 | AF14: 否 | AG14: [10412] | AH14: [10412] | AI14: normal
A15: 30011 | B15: 圣光城 | C15: 剧情副本 | D15: 0 | E15: 多进程 | F15: zhucheng | G15: 30011 | H15: 300 | I15: 300 | J15: vfs://piassets/ui/img/dituguanli/xiaoditu/dt_luandou.png | K15: =16*RC[-3]/3 -> 1600 | L15: =16*RC[-3]/3 -> 1600 | M15: 1 | N15: 否 | O15: 否 | P15: 2#1111 | Q15: 是 | R15: 否 | S15: 否 | T15: 否 | U15: 2 | W15: 0 | Z15: {3001,{255,0,248}} | AF15: 否 | AG15: [10413] | AH15: [10412,10413] | AI15: normal | AK15: 1
A16: 30012 | B16: 圣光城 | C16: 剧情副本 | D16: 0 | E16: 多进程 | F16: zhucheng | G16: 30012 | H16: 300 | I16: 300 | J16: vfs://piassets/ui/img/dituguanli/xiaoditu/dt_luandou.png | K16: =16*RC[-3]/3 -> 1600 | L16: =16*RC[-3]/3 -> 1600 | M16: 1 | N16: 否 | O16: 否 | P16: 2#1111 | Q16: 是 | R16: 否 | S16: 否 | T16: 否 | U16: 2 | W16: 0 | Z16: {3001,{226,0,117}} | AF16: 否 | AG16: [10413] | AH16: [10412,10413] | AI16: normal | AK16: 1
A17: 1006 | B17: 微风平原 | C17: 主场景 | D17: 1 | E17: 多进程 | F17: weifengpingyuan | G17: 1006 | H17: 270 | I17: 210 | J17: tab_map3.dt_weifengpingyuan | K17: =16*RC[-3]/3 -> 1440 | L17: =16*RC[-3]/3 -> 1120 | M17: 1 | N17: 是 | O17: 是 | P17: 2#1111 | Q17: 是 | R17: 是 | U17: 1 | W17: 15 | X17: [{60,default},{20,rain},{5,thunderStorm},{5,fog}] | AB17: 200 | AC17: 10 | AF17: 否 | AG17: [10412] | AH17: [10412] | AI17: normal
A18: 10061 | B18: 微风平原 | C18: 剧情副本 | D18: 0 | E18: 多进程 | F18: weifengpingyuan | G18: 10061 | H18: 270 | I18: 210 | J18: tab_map3.dt_weifengpingyuan | K18: =16*RC[-3]/3 -> 1440 | L18: =16*RC[-3]/3 -> 1120 | M18: 1 | N18: 否 | O18: 否 | P18: 2#1111 | Q18: 是 | R18: 否 | S18: 否 | T18: 否 | U18: 2 | W18: 0 | Z18: {1006,{77,0,122}} | AF18: 否 | AG18: [10413] | AH18: [10412,10413] | AI18: normal | AK18: 1
A19: 10062 | B19: 微风平原 | C19: 剧情副本 | D19: 0 | E19: 多进程 | F19: weifengpingyuan | G19: 10062 | H19: 270 | I19: 210 | J19: tab_map3.dt_weifengpingyuan | K19: =16*RC[-3]/3 -> 1440 | L19: =16*RC[-3]/3 -> 1120 | M19: 1 | N19: 否 | O19: 否 | P19: 2#1111 | Q19: 是 | R19: 否 | S19: 否 | T19: 否 | U19: 2 | W19: 0 | Z19: {1006,{140,0,170}} | AF19: 否 | AG19: [10413] | AH19: [10412,10413] | AI19: normal | AK19: 1
A20: 1003 | B20: 日暮森林 | C20: 主场景 | D20: 1 | E20: 多进程 | F20: musesenlin | G20: 1003 | H20: 330 | I20: 270 | J20: tab_map2.dt_jinghulindi | K20: =16*RC[-3]/3 -> 1760 | L20: =16*RC[-3]/3 -> 1440 | M20: 1 | N20: 是 | O20: 是 | P20: 2#1111 | Q20: 是 | R20: 是 | U20: 1 | W20: 25 | X20: [{60,default},{20,rain},{5,thunderStorm},{5,fog}] | AB20: 345 | AC20: 8 | AF20: 否 | AG20: [10412] | AH20: [10412] | AI20: normal
A21: 1005 | B21: 巨岩沙海 | C21: 主场景 | D21: 1 | E21: 多进程 | F21: juyanshahai | G21: 1005 | H21: 480 | I21: 450 | J21: vfs://piassets/ui/img/map/dt_juyanshahai.png | K21: =16*RC[-3]/3 -> 2560 | L21: =16*RC[-3]/3 -> 2400 | M21: 1 | N21: 是 | O21: 是 | P21: 2#1111 | Q21: 是 | R21: 是 | U21: 1 | W21: 35 | X21: [{65,default},{5,rain},{5,thunderStorm},{5,fog}] | AB21: 600 | AC21: 4 | AF21: 否 | AG21: [10412] | AH21: [10412] | AI21: normal
A22: 1101 | B22: 不朽圣殿一层 | C22: 主场景 | D22: 1 | E22: 多进程 | F22: buxiushengdian | G22: 1101 | H22: 360 | I22: 360 | J22: vfs://piassets/ui/img/map/dt_buxiushengdian_1.png | K22: =16*RC[-3]/3 -> 1920 | L22: =16*RC[-3]/3 -> 1920 | M22: 1 | N22: 否 | O22: 是 | P22: 2#1111 | Q22: 是 | R22: 否 | T22: 否 | U22: 1 | W22: 36 | AB22: 333 | AC22: 6 | AF22: 否 | AG22: [10412] | AH22: [10412] | AI22: normal
A23: 1102 | B23: 不朽圣殿二层 | C23: 主场景 | D23: 1 | E23: 多进程 | F23: buxiushengdian_2ceng | G23: 1102 | H23: 330 | I23: 330 | J23: vfs://piassets/ui/img/map/dt_buxiushengdian_2.png | K23: =16*RC[-3]/3 -> 1760 | L23: =16*RC[-3]/3 -> 1760 | M23: 1 | N23: 否 | O23: 是 | P23: 2#1111 | Q23: 是 | R23: 否 | T23: 否 | U23: 1 | W23: 37 | AB23: 233 | AC23: 6 | AF23: 否 | AG23: [10412] | AH23: [10412] | AI23: normal
A24: 1007 | B24: 叹息之地 | C24: 主场景 | D24: 1 | E24: 多进程 | F24: yiwangzhidi | G24: 1007 | H24: 420 | I24: 330 | J24: vfs://piassets/ui/img/map/dt_tanxizhidi.png | K24: =16*RC[-3]/3 -> 2240 | L24: =16*RC[-3]/3 -> 1760 | M24: 1 | N24: 是 | O24: 是 | P24: 2#1111 | Q24: 是 | R24: 是 | U24: 1 | W24: 45 | X24: [{60,default},{20,rain},{5,thunderStorm},{5,fog}] | AB24: 600 | AC24: 4 | AF24: 否 | AG24: [10412] | AH24: [10412] | AI24: normal
A25: 1009 | B25: 寂静深海 | C25: 主场景 | D25: 1 | E25: 多进程 | F25: jijingshenhai | G25: 1009 | H25: 360 | I25: 300 | J25: vfs://piassets/ui/img/map/dt_jijingshenhai.png | K25: =16*RC[-3]/3 -> 1920 | L25: =16*RC[-3]/3 -> 1600 | M25: 1 | N25: 是 | O25: 是 | P25: 2#1111 | Q25: 是 | R25: 是 | U25: 1 | W25: 55 | AB25: 500 | AC25: 4 | AF25: 否 | AG25: [10412] | AH25: [10412] | AI25: normal
A26: 1103 | B26: 海皇遗迹一层 | C26: 主场景 | D26: 1 | E26: 多进程 | F26: haihuangyiji | G26: 1103 | H26: 330 | I26: 300 | J26: vfs://piassets/ui/img/map/dt_haihuangyiceng.png | K26: =16*RC[-3]/3 -> 1760 | L26: =16*RC[-3]/3 -> 1600 | M26: 1 | N26: 否 | O26: 是 | P26: 2#1111 | Q26: 是 | R26: 否 | T26: 否 | U26: 1 | W26: 56 | AB26: 290 | AC26: 5 | AF26: 否 | AG26: [10412] | AH26: [10412] | AI26: normal
A27: 1104 | B27: 海皇遗迹二层 | C27: 主场景 | D27: 1 | E27: 多进程 | F27: haihuangyiji_two | G27: 1104 | H27: 330 | I27: 300 | J27: vfs://piassets/ui/img/map/dt_haihuangerceng.png | K27: =16*RC[-3]/3 -> 1760 | L27: =16*RC[-3]/3 -> 1600 | M27: 1 | N27: 否 | O27: 是 | P27: 2#1111 | Q27: 是 | R27: 否 | T27: 否 | U27: 1 | W27: 57 | AB27: 250 | AC27: 5 | AF27: 否 | AG27: [10412] | AH27: [10412] | AI27: normal
A28: 6000 | B28: 远征城门 | C28: 远征场景 | D28: 0 | E28: 多进程 | F28: yuanzhengchengmen | G28: 6000 | H28: 180 | I28: 180 | J28: vfs://piassets/ui/img/map/dt_yuanzhengchengmen.png | K28: =16*RC[-3]/3 -> 960 | L28: =16*RC[-3]/3 -> 960 | M28: 1 | N28: 否 | O28: 是 | P28: 0 | Q28: 是 | R28: 否 | S28: 否 | T28: 否 | U28: 2 | W28: 0 | Y28: 否 | AD28: 退出副本将导致副本失败，是否退出? | AF28: 否 | AG28: [10412] | AH28: [10412] | AI28: normal | AL28: ignore
A29: 6001 | B29: 远征草原 | C29: 远征场景 | D29: 0 | E29: 多进程 | F29: yuanzhengcaoyuan | G29: 6001 | H29: 120 | I29: 120 | J29: vfs://piassets/ui/img/map/dt_haihuangerceng.png | K29: =16*RC[-3]/3 -> 640 | L29: =16*RC[-3]/3 -> 640 | M29: 1 | N29: 否 | O29: 是 | P29: 0 | Q29: 是 | R29: 否 | S29: 否 | T29: 否 | U29: 2 | W29: 0 | Y29: 否 | AD29: 退出副本将导致副本失败，是否退出? | AF29: 否 | AG29: [10412] | AH29: [10412] | AI29: normal | AL29: ignore
A30: 6002 | B30: 远征森林 | C30: 远征场景 | D30: 0 | E30: 多进程 | F30: yuanzhengsenlin | G30: 6002 | H30: 120 | I30: 150 | J30: vfs://piassets/ui/img/map/dt_haihuangerceng.png | K30: =16*RC[-3]/3 -> 640 | L30: =16*RC[-3]/3 -> 800 | M30: 1 | N30: 否 | O30: 是 | P30: 0 | Q30: 是 | R30: 否 | S30: 否 | T30: 否 | U30: 2 | W30: 0 | Y30: 否 | AD30: 退出副本将导致副本失败，是否退出? | AF30: 否 | AG30: [10412] | AH30: [10412] | AI30: normal | AL30: ignore
A31: 6003 | B31: 远征峡谷 | C31: 远征场景 | D31: 0 | E31: 多进程 | F31: yuanzhengxiagu | G31: 6003 | H31: 120 | I31: 180 | J31: vfs://piassets/ui/img/map/dt_haihuangerceng.png | K31: =16*RC[-3]/3 -> 640 | L31: =16*RC[-3]/3 -> 960 | M31: 1 | N31: 否 | O31: 是 | P31: 0 | Q31: 是 | R31: 否 | S31: 否 | T31: 否 | U31: 2 | W31: 0 | Y31: 否 | AD31: 退出副本将导致副本失败，是否退出? | AF31: 否 | AG31: [10412] | AH31: [10412] | AI31: normal | AL31: ignore
A32: 4000 | B32: 军团驻地 | C32: 军团场景 | D32: 0 | E32: 多进程 | F32: juntuanjidi | G32: 4000 | H32: 240 | I32: 240 | J32: tab_map2.dt_jinghulindi | K32: =16*RC[-3]/3 -> 1280 | L32: =16*RC[-3]/3 -> 1280 | M32: 30 | N32: 是 | O32: 是 | P32: 2#1111 | Q32: 是 | R32: 是 | U32: 2 | W32: 30 | Y32: 否 | Z32: {3001,{122,0,170}} | AF32: 否 | AG32: [10412] | AH32: [10412] | AI32: all
A33: 6010 | B33: 远征城门 | C33: 远征场景 | D33: 0 | E33: 多进程 | F33: yuanzhengchengmen | G33: 6010 | H33: 180 | I33: 180 | J33: vfs://piassets/ui/img/map/dt_yuanzhengchengmen.png | K33: =16*RC[-3]/3 -> 960 | L33: =16*RC[-3]/3 -> 960 | M33: 1 | N33: 否 | O33: 是 | P33: 0 | Q33: 是 | R33: 否 | S33: 否 | T33: 否 | U33: 2 | W33: 0 | Y33: 否 | AD33: 退出副本将导致副本失败，是否退出? | AF33: 否 | AG33: [10412] | AH33: [10412] | AI33: normal | AL33: ignore
A34: 6011 | B34: 远征城门 | C34: 远征场景 | D34: 0 | E34: 多进程 | F34: yuanzhengchengmen | G34: 6010 | H34: 180 | I34: 180 | J34: vfs://piassets/ui/img/map/dt_yuanzhengchengmen.png | K34: =16*RC[-3]/3 -> 960 | L34: =16*RC[-3]/3 -> 960 | M34: 1 | N34: 否 | O34: 是 | P34: 0 | Q34: 是 | R34: 否 | S34: 否 | T34: 否 | U34: 2 | W34: 0 | Y34: 否 | AD34: 退出副本将导致副本失败，是否退出? | AF34: 否 | AG34: [10412] | AH34: [10412] | AI34: normal | AL34: ignore

Sheet: area
A1: 场景id | B1: 场景名（策划使用） | C1: 区域id | D1: 区域类型 | E1: PK模式 | F1: 是否可切换PK模式 | G1: 杀人惩罚 | H1: 杀怪是否消除善恶值 | I1: 死亡惩罚 | J1: 复活（是否可以原地复活） | K1: 骑乘 | L1: 阻挡 | O1: 复活点坐标列表 | P1: 是否可飞行 | Q1: 危险程度
A2: scene_id | C2: area_id | D2: type | E2: pk_mode | F2: pk_mode_change | G2: killing_punishment | H2: clear_sin | I2: death_punishment | J2: rebirth_in_situ | K2: rider | L2: obstacle | O2: rebirth_place | P2: flying | Q2: dangerous_level
A3: 2001 | B3: =VLOOKUP(area!RC[-1],scene!R1C1:R119C2,2,FALSE) -> 试炼祭坛 | C3: default | E3: 按PK模式 | F3: 是 | G3: 有 | H3: 否 | J3: 无 | K3: 是 | L3: 有 | O3: [{3001, {176,10,171}, 1}] | P3: 是 | Q3: 安全
A4: 1003 | B4: =VLOOKUP(area!RC[-1],scene!R4C1:R119C2,2,FALSE) -> 日暮森林 | C4: default | E4: 按PK模式 | F4: 是 | G4: 有 | H4: 是 | I4: 有 | J4: 是 | K4: 是 | L4: 有 | O4: [{3001, {176,10,171}, 1}] | P4: 是 | Q4: 普通
A5: 1005 | B5: =VLOOKUP(area!RC[-1],scene!R4C1:R119C2,2,FALSE) -> 巨岩沙海 | C5: default | E5: 按PK模式 | F5: 是 | G5: 有 | H5: 有 | I5: 是 | J5: 是 | K5: 是 | L5: 是 | O5: [{3001, {176,10,171}, 1}] | P5: 是 | Q5: 安全
A6: 1006 | B6: =VLOOKUP(area!RC[-1],scene!R4C1:R119C2,2,FALSE) -> 微风平原 | C6: default | E6: 按PK模式 | F6: 是 | G6: 有 | H6: 有 | I6: 是 | J6: 是 | K6: 是 | L6: 是 | O6: [{3001, {176,10,171}, 1}] | P6: 是 | Q6: 安全
A7: 10061 | B7: =VLOOKUP(area!RC[-1],scene!R4C1:R119C2,2,FALSE) -> 微风平原 | C7: default | E7: 禁止PK | F7: 否 | G7: 有 | H7: 有 | J7: 是 | K7: 是 | L7: 无 | O7: [{1006,{77,0,122},1}] | P7: 是 | Q7: 安全
A8: 10062 | B8: =VLOOKUP(area!RC[-1],scene!R4C1:R119C2,2,FALSE) -> 微风平原 | C8: default | E8: 禁止PK | F8: 否 | G8: 有 | H8: 有 | J8: 是 | K8: 是 | L8: 无 | O8: [{1006,{140,0,170},1}] | P8: 是 | Q8: 安全
A9: 1101 | B9: =VLOOKUP(area!RC[-1],scene!R4C1:R119C2,2,FALSE) -> 不朽圣殿一层 | C9: default | E9: 按PK模式 | F9: 是 | G9: 有 | H9: 有 | I9: 是 | J9: 是 | K9: 是 | L9: 是 | O9: [{1101, {88,0,293}, 1}] | P9: 是 | Q9: 安全
A10: 1101 | B10: =VLOOKUP(area!RC[-1],scene!R4C1:R119C2,2,FALSE) -> 不朽圣殿一层 | C10: safe_place | D10: safe_place | E10: 禁止PK | F10: 是 | G10: 有 | H10: 是 | I10: 有 | J10: 是 | K10: 是 | L10: 有 | O10: [{1101, {88,0,293}, 1}] | P10: 是 | Q10: 安全
A11: 1102 | B11: =VLOOKUP(area!RC[-1],scene!R4C1:R119C2,2,FALSE) -> 不朽圣殿二层 | C11: default | E11: 按PK模式 | F11: 是 | G11: 有 | H11: 有 | I11: 是 | J11: 是 | K11: 是 | L11: 是 | O11: [{1102, {75,0,262}, 1}] | P11: 是 | Q11: 安全
A12: 1102 | B12: =VLOOKUP(area!RC[-1],scene!R4C1:R119C2,2,FALSE) -> 不朽圣殿二层 | C12: safe_place | D12: safe_place | E12: 禁止PK | F12: 是 | G12: 有 | H12: 是 | I12: 有 | J12: 是 | K12: 是 | L12: 有 | O12: [{1102, {75,0,262}, 1}] | P12: 是 | Q12: 安全
A13: 1007 | B13: =VLOOKUP(area!RC[-1],scene!R4C1:R119C2,2,FALSE) -> 叹息之地 | C13: default | E13: 按PK模式 | F13: 是 | G13: 有 | H13: 有 | I13: 是 | J13: 是 | K13: 是 | L13: 是 | O13: [{3001, {176,10,171}, 1}] | P13: 是 | Q13: 安全
A14: 1009 | B14: =VLOOKUP(area!RC[-1],scene!R4C1:R119C2,2,FALSE) -> 寂静深海 | C14: default | E14: 按PK模式 | F14: 是 | G14: 有 | H14: 有 | I14: 是 | J14: 是 | K14: 是 | L14: 是 | O14: [{3001, {176,10,171}, 1}] | P14: 是 | Q14: 安全
A15: 1103 | B15: =VLOOKUP(area!RC[-1],scene!R4C1:R119C2,2,FALSE) -> 海皇遗迹一层 | C15: default | E15: 按PK模式 | F15: 是 | G15: 有 | H15: 有 | I15: 是 | J15: 是 | K15: 是 | L15: 是 | O15: [{1103, {284,0,290}, 1}] | P15: 是 | Q15: 安全
A16: 1103 | B16: =VLOOKUP(area!RC[-1],scene!R4C1:R119C2,2,FALSE) -> 海皇遗迹一层 | C16: safe_place | D16: safe_place | E16: 禁止PK | F16: 是 | G16: 有 | H16: 是 | I16: 有 | J16: 是 | K16: 是 | L16: 有 | O16: [{1103, {284,0,290}, 1}] | P16: 是 | Q16: 安全
A17: 1104 | B17: =VLOOKUP(area!RC[-1],scene!R4C1:R119C2,2,FALSE) -> 海皇遗迹二层 | C17: default | E17: 按PK模式 | F17: 是 | G17: 有 | H17: 有 | I17: 是 | J17: 是 | K17: 是 | L17: 是 | O17: [{1104, {297,10,260}, 1}] | P17: 是 | Q17: 安全
A18: 1104 | B18: =VLOOKUP(area!RC[-1],scene!R4C1:R119C2,2,FALSE) -> 海皇遗迹二层 | C18: safe_place | D18: safe_place | E18: 禁止PK | F18: 是 | G18: 有 | H18: 是 | I18: 有 | J18: 是 | K18: 是 | L18: 有 | O18: [{1104, {297,10,260}, 1}] | P18: 是 | Q18: 安全
A19: 2000 | B19: =VLOOKUP(area!RC[-1],scene!R4C1:R119C2,2,FALSE) -> 虚空之桥 | C19: default | E19: 按PK模式 | F19: 否 | G19: 有 | H19: 有 | I19: 是 | J19: 是 | K19: 是 | L19: 是 | O19: [{2000, {13,10,131}, 1}] | P19: 是 | Q19: 安全
A20: 3001 | B20: =VLOOKUP(area!RC[-1],scene!R4C1:R119C2,2,FALSE) -> 圣光城 | C20: default | E20: 禁止PK | F20: 是 | G20: 有 | H20: 有 | I20: 是 | J20: 是 | K20: 是 | L20: 无 | O20: [{3001, {176,10,171}, 1}] | P20: 是 | Q20: 安全
A21: 30011 | B21: =VLOOKUP(area!RC[-1],scene!R4C1:R119C2,2,FALSE) -> 圣光城 | C21: default | E21: 禁止PK | F21: 否 | G21: 有 | H21: 有 | J21: 是 | K21: 是 | L21: 无 | O21: [{3001,{255,0,248},1}] | P21: 是 | Q21: 安全
A22: 30012 | B22: =VLOOKUP(area!RC[-1],scene!R4C1:R119C2,2,FALSE) -> 圣光城 | C22: default | E22: 禁止PK | F22: 否 | G22: 有 | H22: 有 | J22: 是 | K22: 是 | L22: 无 | O22: [{3001,{205,0,118},1}] | P22: 是 | Q22: 安全
A23: 3000 | B23: =VLOOKUP(area!RC[-1],scene!R4C1:R119C2,2,FALSE) -> 神佑之地 | C23: default | E23: 禁止PK | F23: 否 | G23: 有 | H23: 有 | I23: 是 | J23: 是 | K23: 是 | L23: 无 | O23: [{3000, {14,10,203}, 1}] | P23: 是 | Q23: 安全
A24: 30001 | B24: =VLOOKUP(area!RC[-1],scene!R4C1:R119C2,2,FALSE) -> 神佑之地 | C24: default | E24: 禁止PK | F24: 否 | G24: 有 | H24: 有 | J24: 是 | K24: 是 | L24: 无 | O24: [{3000,{25,0,190}, 1}] | P24: 是 | Q24: 安全
A25: 30002 | B25: =VLOOKUP(area!RC[-1],scene!R4C1:R119C2,2,FALSE) -> 神佑之地 | C25: default | E25: 禁止PK | F25: 否 | G25: 有 | H25: 有 | J25: 是 | K25: 是 | L25: 无 | O25: [{3000,{136,0,164}, 1}] | P25: 是 | Q25: 安全
A26: 30003 | B26: =VLOOKUP(area!RC[-1],scene!R4C1:R119C2,2,FALSE) -> 神佑之地 | C26: default | E26: 禁止PK | F26: 否 | G26: 有 | H26: 有 | J26: 是 | K26: 是 | L26: 无 | O26: [{3000,{230,0,135}, 1}] | P26: 是 | Q26: 安全
A27: 30004 | B27: =VLOOKUP(area!RC[-1],scene!R4C1:R119C2,2,FALSE) -> 神佑之地 | C27: default | E27: 禁止PK | F27: 否 | G27: 有 | H27: 有 | J27: 是 | K27: 是 | L27: 无 | O27: [{3000,{222,0,139}, 1}] | P27: 是 | Q27: 安全
A28: 30005 | B28: =VLOOKUP(area!RC[-1],scene!R4C1:R119C2,2,FALSE) -> 神佑之地 | C28: default | E28: 禁止PK | F28: 否 | G28: 有 | H28: 有 | J28: 是 | K28: 是 | L28: 无 | O28: [{3000,{217,0,135}, 1}] | P28: 是 | Q28: 安全
A29: 5001 | B29: =VLOOKUP(area!RC[-1],scene!R4C1:R119C2,2,FALSE) -> 乱斗场 | C29: default | E29: 自由PK | F29: 否 | G29: 无 | H29: 否 | J29: 无 | K29: 无 | L29: 有 | O29: [{5001, [{5,0,5},{50,0,50}], 1}] | P29: 是 | Q29: 危险
A30: 5002 | B30: =VLOOKUP(area!RC[-1],scene!R4C1:R119C2,2,FALSE) -> 暴风战区 | C30: default | E30: 按PK模式 | F30: 是 | G30: 有 | H30: 是 | J30: 是 | K30: 是 | L30: 有 | O30: [{5002, {40,10,104}, 2},{5002, {234,10,104}, 4}] | P30: 是 | Q30: 危险
A31: 5003 | B31: =VLOOKUP(area!RC[-1],scene!R4C1:R119C2,2,FALSE) -> 暴风战区 | C31: default | E31: 按PK模式 | F31: 是 | G31: 有 | H31: 是 | J31: 是 | K31: 是 | L31: 有 | O31: [{5003, {16,1,162}, 2},{5003, {193,1,15}, 4}] | P31: 是 | Q31: 危险
A32: 6000 | B32: =VLOOKUP(area!RC[-1],scene!R4C1:R119C2,2,FALSE) -> 远征城门 | C32: default | E32: 按PK模式 | F32: 否 | G32: 有 | H32: 是 | J32: 是 | K32: 无 | L32: 有 | O32: [{3001, {176,10,171}, 1}] | P32: 是 | Q32: 危险
A33: 6001 | B33: =VLOOKUP(area!RC[-1],scene!R4C1:R119C2,2,FALSE) -> 远征草原 | C33: default | E33: 按PK模式 | F33: 否 | G33: 有 | H33: 是 | J33: 是 | K33: 无 | L33: 有 | O33: [{3001, {176,10,171}, 1}] | P33: 是 | Q33: 危险
A34: 6002 | B34: =VLOOKUP(area!RC[-1],scene!R4C1:R119C2,2,FALSE) -> 远征森林 | C34: default | E34: 按PK模式 | F34: 否 | G34: 有 | H34: 是 | J34: 是 | K34: 无 | L34: 有 | O34: [{3001, {176,10,171}, 1}] | P34: 是 | Q34: 危险
A35: 6003 | B35: =VLOOKUP(area!RC[-1],scene!R4C1:R119C2,2,FALSE) -> 远征峡谷 | C35: default | E35: 按PK模式 | F35: 否 | G35: 有 | H35: 是 | J35: 是 | K35: 无 | L35: 有 | O35: [{3001, {176,10,171}, 1}] | P35: 是 | Q35: 危险
A36: 3001 | B36: =VLOOKUP(area!RC[-1],scene!R4C1:R119C2,2,FALSE) -> 圣光城 | C36: colosseum | D36: colosseum | E36: 自由PK | F36: 否 | G36: 无 | H36: 否 | I36: 无 | J36: 是 | K36: 无 | L36: 有 | O36: [{3001, {176,10,171}, 1}] | P36: 是 | Q36: 危险
A37: 4000 | B37: =VLOOKUP(area!RC[-1],scene!R4C1:R119C2,2,FALSE) -> 军团驻地 | C37: default | E37: 禁止PK | F37: 否 | G37: 有 | H37: 是 | I37: 无 | J37: 是 | K37: 是 | L37: 有 | O37: [{4000, {154,0,88}, 1}] | P37: 是 | Q37: 安全
A38: 6010 | B38: =VLOOKUP(area!RC[-1],scene!R4C1:R119C2,2,FALSE) -> 远征城门 | C38: default | E38: 按PK模式 | F38: 否 | G38: 有 | H38: 是 | J38: 是 | K38: 无 | L38: 有 | O38: [{3001, {176,10,171}, 1}] | P38: 是 | Q38: 危险
A39: 6011 | B39: =VLOOKUP(area!RC[-1],scene!R4C1:R119C2,2,FALSE) -> 远征城门 | C39: default | E39: 按PK模式 | F39: 否 | G39: 有 | H39: 是 | J39: 是 | K39: 无 | L39: 有 | O39: [{3001, {176,10,171}, 1}] | P39: 是 | Q39: 危险

Sheet: crossrealm_camp
A1: 场景等级 | B1: 场景id | C1: 等级上限 | D1: 返回坐标 | E1: 传送坐标
A2: scene_level | B2: scene_id | C2: max_level | D2: back_place | E2: transfer_place
A3: 28 | B3: 5002 | C3: 99 | D3: {3001, {176,10,171}} | E3: [{2, {40,10,104}},{4, {234,10,104}}]
A4: 30 | B4: 5003 | C4: 39 | D4: {3001, {176,10,171}} | E4: [{2, {16,1,162}},{4, {193,1,15}}]

Sheet: weather_type
A1: 天气名称 | B1: 天气key
A2: 晴天 | B2: fine
A3: 下雨 | B3: rain
A4: 血雨 | B4: bloodRain
A5: 多云 | B5: cloudy
A6: 下雪 | B6: snow
A7: 闪电 | B7: lightning
A8: 沙暴 | B8: sandStorm
A9: 雷雨 | B9: thunderStorm
A10: 雾天 | B10: fog
A11: 默认 | B11: default

Sheet: map_graph
A1: 场景ID | B1: 目标场景ID | C1: 传送NPC | D1: 传送后位置x | E1: 传送后位置y | F1: 传送后位置z | G1: 传送类型 | H1: 传送参数 | I1: 查重 | K1: 配表备忘(取自NPC表） | M1: NPC编号 | N1: 传送目标场景 | O1: 传送目标位置 | P1: 查漏
A2: srcScene | B2: dstScene | C2: transID | D2: dstX | E2: dstY | F2: dstZ | G2: transType | H2: transArg | K2: 联通点： | L2: =COUNT(R[1]C[-9]:R[17]C[-9]) -> 17 | M2: sid | N2: scene_id | O2: pos
A3: 1003 | B3: =VLOOKUP(RC[1],C13:C15,2,FALSE) -> 1005 | C3: 10010797 | D3: =LEFT(VLOOKUP(RC[-1],C13:C15,3,FALSE),FINDB(",",VLOOKUP(RC[-1],C13:C15,3,FALSE))-1) -> 24 | E3: =MID(VLOOKUP(RC[-2],C13:C15,3,FALSE),FINDB(",",VLOOKUP(RC[-2],C13:C15,3,FALSE))+2,FIND(",",VLOOKUP(RC[-2],C13:C15,3,FALSE),FINDB(",",VLOOKUP(RC[-2],C13:C15,3,FALSE))+1)-FINDB(",",VLOOKUP(RC[-2],C13:C15,3,FALSE))-2) -> -5 | F3: =RIGHT(VLOOKUP(RC[-3],C13:C15,3,FALSE),LEN(VLOOKUP(RC[-3],C13:C15,3,FALSE))-FIND(",",VLOOKUP(RC[-3],C13:C15,3,FALSE),FINDB(",",VLOOKUP(RC[-3],C13:C15,3,FALSE))+1)-1) -> 420 | I3: =COUNTIF(C[-6],RC[-6]) -> 1 | K3: 联通NPC： | L3: =COUNT(RC[2]:R[87]C[2]) -> 20 | M3: 10010051 | P3: =IF(RC[-2]="","",IF(IFERROR(VLOOKUP(RC[-3],C[-13],1,FALSE),0)>0,"",1)) -> 
A4: 1003 | B4: =VLOOKUP(RC[1],C13:C15,2,FALSE) -> 1006 | C4: 10010798 | D4: =LEFT(VLOOKUP(RC[-1],C13:C15,3,FALSE),FINDB(",",VLOOKUP(RC[-1],C13:C15,3,FALSE))-1) -> 150 | E4: =MID(VLOOKUP(RC[-2],C13:C15,3,FALSE),FINDB(",",VLOOKUP(RC[-2],C13:C15,3,FALSE))+2,FIND(",",VLOOKUP(RC[-2],C13:C15,3,FALSE),FINDB(",",VLOOKUP(RC[-2],C13:C15,3,FALSE))+1)-FINDB(",",VLOOKUP(RC[-2],C13:C15,3,FALSE))-2) -> 0 | F4: =RIGHT(VLOOKUP(RC[-3],C13:C15,3,FALSE),LEN(VLOOKUP(RC[-3],C13:C15,3,FALSE))-FIND(",",VLOOKUP(RC[-3],C13:C15,3,FALSE),FINDB(",",VLOOKUP(RC[-3],C13:C15,3,FALSE))+1)-1) -> 180 | I4: =COUNTIF(C[-6],RC[-6]) -> 1 | M4: 10010054 | P4: =IF(RC[-2]="","",IF(IFERROR(VLOOKUP(RC[-3],C[-13],1,FALSE),0)>0,"",1)) -> 
A5: 1104 | B5: =VLOOKUP(RC[1],C13:C15,2,FALSE) -> 1103 | C5: 10012199 | D5: =LEFT(VLOOKUP(RC[-1],C13:C15,3,FALSE),FINDB(",",VLOOKUP(RC[-1],C13:C15,3,FALSE))-1) -> 239 | E5: =MID(VLOOKUP(RC[-2],C13:C15,3,FALSE),FINDB(",",VLOOKUP(RC[-2],C13:C15,3,FALSE))+2,FIND(",",VLOOKUP(RC[-2],C13:C15,3,FALSE),FINDB(",",VLOOKUP(RC[-2],C13:C15,3,FALSE))+1)-FINDB(",",VLOOKUP(RC[-2],C13:C15,3,FALSE))-2) -> 10 | F5: =RIGHT(VLOOKUP(RC[-3],C13:C15,3,FALSE),LEN(VLOOKUP(RC[-3],C13:C15,3,FALSE))-FIND(",",VLOOKUP(RC[-3],C13:C15,3,FALSE),FINDB(",",VLOOKUP(RC[-3],C13:C15,3,FALSE))+1)-1) -> 30 | I5: =COUNTIF(C[-6],RC[-6]) -> 1 | M5: 10010056 | P5: =IF(RC[-2]="","",IF(IFERROR(VLOOKUP(RC[-3],C[-13],1,FALSE),0)>0,"",1)) -> 
A6: 1102 | B6: =VLOOKUP(RC[1],C13:C15,2,FALSE) -> 1101 | C6: 10011198 | D6: =LEFT(VLOOKUP(RC[-1],C13:C15,3,FALSE),FINDB(",",VLOOKUP(RC[-1],C13:C15,3,FALSE))-1) -> 265 | E6: =MID(VLOOKUP(RC[-2],C13:C15,3,FALSE),FINDB(",",VLOOKUP(RC[-2],C13:C15,3,FALSE))+2,FIND(",",VLOOKUP(RC[-2],C13:C15,3,FALSE),FINDB(",",VLOOKUP(RC[-2],C13:C15,3,FALSE))+1)-FINDB(",",VLOOKUP(RC[-2],C13:C15,3,FALSE))-2) -> 12 | F6: =RIGHT(VLOOKUP(RC[-3],C13:C15,3,FALSE),LEN(VLOOKUP(RC[-3],C13:C15,3,FALSE))-FIND(",",VLOOKUP(RC[-3],C13:C15,3,FALSE),FINDB(",",VLOOKUP(RC[-3],C13:C15,3,FALSE))+1)-1) -> 78 | I6: =COUNTIF(C[-6],RC[-6]) -> 1 | M6: 10010057 | P6: =IF(RC[-2]="","",IF(IFERROR(VLOOKUP(RC[-3],C[-13],1,FALSE),0)>0,"",1)) -> 
A7: 1005 | B7: =VLOOKUP(RC[1],C13:C15,2,FALSE) -> 1101 | C7: 10011195 | D7: =LEFT(VLOOKUP(RC[-1],C13:C15,3,FALSE),FINDB(",",VLOOKUP(RC[-1],C13:C15,3,FALSE))-1) -> 88 | E7: =MID(VLOOKUP(RC[-2],C13:C15,3,FALSE),FINDB(",",VLOOKUP(RC[-2],C13:C15,3,FALSE))+2,FIND(",",VLOOKUP(RC[-2],C13:C15,3,FALSE),FINDB(",",VLOOKUP(RC[-2],C13:C15,3,FALSE))+1)-FINDB(",",VLOOKUP(RC[-2],C13:C15,3,FALSE))-2) -> 0 | F7: =RIGHT(VLOOKUP(RC[-3],C13:C15,3,FALSE),LEN(VLOOKUP(RC[-3],C13:C15,3,FALSE))-FIND(",",VLOOKUP(RC[-3],C13:C15,3,FALSE),FINDB(",",VLOOKUP(RC[-3],C13:C15,3,FALSE))+1)-1) -> 293 | I7: =COUNTIF(C[-6],RC[-6]) -> 1 | M7: 10010058 | P7: =IF(RC[-2]="","",IF(IFERROR(VLOOKUP(RC[-3],C[-13],1,FALSE),0)>0,"",1)) -> 
A8: 1005 | B8: =VLOOKUP(RC[1],C13:C15,2,FALSE) -> 1003 | C8: 10011199 | D8: =LEFT(VLOOKUP(RC[-1],C13:C15,3,FALSE),FINDB(",",VLOOKUP(RC[-1],C13:C15,3,FALSE))-1) -> 298 | E8: =MID(VLOOKUP(RC[-2],C13:C15,3,FALSE),FINDB(",",VLOOKUP(RC[-2],C13:C15,3,FALSE))+2,FIND(",",VLOOKUP(RC[-2],C13:C15,3,FALSE),FINDB(",",VLOOKUP(RC[-2],C13:C15,3,FALSE))+1)-FINDB(",",VLOOKUP(RC[-2],C13:C15,3,FALSE))-2) -> 0 | F8: =RIGHT(VLOOKUP(RC[-3],C13:C15,3,FALSE),LEN(VLOOKUP(RC[-3],C13:C15,3,FALSE))-FIND(",",VLOOKUP(RC[-3],C13:C15,3,FALSE),FINDB(",",VLOOKUP(RC[-3],C13:C15,3,FALSE))+1)-1) -> 127 | I8: =COUNTIF(C[-6],RC[-6]) -> 1 | M8: 10010059 | P8: =IF(RC[-2]="","",IF(IFERROR(VLOOKUP(RC[-3],C[-13],1,FALSE),0)>0,"",1)) -> 
A9: 1103 | B9: =VLOOKUP(RC[1],C13:C15,2,FALSE) -> 1009 | C9: 10012197 | D9: =LEFT(VLOOKUP(RC[-1],C13:C15,3,FALSE),FINDB(",",VLOOKUP(RC[-1],C13:C15,3,FALSE))-1) -> 140 | E9: =MID(VLOOKUP(RC[-2],C13:C15,3,FALSE),FINDB(",",VLOOKUP(RC[-2],C13:C15,3,FALSE))+2,FIND(",",VLOOKUP(RC[-2],C13:C15,3,FALSE),FINDB(",",VLOOKUP(RC[-2],C13:C15,3,FALSE))+1)-FINDB(",",VLOOKUP(RC[-2],C13:C15,3,FALSE))-2) -> 0 | F9: =RIGHT(VLOOKUP(RC[-3],C13:C15,3,FALSE),LEN(VLOOKUP(RC[-3],C13:C15,3,FALSE))-FIND(",",VLOOKUP(RC[-3],C13:C15,3,FALSE),FINDB(",",VLOOKUP(RC[-3],C13:C15,3,FALSE))+1)-1) -> 292 | I9: =COUNTIF(C[-6],RC[-6]) -> 1 | M9: 10010060 | P9: =IF(RC[-2]="","",IF(IFERROR(VLOOKUP(RC[-3],C[-13],1,FALSE),0)>0,"",1)) -> 
A10: 1103 | B10: =VLOOKUP(RC[1],C13:C15,2,FALSE) -> 1104 | C10: 10012198 | D10: =LEFT(VLOOKUP(RC[-1],C13:C15,3,FALSE),FINDB(",",VLOOKUP(RC[-1],C13:C15,3,FALSE))-1) -> 298 | E10: =MID(VLOOKUP(RC[-2],C13:C15,3,FALSE),FINDB(",",VLOOKUP(RC[-2],C13:C15,3,FALSE))+2,FIND(",",VLOOKUP(RC[-2],C13:C15,3,FALSE),FINDB(",",VLOOKUP(RC[-2],C13:C15,3,FALSE))+1)-FINDB(",",VLOOKUP(RC[-2],C13:C15,3,FALSE))-2) -> 10 | F10: =RIGHT(VLOOKUP(RC[-3],C13:C15,3,FALSE),LEN(VLOOKUP(RC[-3],C13:C15,3,FALSE))-FIND(",",VLOOKUP(RC[-3],C13:C15,3,FALSE),FINDB(",",VLOOKUP(RC[-3],C13:C15,3,FALSE))+1)-1) -> 258 | I10: =COUNTIF(C[-6],RC[-6]) -> 1 | M10: 10010061 | P10: =IF(RC[-2]="","",IF(IFERROR(VLOOKUP(RC[-3],C[-13],1,FALSE),0)>0,"",1)) -> 
A11: 1007 | B11: =VLOOKUP(RC[1],C13:C15,2,FALSE) -> 1006 | C11: 10011798 | D11: =LEFT(VLOOKUP(RC[-1],C13:C15,3,FALSE),FINDB(",",VLOOKUP(RC[-1],C13:C15,3,FALSE))-1) -> 234 | E11: =MID(VLOOKUP(RC[-2],C13:C15,3,FALSE),FINDB(",",VLOOKUP(RC[-2],C13:C15,3,FALSE))+2,FIND(",",VLOOKUP(RC[-2],C13:C15,3,FALSE),FINDB(",",VLOOKUP(RC[-2],C13:C15,3,FALSE))+1)-FINDB(",",VLOOKUP(RC[-2],C13:C15,3,FALSE))-2) -> 0 | F11: =RIGHT(VLOOKUP(RC[-3],C13:C15,3,FALSE),LEN(VLOOKUP(RC[-3],C13:C15,3,FALSE))-FIND(",",VLOOKUP(RC[-3],C13:C15,3,FALSE),FINDB(",",VLOOKUP(RC[-3],C13:C15,3,FALSE))+1)-1) -> 67 | I11: =COUNTIF(C[-6],RC[-6]) -> 1 | M11: 10010199 | N11: 1006 | O11: 20, 0, 184 | P11: =IF(RC[-2]="","",IF(IFERROR(VLOOKUP(RC[-3],C[-13],1,FALSE),0)>0,"",1)) -> 
A12: 1007 | B12: =VLOOKUP(RC[1],C13:C15,2,FALSE) -> 1009 | C12: 10011799 | D12: =LEFT(VLOOKUP(RC[-1],C13:C15,3,FALSE),FINDB(",",VLOOKUP(RC[-1],C13:C15,3,FALSE))-1) -> 30 | E12: =MID(VLOOKUP(RC[-2],C13:C15,3,FALSE),FINDB(",",VLOOKUP(RC[-2],C13:C15,3,FALSE))+2,FIND(",",VLOOKUP(RC[-2],C13:C15,3,FALSE),FINDB(",",VLOOKUP(RC[-2],C13:C15,3,FALSE))+1)-FINDB(",",VLOOKUP(RC[-2],C13:C15,3,FALSE))-2) -> 0 | F12: =RIGHT(VLOOKUP(RC[-3],C13:C15,3,FALSE),LEN(VLOOKUP(RC[-3],C13:C15,3,FALSE))-FIND(",",VLOOKUP(RC[-3],C13:C15,3,FALSE),FINDB(",",VLOOKUP(RC[-3],C13:C15,3,FALSE))+1)-1) -> 164 | I12: =COUNTIF(C[-6],RC[-6]) -> 1 | M12: 10010200 | P12: =IF(RC[-2]="","",IF(IFERROR(VLOOKUP(RC[-3],C[-13],1,FALSE),0)>0,"",1)) -> 
A13: 1101 | B13: =VLOOKUP(RC[1],C13:C15,2,FALSE) -> 1005 | C13: 10011196 | D13: =LEFT(VLOOKUP(RC[-1],C13:C15,3,FALSE),FINDB(",",VLOOKUP(RC[-1],C13:C15,3,FALSE))-1) -> 442 | E13: =MID(VLOOKUP(RC[-2],C13:C15,3,FALSE),FINDB(",",VLOOKUP(RC[-2],C13:C15,3,FALSE))+2,FIND(",",VLOOKUP(RC[-2],C13:C15,3,FALSE),FINDB(",",VLOOKUP(RC[-2],C13:C15,3,FALSE))+1)-FINDB(",",VLOOKUP(RC[-2],C13:C15,3,FALSE))-2) -> 10 | F13: =RIGHT(VLOOKUP(RC[-3],C13:C15,3,FALSE),LEN(VLOOKUP(RC[-3],C13:C15,3,FALSE))-FIND(",",VLOOKUP(RC[-3],C13:C15,3,FALSE),FINDB(",",VLOOKUP(RC[-3],C13:C15,3,FALSE))+1)-1) -> 39 | I13: =COUNTIF(C[-6],RC[-6]) -> 1 | M13: 10060000 | P13: =IF(RC[-2]="","",IF(IFERROR(VLOOKUP(RC[-3],C[-13],1,FALSE),0)>0,"",1)) -> 
A14: 1101 | B14: =VLOOKUP(RC[1],C13:C15,2,FALSE) -> 1102 | C14: 10011197 | D14: =LEFT(VLOOKUP(RC[-1],C13:C15,3,FALSE),FINDB(",",VLOOKUP(RC[-1],C13:C15,3,FALSE))-1) -> 74 | E14: =MID(VLOOKUP(RC[-2],C13:C15,3,FALSE),FINDB(",",VLOOKUP(RC[-2],C13:C15,3,FALSE))+2,FIND(",",VLOOKUP(RC[-2],C13:C15,3,FALSE),FINDB(",",VLOOKUP(RC[-2],C13:C15,3,FALSE))+1)-FINDB(",",VLOOKUP(RC[-2],C13:C15,3,FALSE))-2) -> 0 | F14: =RIGHT(VLOOKUP(RC[-3],C13:C15,3,FALSE),LEN(VLOOKUP(RC[-3],C13:C15,3,FALSE))-FIND(",",VLOOKUP(RC[-3],C13:C15,3,FALSE),FINDB(",",VLOOKUP(RC[-3],C13:C15,3,FALSE))+1)-1) -> 263 | I14: =COUNTIF(C[-6],RC[-6]) -> 1 | M14: 10010062 | P14: =IF(RC[-2]="","",IF(IFERROR(VLOOKUP(RC[-3],C[-13],1,FALSE),0)>0,"",1)) -> 
A15: 1006 | B15: =VLOOKUP(RC[1],C13:C15,2,FALSE) -> 1007 | C15: 10011397 | D15: =LEFT(VLOOKUP(RC[-1],C13:C15,3,FALSE),FINDB(",",VLOOKUP(RC[-1],C13:C15,3,FALSE))-1) -> 40 | E15: =MID(VLOOKUP(RC[-2],C13:C15,3,FALSE),FINDB(",",VLOOKUP(RC[-2],C13:C15,3,FALSE))+2,FIND(",",VLOOKUP(RC[-2],C13:C15,3,FALSE),FINDB(",",VLOOKUP(RC[-2],C13:C15,3,FALSE))+1)-FINDB(",",VLOOKUP(RC[-2],C13:C15,3,FALSE))-2) -> 3 | F15: =RIGHT(VLOOKUP(RC[-3],C13:C15,3,FALSE),LEN(VLOOKUP(RC[-3],C13:C15,3,FALSE))-FIND(",",VLOOKUP(RC[-3],C13:C15,3,FALSE),FINDB(",",VLOOKUP(RC[-3],C13:C15,3,FALSE))+1)-1) -> 290 | I15: =COUNTIF(C[-6],RC[-6]) -> 1 | M15: 10010064 | P15: =IF(RC[-2]="","",IF(IFERROR(VLOOKUP(RC[-3],C[-13],1,FALSE),0)>0,"",1)) -> 
A16: 1006 | B16: =VLOOKUP(RC[1],C13:C15,2,FALSE) -> 1003 | C16: 10011399 | D16: =LEFT(VLOOKUP(RC[-1],C13:C15,3,FALSE),FINDB(",",VLOOKUP(RC[-1],C13:C15,3,FALSE))-1) -> 37 | E16: =MID(VLOOKUP(RC[-2],C13:C15,3,FALSE),FINDB(",",VLOOKUP(RC[-2],C13:C15,3,FALSE))+2,FIND(",",VLOOKUP(RC[-2],C13:C15,3,FALSE),FINDB(",",VLOOKUP(RC[-2],C13:C15,3,FALSE))+1)-FINDB(",",VLOOKUP(RC[-2],C13:C15,3,FALSE))-2) -> 0 | F16: =RIGHT(VLOOKUP(RC[-3],C13:C15,3,FALSE),LEN(VLOOKUP(RC[-3],C13:C15,3,FALSE))-FIND(",",VLOOKUP(RC[-3],C13:C15,3,FALSE),FINDB(",",VLOOKUP(RC[-3],C13:C15,3,FALSE))+1)-1) -> 53 | I16: =COUNTIF(C[-6],RC[-6]) -> 1 | M16: 10010065 | P16: =IF(RC[-2]="","",IF(IFERROR(VLOOKUP(RC[-3],C[-13],1,FALSE),0)>0,"",1)) -> 
A17: 1006 | B17: =VLOOKUP(RC[1],C13:C15,2,FALSE) -> 3001 | C17: 10011396 | D17: =LEFT(VLOOKUP(RC[-1],C13:C15,3,FALSE),FINDB(",",VLOOKUP(RC[-1],C13:C15,3,FALSE))-1) -> 249 | E17: =MID(VLOOKUP(RC[-2],C13:C15,3,FALSE),FINDB(",",VLOOKUP(RC[-2],C13:C15,3,FALSE))+2,FIND(",",VLOOKUP(RC[-2],C13:C15,3,FALSE),FINDB(",",VLOOKUP(RC[-2],C13:C15,3,FALSE))+1)-FINDB(",",VLOOKUP(RC[-2],C13:C15,3,FALSE))-2) -> 0 | F17: =RIGHT(VLOOKUP(RC[-3],C13:C15,3,FALSE),LEN(VLOOKUP(RC[-3],C13:C15,3,FALSE))-FIND(",",VLOOKUP(RC[-3],C13:C15,3,FALSE),FINDB(",",VLOOKUP(RC[-3],C13:C15,3,FALSE))+1)-1) -> 246 | I17: =COUNTIF(C[-6],RC[-6]) -> 1 | M17: 10010797 | N17: 1005 | O17: 24, -5, 420 | P17: =IF(RC[-2]="","",IF(IFERROR(VLOOKUP(RC[-3],C[-13],1,FALSE),0)>0,"",1)) -> 
A18: 3001 | B18: =VLOOKUP(RC[1],C13:C15,2,FALSE) -> 1006 | C18: 10010199 | D18: =LEFT(VLOOKUP(RC[-1],C13:C15,3,FALSE),FINDB(",",VLOOKUP(RC[-1],C13:C15,3,FALSE))-1) -> 20 | E18: =MID(VLOOKUP(RC[-2],C13:C15,3,FALSE),FINDB(",",VLOOKUP(RC[-2],C13:C15,3,FALSE))+2,FIND(",",VLOOKUP(RC[-2],C13:C15,3,FALSE),FINDB(",",VLOOKUP(RC[-2],C13:C15,3,FALSE))+1)-FINDB(",",VLOOKUP(RC[-2],C13:C15,3,FALSE))-2) -> 0 | F18: =RIGHT(VLOOKUP(RC[-3],C13:C15,3,FALSE),LEN(VLOOKUP(RC[-3],C13:C15,3,FALSE))-FIND(",",VLOOKUP(RC[-3],C13:C15,3,FALSE),FINDB(",",VLOOKUP(RC[-3],C13:C15,3,FALSE))+1)-1) -> 184 | I18: =COUNTIF(C[-6],RC[-6]) -> 1 | M18: 10010798 | N18: 1006 | O18: 150, 0, 180 | P18: =IF(RC[-2]="","",IF(IFERROR(VLOOKUP(RC[-3],C[-13],1,FALSE),0)>0,"",1)) -> 
A19: 1009 | B19: =VLOOKUP(RC[1],C13:C15,2,FALSE) -> 1103 | C19: 10011998 | D19: =LEFT(VLOOKUP(RC[-1],C13:C15,3,FALSE),FINDB(",",VLOOKUP(RC[-1],C13:C15,3,FALSE))-1) -> 280 | E19: =MID(VLOOKUP(RC[-2],C13:C15,3,FALSE),FINDB(",",VLOOKUP(RC[-2],C13:C15,3,FALSE))+2,FIND(",",VLOOKUP(RC[-2],C13:C15,3,FALSE),FINDB(",",VLOOKUP(RC[-2],C13:C15,3,FALSE))+1)-FINDB(",",VLOOKUP(RC[-2],C13:C15,3,FALSE))-2) -> 0 | F19: =RIGHT(VLOOKUP(RC[-3],C13:C15,3,FALSE),LEN(VLOOKUP(RC[-3],C13:C15,3,FALSE))-FIND(",",VLOOKUP(RC[-3],C13:C15,3,FALSE),FINDB(",",VLOOKUP(RC[-3],C13:C15,3,FALSE))+1)-1) -> 293 | I19: =COUNTIF(C[-6],RC[-6]) -> 1 | M19: 10010799 | N19: 1006 | O19: 155, 0, 36 | P19: =IF(RC[-2]="","",IF(IFERROR(VLOOKUP(RC[-3],C[-13],1,FALSE),0)>0,"",1)) -> 1
A20: 1009 | B20: =VLOOKUP(RC[1],C13:C15,2,FALSE) -> 1007 | C20: 10011997 | D20: =LEFT(VLOOKUP(RC[-1],C13:C15,3,FALSE),FINDB(",",VLOOKUP(RC[-1],C13:C15,3,FALSE))-1) -> 379 | E20: =MID(VLOOKUP(RC[-2],C13:C15,3,FALSE),FINDB(",",VLOOKUP(RC[-2],C13:C15,3,FALSE))+2,FIND(",",VLOOKUP(RC[-2],C13:C15,3,FALSE),FINDB(",",VLOOKUP(RC[-2],C13:C15,3,FALSE))+1)-FINDB(",",VLOOKUP(RC[-2],C13:C15,3,FALSE))-2) -> 3 | F20: =RIGHT(VLOOKUP(RC[-3],C13:C15,3,FALSE),LEN(VLOOKUP(RC[-3],C13:C15,3,FALSE))-FIND(",",VLOOKUP(RC[-3],C13:C15,3,FALSE),FINDB(",",VLOOKUP(RC[-3],C13:C15,3,FALSE))+1)-1) -> 63 | I20: =COUNTIF(C[-6],RC[-6]) -> 1 | M20: 10011195 | N20: 1101 | O20: 88, 0, 293 | P20: =IF(RC[-2]="","",IF(IFERROR(VLOOKUP(RC[-3],C[-13],1,FALSE),0)>0,"",1)) -> 
A21: 5002 | B21: 3001 | C21: 10012391 | G21: leaveCrossrealmCamp | H21: 28 | I21: =COUNTIF(C[-6],RC[-6]) -> 2 | M21: 10011196 | N21: 1005 | O21: 442, 10, 39 | P21: =IF(RC[-2]="","",IF(IFERROR(VLOOKUP(RC[-3],C[-13],1,FALSE),0)>0,"",1)) -> 
A22: 5002 | B22: 3001 | C22: 10012392 | G22: leaveCrossrealmCamp | H22: 28 | I22: =COUNTIF(C[-6],RC[-6]) -> 2 | M22: 10011197 | N22: 1102 | O22: 74, 0, 263 | P22: =IF(RC[-2]="","",IF(IFERROR(VLOOKUP(RC[-3],C[-13],1,FALSE),0)>0,"",1)) -> 
A23: 5003 | B23: 3001 | C23: 10012391 | G23: leaveCrossrealmCamp | H23: 30 | I23: =COUNTIF(C[-6],RC[-6]) -> 2 | M23: 10011198 | N23: 1101 | O23: 265, 12, 78 | P23: =IF(RC[-2]="","",IF(IFERROR(VLOOKUP(RC[-3],C[-13],1,FALSE),0)>0,"",1)) -> 
A24: 5003 | B24: 3001 | C24: 10012392 | G24: leaveCrossrealmCamp | H24: 30 | I24: =COUNTIF(C[-6],RC[-6]) -> 2 | M24: 10011199 | N24: 1003 | O24: 298, 0, 127 | P24: =IF(RC[-2]="","",IF(IFERROR(VLOOKUP(RC[-3],C[-13],1,FALSE),0)>0,"",1)) -> 
A25: 3001 | B25: 5002 | C25: 10012395 | G25: transferCrossrealmCamp | H25: 28 | I25: =COUNTIF(C[-6],RC[-6]) -> 1 | M25: 10011394 | P25: =IF(RC[-2]="","",IF(IFERROR(VLOOKUP(RC[-3],C[-13],1,FALSE),0)>0,"",1)) -> 
A26: 2000 | B26: 3000 | C26: 10013035 | D26: 81 | E26: 0 | F26: 15 | I26: =COUNTIF(C[-6],RC[-6]) -> 1 | M26: 10011395 | P26: =IF(RC[-2]="","",IF(IFERROR(VLOOKUP(RC[-3],C[-13],1,FALSE),0)>0,"",1)) -> 
M27: 10011396 | N27: 3001 | O27: 249, 0, 246 | P27: =IF(RC[-2]="","",IF(IFERROR(VLOOKUP(RC[-3],C[-13],1,FALSE),0)>0,"",1)) -> 
M28: 10011397 | N28: 1007 | O28: 40, 3, 290 | P28: =IF(RC[-2]="","",IF(IFERROR(VLOOKUP(RC[-3],C[-13],1,FALSE),0)>0,"",1)) -> 
M29: 10011398 | N29: 1004 | O29: 17, -3, 130 | P29: =IF(RC[-2]="","",IF(IFERROR(VLOOKUP(RC[-3],C[-13],1,FALSE),0)>0,"",1)) -> 1
M30: 10011399 | N30: 1003 | O30: 37, 0, 53 | P30: =IF(RC[-2]="","",IF(IFERROR(VLOOKUP(RC[-3],C[-13],1,FALSE),0)>0,"",1)) -> 
M31: 10011798 | N31: 1006 | O31: 234, 0, 67 | P31: =IF(RC[-2]="","",IF(IFERROR(VLOOKUP(RC[-3],C[-13],1,FALSE),0)>0,"",1)) -> 
M32: 10011799 | N32: 1009 | O32: 30, 0, 164 | P32: =IF(RC[-2]="","",IF(IFERROR(VLOOKUP(RC[-3],C[-13],1,FALSE),0)>0,"",1)) -> 
M33: 10011997 | N33: 1007 | O33: 379, 3, 63 | P33: =IF(RC[-2]="","",IF(IFERROR(VLOOKUP(RC[-3],C[-13],1,FALSE),0)>0,"",1)) -> 
M34: 10011998 | N34: 1103 | O34: 280, 0, 293 | P34: =IF(RC[-2]="","",IF(IFERROR(VLOOKUP(RC[-3],C[-13],1,FALSE),0)>0,"",1)) -> 
M35: 10011999 | P35: =IF(RC[-2]="","",IF(IFERROR(VLOOKUP(RC[-3],C[-13],1,FALSE),0)>0,"",1)) -> 
M36: 10012197 | N36: 1009 | O36: 140, 0 , 292 | P36: =IF(RC[-2]="","",IF(IFERROR(VLOOKUP(RC[-3],C[-13],1,FALSE),0)>0,"",1)) -> 
M37: 10012198 | N37: 1104 | O37: 298, 10, 258 | P37: =IF(RC[-2]="","",IF(IFERROR(VLOOKUP(RC[-3],C[-13],1,FALSE),0)>0,"",1)) -> 
M38: 10012199 | N38: 1103 | O38: 239, 10, 30 | P38: =IF(RC[-2]="","",IF(IFERROR(VLOOKUP(RC[-3],C[-13],1,FALSE),0)>0,"",1)) -> 
M39: 10012391 | P39: =IF(RC[-2]="","",IF(IFERROR(VLOOKUP(RC[-3],C[-13],1,FALSE),0)>0,"",1)) -> 
M40: 10012392 | P40: =IF(RC[-2]="","",IF(IFERROR(VLOOKUP(RC[-3],C[-13],1,FALSE),0)>0,"",1)) -> 
M41: 10012393 | P41: =IF(RC[-2]="","",IF(IFERROR(VLOOKUP(RC[-3],C[-13],1,FALSE),0)>0,"",1)) -> 
M42: 10012394 | P42: =IF(RC[-2]="","",IF(IFERROR(VLOOKUP(RC[-3],C[-13],1,FALSE),0)>0,"",1)) -> 
M43: 10012395 | P43: =IF(RC[-2]="","",IF(IFERROR(VLOOKUP(RC[-3],C[-13],1,FALSE),0)>0,"",1)) -> 
M44: 10012396 | P44: =IF(RC[-2]="","",IF(IFERROR(VLOOKUP(RC[-3],C[-13],1,FALSE),0)>0,"",1)) -> 
M45: 10012397 | P45: =IF(RC[-2]="","",IF(IFERROR(VLOOKUP(RC[-3],C[-13],1,FALSE),0)>0,"",1)) -> 
M46: 10012398 | P46: =IF(RC[-2]="","",IF(IFERROR(VLOOKUP(RC[-3],C[-13],1,FALSE),0)>0,"",1)) -> 
M47: 10012399 | P47: =IF(RC[-2]="","",IF(IFERROR(VLOOKUP(RC[-3],C[-13],1,FALSE),0)>0,"",1)) -> 
M48: 10060001 | P48: =IF(RC[-2]="","",IF(IFERROR(VLOOKUP(RC[-3],C[-13],1,FALSE),0)>0,"",1)) -> 
M49: 10060002 | P49: =IF(RC[-2]="","",IF(IFERROR(VLOOKUP(RC[-3],C[-13],1,FALSE),0)>0,"",1)) -> 
M50: 10060003 | P50: =IF(RC[-2]="","",IF(IFERROR(VLOOKUP(RC[-3],C[-13],1,FALSE),0)>0,"",1)) -> 
M51: 10060004 | P51: =IF(RC[-2]="","",IF(IFERROR(VLOOKUP(RC[-3],C[-13],1,FALSE),0)>0,"",1)) -> 
M52: 10060005 | P52: =IF(RC[-2]="","",IF(IFERROR(VLOOKUP(RC[-3],C[-13],1,FALSE),0)>0,"",1)) -> 
M53: 10013000 | P53: =IF(RC[-2]="","",IF(IFERROR(VLOOKUP(RC[-3],C[-13],1,FALSE),0)>0,"",1)) -> 
M54: 10013001 | P54: =IF(RC[-2]="","",IF(IFERROR(VLOOKUP(RC[-3],C[-13],1,FALSE),0)>0,"",1)) -> 
M55: 10013002 | P55: =IF(RC[-2]="","",IF(IFERROR(VLOOKUP(RC[-3],C[-13],1,FALSE),0)>0,"",1)) -> 
M56: 10013003 | P56: =IF(RC[-2]="","",IF(IFERROR(VLOOKUP(RC[-3],C[-13],1,FALSE),0)>0,"",1)) -> 
M57: 10013004 | P57: =IF(RC[-2]="","",IF(IFERROR(VLOOKUP(RC[-3],C[-13],1,FALSE),0)>0,"",1)) -> 
M58: 10013005 | P58: =IF(RC[-2]="","",IF(IFERROR(VLOOKUP(RC[-3],C[-13],1,FALSE),0)>0,"",1)) -> 
M59: 10013006 | P59: =IF(RC[-2]="","",IF(IFERROR(VLOOKUP(RC[-3],C[-13],1,FALSE),0)>0,"",1)) -> 
M60: 10013007 | P60: =IF(RC[-2]="","",IF(IFERROR(VLOOKUP(RC[-3],C[-13],1,FALSE),0)>0,"",1)) -> 
M61: 10013008 | P61: =IF(RC[-2]="","",IF(IFERROR(VLOOKUP(RC[-3],C[-13],1,FALSE),0)>0,"",1)) -> 
M62: 10013009 | P62: =IF(RC[-2]="","",IF(IFERROR(VLOOKUP(RC[-3],C[-13],1,FALSE),0)>0,"",1)) -> 
M63: 10013010 | P63: =IF(RC[-2]="","",IF(IFERROR(VLOOKUP(RC[-3],C[-13],1,FALSE),0)>0,"",1)) -> 
M64: 10013011 | P64: =IF(RC[-2]="","",IF(IFERROR(VLOOKUP(RC[-3],C[-13],1,FALSE),0)>0,"",1)) -> 
M65: 10013012 | P65: =IF(RC[-2]="","",IF(IFERROR(VLOOKUP(RC[-3],C[-13],1,FALSE),0)>0,"",1)) -> 
M66: 10013013 | P66: =IF(RC[-2]="","",IF(IFERROR(VLOOKUP(RC[-3],C[-13],1,FALSE),0)>0,"",1)) -> 
M67: 10013014 | P67: =IF(RC[-2]="","",IF(IFERROR(VLOOKUP(RC[-3],C[-13],1,FALSE),0)>0,"",1)) -> 
M68: 10013015 | P68: =IF(RC[-2]="","",IF(IFERROR(VLOOKUP(RC[-3],C[-13],1,FALSE),0)>0,"",1)) -> 
M69: 10013016 | P69: =IF(RC[-2]="","",IF(IFERROR(VLOOKUP(RC[-3],C[-13],1,FALSE),0)>0,"",1)) -> 
M70: 10013017 | P70: =IF(RC[-2]="","",IF(IFERROR(VLOOKUP(RC[-3],C[-13],1,FALSE),0)>0,"",1)) -> 
M71: 10013018 | P71: =IF(RC[-2]="","",IF(IFERROR(VLOOKUP(RC[-3],C[-13],1,FALSE),0)>0,"",1)) -> 
M72: 10013019 | P72: =IF(RC[-2]="","",IF(IFERROR(VLOOKUP(RC[-3],C[-13],1,FALSE),0)>0,"",1)) -> 
M73: 10013020 | P73: =IF(RC[-2]="","",IF(IFERROR(VLOOKUP(RC[-3],C[-13],1,FALSE),0)>0,"",1)) -> 
M74: 10013021 | P74: =IF(RC[-2]="","",IF(IFERROR(VLOOKUP(RC[-3],C[-13],1,FALSE),0)>0,"",1)) -> 
M75: 10013022 | P75: =IF(RC[-2]="","",IF(IFERROR(VLOOKUP(RC[-3],C[-13],1,FALSE),0)>0,"",1)) -> 
M76: 10013023 | P76: =IF(RC[-2]="","",IF(IFERROR(VLOOKUP(RC[-3],C[-13],1,FALSE),0)>0,"",1)) -> 
M77: 10013024 | P77: =IF(RC[-2]="","",IF(IFERROR(VLOOKUP(RC[-3],C[-13],1,FALSE),0)>0,"",1)) -> 
M78: 10013030 | P78: =IF(RC[-2]="","",IF(IFERROR(VLOOKUP(RC[-3],C[-13],1,FALSE),0)>0,"",1)) -> 
M79: 10013031 | P79: =IF(RC[-2]="","",IF(IFERROR(VLOOKUP(RC[-3],C[-13],1,FALSE),0)>0,"",1)) -> 
M80: 10013032 | P80: =IF(RC[-2]="","",IF(IFERROR(VLOOKUP(RC[-3],C[-13],1,FALSE),0)>0,"",1)) -> 
M81: 10013033 | P81: =IF(RC[-2]="","",IF(IFERROR(VLOOKUP(RC[-3],C[-13],1,FALSE),0)>0,"",1)) -> 
M82: 10013034 | P82: =IF(RC[-2]="","",IF(IFERROR(VLOOKUP(RC[-3],C[-13],1,FALSE),0)>0,"",1)) -> 
M83: 10020010 | P83: =IF(RC[-2]="","",IF(IFERROR(VLOOKUP(RC[-3],C[-13],1,FALSE),0)>0,"",1)) -> 
M84: 10020011 | P84: =IF(RC[-2]="","",IF(IFERROR(VLOOKUP(RC[-3],C[-13],1,FALSE),0)>0,"",1)) -> 
M85: 10021000 | P85: =IF(RC[-2]="","",IF(IFERROR(VLOOKUP(RC[-3],C[-13],1,FALSE),0)>0,"",1)) -> 
M86: 10021001 | P86: =IF(RC[-2]="","",IF(IFERROR(VLOOKUP(RC[-3],C[-13],1,FALSE),0)>0,"",1)) -> 
M87: 10021002 | P87: =IF(RC[-2]="","",IF(IFERROR(VLOOKUP(RC[-3],C[-13],1,FALSE),0)>0,"",1)) -> 
M88: 10021003 | P88: =IF(RC[-2]="","",IF(IFERROR(VLOOKUP(RC[-3],C[-13],1,FALSE),0)>0,"",1)) -> 
M89: 10021004 | P89: =IF(RC[-2]="","",IF(IFERROR(VLOOKUP(RC[-3],C[-13],1,FALSE),0)>0,"",1)) -> 
M90: 10021005 | P90: =IF(RC[-2]="","",IF(IFERROR(VLOOKUP(RC[-3],C[-13],1,FALSE),0)>0,"",1)) -> 
M91: 10014000 | P91: =IF(RC[-2]="","",IF(IFERROR(VLOOKUP(RC[-3],C[-13],1,FALSE),0)>0,"",1)) -> 