Sheet: task
A1: 任务编号 | B1: 描述名称 | C1: 条件类型 | D1: 任务名称 | E1: 前置任务 | F1: 接任务NPC | G1: 交任务NPC | H1: 自动接取后续任务 | I1: 完成后尝试领取任务 | J1: 等级下限 | K1: 等级上限 | L1: 接取后自动化 | M1: 完成后自动化 | N1: 任务类型 | O1: 接取任务传送 | P1: 任务权重 | Q1: 可放弃 | R1: 放弃不可重接 | S1: 任务不可见 | T1: 环任务类型 | U1: 父任务id | V1: 子任务列表 | W1: 完成后可重接 | X1: 阵营 | Y1: 接取任务操作 | Z1: 放弃任务操作 | AA1: 提交任务操作 | AB1: 可接任务描述 | AC1: 任务描述 | AD1: 接受任务对话 | AE1: 未完成对话 | AF1: 完成任务对话 | AG1: 提交任务提示辅助列 | AH1: 提交任务提示 | AI1: 任务等级 | AJ1: 任务品质 | AK1: 金币奖励 | AL1: 经验奖励 | AM1: 物品奖励 | AN1: 副本内任务 | AO1: 完成任务是否播放特效（0不播，默认播）
A2: sid | D2: name | E2: task_completed | F2: get_npc | G2: complete_npc | H2: succeed | I2: auto_task | J2: level_min | K2: level_max | L2: accept_auto | M2: complete_auto | N2: task_type | O2: scene_pos | P2: task_weight | Q2: can_giveup | R2: giveup_retained | S2: invisible | T2: round_type | U2: father_sid | V2: sidlist | W2: repeated_task | X2: camp | Y2: get_mfa | Z2: giveup_mfa | AA2: succeed_mfa | AB2: accept_info | AC2: describe | AD2: get_talk | AE2: handle_talk | AF2: complete_talk | AH2: submit_guide | AI2: priority | AJ2: quality | AK2: gold_award | AL2: experience_award | AM2: items_award | AN2: carbon_task | AO2: showFlag
A3: ='E:\mowen_game\int\piassets\common_cfg\xls\[summary.xml]task'!RC[3] -> 10300301 | B3: =VLOOKUP(RC[-1],'E:\mowen_game\int\piassets\common_cfg\xls\[summary.xml]task'!C4:C8,5,FALSE) -> 魔纹之谜1 | C3: =VLOOKUP(RC[-2],'E:\mowen_game\int\piassets\common_cfg\xls\[summary.xml]task'!C4:C5,2,FALSE) -> 对话npc | D3: =VLOOKUP(RC[-3],'E:\mowen_game\int\piassets\common_cfg\xls\[summary.xml]task'!C4:C6,3,FALSE) -> 魔纹之谜 | G3: =VLOOKUP(RC[-6],'E:\mowen_game\int\piassets\common_cfg\xls\[summary.xml]task'!C4:C13,10,FALSE) -> 10013000 | H3: ="["&R[1]C[-7]&"]" -> [10300302] | J3: 1 | K3: 100 | L3: 1 | M3: 1 | N3: 主线 | P3: 1000 | AG3: <希德|arg=10013000>正在神佑之地等待你 | AH3: =""""&RC[-1]&"""" -> "<希德|arg=10013000>正在神佑之地等待你" | AI3: 1 | AJ3: 2 | AK3: 0 | AL3: 0 | AM3: {item,{110001001,90}}
A4: ='E:\mowen_game\int\piassets\common_cfg\xls\[summary.xml]task'!RC[3] -> 10300302 | B4: =VLOOKUP(RC[-1],'E:\mowen_game\int\piassets\common_cfg\xls\[summary.xml]task'!C4:C8,5,FALSE) -> 分头巡视1 | C4: =VLOOKUP(RC[-2],'E:\mowen_game\int\piassets\common_cfg\xls\[summary.xml]task'!C4:C5,2,FALSE) -> 探索区域 | D4: =VLOOKUP(RC[-3],'E:\mowen_game\int\piassets\common_cfg\xls\[summary.xml]task'!C4:C6,3,FALSE) -> 分头巡视 | E4: =VLOOKUP(RC[-4],'E:\mowen_game\int\piassets\common_cfg\xls\[summary.xml]task'!C4:C11,6,FALSE) -> 10300301 | F4: =VLOOKUP(RC[-5],'E:\mowen_game\int\piassets\common_cfg\xls\[summary.xml]task'!C4:C11,8,FALSE) -> 10013000 | H4: ="["&R[4]C[-7]&"]" -> [10300306] | J4: 1 | K4: 100 | L4: 1 | M4: 1 | N4: 主线 | P4: 1000 | AI4: 1 | AJ4: 2 | AK4: 0 | AL4: 50000
A5: ='E:\mowen_game\int\piassets\common_cfg\xls\[summary.xml]task'!RC[3] -> 10300303 | B5: =VLOOKUP(RC[-1],'E:\mowen_game\int\piassets\common_cfg\xls\[summary.xml]task'!C4:C8,5,FALSE) -> 击退迅影龙1 | C5: =VLOOKUP(RC[-2],'E:\mowen_game\int\piassets\common_cfg\xls\[summary.xml]task'!C4:C5,2,FALSE) -> 击杀npc | D5: =VLOOKUP(RC[-3],'E:\mowen_game\int\piassets\common_cfg\xls\[summary.xml]task'!C4:C6,3,FALSE) -> 击退迅影龙 | E5: =VLOOKUP(RC[-4],'E:\mowen_game\int\piassets\common_cfg\xls\[summary.xml]task'!C4:C11,6,FALSE) -> 10300338 | H5: ="["&R[1]C[-7]&"]" -> [10300304] | J5: 1 | K5: 100 | L5: 1 | M5: 1 | N5: 主线 | P5: 1000 | AI5: 1 | AJ5: 2 | AK5: 0 | AL5: 10000 | AN5: 1
A6: ='E:\mowen_game\int\piassets\common_cfg\xls\[summary.xml]task'!RC[3] -> 10300304 | B6: =VLOOKUP(RC[-1],'E:\mowen_game\int\piassets\common_cfg\xls\[summary.xml]task'!C4:C8,5,FALSE) -> 联系希德1 | C6: =VLOOKUP(RC[-2],'E:\mowen_game\int\piassets\common_cfg\xls\[summary.xml]task'!C4:C5,2,FALSE) -> 探索区域 | D6: =VLOOKUP(RC[-3],'E:\mowen_game\int\piassets\common_cfg\xls\[summary.xml]task'!C4:C6,3,FALSE) -> 联系希德 | E6: =VLOOKUP(RC[-4],'E:\mowen_game\int\piassets\common_cfg\xls\[summary.xml]task'!C4:C11,6,FALSE) -> 10300303 | H6: ="["&R[1]C[-7]&"]" -> [10300305] | J6: 1 | K6: 100 | L6: 1 | M6: 1 | N6: 主线 | P6: 1000 | AI6: 1 | AJ6: 2 | AK6: 0 | AL6: 0 | AN6: 1 | AO6: 0
A7: ='E:\mowen_game\int\piassets\common_cfg\xls\[summary.xml]task'!RC[3] -> 10300305 | B7: =VLOOKUP(RC[-1],'E:\mowen_game\int\piassets\common_cfg\xls\[summary.xml]task'!C4:C8,5,FALSE) -> 解救希德1 | C7: =VLOOKUP(RC[-2],'E:\mowen_game\int\piassets\common_cfg\xls\[summary.xml]task'!C4:C5,2,FALSE) -> 击杀npc | D7: =VLOOKUP(RC[-3],'E:\mowen_game\int\piassets\common_cfg\xls\[summary.xml]task'!C4:C6,3,FALSE) -> 解救希德 | E7: =VLOOKUP(RC[-4],'E:\mowen_game\int\piassets\common_cfg\xls\[summary.xml]task'!C4:C11,6,FALSE) -> 10300304 | G7: =VLOOKUP(RC[-6],'E:\mowen_game\int\piassets\common_cfg\xls\[summary.xml]task'!C4:C13,10,FALSE) -> 10013001 | H7: [] | J7: 1 | K7: 100 | L7: 1 | M7: 1 | N7: 主线 | P7: 1000 | AE7: 2 | AG7: ="回复<"&LEFT(VLOOKUP(RC[-32],'E:\mowen_game\int\piassets\common_cfg\xls\[summary.xml]task'!C4:C18,9,FALSE),LEN(VLOOKUP(RC[-32],'E:\mowen_game\int\piassets\common_cfg\xls\[summary.xml]task'!C4:C18,9,FALSE))-1)&"|arg="&RC[-26]&">" -> 回复<希德|arg=10013001> | AH7: =""""&RC[-1]&"""" -> "回复<希德|arg=10013001>" | AI7: 1 | AJ7: 2 | AK7: 0 | AL7: 40000 | AN7: 1
A8: ='E:\mowen_game\int\piassets\common_cfg\xls\[summary.xml]task'!RC[3] -> 10300306 | B8: =VLOOKUP(RC[-1],'E:\mowen_game\int\piassets\common_cfg\xls\[summary.xml]task'!C4:C8,5,FALSE) -> 汇报异常情况1 | C8: =VLOOKUP(RC[-2],'E:\mowen_game\int\piassets\common_cfg\xls\[summary.xml]task'!C4:C5,2,FALSE) -> 对话npc | D8: =VLOOKUP(RC[-3],'E:\mowen_game\int\piassets\common_cfg\xls\[summary.xml]task'!C4:C6,3,FALSE) -> 汇报异常情况 | E8: =VLOOKUP(RC[-4],'E:\mowen_game\int\piassets\common_cfg\xls\[summary.xml]task'!C4:C11,6,FALSE) -> 10300305 | F8: =VLOOKUP(RC[-5],'E:\mowen_game\int\piassets\common_cfg\xls\[summary.xml]task'!C4:C11,8,FALSE) -> 10013001 | G8: =VLOOKUP(RC[-6],'E:\mowen_game\int\piassets\common_cfg\xls\[summary.xml]task'!C4:C13,10,FALSE) -> 10013002 | H8: ="["&R[1]C[-7]&"]" -> [10300307] | J8: 1 | K8: 100 | L8: 1 | M8: 1 | N8: 主线 | P8: 1000 | AG8: ="回复<"&LEFT(VLOOKUP(RC[-32],'E:\mowen_game\int\piassets\common_cfg\xls\[summary.xml]task'!C4:C18,9,FALSE),LEN(VLOOKUP(RC[-32],'E:\mowen_game\int\piassets\common_cfg\xls\[summary.xml]task'!C4:C18,9,FALSE))-1)&"|arg="&RC[-26]&">" -> 回复<巴尔大叔|arg=10013002> | AH8: =""""&RC[-1]&"""" -> "回复<巴尔大叔|arg=10013002>" | AI8: 1 | AJ8: 2 | AK8: 0 | AL8: 50000
A9: ='E:\mowen_game\int\piassets\common_cfg\xls\[summary.xml]task'!RC[3] -> 10300307 | B9: =VLOOKUP(RC[-1],'E:\mowen_game\int\piassets\common_cfg\xls\[summary.xml]task'!C4:C8,5,FALSE) -> 通知村长1 | C9: =VLOOKUP(RC[-2],'E:\mowen_game\int\piassets\common_cfg\xls\[summary.xml]task'!C4:C5,2,FALSE) -> 对话npc | D9: =VLOOKUP(RC[-3],'E:\mowen_game\int\piassets\common_cfg\xls\[summary.xml]task'!C4:C6,3,FALSE) -> 通知村长 | E9: =VLOOKUP(RC[-4],'E:\mowen_game\int\piassets\common_cfg\xls\[summary.xml]task'!C4:C11,6,FALSE) -> 10300306 | F9: =VLOOKUP(RC[-5],'E:\mowen_game\int\piassets\common_cfg\xls\[summary.xml]task'!C4:C11,8,FALSE) -> 10013002 | G9: =VLOOKUP(RC[-6],'E:\mowen_game\int\piassets\common_cfg\xls\[summary.xml]task'!C4:C13,10,FALSE) -> 10013004 | H9: ="["&R[1]C[-7]&"]" -> [10300308] | J9: 1 | K9: 100 | L9: 1 | M9: 1 | N9: 主线 | P9: 1000 | AG9: ="回复<"&LEFT(VLOOKUP(RC[-32],'E:\mowen_game\int\piassets\common_cfg\xls\[summary.xml]task'!C4:C18,9,FALSE),LEN(VLOOKUP(RC[-32],'E:\mowen_game\int\piassets\common_cfg\xls\[summary.xml]task'!C4:C18,9,FALSE))-1)&"|arg="&RC[-26]&">" -> 回复<村长|arg=10013004> | AH9: =""""&RC[-1]&"""" -> "回复<村长|arg=10013004>" | AI9: 1 | AJ9: 2 | AK9: 0 | AL9: 80000
A10: ='E:\mowen_game\int\piassets\common_cfg\xls\[summary.xml]task'!RC[3] -> 10300308 | B10: =VLOOKUP(RC[-1],'E:\mowen_game\int\piassets\common_cfg\xls\[summary.xml]task'!C4:C8,5,FALSE) -> 前往祭坛1 | C10: =VLOOKUP(RC[-2],'E:\mowen_game\int\piassets\common_cfg\xls\[summary.xml]task'!C4:C5,2,FALSE) -> 探索区域 | D10: =VLOOKUP(RC[-3],'E:\mowen_game\int\piassets\common_cfg\xls\[summary.xml]task'!C4:C6,3,FALSE) -> 前往祭坛 | E10: =VLOOKUP(RC[-4],'E:\mowen_game\int\piassets\common_cfg\xls\[summary.xml]task'!C4:C11,6,FALSE) -> 10300307 | F10: =VLOOKUP(RC[-5],'E:\mowen_game\int\piassets\common_cfg\xls\[summary.xml]task'!C4:C11,8,FALSE) -> 10013004 | H10: [10300312] | J10: 1 | K10: 100 | L10: 1 | M10: 1 | N10: 主线 | P10: 1000 | AI10: 1 | AJ10: 2 | AK10: 0 | AL10: 0
A11: ='E:\mowen_game\int\piassets\common_cfg\xls\[summary.xml]task'!RC[3] -> 10300309 | B11: =VLOOKUP(RC[-1],'E:\mowen_game\int\piassets\common_cfg\xls\[summary.xml]task'!C4:C8,5,FALSE) -> 保护祭坛1 | C11: =VLOOKUP(RC[-2],'E:\mowen_game\int\piassets\common_cfg\xls\[summary.xml]task'!C4:C5,2,FALSE) -> 击杀npc | D11: =VLOOKUP(RC[-3],'E:\mowen_game\int\piassets\common_cfg\xls\[summary.xml]task'!C4:C6,3,FALSE) -> 保护祭坛 | E11: =VLOOKUP(RC[-4],'E:\mowen_game\int\piassets\common_cfg\xls\[summary.xml]task'!C4:C11,6,FALSE) -> 10300339 | G11: =VLOOKUP(RC[-6],'E:\mowen_game\int\piassets\common_cfg\xls\[summary.xml]task'!C4:C13,10,FALSE) -> 10013005 | H11: ="["&R[1]C[-7]&"]" -> [10300310] | J11: 1 | K11: 100 | L11: 1 | M11: 1 | N11: 主线 | P11: 1000 | AE11: 2 | AG11: ="回复<"&LEFT(VLOOKUP(RC[-32],'E:\mowen_game\int\piassets\common_cfg\xls\[summary.xml]task'!C4:C18,9,FALSE),LEN(VLOOKUP(RC[-32],'E:\mowen_game\int\piassets\common_cfg\xls\[summary.xml]task'!C4:C18,9,FALSE))-1)&"|arg="&RC[-26]&">" -> 回复<村长|arg=10013005> | AH11: =""""&RC[-1]&"""" -> "回复<村长|arg=10013005>" | AI11: 1 | AJ11: 2 | AK11: 0 | AL11: 50000 | AN11: 1
A12: ='E:\mowen_game\int\piassets\common_cfg\xls\[summary.xml]task'!RC[3] -> 10300310 | B12: =VLOOKUP(RC[-1],'E:\mowen_game\int\piassets\common_cfg\xls\[summary.xml]task'!C4:C8,5,FALSE) -> 激活祭坛1 | C12: =VLOOKUP(RC[-2],'E:\mowen_game\int\piassets\common_cfg\xls\[summary.xml]task'!C4:C5,2,FALSE) -> 采集无物品 | D12: =VLOOKUP(RC[-3],'E:\mowen_game\int\piassets\common_cfg\xls\[summary.xml]task'!C4:C6,3,FALSE) -> 激活祭坛 | E12: =VLOOKUP(RC[-4],'E:\mowen_game\int\piassets\common_cfg\xls\[summary.xml]task'!C4:C11,6,FALSE) -> 10300309 | F12: =VLOOKUP(RC[-5],'E:\mowen_game\int\piassets\common_cfg\xls\[summary.xml]task'!C4:C11,8,FALSE) -> 10013005 | G12: =VLOOKUP(RC[-6],'E:\mowen_game\int\piassets\common_cfg\xls\[summary.xml]task'!C4:C13,10,FALSE) -> 10013005 | H12: ="["&R[1]C[-7]&"]" -> [10300311] | J12: 1 | K12: 100 | L12: 1 | M12: 1 | N12: 主线 | P12: 1000 | AE12: 3 | AG12: ="回复<"&LEFT(VLOOKUP(RC[-32],'E:\mowen_game\int\piassets\common_cfg\xls\[summary.xml]task'!C4:C18,9,FALSE),LEN(VLOOKUP(RC[-32],'E:\mowen_game\int\piassets\common_cfg\xls\[summary.xml]task'!C4:C18,9,FALSE))-1)&"|arg="&RC[-26]&">" -> 回复<村长|arg=10013005> | AH12: =""""&RC[-1]&"""" -> "回复<村长|arg=10013005>" | AI12: 1 | AJ12: 2 | AK12: 0 | AL12: 50000 | AN12: 1
A13: ='E:\mowen_game\int\piassets\common_cfg\xls\[summary.xml]task'!RC[3] -> 10300311 | B13: =VLOOKUP(RC[-1],'E:\mowen_game\int\piassets\common_cfg\xls\[summary.xml]task'!C4:C8,5,FALSE) -> 敲钟预警1 | C13: =VLOOKUP(RC[-2],'E:\mowen_game\int\piassets\common_cfg\xls\[summary.xml]task'!C4:C5,2,FALSE) -> 击杀npc | D13: =VLOOKUP(RC[-3],'E:\mowen_game\int\piassets\common_cfg\xls\[summary.xml]task'!C4:C6,3,FALSE) -> 敲钟预警 | E13: =VLOOKUP(RC[-4],'E:\mowen_game\int\piassets\common_cfg\xls\[summary.xml]task'!C4:C11,6,FALSE) -> 10300310 | F13: =VLOOKUP(RC[-5],'E:\mowen_game\int\piassets\common_cfg\xls\[summary.xml]task'!C4:C11,8,FALSE) -> 10013005 | G13: =VLOOKUP(RC[-6],'E:\mowen_game\int\piassets\common_cfg\xls\[summary.xml]task'!C4:C13,10,FALSE) -> 10013006 | H13: [] | J13: 1 | K13: 100 | L13: 1 | M13: 1 | N13: 主线 | P13: 1000 | AE13: 2 | AG13: ="回复<"&LEFT(VLOOKUP(RC[-32],'E:\mowen_game\int\piassets\common_cfg\xls\[summary.xml]task'!C4:C18,9,FALSE),LEN(VLOOKUP(RC[-32],'E:\mowen_game\int\piassets\common_cfg\xls\[summary.xml]task'!C4:C18,9,FALSE))-1)&"|arg="&RC[-26]&">" -> 回复<村长|arg=10013006> | AH13: =""""&RC[-1]&"""" -> "回复<村长|arg=10013006>" | AI13: 1 | AJ13: 2 | AK13: 0 | AN13: 1
A14: ='E:\mowen_game\int\piassets\common_cfg\xls\[summary.xml]task'!RC[3] -> 10300312 | B14: =VLOOKUP(RC[-1],'E:\mowen_game\int\piassets\common_cfg\xls\[summary.xml]task'!C4:C8,5,FALSE) -> 村口惊变1 | C14: =VLOOKUP(RC[-2],'E:\mowen_game\int\piassets\common_cfg\xls\[summary.xml]task'!C4:C5,2,FALSE) -> 对话npc | D14: =VLOOKUP(RC[-3],'E:\mowen_game\int\piassets\common_cfg\xls\[summary.xml]task'!C4:C6,3,FALSE) -> 村口惊变 | E14: =VLOOKUP(RC[-4],'E:\mowen_game\int\piassets\common_cfg\xls\[summary.xml]task'!C4:C11,6,FALSE) -> 10300311 | F14: =VLOOKUP(RC[-5],'E:\mowen_game\int\piassets\common_cfg\xls\[summary.xml]task'!C4:C11,8,FALSE) -> 10013006 | G14: =VLOOKUP(RC[-6],'E:\mowen_game\int\piassets\common_cfg\xls\[summary.xml]task'!C4:C13,10,FALSE) -> 10013009 | H14: ="["&R[1]C[-7]&"]" -> [10300313] | J14: 1 | K14: 100 | L14: 1 | M14: 1 | N14: 主线 | P14: 1000 | AG14: ="回复<"&LEFT(VLOOKUP(RC[-32],'E:\mowen_game\int\piassets\common_cfg\xls\[summary.xml]task'!C4:C18,9,FALSE),LEN(VLOOKUP(RC[-32],'E:\mowen_game\int\piassets\common_cfg\xls\[summary.xml]task'!C4:C18,9,FALSE))-1)&"|arg="&RC[-26]&">" -> 回复<受伤的村民|arg=10013009> | AH14: =""""&RC[-1]&"""" -> "回复<受伤的村民|arg=10013009>" | AI14: 1 | AJ14: 2 | AK14: 0 | AL14: 80000 | AM14: {enhance_money,20}
A15: ='E:\mowen_game\int\piassets\common_cfg\xls\[summary.xml]task'!RC[3] -> 10300313 | B15: =VLOOKUP(RC[-1],'E:\mowen_game\int\piassets\common_cfg\xls\[summary.xml]task'!C4:C8,5,FALSE) -> 探查村外1 | C15: =VLOOKUP(RC[-2],'E:\mowen_game\int\piassets\common_cfg\xls\[summary.xml]task'!C4:C5,2,FALSE) -> 探索区域 | D15: =VLOOKUP(RC[-3],'E:\mowen_game\int\piassets\common_cfg\xls\[summary.xml]task'!C4:C6,3,FALSE) -> 探查村外 | E15: =VLOOKUP(RC[-4],'E:\mowen_game\int\piassets\common_cfg\xls\[summary.xml]task'!C4:C11,6,FALSE) -> 10300312 | F15: =VLOOKUP(RC[-5],'E:\mowen_game\int\piassets\common_cfg\xls\[summary.xml]task'!C4:C11,8,FALSE) -> 10013009 | H15: ="["&R[3]C[-7]&"]" -> [10300316] | J15: 1 | K15: 100 | L15: 1 | M15: 1 | N15: 主线 | P15: 1000 | AI15: 1 | AJ15: 2 | AK15: 0 | AL15: 0 | AM15: {enhance_money,20}
A16: ='E:\mowen_game\int\piassets\common_cfg\xls\[summary.xml]task'!RC[3] -> 10300314 | B16: =VLOOKUP(RC[-1],'E:\mowen_game\int\piassets\common_cfg\xls\[summary.xml]task'!C4:C8,5,FALSE) -> 清除爪牙1 | C16: =VLOOKUP(RC[-2],'E:\mowen_game\int\piassets\common_cfg\xls\[summary.xml]task'!C4:C5,2,FALSE) -> 击杀npc | D16: =VLOOKUP(RC[-3],'E:\mowen_game\int\piassets\common_cfg\xls\[summary.xml]task'!C4:C6,3,FALSE) -> 清除爪牙 | E16: =VLOOKUP(RC[-4],'E:\mowen_game\int\piassets\common_cfg\xls\[summary.xml]task'!C4:C11,6,FALSE) -> 10300340 | H16: ="["&R[1]C[-7]&"]" -> [10300315] | J16: 1 | K16: 100 | L16: 1 | M16: 1 | N16: 主线 | P16: 1000 | AI16: 1 | AJ16: 2 | AK16: 0 | AL16: 80000 | AN16: 1
A17: ='E:\mowen_game\int\piassets\common_cfg\xls\[summary.xml]task'!RC[3] -> 10300315 | B17: =VLOOKUP(RC[-1],'E:\mowen_game\int\piassets\common_cfg\xls\[summary.xml]task'!C4:C8,5,FALSE) -> 魔纹觉醒1 | C17: =VLOOKUP(RC[-2],'E:\mowen_game\int\piassets\common_cfg\xls\[summary.xml]task'!C4:C5,2,FALSE) -> 击杀npc | D17: =VLOOKUP(RC[-3],'E:\mowen_game\int\piassets\common_cfg\xls\[summary.xml]task'!C4:C6,3,FALSE) -> 魔纹觉醒 | E17: =VLOOKUP(RC[-4],'E:\mowen_game\int\piassets\common_cfg\xls\[summary.xml]task'!C4:C11,6,FALSE) -> 10300314 | G17: =VLOOKUP(RC[-6],'E:\mowen_game\int\piassets\common_cfg\xls\[summary.xml]task'!C4:C13,10,FALSE) -> 10013008 | H17: [] | J17: 1 | K17: 100 | L17: 1 | M17: 1 | N17: 主线 | P17: 1000 | AE17: 2 | AG17: ="回复<"&LEFT(VLOOKUP(RC[-32],'E:\mowen_game\int\piassets\common_cfg\xls\[summary.xml]task'!C4:C18,9,FALSE),LEN(VLOOKUP(RC[-32],'E:\mowen_game\int\piassets\common_cfg\xls\[summary.xml]task'!C4:C18,9,FALSE))-1)&"|arg="&RC[-26]&">" -> 回复<黑袍人|arg=10013008> | AH17: =""""&RC[-1]&"""" -> "回复<黑袍人|arg=10013008>" | AI17: 1 | AJ17: 2 | AK17: 0 | AL17: 80000 | AN17: 1
A18: ='E:\mowen_game\int\piassets\common_cfg\xls\[summary.xml]task'!RC[3] -> 10300316 | B18: =VLOOKUP(RC[-1],'E:\mowen_game\int\piassets\common_cfg\xls\[summary.xml]task'!C4:C8,5,FALSE) -> 回援村庄1 | C18: =VLOOKUP(RC[-2],'E:\mowen_game\int\piassets\common_cfg\xls\[summary.xml]task'!C4:C5,2,FALSE) -> 探索区域 | D18: =VLOOKUP(RC[-3],'E:\mowen_game\int\piassets\common_cfg\xls\[summary.xml]task'!C4:C6,3,FALSE) -> 回援村庄 | E18: =VLOOKUP(RC[-4],'E:\mowen_game\int\piassets\common_cfg\xls\[summary.xml]task'!C4:C11,6,FALSE) -> 10300315 | F18: =VLOOKUP(RC[-5],'E:\mowen_game\int\piassets\common_cfg\xls\[summary.xml]task'!C4:C11,8,FALSE) -> 10013008 | H18: ="["&R[4]C[-7]&"]" -> [10300320] | J18: 1 | K18: 100 | L18: 1 | M18: 1 | N18: 主线 | P18: 1000 | AI18: 1 | AJ18: 2 | AK18: 0 | AL18: 0
A19: ='E:\mowen_game\int\piassets\common_cfg\xls\[summary.xml]task'!RC[3] -> 10300317 | B19: =VLOOKUP(RC[-1],'E:\mowen_game\int\piassets\common_cfg\xls\[summary.xml]task'!C4:C8,5,FALSE) -> 消灭恶魔1 | C19: =VLOOKUP(RC[-2],'E:\mowen_game\int\piassets\common_cfg\xls\[summary.xml]task'!C4:C5,2,FALSE) -> 击杀npc | D19: =VLOOKUP(RC[-3],'E:\mowen_game\int\piassets\common_cfg\xls\[summary.xml]task'!C4:C6,3,FALSE) -> 消灭恶魔 | E19: =VLOOKUP(RC[-4],'E:\mowen_game\int\piassets\common_cfg\xls\[summary.xml]task'!C4:C11,6,FALSE) -> 10300341 | G19: =VLOOKUP(RC[-6],'E:\mowen_game\int\piassets\common_cfg\xls\[summary.xml]task'!C4:C13,10,FALSE) -> 10013003 | H19: [10300318] | J19: 1 | K19: 100 | L19: 1 | M19: 1 | N19: 主线 | P19: 1000 | AE19: 2 | AG19: ="回复<"&LEFT(VLOOKUP(RC[-32],'E:\mowen_game\int\piassets\common_cfg\xls\[summary.xml]task'!C4:C18,9,FALSE),LEN(VLOOKUP(RC[-32],'E:\mowen_game\int\piassets\common_cfg\xls\[summary.xml]task'!C4:C18,9,FALSE))-1)&"|arg="&RC[-26]&">" -> 回复<巴尔大叔|arg=10013003> | AH19: =""""&RC[-1]&"""" -> "回复<巴尔大叔|arg=10013003>" | AI19: 1 | AJ19: 2 | AK19: 0 | AL19: 50000 | AM19: {enhance_money,20} | AN19: 1
A20: ='E:\mowen_game\int\piassets\common_cfg\xls\[summary.xml]task'!RC[3] -> 10300318 | B20: =VLOOKUP(RC[-1],'E:\mowen_game\int\piassets\common_cfg\xls\[summary.xml]task'!C4:C8,5,FALSE) -> 保护村民1 | C20: =VLOOKUP(RC[-2],'E:\mowen_game\int\piassets\common_cfg\xls\[summary.xml]task'!C4:C5,2,FALSE) -> 击杀npc | D20: =VLOOKUP(RC[-3],'E:\mowen_game\int\piassets\common_cfg\xls\[summary.xml]task'!C4:C6,3,FALSE) -> 保护村民 | E20: =VLOOKUP(RC[-4],'E:\mowen_game\int\piassets\common_cfg\xls\[summary.xml]task'!C4:C11,6,FALSE) -> 10300317 | F20: =VLOOKUP(RC[-5],'E:\mowen_game\int\piassets\common_cfg\xls\[summary.xml]task'!C4:C11,8,FALSE) -> 10013003 | H20: ="["&R[1]C[-7]&"]" -> [10300319] | J20: 1 | K20: 100 | L20: 1 | M20: 1 | N20: 主线 | P20: 1000 | AI20: 1 | AJ20: 2 | AK20: 0 | AL20: 50000 | AN20: 1
A21: ='E:\mowen_game\int\piassets\common_cfg\xls\[summary.xml]task'!RC[3] -> 10300319 | B21: =VLOOKUP(RC[-1],'E:\mowen_game\int\piassets\common_cfg\xls\[summary.xml]task'!C4:C8,5,FALSE) -> 摧毁传送门1 | C21: =VLOOKUP(RC[-2],'E:\mowen_game\int\piassets\common_cfg\xls\[summary.xml]task'!C4:C5,2,FALSE) -> 击杀npc | D21: =VLOOKUP(RC[-3],'E:\mowen_game\int\piassets\common_cfg\xls\[summary.xml]task'!C4:C6,3,FALSE) -> 摧毁传送门 | E21: =VLOOKUP(RC[-4],'E:\mowen_game\int\piassets\common_cfg\xls\[summary.xml]task'!C4:C11,6,FALSE) -> 10300318 | G21: =VLOOKUP(RC[-6],'E:\mowen_game\int\piassets\common_cfg\xls\[summary.xml]task'!C4:C13,10,FALSE) -> 10013007 | H21: [] | J21: 1 | K21: 100 | L21: 1 | M21: 1 | N21: 主线 | P21: 1000 | AE21: 2 | AG21: ="回复<"&LEFT(VLOOKUP(RC[-32],'E:\mowen_game\int\piassets\common_cfg\xls\[summary.xml]task'!C4:C18,9,FALSE),LEN(VLOOKUP(RC[-32],'E:\mowen_game\int\piassets\common_cfg\xls\[summary.xml]task'!C4:C18,9,FALSE))-1)&"|arg="&RC[-26]&">" -> 回复<村长|arg=10013007> | AH21: =""""&RC[-1]&"""" -> "回复<村长|arg=10013007>" | AI21: 1 | AJ21: 2 | AK21: 0 | AL21: 80000 | AN21: 1
A22: ='E:\mowen_game\int\piassets\common_cfg\xls\[summary.xml]task'!RC[3] -> 10300320 | B22: =VLOOKUP(RC[-1],'E:\mowen_game\int\piassets\common_cfg\xls\[summary.xml]task'!C4:C8,5,FALSE) -> 接应援军1 | C22: =VLOOKUP(RC[-2],'E:\mowen_game\int\piassets\common_cfg\xls\[summary.xml]task'!C4:C5,2,FALSE) -> 探索区域 | D22: =VLOOKUP(RC[-3],'E:\mowen_game\int\piassets\common_cfg\xls\[summary.xml]task'!C4:C6,3,FALSE) -> 接应援军 | E22: =VLOOKUP(RC[-4],'E:\mowen_game\int\piassets\common_cfg\xls\[summary.xml]task'!C4:C11,6,FALSE) -> 10300319 | F22: =VLOOKUP(RC[-5],'E:\mowen_game\int\piassets\common_cfg\xls\[summary.xml]task'!C4:C11,8,FALSE) -> 10013007 | H22: [10300323] | J22: 1 | K22: 100 | L22: 1 | M22: 1 | N22: 主线 | P22: 1000 | AI22: 1 | AJ22: 2 | AK22: 0 | AL22: 0
A23: ='E:\mowen_game\int\piassets\common_cfg\xls\[summary.xml]task'!RC[3] -> 10300321 | B23: =VLOOKUP(RC[-1],'E:\mowen_game\int\piassets\common_cfg\xls\[summary.xml]task'!C4:C8,5,FALSE) -> 消灭精灵龙1 | C23: =VLOOKUP(RC[-2],'E:\mowen_game\int\piassets\common_cfg\xls\[summary.xml]task'!C4:C5,2,FALSE) -> 击杀npc | D23: =VLOOKUP(RC[-3],'E:\mowen_game\int\piassets\common_cfg\xls\[summary.xml]task'!C4:C6,3,FALSE) -> 消灭精灵龙 | E23: =VLOOKUP(RC[-4],'E:\mowen_game\int\piassets\common_cfg\xls\[summary.xml]task'!C4:C11,6,FALSE) -> 10300342 | G23: =VLOOKUP(RC[-6],'E:\mowen_game\int\piassets\common_cfg\xls\[summary.xml]task'!C4:C13,10,FALSE) -> 10013011 | H23: ="["&R[1]C[-7]&"]" -> [10300322] | J23: 1 | K23: 100 | L23: 1 | M23: 1 | N23: 主线 | P23: 1000 | AG23: ="回复<"&LEFT(VLOOKUP(RC[-32],'E:\mowen_game\int\piassets\common_cfg\xls\[summary.xml]task'!C4:C18,9,FALSE),LEN(VLOOKUP(RC[-32],'E:\mowen_game\int\piassets\common_cfg\xls\[summary.xml]task'!C4:C18,9,FALSE))-1)&"|arg="&RC[-26]&">" -> 回复<猎魔神射|arg=10013011> | AH23: =""""&RC[-1]&"""" -> "回复<猎魔神射|arg=10013011>" | AI23: 1 | AJ23: 2 | AK23: 0 | AL23: 80000 | AM23: {enhance_money,20} | AN23: 1
A24: ='E:\mowen_game\int\piassets\common_cfg\xls\[summary.xml]task'!RC[3] -> 10300322 | B24: =VLOOKUP(RC[-1],'E:\mowen_game\int\piassets\common_cfg\xls\[summary.xml]task'!C4:C8,5,FALSE) -> 突出重围1 | C24: =VLOOKUP(RC[-2],'E:\mowen_game\int\piassets\common_cfg\xls\[summary.xml]task'!C4:C5,2,FALSE) -> 击杀npc | D24: =VLOOKUP(RC[-3],'E:\mowen_game\int\piassets\common_cfg\xls\[summary.xml]task'!C4:C6,3,FALSE) -> 突出重围 | E24: =VLOOKUP(RC[-4],'E:\mowen_game\int\piassets\common_cfg\xls\[summary.xml]task'!C4:C11,6,FALSE) -> 10300321 | F24: =VLOOKUP(RC[-5],'E:\mowen_game\int\piassets\common_cfg\xls\[summary.xml]task'!C4:C11,8,FALSE) -> 10013011 | G24: =VLOOKUP(RC[-6],'E:\mowen_game\int\piassets\common_cfg\xls\[summary.xml]task'!C4:C13,10,FALSE) -> 10013015 | H24: [10300344] | J24: 1 | K24: 100 | L24: 1 | M24: 1 | N24: 主线 | P24: 1000 | AG24: ="回复<"&LEFT(VLOOKUP(RC[-32],'E:\mowen_game\int\piassets\common_cfg\xls\[summary.xml]task'!C4:C18,9,FALSE),LEN(VLOOKUP(RC[-32],'E:\mowen_game\int\piassets\common_cfg\xls\[summary.xml]task'!C4:C18,9,FALSE))-1)&"|arg="&RC[-26]&">" -> 回复<猎魔神射|arg=10013015> | AH24: =""""&RC[-1]&"""" -> "回复<猎魔神射|arg=10013015>" | AI24: 1 | AJ24: 2 | AK24: 0 | AL24: 80000 | AN24: 1
A25: ='E:\mowen_game\int\piassets\common_cfg\xls\[summary.xml]task'!RC[3] -> 10300323 | B25: =VLOOKUP(RC[-1],'E:\mowen_game\int\piassets\common_cfg\xls\[summary.xml]task'!C4:C8,5,FALSE) -> 除恶务尽1 | C25: =VLOOKUP(RC[-2],'E:\mowen_game\int\piassets\common_cfg\xls\[summary.xml]task'!C4:C5,2,FALSE) -> 使用无物品 | D25: =VLOOKUP(RC[-3],'E:\mowen_game\int\piassets\common_cfg\xls\[summary.xml]task'!C4:C6,3,FALSE) -> 除恶务尽 | E25: =VLOOKUP(RC[-4],'E:\mowen_game\int\piassets\common_cfg\xls\[summary.xml]task'!C4:C11,6,FALSE) -> 10300347 | H25: ="["&R[1]C[-7]&"]" -> [10300324] | J25: 1 | K25: 100 | L25: 1 | M25: 1 | N25: 主线 | P25: 1000 | AI25: 1 | AJ25: 2 | AK25: 0 | AL25: 0
A26: ='E:\mowen_game\int\piassets\common_cfg\xls\[summary.xml]task'!RC[3] -> 10300324 | B26: =VLOOKUP(RC[-1],'E:\mowen_game\int\piassets\common_cfg\xls\[summary.xml]task'!C4:C8,5,FALSE) -> 血债血偿1 | C26: =VLOOKUP(RC[-2],'E:\mowen_game\int\piassets\common_cfg\xls\[summary.xml]task'!C4:C5,2,FALSE) -> 探索区域 | D26: =VLOOKUP(RC[-3],'E:\mowen_game\int\piassets\common_cfg\xls\[summary.xml]task'!C4:C6,3,FALSE) -> 血债血偿 | E26: =VLOOKUP(RC[-4],'E:\mowen_game\int\piassets\common_cfg\xls\[summary.xml]task'!C4:C11,6,FALSE) -> 10300323 | H26: [10300351] | J26: 1 | K26: 100 | L26: 1 | M26: 1 | N26: 主线 | P26: 1000 | AI26: 1 | AJ26: 2 | AK26: 0 | AL26: 0
A27: ='E:\mowen_game\int\piassets\common_cfg\xls\[summary.xml]task'!RC[3] -> 10300325 | B27: =VLOOKUP(RC[-1],'E:\mowen_game\int\piassets\common_cfg\xls\[summary.xml]task'!C4:C8,5,FALSE) -> 副本-虚空之桥1 | C27: =VLOOKUP(RC[-2],'E:\mowen_game\int\piassets\common_cfg\xls\[summary.xml]task'!C4:C5,2,FALSE) -> 探索区域 | D27: =VLOOKUP(RC[-3],'E:\mowen_game\int\piassets\common_cfg\xls\[summary.xml]task'!C4:C6,3,FALSE) -> 副本-虚空之桥 | E27: =VLOOKUP(RC[-4],'E:\mowen_game\int\piassets\common_cfg\xls\[summary.xml]task'!C4:C11,6,FALSE) -> 10300324 | H27: ="["&R[1]C[-7]&"]" -> [10300326] | J27: 1 | K27: 100 | L27: 0 | M27: 0 | N27: 主线 | P27: 1000 | AI27: 1 | AJ27: 2 | AK27: 0 | AL27: 0 | AN27: 1 | AO27: 0
A28: ='E:\mowen_game\int\piassets\common_cfg\xls\[summary.xml]task'!RC[3] -> 10300326 | B28: =VLOOKUP(RC[-1],'E:\mowen_game\int\piassets\common_cfg\xls\[summary.xml]task'!C4:C8,5,FALSE) -> 副本-虚空之桥1 | C28: =VLOOKUP(RC[-2],'E:\mowen_game\int\piassets\common_cfg\xls\[summary.xml]task'!C4:C5,2,FALSE) -> 击杀npc | D28: =VLOOKUP(RC[-3],'E:\mowen_game\int\piassets\common_cfg\xls\[summary.xml]task'!C4:C6,3,FALSE) -> 副本-虚空之桥 | E28: =VLOOKUP(RC[-4],'E:\mowen_game\int\piassets\common_cfg\xls\[summary.xml]task'!C4:C11,6,FALSE) -> 10300325 | H28: ="["&R[1]C[-7]&"]" -> [10300327] | J28: 1 | K28: 100 | L28: 1 | M28: 1 | N28: 主线 | P28: 1000 | AI28: 1 | AJ28: 2 | AK28: 0 | AL28: 0 | AN28: 1
A29: ='E:\mowen_game\int\piassets\common_cfg\xls\[summary.xml]task'!RC[3] -> 10300327 | B29: =VLOOKUP(RC[-1],'E:\mowen_game\int\piassets\common_cfg\xls\[summary.xml]task'!C4:C8,5,FALSE) -> 副本-虚空之桥1 | C29: =VLOOKUP(RC[-2],'E:\mowen_game\int\piassets\common_cfg\xls\[summary.xml]task'!C4:C5,2,FALSE) -> 探索区域 | D29: =VLOOKUP(RC[-3],'E:\mowen_game\int\piassets\common_cfg\xls\[summary.xml]task'!C4:C6,3,FALSE) -> 副本-虚空之桥 | E29: =VLOOKUP(RC[-4],'E:\mowen_game\int\piassets\common_cfg\xls\[summary.xml]task'!C4:C11,6,FALSE) -> 10300326 | H29: ="["&R[1]C[-7]&"]" -> [10300328] | J29: 1 | K29: 100 | L29: 1 | M29: 1 | N29: 主线 | P29: 1000 | AI29: 1 | AJ29: 2 | AK29: 0 | AL29: 0 | AN29: 1 | AO29: 0
A30: ='E:\mowen_game\int\piassets\common_cfg\xls\[summary.xml]task'!RC[3] -> 10300328 | B30: =VLOOKUP(RC[-1],'E:\mowen_game\int\piassets\common_cfg\xls\[summary.xml]task'!C4:C8,5,FALSE) -> 副本-虚空之桥1 | C30: =VLOOKUP(RC[-2],'E:\mowen_game\int\piassets\common_cfg\xls\[summary.xml]task'!C4:C5,2,FALSE) -> 探索区域 | D30: =VLOOKUP(RC[-3],'E:\mowen_game\int\piassets\common_cfg\xls\[summary.xml]task'!C4:C6,3,FALSE) -> 副本-虚空之桥 | E30: =VLOOKUP(RC[-4],'E:\mowen_game\int\piassets\common_cfg\xls\[summary.xml]task'!C4:C11,6,FALSE) -> 10300327 | H30: ="["&R[1]C[-7]&"]" -> [10300329] | J30: 1 | K30: 100 | L30: 1 | M30: 1 | N30: 主线 | P30: 1000 | AI30: 1 | AJ30: 2 | AK30: 0 | AL30: 0 | AN30: 1 | AO30: 0
A31: ='E:\mowen_game\int\piassets\common_cfg\xls\[summary.xml]task'!RC[3] -> 10300329 | B31: =VLOOKUP(RC[-1],'E:\mowen_game\int\piassets\common_cfg\xls\[summary.xml]task'!C4:C8,5,FALSE) -> 副本-虚空之桥1 | C31: =VLOOKUP(RC[-2],'E:\mowen_game\int\piassets\common_cfg\xls\[summary.xml]task'!C4:C5,2,FALSE) -> 击杀npc | D31: =VLOOKUP(RC[-3],'E:\mowen_game\int\piassets\common_cfg\xls\[summary.xml]task'!C4:C6,3,FALSE) -> 副本-虚空之桥 | E31: =VLOOKUP(RC[-4],'E:\mowen_game\int\piassets\common_cfg\xls\[summary.xml]task'!C4:C11,6,FALSE) -> 10300328 | G31: =VLOOKUP(RC[-6],'E:\mowen_game\int\piassets\common_cfg\xls\[summary.xml]task'!C4:C13,10,FALSE) -> 10013030 | H31: ="["&R[1]C[-7]&"]" -> [10300330] | J31: 1 | K31: 100 | L31: 1 | M31: 1 | N31: 主线 | P31: 1000 | AE31: 2 | AG31: ="回复<"&LEFT(VLOOKUP(RC[-32],'E:\mowen_game\int\piassets\common_cfg\xls\[summary.xml]task'!C4:C18,9,FALSE),LEN(VLOOKUP(RC[-32],'E:\mowen_game\int\piassets\common_cfg\xls\[summary.xml]task'!C4:C18,9,FALSE))-1)&"|arg="&RC[-26]&">" -> 回复<上古魔纹战魂|arg=10013030> | AH31: =""""&RC[-1]&"""" -> "回复<上古魔纹战魂|arg=10013030>" | AI31: 1 | AJ31: 2 | AK31: 0 | AL31: 0 | AN31: 1
A32: ='E:\mowen_game\int\piassets\common_cfg\xls\[summary.xml]task'!RC[3] -> 10300330 | B32: =VLOOKUP(RC[-1],'E:\mowen_game\int\piassets\common_cfg\xls\[summary.xml]task'!C4:C8,5,FALSE) -> 副本-虚空之桥1 | C32: =VLOOKUP(RC[-2],'E:\mowen_game\int\piassets\common_cfg\xls\[summary.xml]task'!C4:C5,2,FALSE) -> 击杀npc | D32: =VLOOKUP(RC[-3],'E:\mowen_game\int\piassets\common_cfg\xls\[summary.xml]task'!C4:C6,3,FALSE) -> 副本-虚空之桥 | E32: =VLOOKUP(RC[-4],'E:\mowen_game\int\piassets\common_cfg\xls\[summary.xml]task'!C4:C11,6,FALSE) -> 10300329 | F32: =VLOOKUP(RC[-5],'E:\mowen_game\int\piassets\common_cfg\xls\[summary.xml]task'!C4:C11,8,FALSE) -> 10013030 | H32: ="["&R[1]C[-7]&"]" -> [10300331] | J32: 1 | K32: 100 | L32: 1 | M32: 1 | N32: 主线 | P32: 1000 | AI32: 1 | AJ32: 2 | AK32: 0 | AL32: 0 | AN32: 1
A33: ='E:\mowen_game\int\piassets\common_cfg\xls\[summary.xml]task'!RC[3] -> 10300331 | B33: =VLOOKUP(RC[-1],'E:\mowen_game\int\piassets\common_cfg\xls\[summary.xml]task'!C4:C8,5,FALSE) -> 副本-虚空之桥1 | C33: =VLOOKUP(RC[-2],'E:\mowen_game\int\piassets\common_cfg\xls\[summary.xml]task'!C4:C5,2,FALSE) -> 探索区域 | D33: =VLOOKUP(RC[-3],'E:\mowen_game\int\piassets\common_cfg\xls\[summary.xml]task'!C4:C6,3,FALSE) -> 副本-虚空之桥 | E33: =VLOOKUP(RC[-4],'E:\mowen_game\int\piassets\common_cfg\xls\[summary.xml]task'!C4:C11,6,FALSE) -> 10300330 | H33: ="["&R[1]C[-7]&"]" -> [10300332] | J33: 1 | K33: 100 | L33: 1 | M33: 1 | N33: 主线 | P33: 1000 | AI33: 1 | AJ33: 2 | AK33: 0 | AL33: 0 | AN33: 1 | AO33: 0
A34: ='E:\mowen_game\int\piassets\common_cfg\xls\[summary.xml]task'!RC[3] -> 10300332 | B34: =VLOOKUP(RC[-1],'E:\mowen_game\int\piassets\common_cfg\xls\[summary.xml]task'!C4:C8,5,FALSE) -> 副本-虚空之桥1 | C34: =VLOOKUP(RC[-2],'E:\mowen_game\int\piassets\common_cfg\xls\[summary.xml]task'!C4:C5,2,FALSE) -> 探索区域 | D34: =VLOOKUP(RC[-3],'E:\mowen_game\int\piassets\common_cfg\xls\[summary.xml]task'!C4:C6,3,FALSE) -> 副本-虚空之桥 | E34: =VLOOKUP(RC[-4],'E:\mowen_game\int\piassets\common_cfg\xls\[summary.xml]task'!C4:C11,6,FALSE) -> 10300331 | H34: ="["&R[1]C[-7]&"]" -> [10300333] | J34: 1 | K34: 100 | L34: 1 | M34: 1 | N34: 主线 | P34: 1000 | AI34: 1 | AJ34: 2 | AK34: 0 | AL34: 0 | AN34: 1 | AO34: 0
A35: ='E:\mowen_game\int\piassets\common_cfg\xls\[summary.xml]task'!RC[3] -> 10300333 | B35: =VLOOKUP(RC[-1],'E:\mowen_game\int\piassets\common_cfg\xls\[summary.xml]task'!C4:C8,5,FALSE) -> 副本-虚空之桥1 | C35: =VLOOKUP(RC[-2],'E:\mowen_game\int\piassets\common_cfg\xls\[summary.xml]task'!C4:C5,2,FALSE) -> 击杀npc | D35: =VLOOKUP(RC[-3],'E:\mowen_game\int\piassets\common_cfg\xls\[summary.xml]task'!C4:C6,3,FALSE) -> 副本-虚空之桥 | E35: =VLOOKUP(RC[-4],'E:\mowen_game\int\piassets\common_cfg\xls\[summary.xml]task'!C4:C11,6,FALSE) -> 10300332 | H35: [10300335] | J35: 1 | K35: 100 | L35: 1 | M35: 1 | N35: 主线 | P35: 1000 | AI35: 1 | AJ35: 2 | AK35: 0 | AL35: 0 | AN35: 1
A36: ='E:\mowen_game\int\piassets\common_cfg\xls\[summary.xml]task'!RC[3] -> 10300334 | B36: =VLOOKUP(RC[-1],'E:\mowen_game\int\piassets\common_cfg\xls\[summary.xml]task'!C4:C8,5,FALSE) -> 副本-虚空之桥1 | C36: =VLOOKUP(RC[-2],'E:\mowen_game\int\piassets\common_cfg\xls\[summary.xml]task'!C4:C5,2,FALSE) -> 击杀npc | D36: =VLOOKUP(RC[-3],'E:\mowen_game\int\piassets\common_cfg\xls\[summary.xml]task'!C4:C6,3,FALSE) -> 副本-虚空之桥 | H36: [] | J36: 1 | K36: 100 | L36: 1 | M36: 1 | N36: 主线 | P36: 1000 | AI36: 1 | AJ36: 2 | AK36: 0 | AL36: 0 | AN36: 1
A37: ='E:\mowen_game\int\piassets\common_cfg\xls\[summary.xml]task'!RC[3] -> 10300335 | B37: =VLOOKUP(RC[-1],'E:\mowen_game\int\piassets\common_cfg\xls\[summary.xml]task'!C4:C8,5,FALSE) -> 副本-虚空之桥1 | C37: =VLOOKUP(RC[-2],'E:\mowen_game\int\piassets\common_cfg\xls\[summary.xml]task'!C4:C5,2,FALSE) -> 探索区域 | D37: =VLOOKUP(RC[-3],'E:\mowen_game\int\piassets\common_cfg\xls\[summary.xml]task'!C4:C6,3,FALSE) -> 副本-虚空之桥 | E37: =VLOOKUP(RC[-4],'E:\mowen_game\int\piassets\common_cfg\xls\[summary.xml]task'!C4:C11,6,FALSE) -> 10300333 | H37: ="["&R[8]C[-7]&"]" -> [10300343] | J37: 1 | K37: 100 | L37: 1 | M37: 1 | N37: 主线 | P37: 1000 | AI37: 1 | AJ37: 2 | AK37: 0 | AL37: 0 | AN37: 1 | AO37: 0
A38: ='E:\mowen_game\int\piassets\common_cfg\xls\[summary.xml]task'!RC[3] -> 10300336 | B38: =VLOOKUP(RC[-1],'E:\mowen_game\int\piassets\common_cfg\xls\[summary.xml]task'!C4:C8,5,FALSE) -> 副本-虚空之桥1 | C38: =VLOOKUP(RC[-2],'E:\mowen_game\int\piassets\common_cfg\xls\[summary.xml]task'!C4:C5,2,FALSE) -> 击杀npc | D38: =VLOOKUP(RC[-3],'E:\mowen_game\int\piassets\common_cfg\xls\[summary.xml]task'!C4:C6,3,FALSE) -> 副本-虚空之桥 | E38: =VLOOKUP(RC[-4],'E:\mowen_game\int\piassets\common_cfg\xls\[summary.xml]task'!C4:C11,6,FALSE) -> 10300343 | F38: =VLOOKUP(RC[-5],'E:\mowen_game\int\piassets\common_cfg\xls\[summary.xml]task'!C4:C11,8,FALSE) -> 10013031 | H38: [10300337] | J38: 1 | K38: 100 | L38: 1 | M38: 1 | N38: 主线 | P38: 1000 | AI38: 1 | AJ38: 2 | AK38: 0 | AL38: 150000 | AN38: 1
A39: ='E:\mowen_game\int\piassets\common_cfg\xls\[summary.xml]task'!RC[3] -> 10300337 | B39: =VLOOKUP(RC[-1],'E:\mowen_game\int\piassets\common_cfg\xls\[summary.xml]task'!C4:C8,5,FALSE) -> 得偿所愿1 | C39: =VLOOKUP(RC[-2],'E:\mowen_game\int\piassets\common_cfg\xls\[summary.xml]task'!C4:C5,2,FALSE) -> 对话npc | D39: =VLOOKUP(RC[-3],'E:\mowen_game\int\piassets\common_cfg\xls\[summary.xml]task'!C4:C6,3,FALSE) -> 得偿所愿 | E39: =VLOOKUP(RC[-4],'E:\mowen_game\int\piassets\common_cfg\xls\[summary.xml]task'!C4:C11,6,FALSE) -> 10300336 | G39: =VLOOKUP(RC[-6],'E:\mowen_game\int\piassets\common_cfg\xls\[summary.xml]task'!C4:C13,10,FALSE) -> 10013018 | H39: [] | J39: 1 | K39: 100 | L39: 2 | M39: 2 | N39: 主线 | P39: 1000 | AG39: ="回复<"&LEFT(VLOOKUP(RC[-32],'E:\mowen_game\int\piassets\common_cfg\xls\[summary.xml]task'!C4:C18,9,FALSE),LEN(VLOOKUP(RC[-32],'E:\mowen_game\int\piassets\common_cfg\xls\[summary.xml]task'!C4:C18,9,FALSE))-1)&"|arg="&RC[-26]&">" -> 回复<猎魔神射|arg=10013018> | AH39: =""""&RC[-1]&"""" -> "回复<猎魔神射|arg=10013018>" | AI39: 1 | AJ39: 2 | AK39: 100000 | AL39: 0
A40: ='E:\mowen_game\int\piassets\common_cfg\xls\[summary.xml]task'!RC[3] -> 10300338 | B40: =VLOOKUP(RC[-1],'E:\mowen_game\int\piassets\common_cfg\xls\[summary.xml]task'!C4:C8,5,FALSE) -> 陷入重围1 | C40: =VLOOKUP(RC[-2],'E:\mowen_game\int\piassets\common_cfg\xls\[summary.xml]task'!C4:C5,2,FALSE) -> 探索区域 | D40: =VLOOKUP(RC[-3],'E:\mowen_game\int\piassets\common_cfg\xls\[summary.xml]task'!C4:C6,3,FALSE) -> 陷入重围 | E40: =VLOOKUP(RC[-4],'E:\mowen_game\int\piassets\common_cfg\xls\[summary.xml]task'!C4:C11,6,FALSE) -> 10300302 | H40: [10300303] | J40: 1 | K40: 100 | L40: 1 | M40: 1 | N40: 主线 | P40: 1000 | AI40: 1 | AJ40: 2 | AK40: 0 | AL40: 0 | AN40: 1 | AO40: 0
A41: ='E:\mowen_game\int\piassets\common_cfg\xls\[summary.xml]task'!RC[3] -> 10300339 | B41: =VLOOKUP(RC[-1],'E:\mowen_game\int\piassets\common_cfg\xls\[summary.xml]task'!C4:C8,5,FALSE) -> 遭遇入侵1 | C41: =VLOOKUP(RC[-2],'E:\mowen_game\int\piassets\common_cfg\xls\[summary.xml]task'!C4:C5,2,FALSE) -> 探索区域 | D41: =VLOOKUP(RC[-3],'E:\mowen_game\int\piassets\common_cfg\xls\[summary.xml]task'!C4:C6,3,FALSE) -> 遭遇入侵 | E41: =VLOOKUP(RC[-4],'E:\mowen_game\int\piassets\common_cfg\xls\[summary.xml]task'!C4:C11,6,FALSE) -> 10300308 | H41: [10300309] | J41: 1 | K41: 100 | L41: 1 | M41: 1 | N41: 主线 | P41: 1000 | AI41: 1 | AJ41: 2 | AK41: 0 | AL41: 0 | AN41: 1 | AO41: 0
A42: ='E:\mowen_game\int\piassets\common_cfg\xls\[summary.xml]task'!RC[3] -> 10300340 | B42: =VLOOKUP(RC[-1],'E:\mowen_game\int\piassets\common_cfg\xls\[summary.xml]task'!C4:C8,5,FALSE) -> 爪牙堵截1 | C42: =VLOOKUP(RC[-2],'E:\mowen_game\int\piassets\common_cfg\xls\[summary.xml]task'!C4:C5,2,FALSE) -> 探索区域 | D42: =VLOOKUP(RC[-3],'E:\mowen_game\int\piassets\common_cfg\xls\[summary.xml]task'!C4:C6,3,FALSE) -> 爪牙堵截 | E42: =VLOOKUP(RC[-4],'E:\mowen_game\int\piassets\common_cfg\xls\[summary.xml]task'!C4:C11,6,FALSE) -> 10300313 | H42: [10300314] | J42: 1 | K42: 100 | L42: 1 | M42: 1 | N42: 主线 | P42: 1000 | AI42: 1 | AJ42: 2 | AK42: 0 | AL42: 0 | AN42: 1 | AO42: 0
A43: ='E:\mowen_game\int\piassets\common_cfg\xls\[summary.xml]task'!RC[3] -> 10300341 | B43: =VLOOKUP(RC[-1],'E:\mowen_game\int\piassets\common_cfg\xls\[summary.xml]task'!C4:C8,5,FALSE) -> 恶魔入侵1 | C43: =VLOOKUP(RC[-2],'E:\mowen_game\int\piassets\common_cfg\xls\[summary.xml]task'!C4:C5,2,FALSE) -> 探索区域 | D43: =VLOOKUP(RC[-3],'E:\mowen_game\int\piassets\common_cfg\xls\[summary.xml]task'!C4:C6,3,FALSE) -> 恶魔入侵 | E43: =VLOOKUP(RC[-4],'E:\mowen_game\int\piassets\common_cfg\xls\[summary.xml]task'!C4:C11,6,FALSE) -> 10300316 | H43: [10300317] | J43: 1 | K43: 100 | L43: 1 | M43: 1 | N43: 主线 | P43: 1000 | AI43: 1 | AJ43: 2 | AK43: 0 | AL43: 0 | AN43: 1 | AO43: 0
A44: ='E:\mowen_game\int\piassets\common_cfg\xls\[summary.xml]task'!RC[3] -> 10300342 | B44: =VLOOKUP(RC[-1],'E:\mowen_game\int\piassets\common_cfg\xls\[summary.xml]task'!C4:C8,5,FALSE) -> 援军之困1 | C44: =VLOOKUP(RC[-2],'E:\mowen_game\int\piassets\common_cfg\xls\[summary.xml]task'!C4:C5,2,FALSE) -> 探索区域 | D44: =VLOOKUP(RC[-3],'E:\mowen_game\int\piassets\common_cfg\xls\[summary.xml]task'!C4:C6,3,FALSE) -> 援军之困 | E44: =VLOOKUP(RC[-4],'E:\mowen_game\int\piassets\common_cfg\xls\[summary.xml]task'!C4:C11,6,FALSE) -> 10300320 | H44: [10300321] | J44: 1 | K44: 100 | L44: 1 | M44: 1 | N44: 主线 | P44: 1000 | AI44: 1 | AJ44: 2 | AK44: 0 | AL44: 0 | AN44: 1 | AO44: 0
A45: ='E:\mowen_game\int\piassets\common_cfg\xls\[summary.xml]task'!RC[3] -> 10300343 | B45: =VLOOKUP(RC[-1],'E:\mowen_game\int\piassets\common_cfg\xls\[summary.xml]task'!C4:C8,5,FALSE) -> 追击恶首1 | C45: =VLOOKUP(RC[-2],'E:\mowen_game\int\piassets\common_cfg\xls\[summary.xml]task'!C4:C5,2,FALSE) -> 对话npc | D45: =VLOOKUP(RC[-3],'E:\mowen_game\int\piassets\common_cfg\xls\[summary.xml]task'!C4:C6,3,FALSE) -> 追击恶首 | E45: =VLOOKUP(RC[-4],'E:\mowen_game\int\piassets\common_cfg\xls\[summary.xml]task'!C4:C11,6,FALSE) -> 10300335 | G45: =VLOOKUP(RC[-6],'E:\mowen_game\int\piassets\common_cfg\xls\[summary.xml]task'!C4:C13,10,FALSE) -> 10013031 | H45: ="["&R[-7]C[-7]&"]" -> [10300336] | J45: 1 | K45: 100 | L45: 1 | M45: 1 | N45: 主线 | P45: 1000 | AG45: ="回复<"&LEFT(VLOOKUP(RC[-32],'E:\mowen_game\int\piassets\common_cfg\xls\[summary.xml]task'!C4:C18,9,FALSE),LEN(VLOOKUP(RC[-32],'E:\mowen_game\int\piassets\common_cfg\xls\[summary.xml]task'!C4:C18,9,FALSE))-1)&"|arg="&RC[-26]&">" -> 回复<黑袍人|arg=10013031> | AH45: =""""&RC[-1]&"""" -> "回复<黑袍人|arg=10013031>" | AI45: 1 | AJ45: 2 | AK45: 0 | AL45: 0 | AN45: 1
A46: ='E:\mowen_game\int\piassets\common_cfg\xls\[summary.xml]task'!RC[3] -> 10300344 | B46: =VLOOKUP(RC[-1],'E:\mowen_game\int\piassets\common_cfg\xls\[summary.xml]task'!C4:C8,5,FALSE) -> 哥布林草原1 | C46: =VLOOKUP(RC[-2],'E:\mowen_game\int\piassets\common_cfg\xls\[summary.xml]task'!C4:C5,2,FALSE) -> 探索区域 | D46: =VLOOKUP(RC[-3],'E:\mowen_game\int\piassets\common_cfg\xls\[summary.xml]task'!C4:C6,3,FALSE) -> 哥布林草原 | E46: =VLOOKUP(RC[-4],'E:\mowen_game\int\piassets\common_cfg\xls\[summary.xml]task'!C4:C11,6,FALSE) -> 10300322 | F46: =VLOOKUP(RC[-5],'E:\mowen_game\int\piassets\common_cfg\xls\[summary.xml]task'!C4:C11,8,FALSE) -> 10013015 | H46: [10300345] | J46: 1 | K46: 100 | L46: 1 | M46: 1 | N46: 主线 | P46: 1000 | AI46: 1 | AJ46: 2 | AK46: 0 | AL46: 0 | AN46: 1 | AO46: 0
A47: ='E:\mowen_game\int\piassets\common_cfg\xls\[summary.xml]task'!RC[3] -> 10300345 | B47: =VLOOKUP(RC[-1],'E:\mowen_game\int\piassets\common_cfg\xls\[summary.xml]task'!C4:C8,5,FALSE) -> 击退哥布林1 | C47: =VLOOKUP(RC[-2],'E:\mowen_game\int\piassets\common_cfg\xls\[summary.xml]task'!C4:C5,2,FALSE) -> 击杀npc | D47: =VLOOKUP(RC[-3],'E:\mowen_game\int\piassets\common_cfg\xls\[summary.xml]task'!C4:C6,3,FALSE) -> 击退哥布林 | E47: =VLOOKUP(RC[-4],'E:\mowen_game\int\piassets\common_cfg\xls\[summary.xml]task'!C4:C11,6,FALSE) -> 10300344 | G47: =VLOOKUP(RC[-6],'E:\mowen_game\int\piassets\common_cfg\xls\[summary.xml]task'!C4:C13,10,FALSE) -> 10013022 | H47: [10300346] | J47: 1 | K47: 100 | L47: 1 | M47: 1 | N47: 主线 | P47: 1000 | AE47: 1 | AG47: ="回复<"&LEFT(VLOOKUP(RC[-32],'E:\mowen_game\int\piassets\common_cfg\xls\[summary.xml]task'!C4:C18,9,FALSE),LEN(VLOOKUP(RC[-32],'E:\mowen_game\int\piassets\common_cfg\xls\[summary.xml]task'!C4:C18,9,FALSE))-1)&"|arg="&RC[-26]&">" -> 回复<哥布林村长|arg=10013022> | AH47: =""""&RC[-1]&"""" -> "回复<哥布林村长|arg=10013022>" | AI47: 1 | AJ47: 2 | AK47: 0 | AL47: 100000 | AN47: 1
A48: ='E:\mowen_game\int\piassets\common_cfg\xls\[summary.xml]task'!RC[3] -> 10300346 | B48: =VLOOKUP(RC[-1],'E:\mowen_game\int\piassets\common_cfg\xls\[summary.xml]task'!C4:C8,5,FALSE) -> 迷雾冰原1 | C48: =VLOOKUP(RC[-2],'E:\mowen_game\int\piassets\common_cfg\xls\[summary.xml]task'!C4:C5,2,FALSE) -> 探索区域 | D48: =VLOOKUP(RC[-3],'E:\mowen_game\int\piassets\common_cfg\xls\[summary.xml]task'!C4:C6,3,FALSE) -> 迷雾冰原 | E48: =VLOOKUP(RC[-4],'E:\mowen_game\int\piassets\common_cfg\xls\[summary.xml]task'!C4:C11,6,FALSE) -> 10300345 | H48: [10300347] | J48: 1 | K48: 100 | L48: 1 | M48: 1 | N48: 主线 | P48: 1000 | AI48: 1 | AJ48: 2 | AK48: 0 | AL48: 0 | AN48: 1 | AO48: 0
A49: ='E:\mowen_game\int\piassets\common_cfg\xls\[summary.xml]task'!RC[3] -> 10300347 | B49: =VLOOKUP(RC[-1],'E:\mowen_game\int\piassets\common_cfg\xls\[summary.xml]task'!C4:C8,5,FALSE) -> 魔雾藏凶1 | C49: =VLOOKUP(RC[-2],'E:\mowen_game\int\piassets\common_cfg\xls\[summary.xml]task'!C4:C5,2,FALSE) -> 击杀npc | D49: =VLOOKUP(RC[-3],'E:\mowen_game\int\piassets\common_cfg\xls\[summary.xml]task'!C4:C6,3,FALSE) -> 魔雾藏凶 | E49: =VLOOKUP(RC[-4],'E:\mowen_game\int\piassets\common_cfg\xls\[summary.xml]task'!C4:C11,6,FALSE) -> 10300346 | H49: [] | J49: 1 | K49: 100 | L49: 1 | M49: 1 | N49: 主线 | P49: 1000 | AI49: 1 | AJ49: 2 | AK49: 0 | AL49: 100000 | AN49: 1
A50: ='E:\mowen_game\int\piassets\common_cfg\xls\[summary.xml]task'!RC[3] -> 10302001 | B50: =VLOOKUP(RC[-1],'E:\mowen_game\int\piassets\common_cfg\xls\[summary.xml]task'!C4:C8,5,FALSE) -> 虚空毁灭者1 | C50: =VLOOKUP(RC[-2],'E:\mowen_game\int\piassets\common_cfg\xls\[summary.xml]task'!C4:C5,2,FALSE) -> 击杀npc | D50: =VLOOKUP(RC[-3],'E:\mowen_game\int\piassets\common_cfg\xls\[summary.xml]task'!C4:C6,3,FALSE) -> 虚空毁灭者 | F50: =VLOOKUP(RC[-5],'E:\mowen_game\int\piassets\common_cfg\xls\[summary.xml]task'!C4:C11,8,FALSE) -> 10012397 | G50: =VLOOKUP(RC[-6],'E:\mowen_game\int\piassets\common_cfg\xls\[summary.xml]task'!C4:C13,10,FALSE) -> 10012397 | H50: [] | J50: 28 | K50: 29 | L50: 0 | M50: 0 | N50: 跨服 | P50: 1000 | X50: 2 | AD50: 2 | AE50: 3 | AF50: 4 | AG50: ="回复<"&LEFT(VLOOKUP(RC[-32],'E:\mowen_game\int\piassets\common_cfg\xls\[summary.xml]task'!C4:C18,9,FALSE),LEN(VLOOKUP(RC[-32],'E:\mowen_game\int\piassets\common_cfg\xls\[summary.xml]task'!C4:C18,9,FALSE))-1)&"|arg="&RC[-26]&">" -> 回复<暴风战区将军|arg=10012397> | AH50: =""""&RC[-1]&"""" -> "回复<暴风战区将军|arg=10012397>" | AI50: 1 | AJ50: 3 | AK50: 10000 | AL50: 30000
A51: ='E:\mowen_game\int\piassets\common_cfg\xls\[summary.xml]task'!RC[3] -> 10302002 | B51: =VLOOKUP(RC[-1],'E:\mowen_game\int\piassets\common_cfg\xls\[summary.xml]task'!C4:C8,5,FALSE) -> 虚空主宰1 | C51: =VLOOKUP(RC[-2],'E:\mowen_game\int\piassets\common_cfg\xls\[summary.xml]task'!C4:C5,2,FALSE) -> 击杀npc | D51: =VLOOKUP(RC[-3],'E:\mowen_game\int\piassets\common_cfg\xls\[summary.xml]task'!C4:C6,3,FALSE) -> 虚空主宰 | F51: =VLOOKUP(RC[-5],'E:\mowen_game\int\piassets\common_cfg\xls\[summary.xml]task'!C4:C11,8,FALSE) -> 10012397 | G51: =VLOOKUP(RC[-6],'E:\mowen_game\int\piassets\common_cfg\xls\[summary.xml]task'!C4:C13,10,FALSE) -> 10012397 | H51: [] | J51: 28 | K51: 29 | L51: 0 | M51: 0 | N51: 跨服 | P51: 1000 | X51: 2 | AD51: 5 | AE51: 6 | AF51: 7 | AG51: ="回复<"&LEFT(VLOOKUP(RC[-32],'E:\mowen_game\int\piassets\common_cfg\xls\[summary.xml]task'!C4:C18,9,FALSE),LEN(VLOOKUP(RC[-32],'E:\mowen_game\int\piassets\common_cfg\xls\[summary.xml]task'!C4:C18,9,FALSE))-1)&"|arg="&RC[-26]&">" -> 回复<暴风战区将军|arg=10012397> | AH51: =""""&RC[-1]&"""" -> "回复<暴风战区将军|arg=10012397>" | AI51: 1 | AJ51: 3 | AK51: 10000 | AL51: 30000
A52: ='E:\mowen_game\int\piassets\common_cfg\xls\[summary.xml]task'!RC[3] -> 10302003 | B52: =VLOOKUP(RC[-1],'E:\mowen_game\int\piassets\common_cfg\xls\[summary.xml]task'!C4:C8,5,FALSE) -> 法杖材料1 | C52: =VLOOKUP(RC[-2],'E:\mowen_game\int\piassets\common_cfg\xls\[summary.xml]task'!C4:C5,2,FALSE) -> 采集有物品 | D52: =VLOOKUP(RC[-3],'E:\mowen_game\int\piassets\common_cfg\xls\[summary.xml]task'!C4:C6,3,FALSE) -> 法杖材料 | F52: =VLOOKUP(RC[-5],'E:\mowen_game\int\piassets\common_cfg\xls\[summary.xml]task'!C4:C11,8,FALSE) -> 10012396 | G52: =VLOOKUP(RC[-6],'E:\mowen_game\int\piassets\common_cfg\xls\[summary.xml]task'!C4:C13,10,FALSE) -> 10012396 | H52: [] | J52: 28 | K52: 29 | L52: 0 | M52: 0 | N52: 跨服 | P52: 1000 | X52: 2 | AD52: 2 | AE52: 3 | AF52: 4 | AG52: ="回复<"&LEFT(VLOOKUP(RC[-32],'E:\mowen_game\int\piassets\common_cfg\xls\[summary.xml]task'!C4:C18,9,FALSE),LEN(VLOOKUP(RC[-32],'E:\mowen_game\int\piassets\common_cfg\xls\[summary.xml]task'!C4:C18,9,FALSE))-1)&"|arg="&RC[-26]&">" -> 回复<战区军需官|arg=10012396> | AH52: =""""&RC[-1]&"""" -> "回复<战区军需官|arg=10012396>" | AI52: 1 | AJ52: 3 | AK52: 10000 | AL52: 30000
A53: ='E:\mowen_game\int\piassets\common_cfg\xls\[summary.xml]task'!RC[3] -> 10302004 | B53: =VLOOKUP(RC[-1],'E:\mowen_game\int\piassets\common_cfg\xls\[summary.xml]task'!C4:C8,5,FALSE) -> 风暴水晶1 | C53: =VLOOKUP(RC[-2],'E:\mowen_game\int\piassets\common_cfg\xls\[summary.xml]task'!C4:C5,2,FALSE) -> 采集有物品 | D53: =VLOOKUP(RC[-3],'E:\mowen_game\int\piassets\common_cfg\xls\[summary.xml]task'!C4:C6,3,FALSE) -> 风暴水晶 | F53: =VLOOKUP(RC[-5],'E:\mowen_game\int\piassets\common_cfg\xls\[summary.xml]task'!C4:C11,8,FALSE) -> 10012396 | G53: =VLOOKUP(RC[-6],'E:\mowen_game\int\piassets\common_cfg\xls\[summary.xml]task'!C4:C13,10,FALSE) -> 10012396 | H53: [] | J53: 28 | K53: 29 | L53: 0 | M53: 0 | N53: 跨服 | P53: 1000 | X53: 2 | AD53: 5 | AE53: 6 | AF53: 7 | AG53: ="回复<"&LEFT(VLOOKUP(RC[-32],'E:\mowen_game\int\piassets\common_cfg\xls\[summary.xml]task'!C4:C18,9,FALSE),LEN(VLOOKUP(RC[-32],'E:\mowen_game\int\piassets\common_cfg\xls\[summary.xml]task'!C4:C18,9,FALSE))-1)&"|arg="&RC[-26]&">" -> 回复<战区军需官|arg=10012396> | AH53: =""""&RC[-1]&"""" -> "回复<战区军需官|arg=10012396>" | AI53: 1 | AJ53: 3 | AK53: 10000 | AL53: 30000
A54: ='E:\mowen_game\int\piassets\common_cfg\xls\[summary.xml]task'!RC[3] -> 10302011 | B54: =VLOOKUP(RC[-1],'E:\mowen_game\int\piassets\common_cfg\xls\[summary.xml]task'!C4:C8,5,FALSE) -> 虚空毁灭者1 | C54: =VLOOKUP(RC[-2],'E:\mowen_game\int\piassets\common_cfg\xls\[summary.xml]task'!C4:C5,2,FALSE) -> 击杀npc | D54: =VLOOKUP(RC[-3],'E:\mowen_game\int\piassets\common_cfg\xls\[summary.xml]task'!C4:C6,3,FALSE) -> 虚空毁灭者 | F54: =VLOOKUP(RC[-5],'E:\mowen_game\int\piassets\common_cfg\xls\[summary.xml]task'!C4:C11,8,FALSE) -> 10012399 | G54: =VLOOKUP(RC[-6],'E:\mowen_game\int\piassets\common_cfg\xls\[summary.xml]task'!C4:C13,10,FALSE) -> 10012399 | H54: [] | J54: 28 | K54: 29 | L54: 0 | M54: 0 | N54: 跨服 | P54: 1000 | X54: 4 | AD54: 2 | AE54: 3 | AF54: 4 | AG54: ="回复<"&LEFT(VLOOKUP(RC[-32],'E:\mowen_game\int\piassets\common_cfg\xls\[summary.xml]task'!C4:C18,9,FALSE),LEN(VLOOKUP(RC[-32],'E:\mowen_game\int\piassets\common_cfg\xls\[summary.xml]task'!C4:C18,9,FALSE))-1)&"|arg="&RC[-26]&">" -> 回复<暴风战区将军|arg=10012399> | AH54: =""""&RC[-1]&"""" -> "回复<暴风战区将军|arg=10012399>" | AI54: 1 | AJ54: 3 | AK54: 10000 | AL54: 30000
A55: ='E:\mowen_game\int\piassets\common_cfg\xls\[summary.xml]task'!RC[3] -> 10302012 | B55: =VLOOKUP(RC[-1],'E:\mowen_game\int\piassets\common_cfg\xls\[summary.xml]task'!C4:C8,5,FALSE) -> 虚空主宰1 | C55: =VLOOKUP(RC[-2],'E:\mowen_game\int\piassets\common_cfg\xls\[summary.xml]task'!C4:C5,2,FALSE) -> 击杀npc | D55: =VLOOKUP(RC[-3],'E:\mowen_game\int\piassets\common_cfg\xls\[summary.xml]task'!C4:C6,3,FALSE) -> 虚空主宰 | F55: =VLOOKUP(RC[-5],'E:\mowen_game\int\piassets\common_cfg\xls\[summary.xml]task'!C4:C11,8,FALSE) -> 10012399 | G55: =VLOOKUP(RC[-6],'E:\mowen_game\int\piassets\common_cfg\xls\[summary.xml]task'!C4:C13,10,FALSE) -> 10012399 | H55: [] | J55: 28 | K55: 29 | L55: 0 | M55: 0 | N55: 跨服 | P55: 1000 | X55: 4 | AD55: 5 | AE55: 6 | AF55: 7 | AG55: ="回复<"&LEFT(VLOOKUP(RC[-32],'E:\mowen_game\int\piassets\common_cfg\xls\[summary.xml]task'!C4:C18,9,FALSE),LEN(VLOOKUP(RC[-32],'E:\mowen_game\int\piassets\common_cfg\xls\[summary.xml]task'!C4:C18,9,FALSE))-1)&"|arg="&RC[-26]&">" -> 回复<暴风战区将军|arg=10012399> | AH55: =""""&RC[-1]&"""" -> "回复<暴风战区将军|arg=10012399>" | AI55: 1 | AJ55: 3 | AK55: 10000 | AL55: 30000
A56: ='E:\mowen_game\int\piassets\common_cfg\xls\[summary.xml]task'!RC[3] -> 10302013 | B56: =VLOOKUP(RC[-1],'E:\mowen_game\int\piassets\common_cfg\xls\[summary.xml]task'!C4:C8,5,FALSE) -> 法杖材料1 | C56: =VLOOKUP(RC[-2],'E:\mowen_game\int\piassets\common_cfg\xls\[summary.xml]task'!C4:C5,2,FALSE) -> 采集有物品 | D56: =VLOOKUP(RC[-3],'E:\mowen_game\int\piassets\common_cfg\xls\[summary.xml]task'!C4:C6,3,FALSE) -> 法杖材料 | F56: =VLOOKUP(RC[-5],'E:\mowen_game\int\piassets\common_cfg\xls\[summary.xml]task'!C4:C11,8,FALSE) -> 10012398 | G56: =VLOOKUP(RC[-6],'E:\mowen_game\int\piassets\common_cfg\xls\[summary.xml]task'!C4:C13,10,FALSE) -> 10012398 | H56: [] | J56: 28 | K56: 29 | L56: 0 | M56: 0 | N56: 跨服 | P56: 1000 | X56: 4 | AD56: 2 | AE56: 3 | AF56: 4 | AG56: ="回复<"&LEFT(VLOOKUP(RC[-32],'E:\mowen_game\int\piassets\common_cfg\xls\[summary.xml]task'!C4:C18,9,FALSE),LEN(VLOOKUP(RC[-32],'E:\mowen_game\int\piassets\common_cfg\xls\[summary.xml]task'!C4:C18,9,FALSE))-1)&"|arg="&RC[-26]&">" -> 回复<战区军需官|arg=10012398> | AH56: =""""&RC[-1]&"""" -> "回复<战区军需官|arg=10012398>" | AI56: 1 | AJ56: 3 | AK56: 10000 | AL56: 30000
A57: ='E:\mowen_game\int\piassets\common_cfg\xls\[summary.xml]task'!RC[3] -> 10302014 | B57: =VLOOKUP(RC[-1],'E:\mowen_game\int\piassets\common_cfg\xls\[summary.xml]task'!C4:C8,5,FALSE) -> 风暴水晶1 | C57: =VLOOKUP(RC[-2],'E:\mowen_game\int\piassets\common_cfg\xls\[summary.xml]task'!C4:C5,2,FALSE) -> 采集有物品 | D57: =VLOOKUP(RC[-3],'E:\mowen_game\int\piassets\common_cfg\xls\[summary.xml]task'!C4:C6,3,FALSE) -> 风暴水晶 | F57: =VLOOKUP(RC[-5],'E:\mowen_game\int\piassets\common_cfg\xls\[summary.xml]task'!C4:C11,8,FALSE) -> 10012398 | G57: =VLOOKUP(RC[-6],'E:\mowen_game\int\piassets\common_cfg\xls\[summary.xml]task'!C4:C13,10,FALSE) -> 10012398 | H57: [] | J57: 28 | K57: 29 | L57: 0 | M57: 0 | N57: 跨服 | P57: 1000 | X57: 4 | AD57: 5 | AE57: 6 | AF57: 7 | AG57: ="回复<"&LEFT(VLOOKUP(RC[-32],'E:\mowen_game\int\piassets\common_cfg\xls\[summary.xml]task'!C4:C18,9,FALSE),LEN(VLOOKUP(RC[-32],'E:\mowen_game\int\piassets\common_cfg\xls\[summary.xml]task'!C4:C18,9,FALSE))-1)&"|arg="&RC[-26]&">" -> 回复<战区军需官|arg=10012398> | AH57: =""""&RC[-1]&"""" -> "回复<战区军需官|arg=10012398>" | AI57: 1 | AJ57: 3 | AK57: 10000 | AL57: 30000
A58: ='E:\mowen_game\int\piassets\common_cfg\xls\[summary.xml]task'!RC[3] -> 10302021 | B58: =VLOOKUP(RC[-1],'E:\mowen_game\int\piassets\common_cfg\xls\[summary.xml]task'!C4:C8,5,FALSE) -> 虚空毁灭者1 | C58: =VLOOKUP(RC[-2],'E:\mowen_game\int\piassets\common_cfg\xls\[summary.xml]task'!C4:C5,2,FALSE) -> 击杀npc | D58: =VLOOKUP(RC[-3],'E:\mowen_game\int\piassets\common_cfg\xls\[summary.xml]task'!C4:C6,3,FALSE) -> 虚空毁灭者 | F58: =VLOOKUP(RC[-5],'E:\mowen_game\int\piassets\common_cfg\xls\[summary.xml]task'!C4:C11,8,FALSE) -> 10012416 | G58: =VLOOKUP(RC[-6],'E:\mowen_game\int\piassets\common_cfg\xls\[summary.xml]task'!C4:C13,10,FALSE) -> 10012416 | H58: [] | J58: 30 | K58: 39 | L58: 0 | M58: 0 | N58: 跨服 | P58: 1000 | X58: 2 | AD58: 2 | AE58: 3 | AF58: 4 | AG58: ="回复<"&LEFT(VLOOKUP(RC[-32],'E:\mowen_game\int\piassets\common_cfg\xls\[summary.xml]task'!C4:C18,9,FALSE),LEN(VLOOKUP(RC[-32],'E:\mowen_game\int\piassets\common_cfg\xls\[summary.xml]task'!C4:C18,9,FALSE))-1)&"|arg="&RC[-26]&">" -> 回复<暴风战区将军|arg=10012416> | AH58: =""""&RC[-1]&"""" -> "回复<暴风战区将军|arg=10012416>" | AI58: 1 | AJ58: 3 | AK58: 20000 | AL58: 40000
A59: ='E:\mowen_game\int\piassets\common_cfg\xls\[summary.xml]task'!RC[3] -> 10302022 | B59: =VLOOKUP(RC[-1],'E:\mowen_game\int\piassets\common_cfg\xls\[summary.xml]task'!C4:C8,5,FALSE) -> 虚空主宰1 | C59: =VLOOKUP(RC[-2],'E:\mowen_game\int\piassets\common_cfg\xls\[summary.xml]task'!C4:C5,2,FALSE) -> 击杀npc | D59: =VLOOKUP(RC[-3],'E:\mowen_game\int\piassets\common_cfg\xls\[summary.xml]task'!C4:C6,3,FALSE) -> 虚空主宰 | F59: =VLOOKUP(RC[-5],'E:\mowen_game\int\piassets\common_cfg\xls\[summary.xml]task'!C4:C11,8,FALSE) -> 10012416 | G59: =VLOOKUP(RC[-6],'E:\mowen_game\int\piassets\common_cfg\xls\[summary.xml]task'!C4:C13,10,FALSE) -> 10012416 | H59: [] | J59: 30 | K59: 39 | L59: 0 | M59: 0 | N59: 跨服 | P59: 1000 | X59: 2 | AD59: 5 | AE59: 6 | AF59: 7 | AG59: ="回复<"&LEFT(VLOOKUP(RC[-32],'E:\mowen_game\int\piassets\common_cfg\xls\[summary.xml]task'!C4:C18,9,FALSE),LEN(VLOOKUP(RC[-32],'E:\mowen_game\int\piassets\common_cfg\xls\[summary.xml]task'!C4:C18,9,FALSE))-1)&"|arg="&RC[-26]&">" -> 回复<暴风战区将军|arg=10012416> | AH59: =""""&RC[-1]&"""" -> "回复<暴风战区将军|arg=10012416>" | AI59: 1 | AJ59: 3 | AK59: 20000 | AL59: 40000
A60: ='E:\mowen_game\int\piassets\common_cfg\xls\[summary.xml]task'!RC[3] -> 10302023 | B60: =VLOOKUP(RC[-1],'E:\mowen_game\int\piassets\common_cfg\xls\[summary.xml]task'!C4:C8,5,FALSE) -> 法杖材料1 | C60: =VLOOKUP(RC[-2],'E:\mowen_game\int\piassets\common_cfg\xls\[summary.xml]task'!C4:C5,2,FALSE) -> 采集有物品 | D60: =VLOOKUP(RC[-3],'E:\mowen_game\int\piassets\common_cfg\xls\[summary.xml]task'!C4:C6,3,FALSE) -> 法杖材料 | F60: =VLOOKUP(RC[-5],'E:\mowen_game\int\piassets\common_cfg\xls\[summary.xml]task'!C4:C11,8,FALSE) -> 10012415 | G60: =VLOOKUP(RC[-6],'E:\mowen_game\int\piassets\common_cfg\xls\[summary.xml]task'!C4:C13,10,FALSE) -> 10012415 | H60: [] | J60: 30 | K60: 39 | L60: 0 | M60: 0 | N60: 跨服 | P60: 1000 | X60: 2 | AD60: 2 | AE60: 3 | AF60: 4 | AG60: ="回复<"&LEFT(VLOOKUP(RC[-32],'E:\mowen_game\int\piassets\common_cfg\xls\[summary.xml]task'!C4:C18,9,FALSE),LEN(VLOOKUP(RC[-32],'E:\mowen_game\int\piassets\common_cfg\xls\[summary.xml]task'!C4:C18,9,FALSE))-1)&"|arg="&RC[-26]&">" -> 回复<战区军需官|arg=10012415> | AH60: =""""&RC[-1]&"""" -> "回复<战区军需官|arg=10012415>" | AI60: 1 | AJ60: 3 | AK60: 20000 | AL60: 40000
A61: ='E:\mowen_game\int\piassets\common_cfg\xls\[summary.xml]task'!RC[3] -> 10302024 | B61: =VLOOKUP(RC[-1],'E:\mowen_game\int\piassets\common_cfg\xls\[summary.xml]task'!C4:C8,5,FALSE) -> 风暴水晶1 | C61: =VLOOKUP(RC[-2],'E:\mowen_game\int\piassets\common_cfg\xls\[summary.xml]task'!C4:C5,2,FALSE) -> 采集有物品 | D61: =VLOOKUP(RC[-3],'E:\mowen_game\int\piassets\common_cfg\xls\[summary.xml]task'!C4:C6,3,FALSE) -> 风暴水晶 | F61: =VLOOKUP(RC[-5],'E:\mowen_game\int\piassets\common_cfg\xls\[summary.xml]task'!C4:C11,8,FALSE) -> 10012415 | G61: =VLOOKUP(RC[-6],'E:\mowen_game\int\piassets\common_cfg\xls\[summary.xml]task'!C4:C13,10,FALSE) -> 10012415 | H61: [] | J61: 30 | K61: 39 | L61: 0 | M61: 0 | N61: 跨服 | P61: 1000 | X61: 2 | AD61: 5 | AE61: 6 | AF61: 7 | AG61: ="回复<"&LEFT(VLOOKUP(RC[-32],'E:\mowen_game\int\piassets\common_cfg\xls\[summary.xml]task'!C4:C18,9,FALSE),LEN(VLOOKUP(RC[-32],'E:\mowen_game\int\piassets\common_cfg\xls\[summary.xml]task'!C4:C18,9,FALSE))-1)&"|arg="&RC[-26]&">" -> 回复<战区军需官|arg=10012415> | AH61: =""""&RC[-1]&"""" -> "回复<战区军需官|arg=10012415>" | AI61: 1 | AJ61: 3 | AK61: 20000 | AL61: 40000
A62: ='E:\mowen_game\int\piassets\common_cfg\xls\[summary.xml]task'!RC[3] -> 10302025 | B62: =VLOOKUP(RC[-1],'E:\mowen_game\int\piassets\common_cfg\xls\[summary.xml]task'!C4:C8,5,FALSE) -> 虚空毁灭者1 | C62: =VLOOKUP(RC[-2],'E:\mowen_game\int\piassets\common_cfg\xls\[summary.xml]task'!C4:C5,2,FALSE) -> 击杀npc | D62: =VLOOKUP(RC[-3],'E:\mowen_game\int\piassets\common_cfg\xls\[summary.xml]task'!C4:C6,3,FALSE) -> 虚空毁灭者 | F62: =VLOOKUP(RC[-5],'E:\mowen_game\int\piassets\common_cfg\xls\[summary.xml]task'!C4:C11,8,FALSE) -> 10012418 | G62: =VLOOKUP(RC[-6],'E:\mowen_game\int\piassets\common_cfg\xls\[summary.xml]task'!C4:C13,10,FALSE) -> 10012418 | H62: [] | J62: 30 | K62: 39 | L62: 0 | M62: 0 | N62: 跨服 | P62: 1000 | X62: 4 | AD62: 2 | AE62: 3 | AF62: 4 | AG62: ="回复<"&LEFT(VLOOKUP(RC[-32],'E:\mowen_game\int\piassets\common_cfg\xls\[summary.xml]task'!C4:C18,9,FALSE),LEN(VLOOKUP(RC[-32],'E:\mowen_game\int\piassets\common_cfg\xls\[summary.xml]task'!C4:C18,9,FALSE))-1)&"|arg="&RC[-26]&">" -> 回复<暴风战区将军|arg=10012418> | AH62: =""""&RC[-1]&"""" -> "回复<暴风战区将军|arg=10012418>" | AI62: 1 | AJ62: 3 | AK62: 20000 | AL62: 40000
A63: ='E:\mowen_game\int\piassets\common_cfg\xls\[summary.xml]task'!RC[3] -> 10302026 | B63: =VLOOKUP(RC[-1],'E:\mowen_game\int\piassets\common_cfg\xls\[summary.xml]task'!C4:C8,5,FALSE) -> 虚空主宰1 | C63: =VLOOKUP(RC[-2],'E:\mowen_game\int\piassets\common_cfg\xls\[summary.xml]task'!C4:C5,2,FALSE) -> 击杀npc | D63: =VLOOKUP(RC[-3],'E:\mowen_game\int\piassets\common_cfg\xls\[summary.xml]task'!C4:C6,3,FALSE) -> 虚空主宰 | F63: =VLOOKUP(RC[-5],'E:\mowen_game\int\piassets\common_cfg\xls\[summary.xml]task'!C4:C11,8,FALSE) -> 10012418 | G63: =VLOOKUP(RC[-6],'E:\mowen_game\int\piassets\common_cfg\xls\[summary.xml]task'!C4:C13,10,FALSE) -> 10012418 | H63: [] | J63: 30 | K63: 39 | L63: 0 | M63: 0 | N63: 跨服 | P63: 1000 | X63: 4 | AD63: 5 | AE63: 6 | AF63: 7 | AG63: ="回复<"&LEFT(VLOOKUP(RC[-32],'E:\mowen_game\int\piassets\common_cfg\xls\[summary.xml]task'!C4:C18,9,FALSE),LEN(VLOOKUP(RC[-32],'E:\mowen_game\int\piassets\common_cfg\xls\[summary.xml]task'!C4:C18,9,FALSE))-1)&"|arg="&RC[-26]&">" -> 回复<暴风战区将军|arg=10012418> | AH63: =""""&RC[-1]&"""" -> "回复<暴风战区将军|arg=10012418>" | AI63: 1 | AJ63: 3 | AK63: 20000 | AL63: 40000
A64: ='E:\mowen_game\int\piassets\common_cfg\xls\[summary.xml]task'!RC[3] -> 10302027 | B64: =VLOOKUP(RC[-1],'E:\mowen_game\int\piassets\common_cfg\xls\[summary.xml]task'!C4:C8,5,FALSE) -> 法杖材料1 | C64: =VLOOKUP(RC[-2],'E:\mowen_game\int\piassets\common_cfg\xls\[summary.xml]task'!C4:C5,2,FALSE) -> 采集有物品 | D64: =VLOOKUP(RC[-3],'E:\mowen_game\int\piassets\common_cfg\xls\[summary.xml]task'!C4:C6,3,FALSE) -> 法杖材料 | F64: =VLOOKUP(RC[-5],'E:\mowen_game\int\piassets\common_cfg\xls\[summary.xml]task'!C4:C11,8,FALSE) -> 10012417 | G64: =VLOOKUP(RC[-6],'E:\mowen_game\int\piassets\common_cfg\xls\[summary.xml]task'!C4:C13,10,FALSE) -> 10012417 | H64: [] | J64: 30 | K64: 39 | L64: 0 | M64: 0 | N64: 跨服 | P64: 1000 | X64: 4 | AD64: 2 | AE64: 3 | AF64: 4 | AG64: ="回复<"&LEFT(VLOOKUP(RC[-32],'E:\mowen_game\int\piassets\common_cfg\xls\[summary.xml]task'!C4:C18,9,FALSE),LEN(VLOOKUP(RC[-32],'E:\mowen_game\int\piassets\common_cfg\xls\[summary.xml]task'!C4:C18,9,FALSE))-1)&"|arg="&RC[-26]&">" -> 回复<战区军需官|arg=10012417> | AH64: =""""&RC[-1]&"""" -> "回复<战区军需官|arg=10012417>" | AI64: 1 | AJ64: 3 | AK64: 20000 | AL64: 40000
A65: ='E:\mowen_game\int\piassets\common_cfg\xls\[summary.xml]task'!RC[3] -> 10302028 | B65: =VLOOKUP(RC[-1],'E:\mowen_game\int\piassets\common_cfg\xls\[summary.xml]task'!C4:C8,5,FALSE) -> 风暴水晶1 | C65: =VLOOKUP(RC[-2],'E:\mowen_game\int\piassets\common_cfg\xls\[summary.xml]task'!C4:C5,2,FALSE) -> 采集有物品 | D65: =VLOOKUP(RC[-3],'E:\mowen_game\int\piassets\common_cfg\xls\[summary.xml]task'!C4:C6,3,FALSE) -> 风暴水晶 | F65: =VLOOKUP(RC[-5],'E:\mowen_game\int\piassets\common_cfg\xls\[summary.xml]task'!C4:C11,8,FALSE) -> 10012417 | G65: =VLOOKUP(RC[-6],'E:\mowen_game\int\piassets\common_cfg\xls\[summary.xml]task'!C4:C13,10,FALSE) -> 10012417 | H65: [] | J65: 30 | K65: 39 | L65: 0 | M65: 0 | N65: 跨服 | P65: 1000 | X65: 4 | AD65: 5 | AE65: 6 | AF65: 7 | AG65: ="回复<"&LEFT(VLOOKUP(RC[-32],'E:\mowen_game\int\piassets\common_cfg\xls\[summary.xml]task'!C4:C18,9,FALSE),LEN(VLOOKUP(RC[-32],'E:\mowen_game\int\piassets\common_cfg\xls\[summary.xml]task'!C4:C18,9,FALSE))-1)&"|arg="&RC[-26]&">" -> 回复<战区军需官|arg=10012417> | AH65: =""""&RC[-1]&"""" -> "回复<战区军需官|arg=10012417>" | AI65: 1 | AJ65: 3 | AK65: 20000 | AL65: 40000
A66: ='E:\mowen_game\int\piassets\common_cfg\xls\[summary.xml]task'!RC[3] -> 10302041 | B66: =VLOOKUP(RC[-1],'E:\mowen_game\int\piassets\common_cfg\xls\[summary.xml]task'!C4:C8,5,FALSE) -> 虚空毁灭者1 | C66: =VLOOKUP(RC[-2],'E:\mowen_game\int\piassets\common_cfg\xls\[summary.xml]task'!C4:C5,2,FALSE) -> 击杀npc | D66: =VLOOKUP(RC[-3],'E:\mowen_game\int\piassets\common_cfg\xls\[summary.xml]task'!C4:C6,3,FALSE) -> 虚空毁灭者 | F66: =VLOOKUP(RC[-5],'E:\mowen_game\int\piassets\common_cfg\xls\[summary.xml]task'!C4:C11,8,FALSE) -> 10012435 | G66: =VLOOKUP(RC[-6],'E:\mowen_game\int\piassets\common_cfg\xls\[summary.xml]task'!C4:C13,10,FALSE) -> 10012435 | H66: [] | J66: 40 | K66: 49 | L66: 0 | M66: 0 | N66: 跨服 | P66: 1000 | X66: 2 | AD66: 2 | AE66: 3 | AF66: 4 | AG66: ="回复<"&LEFT(VLOOKUP(RC[-32],'E:\mowen_game\int\piassets\common_cfg\xls\[summary.xml]task'!C4:C18,9,FALSE),LEN(VLOOKUP(RC[-32],'E:\mowen_game\int\piassets\common_cfg\xls\[summary.xml]task'!C4:C18,9,FALSE))-1)&"|arg="&RC[-26]&">" -> 回复<暴风战区将军|arg=10012435> | AH66: =""""&RC[-1]&"""" -> "回复<暴风战区将军|arg=10012435>" | AI66: 1 | AJ66: 3 | AK66: 20000 | AL66: 40000
A67: ='E:\mowen_game\int\piassets\common_cfg\xls\[summary.xml]task'!RC[3] -> 10302042 | B67: =VLOOKUP(RC[-1],'E:\mowen_game\int\piassets\common_cfg\xls\[summary.xml]task'!C4:C8,5,FALSE) -> 虚空主宰1 | C67: =VLOOKUP(RC[-2],'E:\mowen_game\int\piassets\common_cfg\xls\[summary.xml]task'!C4:C5,2,FALSE) -> 击杀npc | D67: =VLOOKUP(RC[-3],'E:\mowen_game\int\piassets\common_cfg\xls\[summary.xml]task'!C4:C6,3,FALSE) -> 虚空主宰 | F67: =VLOOKUP(RC[-5],'E:\mowen_game\int\piassets\common_cfg\xls\[summary.xml]task'!C4:C11,8,FALSE) -> 10012435 | G67: =VLOOKUP(RC[-6],'E:\mowen_game\int\piassets\common_cfg\xls\[summary.xml]task'!C4:C13,10,FALSE) -> 10012435 | H67: [] | J67: 40 | K67: 49 | L67: 0 | M67: 0 | N67: 跨服 | P67: 1000 | X67: 2 | AD67: 5 | AE67: 6 | AF67: 7 | AG67: ="回复<"&LEFT(VLOOKUP(RC[-32],'E:\mowen_game\int\piassets\common_cfg\xls\[summary.xml]task'!C4:C18,9,FALSE),LEN(VLOOKUP(RC[-32],'E:\mowen_game\int\piassets\common_cfg\xls\[summary.xml]task'!C4:C18,9,FALSE))-1)&"|arg="&RC[-26]&">" -> 回复<暴风战区将军|arg=10012435> | AH67: =""""&RC[-1]&"""" -> "回复<暴风战区将军|arg=10012435>" | AI67: 1 | AJ67: 3 | AK67: 20000 | AL67: 40000
A68: ='E:\mowen_game\int\piassets\common_cfg\xls\[summary.xml]task'!RC[3] -> 10302043 | B68: =VLOOKUP(RC[-1],'E:\mowen_game\int\piassets\common_cfg\xls\[summary.xml]task'!C4:C8,5,FALSE) -> 法杖材料1 | C68: =VLOOKUP(RC[-2],'E:\mowen_game\int\piassets\common_cfg\xls\[summary.xml]task'!C4:C5,2,FALSE) -> 采集有物品 | D68: =VLOOKUP(RC[-3],'E:\mowen_game\int\piassets\common_cfg\xls\[summary.xml]task'!C4:C6,3,FALSE) -> 法杖材料 | F68: =VLOOKUP(RC[-5],'E:\mowen_game\int\piassets\common_cfg\xls\[summary.xml]task'!C4:C11,8,FALSE) -> 10012434 | G68: =VLOOKUP(RC[-6],'E:\mowen_game\int\piassets\common_cfg\xls\[summary.xml]task'!C4:C13,10,FALSE) -> 10012434 | H68: [] | J68: 40 | K68: 49 | L68: 0 | M68: 0 | N68: 跨服 | P68: 1000 | X68: 2 | AD68: 2 | AE68: 3 | AF68: 4 | AG68: ="回复<"&LEFT(VLOOKUP(RC[-32],'E:\mowen_game\int\piassets\common_cfg\xls\[summary.xml]task'!C4:C18,9,FALSE),LEN(VLOOKUP(RC[-32],'E:\mowen_game\int\piassets\common_cfg\xls\[summary.xml]task'!C4:C18,9,FALSE))-1)&"|arg="&RC[-26]&">" -> 回复<战区军需官|arg=10012434> | AH68: =""""&RC[-1]&"""" -> "回复<战区军需官|arg=10012434>" | AI68: 1 | AJ68: 3 | AK68: 20000 | AL68: 40000
A69: ='E:\mowen_game\int\piassets\common_cfg\xls\[summary.xml]task'!RC[3] -> 10302044 | B69: =VLOOKUP(RC[-1],'E:\mowen_game\int\piassets\common_cfg\xls\[summary.xml]task'!C4:C8,5,FALSE) -> 风暴水晶1 | C69: =VLOOKUP(RC[-2],'E:\mowen_game\int\piassets\common_cfg\xls\[summary.xml]task'!C4:C5,2,FALSE) -> 采集有物品 | D69: =VLOOKUP(RC[-3],'E:\mowen_game\int\piassets\common_cfg\xls\[summary.xml]task'!C4:C6,3,FALSE) -> 风暴水晶 | F69: =VLOOKUP(RC[-5],'E:\mowen_game\int\piassets\common_cfg\xls\[summary.xml]task'!C4:C11,8,FALSE) -> 10012434 | G69: =VLOOKUP(RC[-6],'E:\mowen_game\int\piassets\common_cfg\xls\[summary.xml]task'!C4:C13,10,FALSE) -> 10012434 | H69: [] | J69: 40 | K69: 49 | L69: 0 | M69: 0 | N69: 跨服 | P69: 1000 | X69: 2 | AD69: 5 | AE69: 6 | AF69: 7 | AG69: ="回复<"&LEFT(VLOOKUP(RC[-32],'E:\mowen_game\int\piassets\common_cfg\xls\[summary.xml]task'!C4:C18,9,FALSE),LEN(VLOOKUP(RC[-32],'E:\mowen_game\int\piassets\common_cfg\xls\[summary.xml]task'!C4:C18,9,FALSE))-1)&"|arg="&RC[-26]&">" -> 回复<战区军需官|arg=10012434> | AH69: =""""&RC[-1]&"""" -> "回复<战区军需官|arg=10012434>" | AI69: 1 | AJ69: 3 | AK69: 20000 | AL69: 40000
A70: ='E:\mowen_game\int\piassets\common_cfg\xls\[summary.xml]task'!RC[3] -> 10302051 | B70: =VLOOKUP(RC[-1],'E:\mowen_game\int\piassets\common_cfg\xls\[summary.xml]task'!C4:C8,5,FALSE) -> 虚空毁灭者1 | C70: =VLOOKUP(RC[-2],'E:\mowen_game\int\piassets\common_cfg\xls\[summary.xml]task'!C4:C5,2,FALSE) -> 击杀npc | D70: =VLOOKUP(RC[-3],'E:\mowen_game\int\piassets\common_cfg\xls\[summary.xml]task'!C4:C6,3,FALSE) -> 虚空毁灭者 | F70: =VLOOKUP(RC[-5],'E:\mowen_game\int\piassets\common_cfg\xls\[summary.xml]task'!C4:C11,8,FALSE) -> 10012437 | G70: =VLOOKUP(RC[-6],'E:\mowen_game\int\piassets\common_cfg\xls\[summary.xml]task'!C4:C13,10,FALSE) -> 10012437 | H70: [] | J70: 40 | K70: 49 | L70: 0 | M70: 0 | N70: 跨服 | P70: 1000 | X70: 4 | AD70: 2 | AE70: 3 | AF70: 4 | AG70: ="回复<"&LEFT(VLOOKUP(RC[-32],'E:\mowen_game\int\piassets\common_cfg\xls\[summary.xml]task'!C4:C18,9,FALSE),LEN(VLOOKUP(RC[-32],'E:\mowen_game\int\piassets\common_cfg\xls\[summary.xml]task'!C4:C18,9,FALSE))-1)&"|arg="&RC[-26]&">" -> 回复<暴风战区将军|arg=10012437> | AH70: =""""&RC[-1]&"""" -> "回复<暴风战区将军|arg=10012437>" | AI70: 1 | AJ70: 3 | AK70: 20000 | AL70: 40000
A71: ='E:\mowen_game\int\piassets\common_cfg\xls\[summary.xml]task'!RC[3] -> 10302052 | B71: =VLOOKUP(RC[-1],'E:\mowen_game\int\piassets\common_cfg\xls\[summary.xml]task'!C4:C8,5,FALSE) -> 虚空主宰1 | C71: =VLOOKUP(RC[-2],'E:\mowen_game\int\piassets\common_cfg\xls\[summary.xml]task'!C4:C5,2,FALSE) -> 击杀npc | D71: =VLOOKUP(RC[-3],'E:\mowen_game\int\piassets\common_cfg\xls\[summary.xml]task'!C4:C6,3,FALSE) -> 虚空主宰 | F71: =VLOOKUP(RC[-5],'E:\mowen_game\int\piassets\common_cfg\xls\[summary.xml]task'!C4:C11,8,FALSE) -> 10012437 | G71: =VLOOKUP(RC[-6],'E:\mowen_game\int\piassets\common_cfg\xls\[summary.xml]task'!C4:C13,10,FALSE) -> 10012437 | H71: [] | J71: 40 | K71: 49 | L71: 0 | M71: 0 | N71: 跨服 | P71: 1000 | X71: 4 | AD71: 5 | AE71: 6 | AF71: 7 | AG71: ="回复<"&LEFT(VLOOKUP(RC[-32],'E:\mowen_game\int\piassets\common_cfg\xls\[summary.xml]task'!C4:C18,9,FALSE),LEN(VLOOKUP(RC[-32],'E:\mowen_game\int\piassets\common_cfg\xls\[summary.xml]task'!C4:C18,9,FALSE))-1)&"|arg="&RC[-26]&">" -> 回复<暴风战区将军|arg=10012437> | AH71: =""""&RC[-1]&"""" -> "回复<暴风战区将军|arg=10012437>" | AI71: 1 | AJ71: 3 | AK71: 20000 | AL71: 40000
A72: ='E:\mowen_game\int\piassets\common_cfg\xls\[summary.xml]task'!RC[3] -> 10302053 | B72: =VLOOKUP(RC[-1],'E:\mowen_game\int\piassets\common_cfg\xls\[summary.xml]task'!C4:C8,5,FALSE) -> 法杖材料1 | C72: =VLOOKUP(RC[-2],'E:\mowen_game\int\piassets\common_cfg\xls\[summary.xml]task'!C4:C5,2,FALSE) -> 采集有物品 | D72: =VLOOKUP(RC[-3],'E:\mowen_game\int\piassets\common_cfg\xls\[summary.xml]task'!C4:C6,3,FALSE) -> 法杖材料 | F72: =VLOOKUP(RC[-5],'E:\mowen_game\int\piassets\common_cfg\xls\[summary.xml]task'!C4:C11,8,FALSE) -> 10012436 | G72: =VLOOKUP(RC[-6],'E:\mowen_game\int\piassets\common_cfg\xls\[summary.xml]task'!C4:C13,10,FALSE) -> 10012436 | H72: [] | J72: 40 | K72: 49 | L72: 0 | M72: 0 | N72: 跨服 | P72: 1000 | X72: 4 | AD72: 2 | AE72: 3 | AF72: 4 | AG72: ="回复<"&LEFT(VLOOKUP(RC[-32],'E:\mowen_game\int\piassets\common_cfg\xls\[summary.xml]task'!C4:C18,9,FALSE),LEN(VLOOKUP(RC[-32],'E:\mowen_game\int\piassets\common_cfg\xls\[summary.xml]task'!C4:C18,9,FALSE))-1)&"|arg="&RC[-26]&">" -> 回复<战区军需官|arg=10012436> | AH72: =""""&RC[-1]&"""" -> "回复<战区军需官|arg=10012436>" | AI72: 1 | AJ72: 3 | AK72: 20000 | AL72: 40000
A73: ='E:\mowen_game\int\piassets\common_cfg\xls\[summary.xml]task'!RC[3] -> 10302054 | B73: =VLOOKUP(RC[-1],'E:\mowen_game\int\piassets\common_cfg\xls\[summary.xml]task'!C4:C8,5,FALSE) -> 风暴水晶1 | C73: =VLOOKUP(RC[-2],'E:\mowen_game\int\piassets\common_cfg\xls\[summary.xml]task'!C4:C5,2,FALSE) -> 采集有物品 | D73: =VLOOKUP(RC[-3],'E:\mowen_game\int\piassets\common_cfg\xls\[summary.xml]task'!C4:C6,3,FALSE) -> 风暴水晶 | F73: =VLOOKUP(RC[-5],'E:\mowen_game\int\piassets\common_cfg\xls\[summary.xml]task'!C4:C11,8,FALSE) -> 10012436 | G73: =VLOOKUP(RC[-6],'E:\mowen_game\int\piassets\common_cfg\xls\[summary.xml]task'!C4:C13,10,FALSE) -> 10012436 | H73: [] | J73: 40 | K73: 49 | L73: 0 | M73: 0 | N73: 跨服 | P73: 1000 | X73: 4 | AD73: 5 | AE73: 6 | AF73: 7 | AG73: ="回复<"&LEFT(VLOOKUP(RC[-32],'E:\mowen_game\int\piassets\common_cfg\xls\[summary.xml]task'!C4:C18,9,FALSE),LEN(VLOOKUP(RC[-32],'E:\mowen_game\int\piassets\common_cfg\xls\[summary.xml]task'!C4:C18,9,FALSE))-1)&"|arg="&RC[-26]&">" -> 回复<战区军需官|arg=10012436> | AH73: =""""&RC[-1]&"""" -> "回复<战区军需官|arg=10012436>" | AI73: 1 | AJ73: 3 | AK73: 20000 | AL73: 40000
A74: ='E:\mowen_game\int\piassets\common_cfg\xls\[summary.xml]task'!RC[3] -> 10302061 | B74: =VLOOKUP(RC[-1],'E:\mowen_game\int\piassets\common_cfg\xls\[summary.xml]task'!C4:C8,5,FALSE) -> 虚空毁灭者1 | C74: =VLOOKUP(RC[-2],'E:\mowen_game\int\piassets\common_cfg\xls\[summary.xml]task'!C4:C5,2,FALSE) -> 击杀npc | D74: =VLOOKUP(RC[-3],'E:\mowen_game\int\piassets\common_cfg\xls\[summary.xml]task'!C4:C6,3,FALSE) -> 虚空毁灭者 | F74: =VLOOKUP(RC[-5],'E:\mowen_game\int\piassets\common_cfg\xls\[summary.xml]task'!C4:C11,8,FALSE) -> 10012455 | G74: =VLOOKUP(RC[-6],'E:\mowen_game\int\piassets\common_cfg\xls\[summary.xml]task'!C4:C13,10,FALSE) -> 10012455 | H74: [] | J74: 50 | K74: 59 | L74: 0 | M74: 0 | N74: 跨服 | P74: 1000 | X74: 2 | AD74: 2 | AE74: 3 | AF74: 4 | AG74: ="回复<"&LEFT(VLOOKUP(RC[-32],'E:\mowen_game\int\piassets\common_cfg\xls\[summary.xml]task'!C4:C18,9,FALSE),LEN(VLOOKUP(RC[-32],'E:\mowen_game\int\piassets\common_cfg\xls\[summary.xml]task'!C4:C18,9,FALSE))-1)&"|arg="&RC[-26]&">" -> 回复<暴风战区将军|arg=10012455> | AH74: =""""&RC[-1]&"""" -> "回复<暴风战区将军|arg=10012455>" | AI74: 1 | AJ74: 3 | AK74: 20000 | AL74: 40000
A75: ='E:\mowen_game\int\piassets\common_cfg\xls\[summary.xml]task'!RC[3] -> 10302062 | B75: =VLOOKUP(RC[-1],'E:\mowen_game\int\piassets\common_cfg\xls\[summary.xml]task'!C4:C8,5,FALSE) -> 虚空主宰1 | C75: =VLOOKUP(RC[-2],'E:\mowen_game\int\piassets\common_cfg\xls\[summary.xml]task'!C4:C5,2,FALSE) -> 击杀npc | D75: =VLOOKUP(RC[-3],'E:\mowen_game\int\piassets\common_cfg\xls\[summary.xml]task'!C4:C6,3,FALSE) -> 虚空主宰 | F75: =VLOOKUP(RC[-5],'E:\mowen_game\int\piassets\common_cfg\xls\[summary.xml]task'!C4:C11,8,FALSE) -> 10012455 | G75: =VLOOKUP(RC[-6],'E:\mowen_game\int\piassets\common_cfg\xls\[summary.xml]task'!C4:C13,10,FALSE) -> 10012455 | H75: [] | J75: 50 | K75: 59 | L75: 0 | M75: 0 | N75: 跨服 | P75: 1000 | X75: 2 | AD75: 5 | AE75: 6 | AF75: 7 | AG75: ="回复<"&LEFT(VLOOKUP(RC[-32],'E:\mowen_game\int\piassets\common_cfg\xls\[summary.xml]task'!C4:C18,9,FALSE),LEN(VLOOKUP(RC[-32],'E:\mowen_game\int\piassets\common_cfg\xls\[summary.xml]task'!C4:C18,9,FALSE))-1)&"|arg="&RC[-26]&">" -> 回复<暴风战区将军|arg=10012455> | AH75: =""""&RC[-1]&"""" -> "回复<暴风战区将军|arg=10012455>" | AI75: 1 | AJ75: 3 | AK75: 20000 | AL75: 40000
A76: ='E:\mowen_game\int\piassets\common_cfg\xls\[summary.xml]task'!RC[3] -> 10302063 | B76: =VLOOKUP(RC[-1],'E:\mowen_game\int\piassets\common_cfg\xls\[summary.xml]task'!C4:C8,5,FALSE) -> 法杖材料1 | C76: =VLOOKUP(RC[-2],'E:\mowen_game\int\piassets\common_cfg\xls\[summary.xml]task'!C4:C5,2,FALSE) -> 采集有物品 | D76: =VLOOKUP(RC[-3],'E:\mowen_game\int\piassets\common_cfg\xls\[summary.xml]task'!C4:C6,3,FALSE) -> 法杖材料 | F76: =VLOOKUP(RC[-5],'E:\mowen_game\int\piassets\common_cfg\xls\[summary.xml]task'!C4:C11,8,FALSE) -> 10012454 | G76: =VLOOKUP(RC[-6],'E:\mowen_game\int\piassets\common_cfg\xls\[summary.xml]task'!C4:C13,10,FALSE) -> 10012454 | H76: [] | J76: 50 | K76: 59 | L76: 0 | M76: 0 | N76: 跨服 | P76: 1000 | X76: 2 | AD76: 2 | AE76: 3 | AF76: 4 | AG76: ="回复<"&LEFT(VLOOKUP(RC[-32],'E:\mowen_game\int\piassets\common_cfg\xls\[summary.xml]task'!C4:C18,9,FALSE),LEN(VLOOKUP(RC[-32],'E:\mowen_game\int\piassets\common_cfg\xls\[summary.xml]task'!C4:C18,9,FALSE))-1)&"|arg="&RC[-26]&">" -> 回复<战区军需官|arg=10012454> | AH76: =""""&RC[-1]&"""" -> "回复<战区军需官|arg=10012454>" | AI76: 1 | AJ76: 3 | AK76: 20000 | AL76: 40000
A77: ='E:\mowen_game\int\piassets\common_cfg\xls\[summary.xml]task'!RC[3] -> 10302064 | B77: =VLOOKUP(RC[-1],'E:\mowen_game\int\piassets\common_cfg\xls\[summary.xml]task'!C4:C8,5,FALSE) -> 风暴水晶1 | C77: =VLOOKUP(RC[-2],'E:\mowen_game\int\piassets\common_cfg\xls\[summary.xml]task'!C4:C5,2,FALSE) -> 采集有物品 | D77: =VLOOKUP(RC[-3],'E:\mowen_game\int\piassets\common_cfg\xls\[summary.xml]task'!C4:C6,3,FALSE) -> 风暴水晶 | F77: =VLOOKUP(RC[-5],'E:\mowen_game\int\piassets\common_cfg\xls\[summary.xml]task'!C4:C11,8,FALSE) -> 10012454 | G77: =VLOOKUP(RC[-6],'E:\mowen_game\int\piassets\common_cfg\xls\[summary.xml]task'!C4:C13,10,FALSE) -> 10012454 | H77: [] | J77: 50 | K77: 59 | L77: 0 | M77: 0 | N77: 跨服 | P77: 1000 | X77: 2 | AD77: 5 | AE77: 6 | AF77: 7 | AG77: ="回复<"&LEFT(VLOOKUP(RC[-32],'E:\mowen_game\int\piassets\common_cfg\xls\[summary.xml]task'!C4:C18,9,FALSE),LEN(VLOOKUP(RC[-32],'E:\mowen_game\int\piassets\common_cfg\xls\[summary.xml]task'!C4:C18,9,FALSE))-1)&"|arg="&RC[-26]&">" -> 回复<战区军需官|arg=10012454> | AH77: =""""&RC[-1]&"""" -> "回复<战区军需官|arg=10012454>" | AI77: 1 | AJ77: 3 | AK77: 20000 | AL77: 40000
A78: ='E:\mowen_game\int\piassets\common_cfg\xls\[summary.xml]task'!RC[3] -> 10302071 | B78: =VLOOKUP(RC[-1],'E:\mowen_game\int\piassets\common_cfg\xls\[summary.xml]task'!C4:C8,5,FALSE) -> 虚空毁灭者1 | C78: =VLOOKUP(RC[-2],'E:\mowen_game\int\piassets\common_cfg\xls\[summary.xml]task'!C4:C5,2,FALSE) -> 击杀npc | D78: =VLOOKUP(RC[-3],'E:\mowen_game\int\piassets\common_cfg\xls\[summary.xml]task'!C4:C6,3,FALSE) -> 虚空毁灭者 | F78: =VLOOKUP(RC[-5],'E:\mowen_game\int\piassets\common_cfg\xls\[summary.xml]task'!C4:C11,8,FALSE) -> 10012457 | G78: =VLOOKUP(RC[-6],'E:\mowen_game\int\piassets\common_cfg\xls\[summary.xml]task'!C4:C13,10,FALSE) -> 10012457 | H78: [] | J78: 50 | K78: 59 | L78: 0 | M78: 0 | N78: 跨服 | P78: 1000 | X78: 4 | AD78: 2 | AE78: 3 | AF78: 4 | AG78: ="回复<"&LEFT(VLOOKUP(RC[-32],'E:\mowen_game\int\piassets\common_cfg\xls\[summary.xml]task'!C4:C18,9,FALSE),LEN(VLOOKUP(RC[-32],'E:\mowen_game\int\piassets\common_cfg\xls\[summary.xml]task'!C4:C18,9,FALSE))-1)&"|arg="&RC[-26]&">" -> 回复<暴风战区将军|arg=10012457> | AH78: =""""&RC[-1]&"""" -> "回复<暴风战区将军|arg=10012457>" | AI78: 1 | AJ78: 3 | AK78: 20000 | AL78: 40000
A79: ='E:\mowen_game\int\piassets\common_cfg\xls\[summary.xml]task'!RC[3] -> 10302072 | B79: =VLOOKUP(RC[-1],'E:\mowen_game\int\piassets\common_cfg\xls\[summary.xml]task'!C4:C8,5,FALSE) -> 虚空主宰1 | C79: =VLOOKUP(RC[-2],'E:\mowen_game\int\piassets\common_cfg\xls\[summary.xml]task'!C4:C5,2,FALSE) -> 击杀npc | D79: =VLOOKUP(RC[-3],'E:\mowen_game\int\piassets\common_cfg\xls\[summary.xml]task'!C4:C6,3,FALSE) -> 虚空主宰 | F79: =VLOOKUP(RC[-5],'E:\mowen_game\int\piassets\common_cfg\xls\[summary.xml]task'!C4:C11,8,FALSE) -> 10012457 | G79: =VLOOKUP(RC[-6],'E:\mowen_game\int\piassets\common_cfg\xls\[summary.xml]task'!C4:C13,10,FALSE) -> 10012457 | H79: [] | J79: 50 | K79: 59 | L79: 0 | M79: 0 | N79: 跨服 | P79: 1000 | X79: 4 | AD79: 5 | AE79: 6 | AF79: 7 | AG79: ="回复<"&LEFT(VLOOKUP(RC[-32],'E:\mowen_game\int\piassets\common_cfg\xls\[summary.xml]task'!C4:C18,9,FALSE),LEN(VLOOKUP(RC[-32],'E:\mowen_game\int\piassets\common_cfg\xls\[summary.xml]task'!C4:C18,9,FALSE))-1)&"|arg="&RC[-26]&">" -> 回复<暴风战区将军|arg=10012457> | AH79: =""""&RC[-1]&"""" -> "回复<暴风战区将军|arg=10012457>" | AI79: 1 | AJ79: 3 | AK79: 20000 | AL79: 40000
A80: ='E:\mowen_game\int\piassets\common_cfg\xls\[summary.xml]task'!RC[3] -> 10302073 | B80: =VLOOKUP(RC[-1],'E:\mowen_game\int\piassets\common_cfg\xls\[summary.xml]task'!C4:C8,5,FALSE) -> 法杖材料1 | C80: =VLOOKUP(RC[-2],'E:\mowen_game\int\piassets\common_cfg\xls\[summary.xml]task'!C4:C5,2,FALSE) -> 采集有物品 | D80: =VLOOKUP(RC[-3],'E:\mowen_game\int\piassets\common_cfg\xls\[summary.xml]task'!C4:C6,3,FALSE) -> 法杖材料 | F80: =VLOOKUP(RC[-5],'E:\mowen_game\int\piassets\common_cfg\xls\[summary.xml]task'!C4:C11,8,FALSE) -> 10012456 | G80: =VLOOKUP(RC[-6],'E:\mowen_game\int\piassets\common_cfg\xls\[summary.xml]task'!C4:C13,10,FALSE) -> 10012456 | H80: [] | J80: 50 | K80: 59 | L80: 0 | M80: 0 | N80: 跨服 | P80: 1000 | X80: 4 | AD80: 2 | AE80: 3 | AF80: 4 | AG80: ="回复<"&LEFT(VLOOKUP(RC[-32],'E:\mowen_game\int\piassets\common_cfg\xls\[summary.xml]task'!C4:C18,9,FALSE),LEN(VLOOKUP(RC[-32],'E:\mowen_game\int\piassets\common_cfg\xls\[summary.xml]task'!C4:C18,9,FALSE))-1)&"|arg="&RC[-26]&">" -> 回复<战区军需官|arg=10012456> | AH80: =""""&RC[-1]&"""" -> "回复<战区军需官|arg=10012456>" | AI80: 1 | AJ80: 3 | AK80: 20000 | AL80: 40000
A81: ='E:\mowen_game\int\piassets\common_cfg\xls\[summary.xml]task'!RC[3] -> 10302074 | B81: =VLOOKUP(RC[-1],'E:\mowen_game\int\piassets\common_cfg\xls\[summary.xml]task'!C4:C8,5,FALSE) -> 风暴水晶1 | C81: =VLOOKUP(RC[-2],'E:\mowen_game\int\piassets\common_cfg\xls\[summary.xml]task'!C4:C5,2,FALSE) -> 采集有物品 | D81: =VLOOKUP(RC[-3],'E:\mowen_game\int\piassets\common_cfg\xls\[summary.xml]task'!C4:C6,3,FALSE) -> 风暴水晶 | F81: =VLOOKUP(RC[-5],'E:\mowen_game\int\piassets\common_cfg\xls\[summary.xml]task'!C4:C11,8,FALSE) -> 10012456 | G81: =VLOOKUP(RC[-6],'E:\mowen_game\int\piassets\common_cfg\xls\[summary.xml]task'!C4:C13,10,FALSE) -> 10012456 | H81: [] | J81: 50 | K81: 59 | L81: 0 | M81: 0 | N81: 跨服 | P81: 1000 | X81: 4 | AD81: 5 | AE81: 6 | AF81: 7 | AG81: ="回复<"&LEFT(VLOOKUP(RC[-32],'E:\mowen_game\int\piassets\common_cfg\xls\[summary.xml]task'!C4:C18,9,FALSE),LEN(VLOOKUP(RC[-32],'E:\mowen_game\int\piassets\common_cfg\xls\[summary.xml]task'!C4:C18,9,FALSE))-1)&"|arg="&RC[-26]&">" -> 回复<战区军需官|arg=10012456> | AH81: =""""&RC[-1]&"""" -> "回复<战区军需官|arg=10012456>" | AI81: 1 | AJ81: 3 | AK81: 20000 | AL81: 40000
A82: ='E:\mowen_game\int\piassets\common_cfg\xls\[summary.xml]task'!RC[3] -> 10302081 | B82: =VLOOKUP(RC[-1],'E:\mowen_game\int\piassets\common_cfg\xls\[summary.xml]task'!C4:C8,5,FALSE) -> 虚空毁灭者1 | C82: =VLOOKUP(RC[-2],'E:\mowen_game\int\piassets\common_cfg\xls\[summary.xml]task'!C4:C5,2,FALSE) -> 击杀npc | D82: =VLOOKUP(RC[-3],'E:\mowen_game\int\piassets\common_cfg\xls\[summary.xml]task'!C4:C6,3,FALSE) -> 虚空毁灭者 | F82: =VLOOKUP(RC[-5],'E:\mowen_game\int\piassets\common_cfg\xls\[summary.xml]task'!C4:C11,8,FALSE) -> 10012465 | G82: =VLOOKUP(RC[-6],'E:\mowen_game\int\piassets\common_cfg\xls\[summary.xml]task'!C4:C13,10,FALSE) -> 10012465 | H82: [] | J82: 60 | K82: 69 | L82: 0 | M82: 0 | N82: 跨服 | P82: 1000 | X82: 2 | AD82: 2 | AE82: 3 | AF82: 4 | AG82: ="回复<"&LEFT(VLOOKUP(RC[-32],'E:\mowen_game\int\piassets\common_cfg\xls\[summary.xml]task'!C4:C18,9,FALSE),LEN(VLOOKUP(RC[-32],'E:\mowen_game\int\piassets\common_cfg\xls\[summary.xml]task'!C4:C18,9,FALSE))-1)&"|arg="&RC[-26]&">" -> 回复<暴风战区将军|arg=10012465> | AH82: =""""&RC[-1]&"""" -> "回复<暴风战区将军|arg=10012465>" | AI82: 1 | AJ82: 3 | AK82: 20000 | AL82: 40000
A83: ='E:\mowen_game\int\piassets\common_cfg\xls\[summary.xml]task'!RC[3] -> 10302082 | B83: =VLOOKUP(RC[-1],'E:\mowen_game\int\piassets\common_cfg\xls\[summary.xml]task'!C4:C8,5,FALSE) -> 虚空主宰1 | C83: =VLOOKUP(RC[-2],'E:\mowen_game\int\piassets\common_cfg\xls\[summary.xml]task'!C4:C5,2,FALSE) -> 击杀npc | D83: =VLOOKUP(RC[-3],'E:\mowen_game\int\piassets\common_cfg\xls\[summary.xml]task'!C4:C6,3,FALSE) -> 虚空主宰 | F83: =VLOOKUP(RC[-5],'E:\mowen_game\int\piassets\common_cfg\xls\[summary.xml]task'!C4:C11,8,FALSE) -> 10012465 | G83: =VLOOKUP(RC[-6],'E:\mowen_game\int\piassets\common_cfg\xls\[summary.xml]task'!C4:C13,10,FALSE) -> 10012465 | H83: [] | J83: 60 | K83: 69 | L83: 0 | M83: 0 | N83: 跨服 | P83: 1000 | X83: 2 | AD83: 5 | AE83: 6 | AF83: 7 | AG83: ="回复<"&LEFT(VLOOKUP(RC[-32],'E:\mowen_game\int\piassets\common_cfg\xls\[summary.xml]task'!C4:C18,9,FALSE),LEN(VLOOKUP(RC[-32],'E:\mowen_game\int\piassets\common_cfg\xls\[summary.xml]task'!C4:C18,9,FALSE))-1)&"|arg="&RC[-26]&">" -> 回复<暴风战区将军|arg=10012465> | AH83: =""""&RC[-1]&"""" -> "回复<暴风战区将军|arg=10012465>" | AI83: 1 | AJ83: 3 | AK83: 20000 | AL83: 40000
A84: ='E:\mowen_game\int\piassets\common_cfg\xls\[summary.xml]task'!RC[3] -> 10302083 | B84: =VLOOKUP(RC[-1],'E:\mowen_game\int\piassets\common_cfg\xls\[summary.xml]task'!C4:C8,5,FALSE) -> 法杖材料1 | C84: =VLOOKUP(RC[-2],'E:\mowen_game\int\piassets\common_cfg\xls\[summary.xml]task'!C4:C5,2,FALSE) -> 采集有物品 | D84: =VLOOKUP(RC[-3],'E:\mowen_game\int\piassets\common_cfg\xls\[summary.xml]task'!C4:C6,3,FALSE) -> 法杖材料 | F84: =VLOOKUP(RC[-5],'E:\mowen_game\int\piassets\common_cfg\xls\[summary.xml]task'!C4:C11,8,FALSE) -> 10012464 | G84: =VLOOKUP(RC[-6],'E:\mowen_game\int\piassets\common_cfg\xls\[summary.xml]task'!C4:C13,10,FALSE) -> 10012464 | H84: [] | J84: 60 | K84: 69 | L84: 0 | M84: 0 | N84: 跨服 | P84: 1000 | X84: 2 | AD84: 2 | AE84: 3 | AF84: 4 | AG84: ="回复<"&LEFT(VLOOKUP(RC[-32],'E:\mowen_game\int\piassets\common_cfg\xls\[summary.xml]task'!C4:C18,9,FALSE),LEN(VLOOKUP(RC[-32],'E:\mowen_game\int\piassets\common_cfg\xls\[summary.xml]task'!C4:C18,9,FALSE))-1)&"|arg="&RC[-26]&">" -> 回复<战区军需官|arg=10012464> | AH84: =""""&RC[-1]&"""" -> "回复<战区军需官|arg=10012464>" | AI84: 1 | AJ84: 3 | AK84: 20000 | AL84: 40000
A85: ='E:\mowen_game\int\piassets\common_cfg\xls\[summary.xml]task'!RC[3] -> 10302084 | B85: =VLOOKUP(RC[-1],'E:\mowen_game\int\piassets\common_cfg\xls\[summary.xml]task'!C4:C8,5,FALSE) -> 风暴水晶1 | C85: =VLOOKUP(RC[-2],'E:\mowen_game\int\piassets\common_cfg\xls\[summary.xml]task'!C4:C5,2,FALSE) -> 采集有物品 | D85: =VLOOKUP(RC[-3],'E:\mowen_game\int\piassets\common_cfg\xls\[summary.xml]task'!C4:C6,3,FALSE) -> 风暴水晶 | F85: =VLOOKUP(RC[-5],'E:\mowen_game\int\piassets\common_cfg\xls\[summary.xml]task'!C4:C11,8,FALSE) -> 10012464 | G85: =VLOOKUP(RC[-6],'E:\mowen_game\int\piassets\common_cfg\xls\[summary.xml]task'!C4:C13,10,FALSE) -> 10012464 | H85: [] | J85: 60 | K85: 69 | L85: 0 | M85: 0 | N85: 跨服 | P85: 1000 | X85: 2 | AD85: 5 | AE85: 6 | AF85: 7 | AG85: ="回复<"&LEFT(VLOOKUP(RC[-32],'E:\mowen_game\int\piassets\common_cfg\xls\[summary.xml]task'!C4:C18,9,FALSE),LEN(VLOOKUP(RC[-32],'E:\mowen_game\int\piassets\common_cfg\xls\[summary.xml]task'!C4:C18,9,FALSE))-1)&"|arg="&RC[-26]&">" -> 回复<战区军需官|arg=10012464> | AH85: =""""&RC[-1]&"""" -> "回复<战区军需官|arg=10012464>" | AI85: 1 | AJ85: 3 | AK85: 20000 | AL85: 40000
A86: ='E:\mowen_game\int\piassets\common_cfg\xls\[summary.xml]task'!RC[3] -> 10302091 | B86: =VLOOKUP(RC[-1],'E:\mowen_game\int\piassets\common_cfg\xls\[summary.xml]task'!C4:C8,5,FALSE) -> 虚空毁灭者1 | C86: =VLOOKUP(RC[-2],'E:\mowen_game\int\piassets\common_cfg\xls\[summary.xml]task'!C4:C5,2,FALSE) -> 击杀npc | D86: =VLOOKUP(RC[-3],'E:\mowen_game\int\piassets\common_cfg\xls\[summary.xml]task'!C4:C6,3,FALSE) -> 虚空毁灭者 | F86: =VLOOKUP(RC[-5],'E:\mowen_game\int\piassets\common_cfg\xls\[summary.xml]task'!C4:C11,8,FALSE) -> 10012467 | G86: =VLOOKUP(RC[-6],'E:\mowen_game\int\piassets\common_cfg\xls\[summary.xml]task'!C4:C13,10,FALSE) -> 10012467 | H86: [] | J86: 60 | K86: 69 | L86: 0 | M86: 0 | N86: 跨服 | P86: 1000 | X86: 4 | AD86: 2 | AE86: 3 | AF86: 4 | AG86: ="回复<"&LEFT(VLOOKUP(RC[-32],'E:\mowen_game\int\piassets\common_cfg\xls\[summary.xml]task'!C4:C18,9,FALSE),LEN(VLOOKUP(RC[-32],'E:\mowen_game\int\piassets\common_cfg\xls\[summary.xml]task'!C4:C18,9,FALSE))-1)&"|arg="&RC[-26]&">" -> 回复<暴风战区将军1|arg=10012467> | AH86: =""""&RC[-1]&"""" -> "回复<暴风战区将军1|arg=10012467>" | AI86: 1 | AJ86: 3 | AK86: 20000 | AL86: 40000
A87: ='E:\mowen_game\int\piassets\common_cfg\xls\[summary.xml]task'!RC[3] -> 10302092 | B87: =VLOOKUP(RC[-1],'E:\mowen_game\int\piassets\common_cfg\xls\[summary.xml]task'!C4:C8,5,FALSE) -> 虚空主宰1 | C87: =VLOOKUP(RC[-2],'E:\mowen_game\int\piassets\common_cfg\xls\[summary.xml]task'!C4:C5,2,FALSE) -> 击杀npc | D87: =VLOOKUP(RC[-3],'E:\mowen_game\int\piassets\common_cfg\xls\[summary.xml]task'!C4:C6,3,FALSE) -> 虚空主宰 | F87: =VLOOKUP(RC[-5],'E:\mowen_game\int\piassets\common_cfg\xls\[summary.xml]task'!C4:C11,8,FALSE) -> 10012467 | G87: =VLOOKUP(RC[-6],'E:\mowen_game\int\piassets\common_cfg\xls\[summary.xml]task'!C4:C13,10,FALSE) -> 10012467 | H87: [] | J87: 60 | K87: 69 | L87: 0 | M87: 0 | N87: 跨服 | P87: 1000 | X87: 4 | AD87: 5 | AE87: 6 | AF87: 7 | AG87: ="回复<"&LEFT(VLOOKUP(RC[-32],'E:\mowen_game\int\piassets\common_cfg\xls\[summary.xml]task'!C4:C18,9,FALSE),LEN(VLOOKUP(RC[-32],'E:\mowen_game\int\piassets\common_cfg\xls\[summary.xml]task'!C4:C18,9,FALSE))-1)&"|arg="&RC[-26]&">" -> 回复<暴风战区将军1|arg=10012467> | AH87: =""""&RC[-1]&"""" -> "回复<暴风战区将军1|arg=10012467>" | AI87: 1 | AJ87: 3 | AK87: 20000 | AL87: 40000
A88: ='E:\mowen_game\int\piassets\common_cfg\xls\[summary.xml]task'!RC[3] -> 10302093 | B88: =VLOOKUP(RC[-1],'E:\mowen_game\int\piassets\common_cfg\xls\[summary.xml]task'!C4:C8,5,FALSE) -> 法杖材料1 | C88: =VLOOKUP(RC[-2],'E:\mowen_game\int\piassets\common_cfg\xls\[summary.xml]task'!C4:C5,2,FALSE) -> 采集有物品 | D88: =VLOOKUP(RC[-3],'E:\mowen_game\int\piassets\common_cfg\xls\[summary.xml]task'!C4:C6,3,FALSE) -> 法杖材料 | F88: =VLOOKUP(RC[-5],'E:\mowen_game\int\piassets\common_cfg\xls\[summary.xml]task'!C4:C11,8,FALSE) -> 10012466 | G88: =VLOOKUP(RC[-6],'E:\mowen_game\int\piassets\common_cfg\xls\[summary.xml]task'!C4:C13,10,FALSE) -> 10012466 | H88: [] | J88: 60 | K88: 69 | L88: 0 | M88: 0 | N88: 跨服 | P88: 1000 | X88: 4 | AD88: 2 | AE88: 3 | AF88: 4 | AG88: ="回复<"&LEFT(VLOOKUP(RC[-32],'E:\mowen_game\int\piassets\common_cfg\xls\[summary.xml]task'!C4:C18,9,FALSE),LEN(VLOOKUP(RC[-32],'E:\mowen_game\int\piassets\common_cfg\xls\[summary.xml]task'!C4:C18,9,FALSE))-1)&"|arg="&RC[-26]&">" -> 回复<战区军需官1|arg=10012466> | AH88: =""""&RC[-1]&"""" -> "回复<战区军需官1|arg=10012466>" | AI88: 1 | AJ88: 3 | AK88: 20000 | AL88: 40000
A89: ='E:\mowen_game\int\piassets\common_cfg\xls\[summary.xml]task'!RC[3] -> 10302094 | B89: =VLOOKUP(RC[-1],'E:\mowen_game\int\piassets\common_cfg\xls\[summary.xml]task'!C4:C8,5,FALSE) -> 风暴水晶1 | C89: =VLOOKUP(RC[-2],'E:\mowen_game\int\piassets\common_cfg\xls\[summary.xml]task'!C4:C5,2,FALSE) -> 采集有物品 | D89: =VLOOKUP(RC[-3],'E:\mowen_game\int\piassets\common_cfg\xls\[summary.xml]task'!C4:C6,3,FALSE) -> 风暴水晶 | F89: =VLOOKUP(RC[-5],'E:\mowen_game\int\piassets\common_cfg\xls\[summary.xml]task'!C4:C11,8,FALSE) -> 10012466 | G89: =VLOOKUP(RC[-6],'E:\mowen_game\int\piassets\common_cfg\xls\[summary.xml]task'!C4:C13,10,FALSE) -> 10012466 | H89: [] | J89: 60 | K89: 69 | L89: 0 | M89: 0 | N89: 跨服 | P89: 1000 | X89: 4 | AD89: 5 | AE89: 6 | AF89: 7 | AG89: ="回复<"&LEFT(VLOOKUP(RC[-32],'E:\mowen_game\int\piassets\common_cfg\xls\[summary.xml]task'!C4:C18,9,FALSE),LEN(VLOOKUP(RC[-32],'E:\mowen_game\int\piassets\common_cfg\xls\[summary.xml]task'!C4:C18,9,FALSE))-1)&"|arg="&RC[-26]&">" -> 回复<战区军需官1|arg=10012466> | AH89: =""""&RC[-1]&"""" -> "回复<战区军需官1|arg=10012466>" | AI89: 1 | AJ89: 3 | AK89: 20000 | AL89: 40000
A90: ='E:\mowen_game\int\piassets\common_cfg\xls\[summary.xml]task'!RC[3] -> 10303001 | B90: =VLOOKUP(RC[-1],'E:\mowen_game\int\piassets\common_cfg\xls\[summary.xml]task'!C4:C8,5,FALSE) -> 目标11 | C90: =VLOOKUP(RC[-2],'E:\mowen_game\int\piassets\common_cfg\xls\[summary.xml]task'!C4:C5,2,FALSE) -> 击杀npc | D90: =VLOOKUP(RC[-3],'E:\mowen_game\int\piassets\common_cfg\xls\[summary.xml]task'!C4:C6,3,FALSE) -> 目标1 | H90: [10303002] | J90: 1 | K90: 100 | L90: 0 | M90: 0 | N90: 远征 | P90: 1000 | AI90: 1 | AJ90: 2 | AK90: 0 | AL90: 0 | AN90: 1
A91: ='E:\mowen_game\int\piassets\common_cfg\xls\[summary.xml]task'!RC[3] -> 10303002 | B91: =VLOOKUP(RC[-1],'E:\mowen_game\int\piassets\common_cfg\xls\[summary.xml]task'!C4:C8,5,FALSE) -> 目标21 | C91: =VLOOKUP(RC[-2],'E:\mowen_game\int\piassets\common_cfg\xls\[summary.xml]task'!C4:C5,2,FALSE) -> 击杀npc | D91: =VLOOKUP(RC[-3],'E:\mowen_game\int\piassets\common_cfg\xls\[summary.xml]task'!C4:C6,3,FALSE) -> 目标2 | E91: =VLOOKUP(RC[-4],'E:\mowen_game\int\piassets\common_cfg\xls\[summary.xml]task'!C4:C11,6,FALSE) -> 10303001 | H91: [10303003] | J91: 1 | K91: 100 | L91: 1 | M91: 1 | N91: 远征 | P91: 1000 | AI91: 1 | AJ91: 2 | AK91: 0 | AL91: 0 | AN91: 1
A92: ='E:\mowen_game\int\piassets\common_cfg\xls\[summary.xml]task'!RC[3] -> 10303003 | B92: =VLOOKUP(RC[-1],'E:\mowen_game\int\piassets\common_cfg\xls\[summary.xml]task'!C4:C8,5,FALSE) -> 最终目标1 | C92: =VLOOKUP(RC[-2],'E:\mowen_game\int\piassets\common_cfg\xls\[summary.xml]task'!C4:C5,2,FALSE) -> 击杀npc | D92: =VLOOKUP(RC[-3],'E:\mowen_game\int\piassets\common_cfg\xls\[summary.xml]task'!C4:C6,3,FALSE) -> 最终目标 | E92: =VLOOKUP(RC[-4],'E:\mowen_game\int\piassets\common_cfg\xls\[summary.xml]task'!C4:C11,6,FALSE) -> 10303002 | H92: [] | J92: 1 | K92: 100 | L92: 1 | M92: 1 | N92: 远征 | P92: 1000 | AI92: 1 | AJ92: 2 | AK92: 0 | AL92: 0 | AN92: 1
A93: ='E:\mowen_game\int\piassets\common_cfg\xls\[summary.xml]task'!RC[3] -> 10303021 | B93: =VLOOKUP(RC[-1],'E:\mowen_game\int\piassets\common_cfg\xls\[summary.xml]task'!C4:C8,5,FALSE) -> 目标11 | C93: =VLOOKUP(RC[-2],'E:\mowen_game\int\piassets\common_cfg\xls\[summary.xml]task'!C4:C5,2,FALSE) -> 击杀npc | D93: =VLOOKUP(RC[-3],'E:\mowen_game\int\piassets\common_cfg\xls\[summary.xml]task'!C4:C6,3,FALSE) -> 目标1 | H93: [10303022] | J93: 1 | K93: 100 | L93: 0 | M93: 0 | N93: 远征 | P93: 1000 | AI93: 1 | AJ93: 2 | AK93: 0 | AL93: 0 | AN93: 1
A94: ='E:\mowen_game\int\piassets\common_cfg\xls\[summary.xml]task'!RC[3] -> 10303022 | B94: =VLOOKUP(RC[-1],'E:\mowen_game\int\piassets\common_cfg\xls\[summary.xml]task'!C4:C8,5,FALSE) -> 目标21 | C94: =VLOOKUP(RC[-2],'E:\mowen_game\int\piassets\common_cfg\xls\[summary.xml]task'!C4:C5,2,FALSE) -> 击杀npc | D94: =VLOOKUP(RC[-3],'E:\mowen_game\int\piassets\common_cfg\xls\[summary.xml]task'!C4:C6,3,FALSE) -> 目标2 | E94: =VLOOKUP(RC[-4],'E:\mowen_game\int\piassets\common_cfg\xls\[summary.xml]task'!C4:C11,6,FALSE) -> 10303021 | H94: [10303023] | J94: 1 | K94: 100 | L94: 1 | M94: 1 | N94: 远征 | P94: 1000 | AI94: 1 | AJ94: 2 | AK94: 0 | AL94: 0 | AN94: 1
A95: ='E:\mowen_game\int\piassets\common_cfg\xls\[summary.xml]task'!RC[3] -> 10303023 | B95: =VLOOKUP(RC[-1],'E:\mowen_game\int\piassets\common_cfg\xls\[summary.xml]task'!C4:C8,5,FALSE) -> 最终目标1 | C95: =VLOOKUP(RC[-2],'E:\mowen_game\int\piassets\common_cfg\xls\[summary.xml]task'!C4:C5,2,FALSE) -> 击杀npc | D95: =VLOOKUP(RC[-3],'E:\mowen_game\int\piassets\common_cfg\xls\[summary.xml]task'!C4:C6,3,FALSE) -> 最终目标 | E95: =VLOOKUP(RC[-4],'E:\mowen_game\int\piassets\common_cfg\xls\[summary.xml]task'!C4:C11,6,FALSE) -> 10303022 | H95: [] | J95: 1 | K95: 100 | L95: 1 | M95: 1 | N95: 远征 | P95: 1000 | AI95: 1 | AJ95: 2 | AK95: 0 | AL95: 0 | AN95: 1
A96: ='E:\mowen_game\int\piassets\common_cfg\xls\[summary.xml]task'!RC[3] -> 10300351 | B96: =VLOOKUP(RC[-1],'E:\mowen_game\int\piassets\common_cfg\xls\[summary.xml]task'!C4:C8,5,FALSE) -> 初入圣光城1 | C96: =VLOOKUP(RC[-2],'E:\mowen_game\int\piassets\common_cfg\xls\[summary.xml]task'!C4:C5,2,FALSE) -> 探索区域 | D96: =VLOOKUP(RC[-3],'E:\mowen_game\int\piassets\common_cfg\xls\[summary.xml]task'!C4:C6,3,FALSE) -> 初入圣光城 | E96: =VLOOKUP(RC[-4],'E:\mowen_game\int\piassets\common_cfg\xls\[summary.xml]task'!C4:C11,6,FALSE) -> 10300337 | F96: =VLOOKUP(RC[-5],'E:\mowen_game\int\piassets\common_cfg\xls\[summary.xml]task'!C4:C11,8,FALSE) -> 10013018 | H96: ="["&R[1]C[-7]&"]" -> [10300352] | J96: 1 | K96: 100 | L96: 0 | M96: 0 | N96: 主线 | O96: 3001,{255,0,248} | P96: 1000 | AI96: 1 | AJ96: 2 | AK96: 0 | AL96: 0 | AR96: 20
A97: ='E:\mowen_game\int\piassets\common_cfg\xls\[summary.xml]task'!RC[3] -> 10300352 | B97: =VLOOKUP(RC[-1],'E:\mowen_game\int\piassets\common_cfg\xls\[summary.xml]task'!C4:C8,5,FALSE) -> 进入圣光城1 | C97: =VLOOKUP(RC[-2],'E:\mowen_game\int\piassets\common_cfg\xls\[summary.xml]task'!C4:C5,2,FALSE) -> 探索区域 | D97: =VLOOKUP(RC[-3],'E:\mowen_game\int\piassets\common_cfg\xls\[summary.xml]task'!C4:C6,3,FALSE) -> 进入圣光城 | E97: =VLOOKUP(RC[-4],'E:\mowen_game\int\piassets\common_cfg\xls\[summary.xml]task'!C4:C11,6,FALSE) -> 10300351 | H97: [10300355] | J97: 1 | K97: 100 | L97: 1 | M97: 1 | N97: 主线 | P97: 1000 | AI97: 1 | AJ97: 2 | AK97: 0 | AL97: 50000 | AP97: 26000 | AQ97: 20 | AR97: 20
A98: ='E:\mowen_game\int\piassets\common_cfg\xls\[summary.xml]task'!RC[3] -> 10300353 | B98: =VLOOKUP(RC[-1],'E:\mowen_game\int\piassets\common_cfg\xls\[summary.xml]task'!C4:C8,5,FALSE) -> 圣光城卫1 | C98: =VLOOKUP(RC[-2],'E:\mowen_game\int\piassets\common_cfg\xls\[summary.xml]task'!C4:C5,2,FALSE) -> 对话npc | D98: =VLOOKUP(RC[-3],'E:\mowen_game\int\piassets\common_cfg\xls\[summary.xml]task'!C4:C6,3,FALSE) -> 圣光城卫 | E98: =VLOOKUP(RC[-4],'E:\mowen_game\int\piassets\common_cfg\xls\[summary.xml]task'!C4:C11,6,FALSE) -> 10300352 | G98: =VLOOKUP(RC[-6],'E:\mowen_game\int\piassets\common_cfg\xls\[summary.xml]task'!C4:C13,10,FALSE) -> 10013040 | H98: ="["&R[1]C[-7]&"]" -> [10300354] | J98: 1 | K98: 100 | L98: 1 | M98: 1 | N98: 主线 | P98: 1000 | AG98: ="回复<"&LEFT(VLOOKUP(RC[-32],'E:\mowen_game\int\piassets\common_cfg\xls\[summary.xml]task'!C4:C18,9,FALSE),LEN(VLOOKUP(RC[-32],'E:\mowen_game\int\piassets\common_cfg\xls\[summary.xml]task'!C4:C18,9,FALSE))-1)&"|arg="&RC[-26]&">" -> 回复<圣光城卫|arg=10013040> | AH98: =""""&RC[-1]&"""" -> "回复<圣光城卫|arg=10013040>" | AI98: 1 | AJ98: 2 | AK98: 0 | AL98: 0 | AN98: 1 | AP98: 31000 | AQ98: 21
A99: ='E:\mowen_game\int\piassets\common_cfg\xls\[summary.xml]task'!RC[3] -> 10300354 | B99: =VLOOKUP(RC[-1],'E:\mowen_game\int\piassets\common_cfg\xls\[summary.xml]task'!C4:C8,5,FALSE) -> 教训守卫1 | C99: =VLOOKUP(RC[-2],'E:\mowen_game\int\piassets\common_cfg\xls\[summary.xml]task'!C4:C5,2,FALSE) -> 击杀npc | D99: =VLOOKUP(RC[-3],'E:\mowen_game\int\piassets\common_cfg\xls\[summary.xml]task'!C4:C6,3,FALSE) -> 教训守卫 | E99: =VLOOKUP(RC[-4],'E:\mowen_game\int\piassets\common_cfg\xls\[summary.xml]task'!C4:C11,6,FALSE) -> 10300353 | F99: =VLOOKUP(RC[-5],'E:\mowen_game\int\piassets\common_cfg\xls\[summary.xml]task'!C4:C11,8,FALSE) -> 10013040 | G99: =VLOOKUP(RC[-6],'E:\mowen_game\int\piassets\common_cfg\xls\[summary.xml]task'!C4:C13,10,FALSE) -> 10013040 | H99: [] | J99: 1 | K99: 100 | L99: 1 | M99: 1 | N99: 主线 | P99: 1000 | AE99: 1 | AG99: ="回复<"&LEFT(VLOOKUP(RC[-32],'E:\mowen_game\int\piassets\common_cfg\xls\[summary.xml]task'!C4:C18,9,FALSE),LEN(VLOOKUP(RC[-32],'E:\mowen_game\int\piassets\common_cfg\xls\[summary.xml]task'!C4:C18,9,FALSE))-1)&"|arg="&RC[-26]&">" -> 回复<圣光城卫|arg=10013040> | AH99: =""""&RC[-1]&"""" -> "回复<圣光城卫|arg=10013040>" | AI99: 1 | AJ99: 2 | AK99: 0 | AL99: 50000 | AN99: 1 | AP99: 36000 | AQ99: 22
A100: ='E:\mowen_game\int\piassets\common_cfg\xls\[summary.xml]task'!RC[3] -> 10300355 | B100: =VLOOKUP(RC[-1],'E:\mowen_game\int\piassets\common_cfg\xls\[summary.xml]task'!C4:C8,5,FALSE) -> 登记入城1 | C100: =VLOOKUP(RC[-2],'E:\mowen_game\int\piassets\common_cfg\xls\[summary.xml]task'!C4:C5,2,FALSE) -> 对话npc | D100: =VLOOKUP(RC[-3],'E:\mowen_game\int\piassets\common_cfg\xls\[summary.xml]task'!C4:C6,3,FALSE) -> 登记入城 | E100: =VLOOKUP(RC[-4],'E:\mowen_game\int\piassets\common_cfg\xls\[summary.xml]task'!C4:C11,6,FALSE) -> 10300354 | F100: =VLOOKUP(RC[-5],'E:\mowen_game\int\piassets\common_cfg\xls\[summary.xml]task'!C4:C11,8,FALSE) -> 10013040 | G100: =VLOOKUP(RC[-6],'E:\mowen_game\int\piassets\common_cfg\xls\[summary.xml]task'!C4:C13,10,FALSE) -> 10013043 | H100: [10300377] | J100: 1 | K100: 100 | L100: 1 | M100: 1 | N100: 主线 | P100: 1000 | AG100: ="回复<"&LEFT(VLOOKUP(RC[-32],'E:\mowen_game\int\piassets\common_cfg\xls\[summary.xml]task'!C4:C18,9,FALSE),LEN(VLOOKUP(RC[-32],'E:\mowen_game\int\piassets\common_cfg\xls\[summary.xml]task'!C4:C18,9,FALSE))-1)&"|arg="&RC[-26]&">" -> 回复<登记官卡尔|arg=10013043> | AH100: =""""&RC[-1]&"""" -> "回复<登记官卡尔|arg=10013043>" | AI100: 1 | AJ100: 2 | AK100: 0 | AL100: 80000 | AP100: 41000 | AQ100: 23 | AR100: 21
A101: ='E:\mowen_game\int\piassets\common_cfg\xls\[summary.xml]task'!RC[3] -> 10300356 | B101: =VLOOKUP(RC[-1],'E:\mowen_game\int\piassets\common_cfg\xls\[summary.xml]task'!C4:C8,5,FALSE) -> 议会大厦1 | C101: =VLOOKUP(RC[-2],'E:\mowen_game\int\piassets\common_cfg\xls\[summary.xml]task'!C4:C5,2,FALSE) -> 探索区域 | D101: =VLOOKUP(RC[-3],'E:\mowen_game\int\piassets\common_cfg\xls\[summary.xml]task'!C4:C6,3,FALSE) -> 议会大厦 | E101: =VLOOKUP(RC[-4],'E:\mowen_game\int\piassets\common_cfg\xls\[summary.xml]task'!C4:C11,6,FALSE) -> 10300377 | F101: =VLOOKUP(RC[-5],'E:\mowen_game\int\piassets\common_cfg\xls\[summary.xml]task'!C4:C11,8,FALSE) -> 10010051 | H101: ="["&R[3]C[-7]&"]" -> [10300359] | J101: 1 | K101: 100 | L101: 1 | M101: 1 | N101: 主线 | P101: 1000 | AI101: 1 | AJ101: 2 | AK101: 0 | AL101: 0 | AP101: 46000 | AQ101: 24 | AR101: 21
A102: ='E:\mowen_game\int\piassets\common_cfg\xls\[summary.xml]task'!RC[3] -> 10300357 | B102: =VLOOKUP(RC[-1],'E:\mowen_game\int\piassets\common_cfg\xls\[summary.xml]task'!C4:C8,5,FALSE) -> 坚岩军团1 | C102: =VLOOKUP(RC[-2],'E:\mowen_game\int\piassets\common_cfg\xls\[summary.xml]task'!C4:C5,2,FALSE) -> 对话npc | D102: =VLOOKUP(RC[-3],'E:\mowen_game\int\piassets\common_cfg\xls\[summary.xml]task'!C4:C6,3,FALSE) -> 坚岩军团 | E102: =VLOOKUP(RC[-4],'E:\mowen_game\int\piassets\common_cfg\xls\[summary.xml]task'!C4:C11,6,FALSE) -> 10300356 | G102: =VLOOKUP(RC[-6],'E:\mowen_game\int\piassets\common_cfg\xls\[summary.xml]task'!C4:C13,10,FALSE) -> 10013044 | H102: ="["&R[1]C[-7]&"]" -> [10300358] | J102: 1 | K102: 100 | L102: 1 | M102: 1 | N102: 主线 | P102: 1000 | AG102: ="回复<"&LEFT(VLOOKUP(RC[-32],'E:\mowen_game\int\piassets\common_cfg\xls\[summary.xml]task'!C4:C18,9,FALSE),LEN(VLOOKUP(RC[-32],'E:\mowen_game\int\piassets\common_cfg\xls\[summary.xml]task'!C4:C18,9,FALSE))-1)&"|arg="&RC[-26]&">" -> 回复<侍卫长|arg=10013044> | AH102: =""""&RC[-1]&"""" -> "回复<侍卫长|arg=10013044>" | AI102: 1 | AJ102: 2 | AK102: 0 | AL102: 0 | AN102: 1 | AP102: 51000 | AQ102: 25 | AR102: 21
A103: ='E:\mowen_game\int\piassets\common_cfg\xls\[summary.xml]task'!RC[3] -> 10300358 | B103: =VLOOKUP(RC[-1],'E:\mowen_game\int\piassets\common_cfg\xls\[summary.xml]task'!C4:C8,5,FALSE) -> 再次挑衅1 | C103: =VLOOKUP(RC[-2],'E:\mowen_game\int\piassets\common_cfg\xls\[summary.xml]task'!C4:C5,2,FALSE) -> 击杀npc | D103: =VLOOKUP(RC[-3],'E:\mowen_game\int\piassets\common_cfg\xls\[summary.xml]task'!C4:C6,3,FALSE) -> 再次挑衅 | E103: =VLOOKUP(RC[-4],'E:\mowen_game\int\piassets\common_cfg\xls\[summary.xml]task'!C4:C11,6,FALSE) -> 10300357 | F103: =VLOOKUP(RC[-5],'E:\mowen_game\int\piassets\common_cfg\xls\[summary.xml]task'!C4:C11,8,FALSE) -> 10013044 | G103: =VLOOKUP(RC[-6],'E:\mowen_game\int\piassets\common_cfg\xls\[summary.xml]task'!C4:C13,10,FALSE) -> 10013044 | H103: [] | J103: 1 | K103: 100 | L103: 1 | M103: 1 | N103: 主线 | P103: 1000 | AE103: 1 | AG103: ="回复<"&LEFT(VLOOKUP(RC[-32],'E:\mowen_game\int\piassets\common_cfg\xls\[summary.xml]task'!C4:C18,9,FALSE),LEN(VLOOKUP(RC[-32],'E:\mowen_game\int\piassets\common_cfg\xls\[summary.xml]task'!C4:C18,9,FALSE))-1)&"|arg="&RC[-26]&">" -> 回复<侍卫长|arg=10013044> | AH103: =""""&RC[-1]&"""" -> "回复<侍卫长|arg=10013044>" | AI103: 1 | AJ103: 2 | AK103: 0 | AL103: 100000 | AN103: 1 | AP103: 56000 | AQ103: 26 | AR103: 21
A104: ='E:\mowen_game\int\piassets\common_cfg\xls\[summary.xml]task'!RC[3] -> 10300359 | B104: =VLOOKUP(RC[-1],'E:\mowen_game\int\piassets\common_cfg\xls\[summary.xml]task'!C4:C8,5,FALSE) -> 微风议长1 | C104: =VLOOKUP(RC[-2],'E:\mowen_game\int\piassets\common_cfg\xls\[summary.xml]task'!C4:C5,2,FALSE) -> 对话npc | D104: =VLOOKUP(RC[-3],'E:\mowen_game\int\piassets\common_cfg\xls\[summary.xml]task'!C4:C6,3,FALSE) -> 微风议长 | E104: =VLOOKUP(RC[-4],'E:\mowen_game\int\piassets\common_cfg\xls\[summary.xml]task'!C4:C11,6,FALSE) -> 10300358 | F104: =VLOOKUP(RC[-5],'E:\mowen_game\int\piassets\common_cfg\xls\[summary.xml]task'!C4:C11,8,FALSE) -> 10013044 | G104: =VLOOKUP(RC[-6],'E:\mowen_game\int\piassets\common_cfg\xls\[summary.xml]task'!C4:C13,10,FALSE) -> 10013048 | H104: ="["&R[1]C[-7]&"]" -> [10300360] | J104: 1 | K104: 100 | L104: 1 | M104: 1 | N104: 主线 | P104: 1000 | AG104: ="回复<"&LEFT(VLOOKUP(RC[-32],'E:\mowen_game\int\piassets\common_cfg\xls\[summary.xml]task'!C4:C18,9,FALSE),LEN(VLOOKUP(RC[-32],'E:\mowen_game\int\piassets\common_cfg\xls\[summary.xml]task'!C4:C18,9,FALSE))-1)&"|arg="&RC[-26]&">" -> 回复<微风议长|arg=10013048> | AH104: =""""&RC[-1]&"""" -> "回复<微风议长|arg=10013048>" | AI104: 1 | AJ104: 2 | AK104: 0 | AL104: 0 | AP104: 61000 | AQ104: 27 | AR104: 22
A105: ='E:\mowen_game\int\piassets\common_cfg\xls\[summary.xml]task'!RC[3] -> 10300360 | B105: =VLOOKUP(RC[-1],'E:\mowen_game\int\piassets\common_cfg\xls\[summary.xml]task'!C4:C8,5,FALSE) -> 烈焰将军1 | C105: =VLOOKUP(RC[-2],'E:\mowen_game\int\piassets\common_cfg\xls\[summary.xml]task'!C4:C5,2,FALSE) -> 对话npc | D105: =VLOOKUP(RC[-3],'E:\mowen_game\int\piassets\common_cfg\xls\[summary.xml]task'!C4:C6,3,FALSE) -> 烈焰将军 | E105: =VLOOKUP(RC[-4],'E:\mowen_game\int\piassets\common_cfg\xls\[summary.xml]task'!C4:C11,6,FALSE) -> 10300359 | F105: =VLOOKUP(RC[-5],'E:\mowen_game\int\piassets\common_cfg\xls\[summary.xml]task'!C4:C11,8,FALSE) -> 10013048 | G105: =VLOOKUP(RC[-6],'E:\mowen_game\int\piassets\common_cfg\xls\[summary.xml]task'!C4:C13,10,FALSE) -> 10013049 | H105: [{24,10300374,10300361},10301302] | J105: 1 | K105: 100 | L105: 1 | M105: 1 | N105: 主线 | P105: 1000 | AG105: ="回复<"&LEFT(VLOOKUP(RC[-32],'E:\mowen_game\int\piassets\common_cfg\xls\[summary.xml]task'!C4:C18,9,FALSE),LEN(VLOOKUP(RC[-32],'E:\mowen_game\int\piassets\common_cfg\xls\[summary.xml]task'!C4:C18,9,FALSE))-1)&"|arg="&RC[-26]&">" -> 回复<烈焰将军|arg=10013049> | AH105: =""""&RC[-1]&"""" -> "回复<烈焰将军|arg=10013049>" | AI105: 1 | AJ105: 2 | AK105: 0 | AL105: 230000 | AP105: 66000 | AQ105: 28 | AR105: 25
A106: ='E:\mowen_game\int\piassets\common_cfg\xls\[summary.xml]task'!RC[3] -> 10300361 | B106: =VLOOKUP(RC[-1],'E:\mowen_game\int\piassets\common_cfg\xls\[summary.xml]task'!C4:C8,5,FALSE) -> 初露锋芒1 | C106: =VLOOKUP(RC[-2],'E:\mowen_game\int\piassets\common_cfg\xls\[summary.xml]task'!C4:C5,2,FALSE) -> 提升等级 | D106: =VLOOKUP(RC[-3],'E:\mowen_game\int\piassets\common_cfg\xls\[summary.xml]task'!C4:C6,3,FALSE) -> 初露锋芒 | E106: =VLOOKUP(RC[-4],'E:\mowen_game\int\piassets\common_cfg\xls\[summary.xml]task'!C4:C11,6,FALSE) -> 10300360 | G106: =VLOOKUP(RC[-6],'E:\mowen_game\int\piassets\common_cfg\xls\[summary.xml]task'!C4:C13,10,FALSE) -> 10013049 | H106: [10300362] | J106: 1 | K106: 100 | L106: 0 | M106: 0 | N106: 主线 | P106: 1000 | AE106: 2 | AG106: ="回复<"&LEFT(VLOOKUP(RC[-32],'E:\mowen_game\int\piassets\common_cfg\xls\[summary.xml]task'!C4:C18,9,FALSE),LEN(VLOOKUP(RC[-32],'E:\mowen_game\int\piassets\common_cfg\xls\[summary.xml]task'!C4:C18,9,FALSE))-1)&"|arg="&RC[-26]&">" -> 回复<烈焰将军|arg=10013049> | AH106: =""""&RC[-1]&"""" -> "回复<烈焰将军|arg=10013049>" | AI106: 1 | AJ106: 2 | AK106: 0 | AL106: 100000 | AP106: 71000 | AQ106: 29
A107: ='E:\mowen_game\int\piassets\common_cfg\xls\[summary.xml]task'!RC[3] -> 10300362 | B107: =VLOOKUP(RC[-1],'E:\mowen_game\int\piassets\common_cfg\xls\[summary.xml]task'!C4:C8,5,FALSE) -> 微风救援1 | C107: =VLOOKUP(RC[-2],'E:\mowen_game\int\piassets\common_cfg\xls\[summary.xml]task'!C4:C5,2,FALSE) -> 击杀npc | D107: =VLOOKUP(RC[-3],'E:\mowen_game\int\piassets\common_cfg\xls\[summary.xml]task'!C4:C6,3,FALSE) -> 微风救援 | E107: =VLOOKUP(RC[-4],'E:\mowen_game\int\piassets\common_cfg\xls\[summary.xml]task'!C4:C11,6,FALSE) -> 10300361 | F107: =VLOOKUP(RC[-5],'E:\mowen_game\int\piassets\common_cfg\xls\[summary.xml]task'!C4:C11,8,FALSE) -> 10013049 | G107: =VLOOKUP(RC[-6],'E:\mowen_game\int\piassets\common_cfg\xls\[summary.xml]task'!C4:C13,10,FALSE) -> 10013050 | H107: ="["&R[1]C[-7]&"]" -> [10300363] | J107: 1 | K107: 100 | L107: 1 | M107: 1 | N107: 主线 | O107: 1006,{21,0,183} | P107: 1000 | AE107: 2 | AG107: ="回复<"&LEFT(VLOOKUP(RC[-32],'E:\mowen_game\int\piassets\common_cfg\xls\[summary.xml]task'!C4:C18,9,FALSE),LEN(VLOOKUP(RC[-32],'E:\mowen_game\int\piassets\common_cfg\xls\[summary.xml]task'!C4:C18,9,FALSE))-1)&"|arg="&RC[-26]&">" -> 回复<巡逻士兵|arg=10013050> | AH107: =""""&RC[-1]&"""" -> "回复<巡逻士兵|arg=10013050>" | AI107: 1 | AJ107: 2 | AK107: 0 | AL107: 100000 | AR107: 26
A108: ='E:\mowen_game\int\piassets\common_cfg\xls\[summary.xml]task'!RC[3] -> 10300363 | B108: =VLOOKUP(RC[-1],'E:\mowen_game\int\piassets\common_cfg\xls\[summary.xml]task'!C4:C8,5,FALSE) -> 追查鼠王1 | C108: =VLOOKUP(RC[-2],'E:\mowen_game\int\piassets\common_cfg\xls\[summary.xml]task'!C4:C5,2,FALSE) -> 探索区域 | D108: =VLOOKUP(RC[-3],'E:\mowen_game\int\piassets\common_cfg\xls\[summary.xml]task'!C4:C6,3,FALSE) -> 追查鼠王 | E108: =VLOOKUP(RC[-4],'E:\mowen_game\int\piassets\common_cfg\xls\[summary.xml]task'!C4:C11,6,FALSE) -> 10300362 | F108: =VLOOKUP(RC[-5],'E:\mowen_game\int\piassets\common_cfg\xls\[summary.xml]task'!C4:C11,8,FALSE) -> 10013050 | H108: ="["&R[4]C[-7]&"]" -> [10300367] | J108: 1 | K108: 100 | L108: 1 | M108: 1 | N108: 主线 | P108: 1000 | AI108: 1 | AJ108: 2 | AK108: 0 | AL108: 0
A109: ='E:\mowen_game\int\piassets\common_cfg\xls\[summary.xml]task'!RC[3] -> 10300364 | B109: =VLOOKUP(RC[-1],'E:\mowen_game\int\piassets\common_cfg\xls\[summary.xml]task'!C4:C8,5,FALSE) -> 灾厄巨鼠1 | C109: =VLOOKUP(RC[-2],'E:\mowen_game\int\piassets\common_cfg\xls\[summary.xml]task'!C4:C5,2,FALSE) -> 击杀npc | D109: =VLOOKUP(RC[-3],'E:\mowen_game\int\piassets\common_cfg\xls\[summary.xml]task'!C4:C6,3,FALSE) -> 灾厄巨鼠 | E109: =VLOOKUP(RC[-4],'E:\mowen_game\int\piassets\common_cfg\xls\[summary.xml]task'!C4:C11,6,FALSE) -> 10300363 | G109: =VLOOKUP(RC[-6],'E:\mowen_game\int\piassets\common_cfg\xls\[summary.xml]task'!C4:C13,10,FALSE) -> 10013051 | H109: ="["&R[1]C[-7]&"]" -> [10300365] | J109: 1 | K109: 100 | L109: 1 | M109: 1 | N109: 主线 | P109: 1000 | AE109: 2 | AG109: ="回复<"&LEFT(VLOOKUP(RC[-32],'E:\mowen_game\int\piassets\common_cfg\xls\[summary.xml]task'!C4:C18,9,FALSE),LEN(VLOOKUP(RC[-32],'E:\mowen_game\int\piassets\common_cfg\xls\[summary.xml]task'!C4:C18,9,FALSE))-1)&"|arg="&RC[-26]&">" -> 回复<大魔导师|arg=10013051> | AH109: =""""&RC[-1]&"""" -> "回复<大魔导师|arg=10013051>" | AI109: 1 | AJ109: 2 | AK109: 0 | AL109: 150000 | AN109: 1
A110: ='E:\mowen_game\int\piassets\common_cfg\xls\[summary.xml]task'!RC[3] -> 10300365 | B110: =VLOOKUP(RC[-1],'E:\mowen_game\int\piassets\common_cfg\xls\[summary.xml]task'!C4:C8,5,FALSE) -> 蓝魂草1 | C110: =VLOOKUP(RC[-2],'E:\mowen_game\int\piassets\common_cfg\xls\[summary.xml]task'!C4:C5,2,FALSE) -> 采集无物品 | D110: =VLOOKUP(RC[-3],'E:\mowen_game\int\piassets\common_cfg\xls\[summary.xml]task'!C4:C6,3,FALSE) -> 蓝魂草 | E110: =VLOOKUP(RC[-4],'E:\mowen_game\int\piassets\common_cfg\xls\[summary.xml]task'!C4:C11,6,FALSE) -> 10300364 | F110: =VLOOKUP(RC[-5],'E:\mowen_game\int\piassets\common_cfg\xls\[summary.xml]task'!C4:C11,8,FALSE) -> 10013051 | G110: =VLOOKUP(RC[-6],'E:\mowen_game\int\piassets\common_cfg\xls\[summary.xml]task'!C4:C13,10,FALSE) -> 10013051 | H110: ="["&R[1]C[-7]&"]" -> [10300366] | J110: 1 | K110: 100 | L110: 1 | M110: 1 | N110: 主线 | P110: 1000 | AE110: 3 | AG110: ="回复<"&LEFT(VLOOKUP(RC[-32],'E:\mowen_game\int\piassets\common_cfg\xls\[summary.xml]task'!C4:C18,9,FALSE),LEN(VLOOKUP(RC[-32],'E:\mowen_game\int\piassets\common_cfg\xls\[summary.xml]task'!C4:C18,9,FALSE))-1)&"|arg="&RC[-26]&">" -> 回复<大魔导师|arg=10013051> | AH110: =""""&RC[-1]&"""" -> "回复<大魔导师|arg=10013051>" | AI110: 1 | AJ110: 2 | AK110: 0 | AL110: 80000 | AN110: 1
A111: ='E:\mowen_game\int\piassets\common_cfg\xls\[summary.xml]task'!RC[3] -> 10300366 | B111: =VLOOKUP(RC[-1],'E:\mowen_game\int\piassets\common_cfg\xls\[summary.xml]task'!C4:C8,5,FALSE) -> 治疗大魔导师1 | C111: =VLOOKUP(RC[-2],'E:\mowen_game\int\piassets\common_cfg\xls\[summary.xml]task'!C4:C5,2,FALSE) -> 使用无物品 | D111: =VLOOKUP(RC[-3],'E:\mowen_game\int\piassets\common_cfg\xls\[summary.xml]task'!C4:C6,3,FALSE) -> 治疗大魔导师 | E111: =VLOOKUP(RC[-4],'E:\mowen_game\int\piassets\common_cfg\xls\[summary.xml]task'!C4:C11,6,FALSE) -> 10300365 | F111: =VLOOKUP(RC[-5],'E:\mowen_game\int\piassets\common_cfg\xls\[summary.xml]task'!C4:C11,8,FALSE) -> 10013051 | G111: =VLOOKUP(RC[-6],'E:\mowen_game\int\piassets\common_cfg\xls\[summary.xml]task'!C4:C13,10,FALSE) -> 10013051 | H111: [] | J111: 1 | K111: 100 | L111: 0 | M111: 1 | N111: 主线 | P111: 1000 | AE111: 4 | AG111: ="回复<"&LEFT(VLOOKUP(RC[-32],'E:\mowen_game\int\piassets\common_cfg\xls\[summary.xml]task'!C4:C18,9,FALSE),LEN(VLOOKUP(RC[-32],'E:\mowen_game\int\piassets\common_cfg\xls\[summary.xml]task'!C4:C18,9,FALSE))-1)&"|arg="&RC[-26]&">" -> 回复<大魔导师|arg=10013051> | AH111: =""""&RC[-1]&"""" -> "回复<大魔导师|arg=10013051>" | AI111: 1 | AJ111: 2 | AK111: 0 | AL111: 100000 | AN111: 1
A112: ='E:\mowen_game\int\piassets\common_cfg\xls\[summary.xml]task'!RC[3] -> 10300367 | B112: =VLOOKUP(RC[-1],'E:\mowen_game\int\piassets\common_cfg\xls\[summary.xml]task'!C4:C8,5,FALSE) -> 狮虎兽牙1 | C112: =VLOOKUP(RC[-2],'E:\mowen_game\int\piassets\common_cfg\xls\[summary.xml]task'!C4:C5,2,FALSE) -> 击杀npc收集物品 | D112: =VLOOKUP(RC[-3],'E:\mowen_game\int\piassets\common_cfg\xls\[summary.xml]task'!C4:C6,3,FALSE) -> 狮虎兽牙 | E112: =VLOOKUP(RC[-4],'E:\mowen_game\int\piassets\common_cfg\xls\[summary.xml]task'!C4:C11,6,FALSE) -> 10300366 | F112: =VLOOKUP(RC[-5],'E:\mowen_game\int\piassets\common_cfg\xls\[summary.xml]task'!C4:C11,8,FALSE) -> 10013051 | G112: =VLOOKUP(RC[-6],'E:\mowen_game\int\piassets\common_cfg\xls\[summary.xml]task'!C4:C13,10,FALSE) -> 10013052 | H112: [10300376] | J112: 1 | K112: 100 | L112: 1 | M112: 1 | N112: 主线 | P112: 1000 | AE112: 2 | AG112: ="回复<"&LEFT(VLOOKUP(RC[-32],'E:\mowen_game\int\piassets\common_cfg\xls\[summary.xml]task'!C4:C18,9,FALSE),LEN(VLOOKUP(RC[-32],'E:\mowen_game\int\piassets\common_cfg\xls\[summary.xml]task'!C4:C18,9,FALSE))-1)&"|arg="&RC[-26]&">" -> 回复<大魔导师|arg=10013052> | AH112: =""""&RC[-1]&"""" -> "回复<大魔导师|arg=10013052>" | AI112: 1 | AJ112: 2 | AK112: 0 | AL112: 150000 | AR112: 28
A113: ='E:\mowen_game\int\piassets\common_cfg\xls\[summary.xml]task'!RC[3] -> 10300368 | B113: =VLOOKUP(RC[-1],'E:\mowen_game\int\piassets\common_cfg\xls\[summary.xml]task'!C4:C8,5,FALSE) -> 初露锋芒3 | C113: =VLOOKUP(RC[-2],'E:\mowen_game\int\piassets\common_cfg\xls\[summary.xml]task'!C4:C5,2,FALSE) -> 提升等级 | D113: =VLOOKUP(RC[-3],'E:\mowen_game\int\piassets\common_cfg\xls\[summary.xml]task'!C4:C6,3,FALSE) -> 初露锋芒 | E113: =VLOOKUP(RC[-4],'E:\mowen_game\int\piassets\common_cfg\xls\[summary.xml]task'!C4:C11,6,FALSE) -> 10300376 | G113: =VLOOKUP(RC[-6],'E:\mowen_game\int\piassets\common_cfg\xls\[summary.xml]task'!C4:C13,10,FALSE) -> 10013052 | H113: [10300369] | J113: 1 | K113: 100 | L113: 0 | M113: 0 | N113: 主线 | P113: 1000 | AE113: 4 | AG113: ="回复<"&LEFT(VLOOKUP(RC[-32],'E:\mowen_game\int\piassets\common_cfg\xls\[summary.xml]task'!C4:C18,9,FALSE),LEN(VLOOKUP(RC[-32],'E:\mowen_game\int\piassets\common_cfg\xls\[summary.xml]task'!C4:C18,9,FALSE))-1)&"|arg="&RC[-26]&">" -> 回复<大魔导师|arg=10013052> | AH113: =""""&RC[-1]&"""" -> "回复<大魔导师|arg=10013052>" | AI113: 1 | AJ113: 2 | AK113: 0 | AL113: 100000
A114: ='E:\mowen_game\int\piassets\common_cfg\xls\[summary.xml]task'!RC[3] -> 10300369 | B114: =VLOOKUP(RC[-1],'E:\mowen_game\int\piassets\common_cfg\xls\[summary.xml]task'!C4:C8,5,FALSE) -> 布置法阵1 | C114: =VLOOKUP(RC[-2],'E:\mowen_game\int\piassets\common_cfg\xls\[summary.xml]task'!C4:C5,2,FALSE) -> 使用有物品 | D114: =VLOOKUP(RC[-3],'E:\mowen_game\int\piassets\common_cfg\xls\[summary.xml]task'!C4:C6,3,FALSE) -> 布置法阵 | E114: =VLOOKUP(RC[-4],'E:\mowen_game\int\piassets\common_cfg\xls\[summary.xml]task'!C4:C11,6,FALSE) -> 10300368 | F114: =VLOOKUP(RC[-5],'E:\mowen_game\int\piassets\common_cfg\xls\[summary.xml]task'!C4:C11,8,FALSE) -> 10013052 | H114: ="["&R[1]C[-7]&"]" -> [10300370] | J114: 1 | K114: 100 | L114: 1 | M114: 1 | N114: 主线 | P114: 1000 | AI114: 1 | AJ114: 2 | AK114: 0 | AL114: 0
A115: ='E:\mowen_game\int\piassets\common_cfg\xls\[summary.xml]task'!RC[3] -> 10300370 | B115: =VLOOKUP(RC[-1],'E:\mowen_game\int\piassets\common_cfg\xls\[summary.xml]task'!C4:C8,5,FALSE) -> 加强法阵1 | C115: =VLOOKUP(RC[-2],'E:\mowen_game\int\piassets\common_cfg\xls\[summary.xml]task'!C4:C5,2,FALSE) -> 使用有物品 | D115: =VLOOKUP(RC[-3],'E:\mowen_game\int\piassets\common_cfg\xls\[summary.xml]task'!C4:C6,3,FALSE) -> 加强法阵 | E115: =VLOOKUP(RC[-4],'E:\mowen_game\int\piassets\common_cfg\xls\[summary.xml]task'!C4:C11,6,FALSE) -> 10300369 | H115: ="["&R[1]C[-7]&"]" -> [10300371] | J115: 1 | K115: 100 | L115: 1 | M115: 1 | N115: 主线 | P115: 1000 | AI115: 1 | AJ115: 2 | AK115: 0 | AL115: 0 | AR115: 29
A116: ='E:\mowen_game\int\piassets\common_cfg\xls\[summary.xml]task'!RC[3] -> 10300371 | B116: =VLOOKUP(RC[-1],'E:\mowen_game\int\piassets\common_cfg\xls\[summary.xml]task'!C4:C8,5,FALSE) -> 启动法阵1 | C116: =VLOOKUP(RC[-2],'E:\mowen_game\int\piassets\common_cfg\xls\[summary.xml]task'!C4:C5,2,FALSE) -> 使用有物品 | D116: =VLOOKUP(RC[-3],'E:\mowen_game\int\piassets\common_cfg\xls\[summary.xml]task'!C4:C6,3,FALSE) -> 启动法阵 | E116: =VLOOKUP(RC[-4],'E:\mowen_game\int\piassets\common_cfg\xls\[summary.xml]task'!C4:C11,6,FALSE) -> 10300370 | G116: =VLOOKUP(RC[-6],'E:\mowen_game\int\piassets\common_cfg\xls\[summary.xml]task'!C4:C13,10,FALSE) -> 10013052 | H116: ="["&R[1]C[-7]&"]" -> [10300372] | J116: 1 | K116: 100 | L116: 1 | M116: 1 | N116: 主线 | P116: 1000 | AE116: 3 | AG116: ="回复<"&LEFT(VLOOKUP(RC[-32],'E:\mowen_game\int\piassets\common_cfg\xls\[summary.xml]task'!C4:C18,9,FALSE),LEN(VLOOKUP(RC[-32],'E:\mowen_game\int\piassets\common_cfg\xls\[summary.xml]task'!C4:C18,9,FALSE))-1)&"|arg="&RC[-26]&">" -> 回复<大魔导师|arg=10013052> | AH116: =""""&RC[-1]&"""" -> "回复<大魔导师|arg=10013052>" | AI116: 1 | AJ116: 2 | AK116: 0 | AL116: 0
A117: ='E:\mowen_game\int\piassets\common_cfg\xls\[summary.xml]task'!RC[3] -> 10300372 | B117: =VLOOKUP(RC[-1],'E:\mowen_game\int\piassets\common_cfg\xls\[summary.xml]task'!C4:C8,5,FALSE) -> 迫近结界1 | C117: =VLOOKUP(RC[-2],'E:\mowen_game\int\piassets\common_cfg\xls\[summary.xml]task'!C4:C5,2,FALSE) -> 探索区域 | D117: =VLOOKUP(RC[-3],'E:\mowen_game\int\piassets\common_cfg\xls\[summary.xml]task'!C4:C6,3,FALSE) -> 迫近结界 | E117: =VLOOKUP(RC[-4],'E:\mowen_game\int\piassets\common_cfg\xls\[summary.xml]task'!C4:C11,6,FALSE) -> 10300371 | F117: =VLOOKUP(RC[-5],'E:\mowen_game\int\piassets\common_cfg\xls\[summary.xml]task'!C4:C11,8,FALSE) -> 10013052 | H117: [{33,10300382,10300381},10301304] | J117: 1 | K117: 100 | L117: 1 | M117: 1 | N117: 主线 | P117: 1000 | AI117: 1 | AJ117: 2 | AK117: 0 | AL117: 10000
A118: ='E:\mowen_game\int\piassets\common_cfg\xls\[summary.xml]task'!RC[3] -> 10300373 | B118: =VLOOKUP(RC[-1],'E:\mowen_game\int\piassets\common_cfg\xls\[summary.xml]task'!C4:C8,5,FALSE) -> 击碎结界1 | C118: =VLOOKUP(RC[-2],'E:\mowen_game\int\piassets\common_cfg\xls\[summary.xml]task'!C4:C5,2,FALSE) -> 击杀npc | D118: =VLOOKUP(RC[-3],'E:\mowen_game\int\piassets\common_cfg\xls\[summary.xml]task'!C4:C6,3,FALSE) -> 击碎结界 | E118: =VLOOKUP(RC[-4],'E:\mowen_game\int\piassets\common_cfg\xls\[summary.xml]task'!C4:C11,6,FALSE) -> 10300372 | G118: =VLOOKUP(RC[-6],'E:\mowen_game\int\piassets\common_cfg\xls\[summary.xml]task'!C4:C13,10,FALSE) -> 10013053 | H118: [] | J118: 1 | K118: 100 | L118: 1 | M118: 1 | N118: 主线 | P118: 1000 | AE118: 2 | AG118: ="回复<"&LEFT(VLOOKUP(RC[-32],'E:\mowen_game\int\piassets\common_cfg\xls\[summary.xml]task'!C4:C18,9,FALSE),LEN(VLOOKUP(RC[-32],'E:\mowen_game\int\piassets\common_cfg\xls\[summary.xml]task'!C4:C18,9,FALSE))-1)&"|arg="&RC[-26]&">" -> 回复<大魔导师|arg=10013053> | AH118: =""""&RC[-1]&"""" -> "回复<大魔导师|arg=10013053>" | AI118: 1 | AJ118: 2 | AK118: 0 | AL118: 180000 | AN118: 1
A119: ='E:\mowen_game\int\piassets\common_cfg\xls\[summary.xml]task'!RC[3] -> 10300374 | B119: =VLOOKUP(RC[-1],'E:\mowen_game\int\piassets\common_cfg\xls\[summary.xml]task'!C4:C8,5,FALSE) -> 初露锋芒2 | C119: =VLOOKUP(RC[-2],'E:\mowen_game\int\piassets\common_cfg\xls\[summary.xml]task'!C4:C5,2,FALSE) -> 对话npc | D119: =VLOOKUP(RC[-3],'E:\mowen_game\int\piassets\common_cfg\xls\[summary.xml]task'!C4:C6,3,FALSE) -> 初露锋芒 | E119: =VLOOKUP(RC[-4],'E:\mowen_game\int\piassets\common_cfg\xls\[summary.xml]task'!C4:C11,6,FALSE) -> 10300360 | G119: =VLOOKUP(RC[-6],'E:\mowen_game\int\piassets\common_cfg\xls\[summary.xml]task'!C4:C13,10,FALSE) -> 10013049 | H119: [10300362] | J119: 1 | K119: 100 | L119: 1 | M119: 1 | N119: 主线 | P119: 1000 | AG119: ="回复<"&LEFT(VLOOKUP(RC[-32],'E:\mowen_game\int\piassets\common_cfg\xls\[summary.xml]task'!C4:C18,9,FALSE),LEN(VLOOKUP(RC[-32],'E:\mowen_game\int\piassets\common_cfg\xls\[summary.xml]task'!C4:C18,9,FALSE))-1)&"|arg="&RC[-26]&">" -> 回复<烈焰将军|arg=10013049> | AH119: =""""&RC[-1]&"""" -> "回复<烈焰将军|arg=10013049>" | AI119: 1 | AJ119: 2 | AK119: 0 | AL119: 100000
A120: ='E:\mowen_game\int\piassets\common_cfg\xls\[summary.xml]task'!RC[3] -> 10300375 | B120: =VLOOKUP(RC[-1],'E:\mowen_game\int\piassets\common_cfg\xls\[summary.xml]task'!C4:C8,5,FALSE) -> 初露锋芒4 | C120: =VLOOKUP(RC[-2],'E:\mowen_game\int\piassets\common_cfg\xls\[summary.xml]task'!C4:C5,2,FALSE) -> 对话npc | D120: =VLOOKUP(RC[-3],'E:\mowen_game\int\piassets\common_cfg\xls\[summary.xml]task'!C4:C6,3,FALSE) -> 初露锋芒 | E120: =VLOOKUP(RC[-4],'E:\mowen_game\int\piassets\common_cfg\xls\[summary.xml]task'!C4:C11,6,FALSE) -> 10300376 | G120: =VLOOKUP(RC[-6],'E:\mowen_game\int\piassets\common_cfg\xls\[summary.xml]task'!C4:C13,10,FALSE) -> 10013052 | H120: [10300369] | J120: 1 | K120: 100 | L120: 1 | M120: 1 | N120: 主线 | P120: 1000 | AG120: ="回复<"&LEFT(VLOOKUP(RC[-32],'E:\mowen_game\int\piassets\common_cfg\xls\[summary.xml]task'!C4:C18,9,FALSE),LEN(VLOOKUP(RC[-32],'E:\mowen_game\int\piassets\common_cfg\xls\[summary.xml]task'!C4:C18,9,FALSE))-1)&"|arg="&RC[-26]&">" -> 回复<大魔导师|arg=10013052> | AH120: =""""&RC[-1]&"""" -> "回复<大魔导师|arg=10013052>" | AI120: 1 | AJ120: 2 | AK120: 0 | AL120: 120000
A121: ='E:\mowen_game\int\piassets\common_cfg\xls\[summary.xml]task'!RC[3] -> 10300376 | B121: =VLOOKUP(RC[-1],'E:\mowen_game\int\piassets\common_cfg\xls\[summary.xml]task'!C4:C8,5,FALSE) -> 位面入侵1 | C121: =VLOOKUP(RC[-2],'E:\mowen_game\int\piassets\common_cfg\xls\[summary.xml]task'!C4:C5,2,FALSE) -> 对话npc | D121: =VLOOKUP(RC[-3],'E:\mowen_game\int\piassets\common_cfg\xls\[summary.xml]task'!C4:C6,3,FALSE) -> 位面入侵 | E121: =VLOOKUP(RC[-4],'E:\mowen_game\int\piassets\common_cfg\xls\[summary.xml]task'!C4:C11,6,FALSE) -> 10300367 | F121: =VLOOKUP(RC[-5],'E:\mowen_game\int\piassets\common_cfg\xls\[summary.xml]task'!C4:C11,8,FALSE) -> 10013052 | G121: =VLOOKUP(RC[-6],'E:\mowen_game\int\piassets\common_cfg\xls\[summary.xml]task'!C4:C13,10,FALSE) -> 10012395 | H121: [{29,10300375,10300368},10301303] | J121: 1 | K121: 100 | L121: 0 | M121: 0 | N121: 主线 | O121: 3001,{177,0,171} | P121: 1000 | AG121: ="回复<"&LEFT(VLOOKUP(RC[-32],'E:\mowen_game\int\piassets\common_cfg\xls\[summary.xml]task'!C4:C18,9,FALSE),LEN(VLOOKUP(RC[-32],'E:\mowen_game\int\piassets\common_cfg\xls\[summary.xml]task'!C4:C18,9,FALSE))-1)&"|arg="&RC[-26]&">" -> 回复<暴风战区传送官|arg=10012395> | AH121: =""""&RC[-1]&"""" -> "回复<暴风战区传送官|arg=10012395>" | AI121: 1 | AJ121: 2 | AK121: 0
A122: ='E:\mowen_game\int\piassets\common_cfg\xls\[summary.xml]task'!RC[3] -> 10300377 | B122: =VLOOKUP(RC[-1],'E:\mowen_game\int\piassets\common_cfg\xls\[summary.xml]task'!C4:C8,5,FALSE) -> 装备大师1 | C122: =VLOOKUP(RC[-2],'E:\mowen_game\int\piassets\common_cfg\xls\[summary.xml]task'!C4:C5,2,FALSE) -> 对话npc | D122: =VLOOKUP(RC[-3],'E:\mowen_game\int\piassets\common_cfg\xls\[summary.xml]task'!C4:C6,3,FALSE) -> 装备大师 | E122: =VLOOKUP(RC[-4],'E:\mowen_game\int\piassets\common_cfg\xls\[summary.xml]task'!C4:C11,6,FALSE) -> 10300355 | F122: =VLOOKUP(RC[-5],'E:\mowen_game\int\piassets\common_cfg\xls\[summary.xml]task'!C4:C11,8,FALSE) -> 10013043 | G122: =VLOOKUP(RC[-6],'E:\mowen_game\int\piassets\common_cfg\xls\[summary.xml]task'!C4:C13,10,FALSE) -> 10010051 | H122: [10300356,10301301] | J122: 1 | K122: 100 | L122: 1 | M122: 1 | N122: 主线 | P122: 1000 | AG122: ="回复<"&LEFT(VLOOKUP(RC[-32],'E:\mowen_game\int\piassets\common_cfg\xls\[summary.xml]task'!C4:C18,9,FALSE),LEN(VLOOKUP(RC[-32],'E:\mowen_game\int\piassets\common_cfg\xls\[summary.xml]task'!C4:C18,9,FALSE))-1)&"|arg="&RC[-26]&">" -> 回复<铁匠罗德|arg=10010051> | AH122: =""""&RC[-1]&"""" -> "回复<铁匠罗德|arg=10010051>" | AI122: 1 | AJ122: 2 | AK122: 0 | AL122: 0
A123: ='E:\mowen_game\int\piassets\common_cfg\xls\[summary.xml]task'!RC[3] -> 10301301 | B123: =VLOOKUP(RC[-1],'E:\mowen_game\int\piassets\common_cfg\xls\[summary.xml]task'!C4:C8,5,FALSE) -> 属性洗炼1 | C123: =VLOOKUP(RC[-2],'E:\mowen_game\int\piassets\common_cfg\xls\[summary.xml]task'!C4:C5,2,FALSE) -> 支线任务 | D123: =VLOOKUP(RC[-3],'E:\mowen_game\int\piassets\common_cfg\xls\[summary.xml]task'!C4:C6,3,FALSE) -> 属性洗炼 | E123: =VLOOKUP(RC[-4],'E:\mowen_game\int\piassets\common_cfg\xls\[summary.xml]task'!C4:C11,6,FALSE) -> 10300354 | F123: =VLOOKUP(RC[-5],'E:\mowen_game\int\piassets\common_cfg\xls\[summary.xml]task'!C4:C11,8,FALSE) -> 10013040 | G123: -1 | H123: [] | J123: 1 | K123: 100 | L123: 0 | M123: 0 | N123: 支线 | P123: 1000 | AG123: 领取<任务奖励|arg=submit_branch,type=openUI> | AH123: =""""&RC[-1]&"""" -> "领取<任务奖励|arg=submit_branch,type=openUI>" | AI123: 1 | AJ123: 1 | AK123: 0 | AL123: 80000
A124: ='E:\mowen_game\int\piassets\common_cfg\xls\[summary.xml]task'!RC[3] -> 10301302 | B124: =VLOOKUP(RC[-1],'E:\mowen_game\int\piassets\common_cfg\xls\[summary.xml]task'!C4:C8,5,FALSE) -> 魔界远征1 | C124: =VLOOKUP(RC[-2],'E:\mowen_game\int\piassets\common_cfg\xls\[summary.xml]task'!C4:C5,2,FALSE) -> 支线任务 | D124: =VLOOKUP(RC[-3],'E:\mowen_game\int\piassets\common_cfg\xls\[summary.xml]task'!C4:C6,3,FALSE) -> 魔界远征 | E124: =VLOOKUP(RC[-4],'E:\mowen_game\int\piassets\common_cfg\xls\[summary.xml]task'!C4:C11,6,FALSE) -> 10300360 | F124: =VLOOKUP(RC[-5],'E:\mowen_game\int\piassets\common_cfg\xls\[summary.xml]task'!C4:C11,8,FALSE) -> 10013049 | G124: -1 | H124: [] | J124: 1 | K124: 100 | L124: 0 | M124: 0 | N124: 支线 | P124: 1000 | AG124: 领取<任务奖励|arg=submit_branch,type=openUI> | AH124: =""""&RC[-1]&"""" -> "领取<任务奖励|arg=submit_branch,type=openUI>" | AI124: 1 | AJ124: 1 | AK124: 0 | AL124: 200000
A125: ='E:\mowen_game\int\piassets\common_cfg\xls\[summary.xml]task'!RC[3] -> 10301303 | B125: =VLOOKUP(RC[-1],'E:\mowen_game\int\piassets\common_cfg\xls\[summary.xml]task'!C4:C8,5,FALSE) -> 风暴战区1 | C125: =VLOOKUP(RC[-2],'E:\mowen_game\int\piassets\common_cfg\xls\[summary.xml]task'!C4:C5,2,FALSE) -> 支线任务 | D125: =VLOOKUP(RC[-3],'E:\mowen_game\int\piassets\common_cfg\xls\[summary.xml]task'!C4:C6,3,FALSE) -> 风暴战区 | E125: =VLOOKUP(RC[-4],'E:\mowen_game\int\piassets\common_cfg\xls\[summary.xml]task'!C4:C11,6,FALSE) -> 10300376 | F125: =VLOOKUP(RC[-5],'E:\mowen_game\int\piassets\common_cfg\xls\[summary.xml]task'!C4:C11,8,FALSE) -> 10012395 | G125: -1 | H125: [] | J125: 1 | K125: 100 | L125: 0 | M125: 0 | N125: 跨服 | P125: 1000 | AD125: 3 | AG125: 领取<任务奖励|arg=submit_branch,type=openUI> | AH125: =""""&RC[-1]&"""" -> "领取<任务奖励|arg=submit_branch,type=openUI>" | AI125: 1 | AJ125: 1 | AK125: 0 | AL125: 100000
A126: ='E:\mowen_game\int\piassets\common_cfg\xls\[summary.xml]task'!RC[3] -> 10301304 | B126: =VLOOKUP(RC[-1],'E:\mowen_game\int\piassets\common_cfg\xls\[summary.xml]task'!C4:C8,5,FALSE) -> 加入军团1 | C126: =VLOOKUP(RC[-2],'E:\mowen_game\int\piassets\common_cfg\xls\[summary.xml]task'!C4:C5,2,FALSE) -> 支线任务 | D126: =VLOOKUP(RC[-3],'E:\mowen_game\int\piassets\common_cfg\xls\[summary.xml]task'!C4:C6,3,FALSE) -> 加入军团 | E126: =VLOOKUP(RC[-4],'E:\mowen_game\int\piassets\common_cfg\xls\[summary.xml]task'!C4:C11,6,FALSE) -> 10300373 | F126: =VLOOKUP(RC[-5],'E:\mowen_game\int\piassets\common_cfg\xls\[summary.xml]task'!C4:C11,8,FALSE) -> 10013053 | G126: -1 | H126: [] | J126: 1 | K126: 100 | L126: 0 | M126: 0 | N126: 支线 | P126: 1000 | AG126: 领取<任务奖励|arg=submit_branch,type=openUI> | AH126: =""""&RC[-1]&"""" -> "领取<任务奖励|arg=submit_branch,type=openUI>" | AI126: 1 | AJ126: 1 | AK126: 0 | AL126: 10000
A127: ='E:\mowen_game\int\piassets\common_cfg\xls\[summary.xml]task'!RC[3] -> 10300381 | B127: =VLOOKUP(RC[-1],'E:\mowen_game\int\piassets\common_cfg\xls\[summary.xml]task'!C4:C8,5,FALSE) -> 小有所成1 | C127: =VLOOKUP(RC[-2],'E:\mowen_game\int\piassets\common_cfg\xls\[summary.xml]task'!C4:C5,2,FALSE) -> 提升等级 | D127: =VLOOKUP(RC[-3],'E:\mowen_game\int\piassets\common_cfg\xls\[summary.xml]task'!C4:C6,3,FALSE) -> 小有所成 | E127: =VLOOKUP(RC[-4],'E:\mowen_game\int\piassets\common_cfg\xls\[summary.xml]task'!C4:C11,6,FALSE) -> 10300373 | G127: =VLOOKUP(RC[-6],'E:\mowen_game\int\piassets\common_cfg\xls\[summary.xml]task'!C4:C13,10,FALSE) -> 10013052 | H127: [10300383] | J127: 1 | K127: 100 | L127: 0 | M127: 0 | N127: 主线 | P127: 1000 | AE127: 5 | AG127: ="回复<"&LEFT(VLOOKUP(RC[-32],'E:\mowen_game\int\piassets\common_cfg\xls\[summary.xml]task'!C4:C18,9,FALSE),LEN(VLOOKUP(RC[-32],'E:\mowen_game\int\piassets\common_cfg\xls\[summary.xml]task'!C4:C18,9,FALSE))-1)&"|arg="&RC[-26]&">" -> 回复<大魔导师|arg=10013052> | AH127: =""""&RC[-1]&"""" -> "回复<大魔导师|arg=10013052>" | AI127: 1 | AJ127: 2 | AK127: 0 | AL127: 50000
A128: ='E:\mowen_game\int\piassets\common_cfg\xls\[summary.xml]task'!RC[3] -> 10300382 | B128: =VLOOKUP(RC[-1],'E:\mowen_game\int\piassets\common_cfg\xls\[summary.xml]task'!C4:C8,5,FALSE) -> 小有所成2 | C128: =VLOOKUP(RC[-2],'E:\mowen_game\int\piassets\common_cfg\xls\[summary.xml]task'!C4:C5,2,FALSE) -> 对话npc | D128: =VLOOKUP(RC[-3],'E:\mowen_game\int\piassets\common_cfg\xls\[summary.xml]task'!C4:C6,3,FALSE) -> 小有所成 | E128: =VLOOKUP(RC[-4],'E:\mowen_game\int\piassets\common_cfg\xls\[summary.xml]task'!C4:C11,6,FALSE) -> 10300373 | G128: =VLOOKUP(RC[-6],'E:\mowen_game\int\piassets\common_cfg\xls\[summary.xml]task'!C4:C13,10,FALSE) -> 10013052 | H128: [10300383] | J128: 1 | K128: 100 | L128: 1 | M128: 1 | N128: 主线 | P128: 1000 | AG128: ="回复<"&LEFT(VLOOKUP(RC[-32],'E:\mowen_game\int\piassets\common_cfg\xls\[summary.xml]task'!C4:C18,9,FALSE),LEN(VLOOKUP(RC[-32],'E:\mowen_game\int\piassets\common_cfg\xls\[summary.xml]task'!C4:C18,9,FALSE))-1)&"|arg="&RC[-26]&">" -> 回复<大魔导师|arg=10013052> | AH128: =""""&RC[-1]&"""" -> "回复<大魔导师|arg=10013052>" | AI128: 1 | AJ128: 2 | AK128: 0 | AL128: 0
A129: ='E:\mowen_game\int\piassets\common_cfg\xls\[summary.xml]task'!RC[3] -> 10300383 | B129: =VLOOKUP(RC[-1],'E:\mowen_game\int\piassets\common_cfg\xls\[summary.xml]task'!C4:C8,5,FALSE) -> 通风报信1 | C129: =VLOOKUP(RC[-2],'E:\mowen_game\int\piassets\common_cfg\xls\[summary.xml]task'!C4:C5,2,FALSE) -> 对话npc | D129: =VLOOKUP(RC[-3],'E:\mowen_game\int\piassets\common_cfg\xls\[summary.xml]task'!C4:C6,3,FALSE) -> 通风报信 | E129: =VLOOKUP(RC[-4],'E:\mowen_game\int\piassets\common_cfg\xls\[summary.xml]task'!C4:C11,6,FALSE) -> 10300381 | F129: =VLOOKUP(RC[-5],'E:\mowen_game\int\piassets\common_cfg\xls\[summary.xml]task'!C4:C11,8,FALSE) -> 10013053 | G129: =VLOOKUP(RC[-6],'E:\mowen_game\int\piassets\common_cfg\xls\[summary.xml]task'!C4:C13,10,FALSE) -> 10013061 | H129: [{34,10300385,10300384},10301305] | J129: 1 | K129: 100 | L129: 1 | M129: 1 | N129: 主线 | P129: 1000 | AG129: ="回复<"&LEFT(VLOOKUP(RC[-32],'E:\mowen_game\int\piassets\common_cfg\xls\[summary.xml]task'!C4:C18,9,FALSE),LEN(VLOOKUP(RC[-32],'E:\mowen_game\int\piassets\common_cfg\xls\[summary.xml]task'!C4:C18,9,FALSE))-1)&"|arg="&RC[-26]&">" -> 回复<奥莉拉|arg=10013061> | AH129: =""""&RC[-1]&"""" -> "回复<奥莉拉|arg=10013061>" | AI129: 1 | AJ129: 2 | AK129: 0 | AL129: 0
A130: ='E:\mowen_game\int\piassets\common_cfg\xls\[summary.xml]task'!RC[3] -> 10300384 | B130: =VLOOKUP(RC[-1],'E:\mowen_game\int\piassets\common_cfg\xls\[summary.xml]task'!C4:C8,5,FALSE) -> 小有所成3 | C130: =VLOOKUP(RC[-2],'E:\mowen_game\int\piassets\common_cfg\xls\[summary.xml]task'!C4:C5,2,FALSE) -> 提升等级 | D130: =VLOOKUP(RC[-3],'E:\mowen_game\int\piassets\common_cfg\xls\[summary.xml]task'!C4:C6,3,FALSE) -> 小有所成 | E130: =VLOOKUP(RC[-4],'E:\mowen_game\int\piassets\common_cfg\xls\[summary.xml]task'!C4:C11,6,FALSE) -> 10300383 | G130: =VLOOKUP(RC[-6],'E:\mowen_game\int\piassets\common_cfg\xls\[summary.xml]task'!C4:C13,10,FALSE) -> 10013061 | H130: [10300386] | J130: 1 | K130: 100 | L130: 0 | M130: 0 | N130: 主线 | P130: 1000 | AE130: 2 | AG130: ="回复<"&LEFT(VLOOKUP(RC[-32],'E:\mowen_game\int\piassets\common_cfg\xls\[summary.xml]task'!C4:C18,9,FALSE),LEN(VLOOKUP(RC[-32],'E:\mowen_game\int\piassets\common_cfg\xls\[summary.xml]task'!C4:C18,9,FALSE))-1)&"|arg="&RC[-26]&">" -> 回复<奥莉拉|arg=10013061> | AH130: =""""&RC[-1]&"""" -> "回复<奥莉拉|arg=10013061>" | AI130: 1 | AJ130: 2 | AK130: 0 | AL130: 80000
A131: ='E:\mowen_game\int\piassets\common_cfg\xls\[summary.xml]task'!RC[3] -> 10300385 | B131: =VLOOKUP(RC[-1],'E:\mowen_game\int\piassets\common_cfg\xls\[summary.xml]task'!C4:C8,5,FALSE) -> 小有所成4 | C131: =VLOOKUP(RC[-2],'E:\mowen_game\int\piassets\common_cfg\xls\[summary.xml]task'!C4:C5,2,FALSE) -> 对话npc | D131: =VLOOKUP(RC[-3],'E:\mowen_game\int\piassets\common_cfg\xls\[summary.xml]task'!C4:C6,3,FALSE) -> 小有所成 | E131: =VLOOKUP(RC[-4],'E:\mowen_game\int\piassets\common_cfg\xls\[summary.xml]task'!C4:C11,6,FALSE) -> 10300383 | G131: =VLOOKUP(RC[-6],'E:\mowen_game\int\piassets\common_cfg\xls\[summary.xml]task'!C4:C13,10,FALSE) -> 10013061 | H131: [10300386] | J131: 1 | K131: 100 | L131: 1 | M131: 1 | N131: 主线 | P131: 1000 | AG131: ="回复<"&LEFT(VLOOKUP(RC[-32],'E:\mowen_game\int\piassets\common_cfg\xls\[summary.xml]task'!C4:C18,9,FALSE),LEN(VLOOKUP(RC[-32],'E:\mowen_game\int\piassets\common_cfg\xls\[summary.xml]task'!C4:C18,9,FALSE))-1)&"|arg="&RC[-26]&">" -> 回复<奥莉拉|arg=10013061> | AH131: =""""&RC[-1]&"""" -> "回复<奥莉拉|arg=10013061>" | AI131: 1 | AJ131: 2 | AK131: 0 | AL131: 80000
A132: ='E:\mowen_game\int\piassets\common_cfg\xls\[summary.xml]task'!RC[3] -> 10300386 | B132: =VLOOKUP(RC[-1],'E:\mowen_game\int\piassets\common_cfg\xls\[summary.xml]task'!C4:C8,5,FALSE) -> 平原危机1 | C132: =VLOOKUP(RC[-2],'E:\mowen_game\int\piassets\common_cfg\xls\[summary.xml]task'!C4:C5,2,FALSE) -> 对话npc | D132: =VLOOKUP(RC[-3],'E:\mowen_game\int\piassets\common_cfg\xls\[summary.xml]task'!C4:C6,3,FALSE) -> 平原危机 | E132: =VLOOKUP(RC[-4],'E:\mowen_game\int\piassets\common_cfg\xls\[summary.xml]task'!C4:C11,6,FALSE) -> 10300384 | F132: =VLOOKUP(RC[-5],'E:\mowen_game\int\piassets\common_cfg\xls\[summary.xml]task'!C4:C11,8,FALSE) -> 10013061 | G132: =VLOOKUP(RC[-6],'E:\mowen_game\int\piassets\common_cfg\xls\[summary.xml]task'!C4:C13,10,FALSE) -> 10013062 | H132: [{40,10300388,10300387},10301306] | J132: 1 | K132: 100 | L132: 1 | M132: 1 | N132: 主线 | P132: 1000 | AG132: ="回复<"&LEFT(VLOOKUP(RC[-32],'E:\mowen_game\int\piassets\common_cfg\xls\[summary.xml]task'!C4:C18,9,FALSE),LEN(VLOOKUP(RC[-32],'E:\mowen_game\int\piassets\common_cfg\xls\[summary.xml]task'!C4:C18,9,FALSE))-1)&"|arg="&RC[-26]&">" -> 回复<大祭司|arg=10013062> | AH132: =""""&RC[-1]&"""" -> "回复<大祭司|arg=10013062>" | AI132: 1 | AJ132: 2 | AK132: 0 | AL132: 0
A133: ='E:\mowen_game\int\piassets\common_cfg\xls\[summary.xml]task'!RC[3] -> 10300387 | B133: =VLOOKUP(RC[-1],'E:\mowen_game\int\piassets\common_cfg\xls\[summary.xml]task'!C4:C8,5,FALSE) -> 登堂入室1 | C133: =VLOOKUP(RC[-2],'E:\mowen_game\int\piassets\common_cfg\xls\[summary.xml]task'!C4:C5,2,FALSE) -> 提升等级 | D133: =VLOOKUP(RC[-3],'E:\mowen_game\int\piassets\common_cfg\xls\[summary.xml]task'!C4:C6,3,FALSE) -> 登堂入室 | E133: =VLOOKUP(RC[-4],'E:\mowen_game\int\piassets\common_cfg\xls\[summary.xml]task'!C4:C11,6,FALSE) -> 10300386 | G133: =VLOOKUP(RC[-6],'E:\mowen_game\int\piassets\common_cfg\xls\[summary.xml]task'!C4:C13,10,FALSE) -> 10013062 | H133: [10300389] | J133: 1 | K133: 100 | L133: 0 | M133: 0 | N133: 主线 | P133: 1000 | AE133: 2 | AG133: ="回复<"&LEFT(VLOOKUP(RC[-32],'E:\mowen_game\int\piassets\common_cfg\xls\[summary.xml]task'!C4:C18,9,FALSE),LEN(VLOOKUP(RC[-32],'E:\mowen_game\int\piassets\common_cfg\xls\[summary.xml]task'!C4:C18,9,FALSE))-1)&"|arg="&RC[-26]&">" -> 回复<大祭司|arg=10013062> | AH133: =""""&RC[-1]&"""" -> "回复<大祭司|arg=10013062>" | AI133: 1 | AJ133: 2 | AK133: 0 | AL133: 100000
A134: ='E:\mowen_game\int\piassets\common_cfg\xls\[summary.xml]task'!RC[3] -> 10300388 | B134: =VLOOKUP(RC[-1],'E:\mowen_game\int\piassets\common_cfg\xls\[summary.xml]task'!C4:C8,5,FALSE) -> 登堂入室2 | C134: =VLOOKUP(RC[-2],'E:\mowen_game\int\piassets\common_cfg\xls\[summary.xml]task'!C4:C5,2,FALSE) -> 对话npc | D134: =VLOOKUP(RC[-3],'E:\mowen_game\int\piassets\common_cfg\xls\[summary.xml]task'!C4:C6,3,FALSE) -> 登堂入室 | E134: =VLOOKUP(RC[-4],'E:\mowen_game\int\piassets\common_cfg\xls\[summary.xml]task'!C4:C11,6,FALSE) -> 10300386 | G134: =VLOOKUP(RC[-6],'E:\mowen_game\int\piassets\common_cfg\xls\[summary.xml]task'!C4:C13,10,FALSE) -> 10013062 | H134: [10300389] | J134: 1 | K134: 100 | L134: 1 | M134: 1 | N134: 主线 | P134: 1000 | AG134: ="回复<"&LEFT(VLOOKUP(RC[-32],'E:\mowen_game\int\piassets\common_cfg\xls\[summary.xml]task'!C4:C18,9,FALSE),LEN(VLOOKUP(RC[-32],'E:\mowen_game\int\piassets\common_cfg\xls\[summary.xml]task'!C4:C18,9,FALSE))-1)&"|arg="&RC[-26]&">" -> 回复<大祭司|arg=10013062> | AH134: =""""&RC[-1]&"""" -> "回复<大祭司|arg=10013062>" | AI134: 1 | AJ134: 2 | AK134: 0 | AL134: 100000
A135: ='E:\mowen_game\int\piassets\common_cfg\xls\[summary.xml]task'!RC[3] -> 10300389 | B135: =VLOOKUP(RC[-1],'E:\mowen_game\int\piassets\common_cfg\xls\[summary.xml]task'!C4:C8,5,FALSE) -> 故人相见1 | C135: =VLOOKUP(RC[-2],'E:\mowen_game\int\piassets\common_cfg\xls\[summary.xml]task'!C4:C5,2,FALSE) -> 对话npc | D135: =VLOOKUP(RC[-3],'E:\mowen_game\int\piassets\common_cfg\xls\[summary.xml]task'!C4:C6,3,FALSE) -> 故人相见 | E135: =VLOOKUP(RC[-4],'E:\mowen_game\int\piassets\common_cfg\xls\[summary.xml]task'!C4:C11,6,FALSE) -> 10300387 | F135: =VLOOKUP(RC[-5],'E:\mowen_game\int\piassets\common_cfg\xls\[summary.xml]task'!C4:C11,8,FALSE) -> 10013062 | G135: =VLOOKUP(RC[-6],'E:\mowen_game\int\piassets\common_cfg\xls\[summary.xml]task'!C4:C13,10,FALSE) -> 10013063 | H135: [{50,10300391,10300390},10301307] | J135: 1 | K135: 100 | L135: 1 | M135: 1 | N135: 主线 | P135: 1000 | AG135: ="回复<"&LEFT(VLOOKUP(RC[-32],'E:\mowen_game\int\piassets\common_cfg\xls\[summary.xml]task'!C4:C18,9,FALSE),LEN(VLOOKUP(RC[-32],'E:\mowen_game\int\piassets\common_cfg\xls\[summary.xml]task'!C4:C18,9,FALSE))-1)&"|arg="&RC[-26]&">" -> 回复<哥布林村长|arg=10013063> | AH135: =""""&RC[-1]&"""" -> "回复<哥布林村长|arg=10013063>" | AI135: 1 | AJ135: 2 | AK135: 0 | AL135: 0
A136: ='E:\mowen_game\int\piassets\common_cfg\xls\[summary.xml]task'!RC[3] -> 10300390 | B136: =VLOOKUP(RC[-1],'E:\mowen_game\int\piassets\common_cfg\xls\[summary.xml]task'!C4:C8,5,FALSE) -> 登堂入室3 | C136: =VLOOKUP(RC[-2],'E:\mowen_game\int\piassets\common_cfg\xls\[summary.xml]task'!C4:C5,2,FALSE) -> 提升等级 | D136: =VLOOKUP(RC[-3],'E:\mowen_game\int\piassets\common_cfg\xls\[summary.xml]task'!C4:C6,3,FALSE) -> 登堂入室 | E136: =VLOOKUP(RC[-4],'E:\mowen_game\int\piassets\common_cfg\xls\[summary.xml]task'!C4:C11,6,FALSE) -> 10300389 | G136: =VLOOKUP(RC[-6],'E:\mowen_game\int\piassets\common_cfg\xls\[summary.xml]task'!C4:C13,10,FALSE) -> 10013063 | H136: [10300392] | J136: 1 | K136: 100 | L136: 0 | M136: 0 | N136: 主线 | P136: 1000 | AE136: 2 | AG136: ="回复<"&LEFT(VLOOKUP(RC[-32],'E:\mowen_game\int\piassets\common_cfg\xls\[summary.xml]task'!C4:C18,9,FALSE),LEN(VLOOKUP(RC[-32],'E:\mowen_game\int\piassets\common_cfg\xls\[summary.xml]task'!C4:C18,9,FALSE))-1)&"|arg="&RC[-26]&">" -> 回复<哥布林村长|arg=10013063> | AH136: =""""&RC[-1]&"""" -> "回复<哥布林村长|arg=10013063>" | AI136: 1 | AJ136: 2 | AK136: 0 | AL136: 150000
A137: ='E:\mowen_game\int\piassets\common_cfg\xls\[summary.xml]task'!RC[3] -> 10300391 | B137: =VLOOKUP(RC[-1],'E:\mowen_game\int\piassets\common_cfg\xls\[summary.xml]task'!C4:C8,5,FALSE) -> 登堂入室4 | C137: =VLOOKUP(RC[-2],'E:\mowen_game\int\piassets\common_cfg\xls\[summary.xml]task'!C4:C5,2,FALSE) -> 对话npc | D137: =VLOOKUP(RC[-3],'E:\mowen_game\int\piassets\common_cfg\xls\[summary.xml]task'!C4:C6,3,FALSE) -> 登堂入室 | E137: =VLOOKUP(RC[-4],'E:\mowen_game\int\piassets\common_cfg\xls\[summary.xml]task'!C4:C11,6,FALSE) -> 10300389 | G137: =VLOOKUP(RC[-6],'E:\mowen_game\int\piassets\common_cfg\xls\[summary.xml]task'!C4:C13,10,FALSE) -> 10013063 | H137: [10300392] | J137: 1 | K137: 100 | L137: 1 | M137: 1 | N137: 主线 | P137: 1000 | AG137: ="回复<"&LEFT(VLOOKUP(RC[-32],'E:\mowen_game\int\piassets\common_cfg\xls\[summary.xml]task'!C4:C18,9,FALSE),LEN(VLOOKUP(RC[-32],'E:\mowen_game\int\piassets\common_cfg\xls\[summary.xml]task'!C4:C18,9,FALSE))-1)&"|arg="&RC[-26]&">" -> 回复<哥布林村长|arg=10013063> | AH137: =""""&RC[-1]&"""" -> "回复<哥布林村长|arg=10013063>" | AI137: 1 | AJ137: 2 | AK137: 0 | AL137: 150000
A138: ='E:\mowen_game\int\piassets\common_cfg\xls\[summary.xml]task'!RC[3] -> 10300392 | B138: =VLOOKUP(RC[-1],'E:\mowen_game\int\piassets\common_cfg\xls\[summary.xml]task'!C4:C8,5,FALSE) -> 精灵公主1 | C138: =VLOOKUP(RC[-2],'E:\mowen_game\int\piassets\common_cfg\xls\[summary.xml]task'!C4:C5,2,FALSE) -> 对话npc | D138: =VLOOKUP(RC[-3],'E:\mowen_game\int\piassets\common_cfg\xls\[summary.xml]task'!C4:C6,3,FALSE) -> 精灵公主 | E138: =VLOOKUP(RC[-4],'E:\mowen_game\int\piassets\common_cfg\xls\[summary.xml]task'!C4:C11,6,FALSE) -> 10300390 | F138: =VLOOKUP(RC[-5],'E:\mowen_game\int\piassets\common_cfg\xls\[summary.xml]task'!C4:C11,8,FALSE) -> 10013063 | G138: =VLOOKUP(RC[-6],'E:\mowen_game\int\piassets\common_cfg\xls\[summary.xml]task'!C4:C13,10,FALSE) -> 10013065 | H138: [{55,10300394,10300393},10301308] | J138: 1 | K138: 100 | L138: 1 | M138: 1 | N138: 主线 | P138: 1000 | AG138: ="回复<"&LEFT(VLOOKUP(RC[-32],'E:\mowen_game\int\piassets\common_cfg\xls\[summary.xml]task'!C4:C18,9,FALSE),LEN(VLOOKUP(RC[-32],'E:\mowen_game\int\piassets\common_cfg\xls\[summary.xml]task'!C4:C18,9,FALSE))-1)&"|arg="&RC[-26]&">" -> 回复<精灵公主|arg=10013065> | AH138: =""""&RC[-1]&"""" -> "回复<精灵公主|arg=10013065>" | AI138: 1 | AJ138: 2 | AK138: 0 | AL138: 0
A139: ='E:\mowen_game\int\piassets\common_cfg\xls\[summary.xml]task'!RC[3] -> 10300393 | B139: =VLOOKUP(RC[-1],'E:\mowen_game\int\piassets\common_cfg\xls\[summary.xml]task'!C4:C8,5,FALSE) -> 威震四方1 | C139: =VLOOKUP(RC[-2],'E:\mowen_game\int\piassets\common_cfg\xls\[summary.xml]task'!C4:C5,2,FALSE) -> 提升等级 | D139: =VLOOKUP(RC[-3],'E:\mowen_game\int\piassets\common_cfg\xls\[summary.xml]task'!C4:C6,3,FALSE) -> 威震四方 | E139: =VLOOKUP(RC[-4],'E:\mowen_game\int\piassets\common_cfg\xls\[summary.xml]task'!C4:C11,6,FALSE) -> 10300392 | G139: =VLOOKUP(RC[-6],'E:\mowen_game\int\piassets\common_cfg\xls\[summary.xml]task'!C4:C13,10,FALSE) -> 10013065 | H139: [10300395] | J139: 1 | K139: 100 | L139: 0 | M139: 0 | N139: 主线 | P139: 1000 | AE139: 2 | AG139: ="回复<"&LEFT(VLOOKUP(RC[-32],'E:\mowen_game\int\piassets\common_cfg\xls\[summary.xml]task'!C4:C18,9,FALSE),LEN(VLOOKUP(RC[-32],'E:\mowen_game\int\piassets\common_cfg\xls\[summary.xml]task'!C4:C18,9,FALSE))-1)&"|arg="&RC[-26]&">" -> 回复<精灵公主|arg=10013065> | AH139: =""""&RC[-1]&"""" -> "回复<精灵公主|arg=10013065>" | AI139: 1 | AJ139: 2 | AK139: 0 | AL139: 200000
A140: ='E:\mowen_game\int\piassets\common_cfg\xls\[summary.xml]task'!RC[3] -> 10300394 | B140: =VLOOKUP(RC[-1],'E:\mowen_game\int\piassets\common_cfg\xls\[summary.xml]task'!C4:C8,5,FALSE) -> 威震四方2 | C140: =VLOOKUP(RC[-2],'E:\mowen_game\int\piassets\common_cfg\xls\[summary.xml]task'!C4:C5,2,FALSE) -> 对话npc | D140: =VLOOKUP(RC[-3],'E:\mowen_game\int\piassets\common_cfg\xls\[summary.xml]task'!C4:C6,3,FALSE) -> 威震四方 | E140: =VLOOKUP(RC[-4],'E:\mowen_game\int\piassets\common_cfg\xls\[summary.xml]task'!C4:C11,6,FALSE) -> 10300392 | G140: =VLOOKUP(RC[-6],'E:\mowen_game\int\piassets\common_cfg\xls\[summary.xml]task'!C4:C13,10,FALSE) -> 10013065 | H140: [10300395] | J140: 1 | K140: 100 | L140: 1 | M140: 1 | N140: 主线 | P140: 1000 | AG140: ="回复<"&LEFT(VLOOKUP(RC[-32],'E:\mowen_game\int\piassets\common_cfg\xls\[summary.xml]task'!C4:C18,9,FALSE),LEN(VLOOKUP(RC[-32],'E:\mowen_game\int\piassets\common_cfg\xls\[summary.xml]task'!C4:C18,9,FALSE))-1)&"|arg="&RC[-26]&">" -> 回复<精灵公主|arg=10013065> | AH140: =""""&RC[-1]&"""" -> "回复<精灵公主|arg=10013065>" | AI140: 1 | AJ140: 2 | AK140: 0 | AL140: 200000
A141: ='E:\mowen_game\int\piassets\common_cfg\xls\[summary.xml]task'!RC[3] -> 10300395 | B141: =VLOOKUP(RC[-1],'E:\mowen_game\int\piassets\common_cfg\xls\[summary.xml]task'!C4:C8,5,FALSE) -> 沙海危机1 | C141: =VLOOKUP(RC[-2],'E:\mowen_game\int\piassets\common_cfg\xls\[summary.xml]task'!C4:C5,2,FALSE) -> 对话npc | D141: =VLOOKUP(RC[-3],'E:\mowen_game\int\piassets\common_cfg\xls\[summary.xml]task'!C4:C6,3,FALSE) -> 沙海危机 | E141: =VLOOKUP(RC[-4],'E:\mowen_game\int\piassets\common_cfg\xls\[summary.xml]task'!C4:C11,6,FALSE) -> 10300393 | F141: =VLOOKUP(RC[-5],'E:\mowen_game\int\piassets\common_cfg\xls\[summary.xml]task'!C4:C11,8,FALSE) -> 10013065 | G141: =VLOOKUP(RC[-6],'E:\mowen_game\int\piassets\common_cfg\xls\[summary.xml]task'!C4:C13,10,FALSE) -> 10013064 | H141: [10301309] | J141: 1 | K141: 100 | L141: 1 | M141: 1 | N141: 主线 | P141: 1000 | AG141: ="回复<"&LEFT(VLOOKUP(RC[-32],'E:\mowen_game\int\piassets\common_cfg\xls\[summary.xml]task'!C4:C18,9,FALSE),LEN(VLOOKUP(RC[-32],'E:\mowen_game\int\piassets\common_cfg\xls\[summary.xml]task'!C4:C18,9,FALSE))-1)&"|arg="&RC[-26]&">" -> 回复<侍女林奈|arg=10013064> | AH141: =""""&RC[-1]&"""" -> "回复<侍女林奈|arg=10013064>" | AI141: 1 | AJ141: 2 | AK141: 0 | AL141: 0
A142: ='E:\mowen_game\int\piassets\common_cfg\xls\[summary.xml]task'!RC[3] -> 10301305 | B142: =VLOOKUP(RC[-1],'E:\mowen_game\int\piassets\common_cfg\xls\[summary.xml]task'!C4:C8,5,FALSE) -> 领主试炼1 | C142: =VLOOKUP(RC[-2],'E:\mowen_game\int\piassets\common_cfg\xls\[summary.xml]task'!C4:C5,2,FALSE) -> 支线任务 | D142: =VLOOKUP(RC[-3],'E:\mowen_game\int\piassets\common_cfg\xls\[summary.xml]task'!C4:C6,3,FALSE) -> 领主试炼 | E142: =VLOOKUP(RC[-4],'E:\mowen_game\int\piassets\common_cfg\xls\[summary.xml]task'!C4:C11,6,FALSE) -> 10300383 | F142: =VLOOKUP(RC[-5],'E:\mowen_game\int\piassets\common_cfg\xls\[summary.xml]task'!C4:C11,8,FALSE) -> 10013061 | G142: -1 | H142: [] | J142: 1 | K142: 100 | L142: 0 | M142: 0 | N142: 支线 | P142: 1000 | AG142: 领取<任务奖励|arg=submit_branch,type=openUI> | AH142: =""""&RC[-1]&"""" -> "领取<任务奖励|arg=submit_branch,type=openUI>" | AI142: 1 | AJ142: 1 | AK142: 0 | AL142: 80000
A143: ='E:\mowen_game\int\piassets\common_cfg\xls\[summary.xml]task'!RC[3] -> 10301306 | B143: =VLOOKUP(RC[-1],'E:\mowen_game\int\piassets\common_cfg\xls\[summary.xml]task'!C4:C8,5,FALSE) -> 活跃达人1 | C143: =VLOOKUP(RC[-2],'E:\mowen_game\int\piassets\common_cfg\xls\[summary.xml]task'!C4:C5,2,FALSE) -> 支线任务 | D143: =VLOOKUP(RC[-3],'E:\mowen_game\int\piassets\common_cfg\xls\[summary.xml]task'!C4:C6,3,FALSE) -> 活跃达人 | E143: =VLOOKUP(RC[-4],'E:\mowen_game\int\piassets\common_cfg\xls\[summary.xml]task'!C4:C11,6,FALSE) -> 10300386 | F143: =VLOOKUP(RC[-5],'E:\mowen_game\int\piassets\common_cfg\xls\[summary.xml]task'!C4:C11,8,FALSE) -> 10013062 | G143: -1 | H143: [] | J143: 1 | K143: 100 | L143: 0 | M143: 0 | N143: 支线 | P143: 1000 | AG143: 领取<任务奖励|arg=submit_branch,type=openUI> | AH143: =""""&RC[-1]&"""" -> "领取<任务奖励|arg=submit_branch,type=openUI>" | AI143: 1 | AJ143: 1 | AK143: 0 | AL143: 80000
A144: ='E:\mowen_game\int\piassets\common_cfg\xls\[summary.xml]task'!RC[3] -> 10301307 | B144: =VLOOKUP(RC[-1],'E:\mowen_game\int\piassets\common_cfg\xls\[summary.xml]task'!C4:C8,5,FALSE) -> 装备升星1 | C144: =VLOOKUP(RC[-2],'E:\mowen_game\int\piassets\common_cfg\xls\[summary.xml]task'!C4:C5,2,FALSE) -> 支线任务 | D144: =VLOOKUP(RC[-3],'E:\mowen_game\int\piassets\common_cfg\xls\[summary.xml]task'!C4:C6,3,FALSE) -> 装备升星 | E144: =VLOOKUP(RC[-4],'E:\mowen_game\int\piassets\common_cfg\xls\[summary.xml]task'!C4:C11,6,FALSE) -> 10300389 | F144: =VLOOKUP(RC[-5],'E:\mowen_game\int\piassets\common_cfg\xls\[summary.xml]task'!C4:C11,8,FALSE) -> 10013063 | G144: -1 | H144: [] | J144: 1 | K144: 100 | L144: 0 | M144: 0 | N144: 支线 | P144: 1000 | AG144: 领取<任务奖励|arg=submit_branch,type=openUI> | AH144: =""""&RC[-1]&"""" -> "领取<任务奖励|arg=submit_branch,type=openUI>" | AI144: 1 | AJ144: 1 | AK144: 0 | AL144: 100000
A145: ='E:\mowen_game\int\piassets\common_cfg\xls\[summary.xml]task'!RC[3] -> 10301308 | B145: =VLOOKUP(RC[-1],'E:\mowen_game\int\piassets\common_cfg\xls\[summary.xml]task'!C4:C8,5,FALSE) -> 宝石镶嵌1 | C145: =VLOOKUP(RC[-2],'E:\mowen_game\int\piassets\common_cfg\xls\[summary.xml]task'!C4:C5,2,FALSE) -> 支线任务 | D145: =VLOOKUP(RC[-3],'E:\mowen_game\int\piassets\common_cfg\xls\[summary.xml]task'!C4:C6,3,FALSE) -> 宝石镶嵌 | E145: =VLOOKUP(RC[-4],'E:\mowen_game\int\piassets\common_cfg\xls\[summary.xml]task'!C4:C11,6,FALSE) -> 10300392 | F145: =VLOOKUP(RC[-5],'E:\mowen_game\int\piassets\common_cfg\xls\[summary.xml]task'!C4:C11,8,FALSE) -> 10013065 | G145: -1 | H145: [] | J145: 1 | K145: 100 | L145: 0 | M145: 0 | N145: 支线 | P145: 1000 | AG145: 领取<任务奖励|arg=submit_branch,type=openUI> | AH145: =""""&RC[-1]&"""" -> "领取<任务奖励|arg=submit_branch,type=openUI>" | AI145: 1 | AJ145: 1 | AK145: 0 | AL145: 150000
A146: ='E:\mowen_game\int\piassets\common_cfg\xls\[summary.xml]task'!RC[3] -> 10301309 | B146: =VLOOKUP(RC[-1],'E:\mowen_game\int\piassets\common_cfg\xls\[summary.xml]task'!C4:C8,5,FALSE) -> 战魂镶嵌1 | C146: =VLOOKUP(RC[-2],'E:\mowen_game\int\piassets\common_cfg\xls\[summary.xml]task'!C4:C5,2,FALSE) -> 支线任务 | D146: =VLOOKUP(RC[-3],'E:\mowen_game\int\piassets\common_cfg\xls\[summary.xml]task'!C4:C6,3,FALSE) -> 战魂镶嵌 | E146: =VLOOKUP(RC[-4],'E:\mowen_game\int\piassets\common_cfg\xls\[summary.xml]task'!C4:C11,6,FALSE) -> 10300395 | F146: =VLOOKUP(RC[-5],'E:\mowen_game\int\piassets\common_cfg\xls\[summary.xml]task'!C4:C11,8,FALSE) -> 10013064 | G146: -1 | H146: [] | J146: 1 | K146: 100 | L146: 0 | M146: 0 | N146: 支线 | P146: 1000 | AG146: 领取<任务奖励|arg=submit_branch,type=openUI> | AH146: =""""&RC[-1]&"""" -> "领取<任务奖励|arg=submit_branch,type=openUI>" | AI146: 1 | AJ146: 1 | AK146: 0 | AL146: 200000

Sheet: success_condition
A1: 任务编号 | B1: 条件类型 | C1: 需找的NPC | D1: NPC编号 | E1: NPC数量 | F1: 区域 | G1: 物品 | H1: 物品ID | I1: 概率 | J1: 对话NPC | K1: 对话NPC编号 | L1: 对话内容 | M1: 对应目标辅助列 | N1: 对应目标
A2: sid | B2: type | D2: v1 | E2: v2 | F2: area | H2: v3 | I2: v4 | K2: talknpc | L2: dialog | N2: demand
A3: =task!R[1]C -> 10300302 | B3: 完成副本 | E3: 30001 | F3: {3000,{{23,177},{4,4}}} | H3: 10300338 | M3: 巡视 | N3: 巡视<雪山脚下|arg=1212200>
A4: =task!R[1]C -> 10300303 | B4: =VLOOKUP(RC[-1],'E:\mowen_game\int\piassets\common_cfg\xls\[summary.xml]task'!R1C4:R65606C5,2,FALSE) -> 击杀npc | C4: =VLOOKUP(RC[-2],'E:\mowen_game\int\piassets\common_cfg\xls\[summary.xml]task'!R1C4:R65606C17,11,FALSE) -> 迅影龙1 | D4: =IF(VLOOKUP(RC[-3],'E:\mowen_game\int\piassets\common_cfg\xls\[summary.xml]task'!C4:C17,12,FALSE)=0,"",VLOOKUP(RC[-3],'E:\mowen_game\int\piassets\common_cfg\xls\[summary.xml]task'!C4:C17,12,FALSE)) -> 10013101 | E4: 5 | M4: 击败 | N4: =RC[-1]&"<"&LEFT(VLOOKUP(RC[-13],'E:\mowen_game\int\piassets\common_cfg\xls\[summary.xml]task'!R3C4:R100070C15,11,FALSE),LEN(VLOOKUP(RC[-13],'E:\mowen_game\int\piassets\common_cfg\xls\[summary.xml]task'!R3C4:R100070C15,11,FALSE))-1)&"|arg="&RC[-10]&">" -> 击败<迅影龙|arg=10013101>
A5: =task!R[1]C -> 10300304 | B5: =VLOOKUP(RC[-1],'E:\mowen_game\int\piassets\common_cfg\xls\[summary.xml]task'!R1C4:R65606C5,2,FALSE) -> 探索区域 | D5: =IF(VLOOKUP(RC[-3],'E:\mowen_game\int\piassets\common_cfg\xls\[summary.xml]task'!C4:C17,12,FALSE)=0,"",VLOOKUP(RC[-3],'E:\mowen_game\int\piassets\common_cfg\xls\[summary.xml]task'!C4:C17,12,FALSE)) ->  | E5: 3 | F5: {30001,{{42,172},{4,4}}} | M5: 联系 | N5: 联系<希德|arg=1212206>
A6: =task!R[1]C -> 10300305 | B6: =VLOOKUP(RC[-1],'E:\mowen_game\int\piassets\common_cfg\xls\[summary.xml]task'!R1C4:R65606C5,2,FALSE) -> 击杀npc | C6: =VLOOKUP(RC[-2],'E:\mowen_game\int\piassets\common_cfg\xls\[summary.xml]task'!R1C4:R65606C17,11,FALSE) -> 冰霜食人魔1 | D6: =IF(VLOOKUP(RC[-3],'E:\mowen_game\int\piassets\common_cfg\xls\[summary.xml]task'!C4:C17,12,FALSE)=0,"",VLOOKUP(RC[-3],'E:\mowen_game\int\piassets\common_cfg\xls\[summary.xml]task'!C4:C17,12,FALSE)) -> 10013102 | E6: 1 | M6: 击败 | N6: =RC[-1]&"<"&LEFT(VLOOKUP(RC[-13],'E:\mowen_game\int\piassets\common_cfg\xls\[summary.xml]task'!R3C4:R100070C15,11,FALSE),LEN(VLOOKUP(RC[-13],'E:\mowen_game\int\piassets\common_cfg\xls\[summary.xml]task'!R3C4:R100070C15,11,FALSE))-1)&"|arg="&RC[-10]&">" -> 击败<冰霜食人魔|arg=10013102>
A7: =task!R[3]C -> 10300308 | B7: 完成副本 | D7: =IF(VLOOKUP(RC[-3],'E:\mowen_game\int\piassets\common_cfg\xls\[summary.xml]task'!C4:C17,12,FALSE)=0,"",VLOOKUP(RC[-3],'E:\mowen_game\int\piassets\common_cfg\xls\[summary.xml]task'!C4:C17,12,FALSE)) ->  | E7: 30002 | F7: {3000,{{147,164},{3,4}}} | H7: 10300339 | M7: 前往 | N7: 前往<祭坛|arg=1212201>
A8: =task!R[3]C -> 10300309 | B8: =VLOOKUP(RC[-1],'E:\mowen_game\int\piassets\common_cfg\xls\[summary.xml]task'!R1C4:R65606C5,2,FALSE) -> 击杀npc | C8: =VLOOKUP(RC[-2],'E:\mowen_game\int\piassets\common_cfg\xls\[summary.xml]task'!R1C4:R65606C17,11,FALSE) -> 黑暗巫师1 | D8: [10013103,10013118] | E8: 6 | M8: 击败 | N8: 击败<所有入侵者|arg=10013103>
A9: =task!R[3]C -> 10300310 | B9: =VLOOKUP(RC[-1],'E:\mowen_game\int\piassets\common_cfg\xls\[summary.xml]task'!R1C4:R65606C5,2,FALSE) -> 采集无物品 | C9: =VLOOKUP(RC[-2],'E:\mowen_game\int\piassets\common_cfg\xls\[summary.xml]task'!R1C4:R65606C17,11,FALSE) -> 祭坛1 | D9: =IF(VLOOKUP(RC[-3],'E:\mowen_game\int\piassets\common_cfg\xls\[summary.xml]task'!C4:C17,12,FALSE)=0,"",VLOOKUP(RC[-3],'E:\mowen_game\int\piassets\common_cfg\xls\[summary.xml]task'!C4:C17,12,FALSE)) -> 10013020 | E9: 1 | M9: 激活 | N9: =RC[-1]&"<"&LEFT(VLOOKUP(RC[-13],'E:\mowen_game\int\piassets\common_cfg\xls\[summary.xml]task'!R3C4:R100070C15,11,FALSE),LEN(VLOOKUP(RC[-13],'E:\mowen_game\int\piassets\common_cfg\xls\[summary.xml]task'!R3C4:R100070C15,11,FALSE))-1)&"|arg="&RC[-10]&">" -> 激活<祭坛|arg=10013020>
A10: =task!R[3]C -> 10300311 | B10: =VLOOKUP(RC[-1],'E:\mowen_game\int\piassets\common_cfg\xls\[summary.xml]task'!R1C4:R65606C5,2,FALSE) -> 击杀npc | C10: =VLOOKUP(RC[-2],'E:\mowen_game\int\piassets\common_cfg\xls\[summary.xml]task'!R1C4:R65606C17,11,FALSE) -> 警钟1 | D10: =IF(VLOOKUP(RC[-3],'E:\mowen_game\int\piassets\common_cfg\xls\[summary.xml]task'!C4:C17,12,FALSE)=0,"",VLOOKUP(RC[-3],'E:\mowen_game\int\piassets\common_cfg\xls\[summary.xml]task'!C4:C17,12,FALSE)) -> 10013112 | E10: 1 | M10: 敲响 | N10: =RC[-1]&"<"&LEFT(VLOOKUP(RC[-13],'E:\mowen_game\int\piassets\common_cfg\xls\[summary.xml]task'!R3C4:R100070C15,11,FALSE),LEN(VLOOKUP(RC[-13],'E:\mowen_game\int\piassets\common_cfg\xls\[summary.xml]task'!R3C4:R100070C15,11,FALSE))-1)&"|arg="&RC[-10]&">" -> 敲响<警钟|arg=10013112>
A11: =task!R[4]C -> 10300313 | B11: 完成副本 | D11: =IF(VLOOKUP(RC[-3],'E:\mowen_game\int\piassets\common_cfg\xls\[summary.xml]task'!C4:C17,12,FALSE)=0,"",VLOOKUP(RC[-3],'E:\mowen_game\int\piassets\common_cfg\xls\[summary.xml]task'!C4:C17,12,FALSE)) ->  | E11: 30003 | F11: {3000,{{234,124},{2,5}}} | H11: 10300340 | M11: 探查 | N11: 探查<村外|arg=1212202>
A12: =task!R[4]C -> 10300314 | B12: =VLOOKUP(RC[-1],'E:\mowen_game\int\piassets\common_cfg\xls\[summary.xml]task'!R1C4:R65606C5,2,FALSE) -> 击杀npc | C12: =VLOOKUP(RC[-2],'E:\mowen_game\int\piassets\common_cfg\xls\[summary.xml]task'!R1C4:R65606C17,11,FALSE) -> 暗影龙兽1 | D12: =IF(VLOOKUP(RC[-3],'E:\mowen_game\int\piassets\common_cfg\xls\[summary.xml]task'!C4:C17,12,FALSE)=0,"",VLOOKUP(RC[-3],'E:\mowen_game\int\piassets\common_cfg\xls\[summary.xml]task'!C4:C17,12,FALSE)) -> 10013105 | E12: 5 | M12: 击败 | N12: =RC[-1]&"<"&LEFT(VLOOKUP(RC[-13],'E:\mowen_game\int\piassets\common_cfg\xls\[summary.xml]task'!R3C4:R100070C15,11,FALSE),LEN(VLOOKUP(RC[-13],'E:\mowen_game\int\piassets\common_cfg\xls\[summary.xml]task'!R3C4:R100070C15,11,FALSE))-1)&"|arg="&RC[-10]&">" -> 击败<暗影龙兽|arg=10013105>
A13: =task!R[4]C -> 10300315 | B13: =VLOOKUP(RC[-1],'E:\mowen_game\int\piassets\common_cfg\xls\[summary.xml]task'!R1C4:R65606C5,2,FALSE) -> 击杀npc | C13: =VLOOKUP(RC[-2],'E:\mowen_game\int\piassets\common_cfg\xls\[summary.xml]task'!R1C4:R65606C17,11,FALSE) -> 黑袍人分身2 | D13: =IF(VLOOKUP(RC[-3],'E:\mowen_game\int\piassets\common_cfg\xls\[summary.xml]task'!C4:C17,12,FALSE)=0,"",VLOOKUP(RC[-3],'E:\mowen_game\int\piassets\common_cfg\xls\[summary.xml]task'!C4:C17,12,FALSE)) -> 10013106 | E13: 1 | M13: 战胜 | N13: =RC[-1]&"<"&LEFT(VLOOKUP(RC[-13],'E:\mowen_game\int\piassets\common_cfg\xls\[summary.xml]task'!R3C4:R100070C15,11,FALSE),LEN(VLOOKUP(RC[-13],'E:\mowen_game\int\piassets\common_cfg\xls\[summary.xml]task'!R3C4:R100070C15,11,FALSE))-1)&"|arg="&RC[-10]&">" -> 战胜<黑袍人分身|arg=10013106>
A14: =task!R[4]C -> 10300316 | B14: 完成副本 | D14: =IF(VLOOKUP(RC[-3],'E:\mowen_game\int\piassets\common_cfg\xls\[summary.xml]task'!C4:C17,12,FALSE)=0,"",VLOOKUP(RC[-3],'E:\mowen_game\int\piassets\common_cfg\xls\[summary.xml]task'!C4:C17,12,FALSE)) ->  | E14: 30004 | F14: {3000,{{219,145},{6,3}}} | H14: 10300341 | M14: 回援 | N14: 回援<村庄|arg=1212203>
A15: =task!R[4]C -> 10300317 | B15: =VLOOKUP(RC[-1],'E:\mowen_game\int\piassets\common_cfg\xls\[summary.xml]task'!R1C4:R65606C5,2,FALSE) -> 击杀npc | C15: =VLOOKUP(RC[-2],'E:\mowen_game\int\piassets\common_cfg\xls\[summary.xml]task'!R1C4:R65606C17,11,FALSE) -> 小恶魔1 | D15: =IF(VLOOKUP(RC[-3],'E:\mowen_game\int\piassets\common_cfg\xls\[summary.xml]task'!C4:C17,12,FALSE)=0,"",VLOOKUP(RC[-3],'E:\mowen_game\int\piassets\common_cfg\xls\[summary.xml]task'!C4:C17,12,FALSE)) -> 10013104 | E15: 10 | M15: 击败 | N15: =RC[-1]&"<"&LEFT(VLOOKUP(RC[-13],'E:\mowen_game\int\piassets\common_cfg\xls\[summary.xml]task'!R3C4:R100070C15,11,FALSE),LEN(VLOOKUP(RC[-13],'E:\mowen_game\int\piassets\common_cfg\xls\[summary.xml]task'!R3C4:R100070C15,11,FALSE))-1)&"|arg="&RC[-10]&">" -> 击败<小恶魔|arg=10013104>
A16: =task!R[4]C -> 10300318 | B16: =VLOOKUP(RC[-1],'E:\mowen_game\int\piassets\common_cfg\xls\[summary.xml]task'!R1C4:R65606C5,2,FALSE) -> 击杀npc | C16: =VLOOKUP(RC[-2],'E:\mowen_game\int\piassets\common_cfg\xls\[summary.xml]task'!R1C4:R65606C17,11,FALSE) -> 冰霜恶魔1 | D16: =IF(VLOOKUP(RC[-3],'E:\mowen_game\int\piassets\common_cfg\xls\[summary.xml]task'!C4:C17,12,FALSE)=0,"",VLOOKUP(RC[-3],'E:\mowen_game\int\piassets\common_cfg\xls\[summary.xml]task'!C4:C17,12,FALSE)) -> 10013108 | E16: 5 | M16: 击败 | N16: =RC[-1]&"<"&LEFT(VLOOKUP(RC[-13],'E:\mowen_game\int\piassets\common_cfg\xls\[summary.xml]task'!R3C4:R100070C15,11,FALSE),LEN(VLOOKUP(RC[-13],'E:\mowen_game\int\piassets\common_cfg\xls\[summary.xml]task'!R3C4:R100070C15,11,FALSE))-1)&"|arg="&RC[-10]&">" -> 击败<冰霜恶魔|arg=10013108>
A17: =task!R[4]C -> 10300319 | B17: =VLOOKUP(RC[-1],'E:\mowen_game\int\piassets\common_cfg\xls\[summary.xml]task'!R1C4:R65606C5,2,FALSE) -> 击杀npc | C17: =VLOOKUP(RC[-2],'E:\mowen_game\int\piassets\common_cfg\xls\[summary.xml]task'!R1C4:R65606C17,11,FALSE) -> 黑暗传送门1 | D17: [10013109,10013120,10013121] | E17: 7 | M17: 清除 | N17: 清除<黑暗传送门和守卫|arg=10013109>
A18: =task!R[4]C -> 10300320 | B18: 完成副本 | D18: =IF(VLOOKUP(RC[-3],'E:\mowen_game\int\piassets\common_cfg\xls\[summary.xml]task'!C4:C17,12,FALSE)=0,"",VLOOKUP(RC[-3],'E:\mowen_game\int\piassets\common_cfg\xls\[summary.xml]task'!C4:C17,12,FALSE)) ->  | E18: 30005 | F18: {3000,{{210,132},{2,5}}} | H18: 10300342 | M18: 接应 | N18: 接应<援军|arg=1212204>
A19: =task!R[4]C -> 10300321 | B19: =VLOOKUP(RC[-1],'E:\mowen_game\int\piassets\common_cfg\xls\[summary.xml]task'!R1C4:R65606C5,2,FALSE) -> 击杀npc | C19: =VLOOKUP(RC[-2],'E:\mowen_game\int\piassets\common_cfg\xls\[summary.xml]task'!R1C4:R65606C17,11,FALSE) -> 精灵龙1 | D19: =IF(VLOOKUP(RC[-3],'E:\mowen_game\int\piassets\common_cfg\xls\[summary.xml]task'!C4:C17,12,FALSE)=0,"",VLOOKUP(RC[-3],'E:\mowen_game\int\piassets\common_cfg\xls\[summary.xml]task'!C4:C17,12,FALSE)) -> 10013110 | E19: 10 | M19: 击败 | N19: =RC[-1]&"<"&LEFT(VLOOKUP(RC[-13],'E:\mowen_game\int\piassets\common_cfg\xls\[summary.xml]task'!R3C4:R100070C15,11,FALSE),LEN(VLOOKUP(RC[-13],'E:\mowen_game\int\piassets\common_cfg\xls\[summary.xml]task'!R3C4:R100070C15,11,FALSE))-1)&"|arg="&RC[-10]&">" -> 击败<精灵龙|arg=10013110>
A20: =task!R[4]C -> 10300322 | B20: =VLOOKUP(RC[-1],'E:\mowen_game\int\piassets\common_cfg\xls\[summary.xml]task'!R1C4:R65606C5,2,FALSE) -> 击杀npc | C20: =VLOOKUP(RC[-2],'E:\mowen_game\int\piassets\common_cfg\xls\[summary.xml]task'!R1C4:R65606C17,11,FALSE) -> 食人花妖1 | D20: =IF(VLOOKUP(RC[-3],'E:\mowen_game\int\piassets\common_cfg\xls\[summary.xml]task'!C4:C17,12,FALSE)=0,"",VLOOKUP(RC[-3],'E:\mowen_game\int\piassets\common_cfg\xls\[summary.xml]task'!C4:C17,12,FALSE)) -> 10013111 | E20: 20 | M20: 击败 | N20: =RC[-1]&"<"&LEFT(VLOOKUP(RC[-13],'E:\mowen_game\int\piassets\common_cfg\xls\[summary.xml]task'!R3C4:R100070C15,11,FALSE),LEN(VLOOKUP(RC[-13],'E:\mowen_game\int\piassets\common_cfg\xls\[summary.xml]task'!R3C4:R100070C15,11,FALSE))-1)&"|arg="&RC[-10]&">" -> 击败<食人花妖|arg=10013111>
A21: =task!R[4]C -> 10300323 | B21: =VLOOKUP(RC[-1],'E:\mowen_game\int\piassets\common_cfg\xls\[summary.xml]task'!R1C4:R65606C5,2,FALSE) -> 使用无物品 | E21: 1 | F21: {3000,{{81,11},{3,3}}} | G21: 魔气追踪仪1 | H21: 1012101 | I21: 3 | M21: 使用 | N21: 使用<魔气追踪仪|arg=1212205>
A22: =task!R[4]C -> 10300324 | B22: 完成副本 | E22: 2000 | H22: 10300325 | M22: 通关 | N22: 通关<虚空之桥|arg=2000,type=finishCarbon>
A23: =task!R[4]C -> 10300325 | B23: =VLOOKUP(RC[-1],'E:\mowen_game\int\piassets\common_cfg\xls\[summary.xml]task'!R1C4:R65606C5,2,FALSE) -> 探索区域 | E23: 1 | F23: {2000,{{18,127},{5,2}}} | M23: 向前 | N23: 向前<探索|arg=1212300>
A24: =task!R[4]C -> 10300326 | B24: =VLOOKUP(RC[-1],'E:\mowen_game\int\piassets\common_cfg\xls\[summary.xml]task'!R1C4:R65606C5,2,FALSE) -> 击杀npc | C24: =VLOOKUP(RC[-2],'E:\mowen_game\int\piassets\common_cfg\xls\[summary.xml]task'!R1C4:R65606C17,11,FALSE) -> 虚空猎犬1 | D24: =IF(VLOOKUP(RC[-3],'E:\mowen_game\int\piassets\common_cfg\xls\[summary.xml]task'!C4:C17,12,FALSE)=0,"",VLOOKUP(RC[-3],'E:\mowen_game\int\piassets\common_cfg\xls\[summary.xml]task'!C4:C17,12,FALSE)) -> 10013130 | E24: 5 | M24: 击败 | N24: 击败<虚空猎犬|arg=10013130>
A25: =task!R[4]C -> 10300327 | B25: =VLOOKUP(RC[-1],'E:\mowen_game\int\piassets\common_cfg\xls\[summary.xml]task'!R1C4:R65606C5,2,FALSE) -> 探索区域 | E25: 1 | F25: {2000,{{36,114},{2,5}}} | M25: 继续 | N25: 继续<向前探索|arg=1212301>
A26: =task!R[4]C -> 10300328 | B26: =VLOOKUP(RC[-1],'E:\mowen_game\int\piassets\common_cfg\xls\[summary.xml]task'!R1C4:R65606C5,2,FALSE) -> 探索区域 | E26: 1 | F26: {2000,{{49,98},{2,5}}} | M26: 穿过 | N26: 穿过<虚空之桥|arg=1212302>
A27: =task!R[4]C -> 10300329 | B27: =VLOOKUP(RC[-1],'E:\mowen_game\int\piassets\common_cfg\xls\[summary.xml]task'!R1C4:R65606C5,2,FALSE) -> 击杀npc | C27: =VLOOKUP(RC[-2],'E:\mowen_game\int\piassets\common_cfg\xls\[summary.xml]task'!R1C4:R65606C17,11,FALSE) -> 虚空魔眼1 | D27: =IF(VLOOKUP(RC[-3],'E:\mowen_game\int\piassets\common_cfg\xls\[summary.xml]task'!C4:C17,12,FALSE)=0,"",VLOOKUP(RC[-3],'E:\mowen_game\int\piassets\common_cfg\xls\[summary.xml]task'!C4:C17,12,FALSE)) -> 10013131 | E27: 5 | M27: 击败 | N27: 击败<虚空魔眼|arg=10013131>
A28: =task!R[4]C -> 10300330 | B28: =VLOOKUP(RC[-1],'E:\mowen_game\int\piassets\common_cfg\xls\[summary.xml]task'!R1C4:R65606C5,2,FALSE) -> 击杀npc | C28: =VLOOKUP(RC[-2],'E:\mowen_game\int\piassets\common_cfg\xls\[summary.xml]task'!R1C4:R65606C17,11,FALSE) -> 虚空行者1 | D28: =IF(VLOOKUP(RC[-3],'E:\mowen_game\int\piassets\common_cfg\xls\[summary.xml]task'!C4:C17,12,FALSE)=0,"",VLOOKUP(RC[-3],'E:\mowen_game\int\piassets\common_cfg\xls\[summary.xml]task'!C4:C17,12,FALSE)) -> 10013132 | E28: 5 | M28: 击败 | N28: 击败<虚空行者|arg=10013132>
A29: =task!R[4]C -> 10300331 | B29: =VLOOKUP(RC[-1],'E:\mowen_game\int\piassets\common_cfg\xls\[summary.xml]task'!R1C4:R65606C5,2,FALSE) -> 探索区域 | E29: 1 | F29: {2000,{{44,60},{2,5}}} | M29: 继续 | N29: 继续<向前探索|arg=1212303>
A30: =task!R[4]C -> 10300332 | B30: =VLOOKUP(RC[-1],'E:\mowen_game\int\piassets\common_cfg\xls\[summary.xml]task'!R1C4:R65606C5,2,FALSE) -> 探索区域 | E30: 1 | F30: {2000,{{66,51},{2,5}}} | M30: 穿过 | N30: 穿过<虚空之桥|arg=1212304>
A31: =task!R[4]C -> 10300333 | B31: =VLOOKUP(RC[-1],'E:\mowen_game\int\piassets\common_cfg\xls\[summary.xml]task'!R1C4:R65606C5,2,FALSE) -> 击杀npc | C31: =VLOOKUP(RC[-2],'E:\mowen_game\int\piassets\common_cfg\xls\[summary.xml]task'!R1C4:R65606C17,11,FALSE) -> 虚空魔影1 | D31: [10013136,10013134,10013133] | E31: 11 | M31: 清空 | N31: 清空<当前区域所有怪物|arg=10013133>
A32: =task!R[4]C -> 10300334 | B32: =VLOOKUP(RC[-1],'E:\mowen_game\int\piassets\common_cfg\xls\[summary.xml]task'!R1C4:R65606C5,2,FALSE) -> 击杀npc | C32: =VLOOKUP(RC[-2],'E:\mowen_game\int\piassets\common_cfg\xls\[summary.xml]task'!R1C4:R65606C17,11,FALSE) -> 虚空魔颅1 | E32: 1 | M32: 击败 | N32: =RC[-1]&"<"&LEFT(VLOOKUP(RC[-13],'E:\mowen_game\int\piassets\common_cfg\xls\[summary.xml]task'!R3C4:R100070C15,11,FALSE),LEN(VLOOKUP(RC[-13],'E:\mowen_game\int\piassets\common_cfg\xls\[summary.xml]task'!R3C4:R100070C15,11,FALSE))-1)&"|arg="&R[-1]C[-10]&">" -> 击败<虚空魔颅|arg=[10013136,10013134,10013133]>
A33: =task!R[4]C -> 10300335 | B33: =VLOOKUP(RC[-1],'E:\mowen_game\int\piassets\common_cfg\xls\[summary.xml]task'!R1C4:R65606C5,2,FALSE) -> 探索区域 | E33: 1 | F33: {2000,{{102,25},{5,2}}} | M33: 继续 | N33: 继续<向前探索|arg=1212305>
A34: =task!R[4]C -> 10300336 | B34: =VLOOKUP(RC[-1],'E:\mowen_game\int\piassets\common_cfg\xls\[summary.xml]task'!R1C4:R65606C5,2,FALSE) -> 击杀npc | C34: =VLOOKUP(RC[-2],'E:\mowen_game\int\piassets\common_cfg\xls\[summary.xml]task'!R1C4:R65606C17,11,FALSE) -> 虚空魔龙1 | D34: =IF(VLOOKUP(RC[-3],'E:\mowen_game\int\piassets\common_cfg\xls\[summary.xml]task'!C4:C17,12,FALSE)=0,"",VLOOKUP(RC[-3],'E:\mowen_game\int\piassets\common_cfg\xls\[summary.xml]task'!C4:C17,12,FALSE)) -> 10013135 | E34: 1 | M34: 击败 | N34: 击败<虚空魔龙|arg=10013135>
A35: =task!R[5]C -> 10300338 | B35: =VLOOKUP(RC[-1],'E:\mowen_game\int\piassets\common_cfg\xls\[summary.xml]task'!R1C4:R65606C5,2,FALSE) -> 探索区域 | E35: 1 | F35: {30001,{{23,177},{4,4}}} | M35: 突破 | N35: 突破<重围|arg=1212207>
A36: =task!R[5]C -> 10300339 | B36: =VLOOKUP(RC[-1],'E:\mowen_game\int\piassets\common_cfg\xls\[summary.xml]task'!R1C4:R65606C5,2,FALSE) -> 探索区域 | E36: 1 | F36: {30002,{{147,164},{3,4}}} | M36: 阻止 | N36: 阻止<神秘人|arg=1212208>
A37: =task!R[5]C -> 10300340 | B37: =VLOOKUP(RC[-1],'E:\mowen_game\int\piassets\common_cfg\xls\[summary.xml]task'!R1C4:R65606C5,2,FALSE) -> 探索区域 | E37: 1 | F37: {30003,{{234,124},{2,5}}} | M37: 消灭 | N37: 消灭<魔兽|arg=1212209>
A38: =task!R[5]C -> 10300341 | B38: =VLOOKUP(RC[-1],'E:\mowen_game\int\piassets\common_cfg\xls\[summary.xml]task'!R1C4:R65606C5,2,FALSE) -> 探索区域 | E38: 1 | F38: {30004,{{219,145},{6,3}}} | M38: 消灭 | N38: 消灭<恶魔|arg=1212210>
A39: =task!R[5]C -> 10300342 | B39: =VLOOKUP(RC[-1],'E:\mowen_game\int\piassets\common_cfg\xls\[summary.xml]task'!R1C4:R65606C5,2,FALSE) -> 探索区域 | E39: 1 | F39: {30005,{{204,129},{2,5}}} | M39: 突破 | N39: 突破<拦截|arg=1212211>
A40: =task!R[6]C -> 10300344 | B40: =VLOOKUP(RC[-1],'E:\mowen_game\int\piassets\common_cfg\xls\[summary.xml]task'!R1C4:R65606C5,2,FALSE) -> 探索区域 | D40: =IF(VLOOKUP(RC[-3],'E:\mowen_game\int\piassets\common_cfg\xls\[summary.xml]task'!C4:C17,12,FALSE)=0,"",VLOOKUP(RC[-3],'E:\mowen_game\int\piassets\common_cfg\xls\[summary.xml]task'!C4:C17,12,FALSE)) ->  | E40: 1 | F40: {30005,{{93,88},{2,5}}} | M40: 前往 | N40: 前往<哥布林草原|arg=1212212>
A41: =task!R[6]C -> 10300345 | B41: =VLOOKUP(RC[-1],'E:\mowen_game\int\piassets\common_cfg\xls\[summary.xml]task'!R1C4:R65606C5,2,FALSE) -> 击杀npc | C41: =VLOOKUP(RC[-2],'E:\mowen_game\int\piassets\common_cfg\xls\[summary.xml]task'!R1C4:R65606C17,11,FALSE) -> 疯狂的哥布林1 | D41: [10013115,10013122] | E41: 11 | M41: 击败 | N41: 击败<魔化的哥布林|arg=10013115>
A42: =task!R[6]C -> 10300346 | B42: =VLOOKUP(RC[-1],'E:\mowen_game\int\piassets\common_cfg\xls\[summary.xml]task'!R1C4:R65606C5,2,FALSE) -> 探索区域 | E42: 1 | F42: {30005,{{75,47},{5,2}}} | M42: 前往 | N42: 前往<迷雾冰原|arg=1212213>
A43: =task!R[6]C -> 10300347 | B43: =VLOOKUP(RC[-1],'E:\mowen_game\int\piassets\common_cfg\xls\[summary.xml]task'!R1C4:R65606C5,2,FALSE) -> 击杀npc | C43: =VLOOKUP(RC[-2],'E:\mowen_game\int\piassets\common_cfg\xls\[summary.xml]task'!R1C4:R65606C17,11,FALSE) -> 吸血蝙蝠1 | D43: =IF(VLOOKUP(RC[-3],'E:\mowen_game\int\piassets\common_cfg\xls\[summary.xml]task'!C4:C17,12,FALSE)=0,"",VLOOKUP(RC[-3],'E:\mowen_game\int\piassets\common_cfg\xls\[summary.xml]task'!C4:C17,12,FALSE)) -> 10013116 | E43: 10 | M43: 消灭 | N43: 消灭<吸血蝙蝠|arg=10013116>
A44: =task!R[6]C -> 10302001 | B44: =VLOOKUP(RC[-1],'E:\mowen_game\int\piassets\common_cfg\xls\[summary.xml]task'!R1C4:R65606C5,2,FALSE) -> 击杀npc | C44: =VLOOKUP(RC[-2],'E:\mowen_game\int\piassets\common_cfg\xls\[summary.xml]task'!R1C4:R65606C17,11,FALSE) -> 虚灵1 | D44: =IF(VLOOKUP(RC[-3],'E:\mowen_game\int\piassets\common_cfg\xls\[summary.xml]task'!C4:C17,12,FALSE)=0,"",VLOOKUP(RC[-3],'E:\mowen_game\int\piassets\common_cfg\xls\[summary.xml]task'!C4:C17,12,FALSE)) -> 10012300 | E44: 25 | M44: 击杀 | N44: =RC[-1]&"<"&LEFT(VLOOKUP(RC[-13],'E:\mowen_game\int\piassets\common_cfg\xls\[summary.xml]task'!R3C4:R100070C15,11,FALSE),LEN(VLOOKUP(RC[-13],'E:\mowen_game\int\piassets\common_cfg\xls\[summary.xml]task'!R3C4:R100070C15,11,FALSE))-1)&"|arg="&RC[-10]&">" -> 击杀<虚灵|arg=10012300>
A45: =task!R[6]C -> 10302002 | B45: =VLOOKUP(RC[-1],'E:\mowen_game\int\piassets\common_cfg\xls\[summary.xml]task'!R1C4:R65606C5,2,FALSE) -> 击杀npc | C45: =VLOOKUP(RC[-2],'E:\mowen_game\int\piassets\common_cfg\xls\[summary.xml]task'!R1C4:R65606C17,11,FALSE) -> 虚空先知1 | D45: =IF(VLOOKUP(RC[-3],'E:\mowen_game\int\piassets\common_cfg\xls\[summary.xml]task'!C4:C17,12,FALSE)=0,"",VLOOKUP(RC[-3],'E:\mowen_game\int\piassets\common_cfg\xls\[summary.xml]task'!C4:C17,12,FALSE)) -> 10012301 | E45: 25 | M45: 击败 | N45: =RC[-1]&"<"&LEFT(VLOOKUP(RC[-13],'E:\mowen_game\int\piassets\common_cfg\xls\[summary.xml]task'!R3C4:R100070C15,11,FALSE),LEN(VLOOKUP(RC[-13],'E:\mowen_game\int\piassets\common_cfg\xls\[summary.xml]task'!R3C4:R100070C15,11,FALSE))-1)&"|arg="&RC[-10]&">" -> 击败<虚空先知|arg=10012301>
A46: =task!R[6]C -> 10302003 | B46: =VLOOKUP(RC[-1],'E:\mowen_game\int\piassets\common_cfg\xls\[summary.xml]task'!R1C4:R65606C5,2,FALSE) -> 采集有物品 | C46: =VLOOKUP(RC[-2],'E:\mowen_game\int\piassets\common_cfg\xls\[summary.xml]task'!R1C4:R65606C17,11,FALSE) -> 晶体树枝1 | D46: =IF(VLOOKUP(RC[-3],'E:\mowen_game\int\piassets\common_cfg\xls\[summary.xml]task'!C4:C17,12,FALSE)=0,"",VLOOKUP(RC[-3],'E:\mowen_game\int\piassets\common_cfg\xls\[summary.xml]task'!C4:C17,12,FALSE)) -> 10012393 | E46: 5 | G46: 晶体树枝 | H46: 1012010 | I46: 100 | M46: 采集 | N46: =RC[-1]&"<"&LEFT(VLOOKUP(RC[-13],'E:\mowen_game\int\piassets\common_cfg\xls\[summary.xml]task'!R3C4:R100070C15,11,FALSE),LEN(VLOOKUP(RC[-13],'E:\mowen_game\int\piassets\common_cfg\xls\[summary.xml]task'!R3C4:R100070C15,11,FALSE))-1)&"|arg="&RC[-10]&">" -> 采集<晶体树枝|arg=10012393>
A47: =task!R[6]C -> 10302004 | B47: =VLOOKUP(RC[-1],'E:\mowen_game\int\piassets\common_cfg\xls\[summary.xml]task'!R1C4:R65606C5,2,FALSE) -> 采集有物品 | C47: =VLOOKUP(RC[-2],'E:\mowen_game\int\piassets\common_cfg\xls\[summary.xml]task'!R1C4:R65606C17,11,FALSE) -> 风暴水晶1 | D47: =IF(VLOOKUP(RC[-3],'E:\mowen_game\int\piassets\common_cfg\xls\[summary.xml]task'!C4:C17,12,FALSE)=0,"",VLOOKUP(RC[-3],'E:\mowen_game\int\piassets\common_cfg\xls\[summary.xml]task'!C4:C17,12,FALSE)) -> 10012394 | E47: 5 | G47: 风暴水晶 | H47: 1012011 | I47: 100 | M47: 收集 | N47: =RC[-1]&"<"&LEFT(VLOOKUP(RC[-13],'E:\mowen_game\int\piassets\common_cfg\xls\[summary.xml]task'!R3C4:R100070C15,11,FALSE),LEN(VLOOKUP(RC[-13],'E:\mowen_game\int\piassets\common_cfg\xls\[summary.xml]task'!R3C4:R100070C15,11,FALSE))-1)&"|arg="&RC[-10]&">" -> 收集<风暴水晶|arg=10012394>
A48: =task!R[6]C -> 10302011 | B48: =VLOOKUP(RC[-1],'E:\mowen_game\int\piassets\common_cfg\xls\[summary.xml]task'!R1C4:R65606C5,2,FALSE) -> 击杀npc | C48: =VLOOKUP(RC[-2],'E:\mowen_game\int\piassets\common_cfg\xls\[summary.xml]task'!R1C4:R65606C17,11,FALSE) -> 虚灵1 | D48: =IF(VLOOKUP(RC[-3],'E:\mowen_game\int\piassets\common_cfg\xls\[summary.xml]task'!C4:C17,12,FALSE)=0,"",VLOOKUP(RC[-3],'E:\mowen_game\int\piassets\common_cfg\xls\[summary.xml]task'!C4:C17,12,FALSE)) -> 10012300 | E48: 25 | M48: 击杀 | N48: =RC[-1]&"<"&LEFT(VLOOKUP(RC[-13],'E:\mowen_game\int\piassets\common_cfg\xls\[summary.xml]task'!R3C4:R100070C15,11,FALSE),LEN(VLOOKUP(RC[-13],'E:\mowen_game\int\piassets\common_cfg\xls\[summary.xml]task'!R3C4:R100070C15,11,FALSE))-1)&"|arg="&RC[-10]&">" -> 击杀<虚灵|arg=10012300>
A49: =task!R[6]C -> 10302012 | B49: =VLOOKUP(RC[-1],'E:\mowen_game\int\piassets\common_cfg\xls\[summary.xml]task'!R1C4:R65606C5,2,FALSE) -> 击杀npc | C49: =VLOOKUP(RC[-2],'E:\mowen_game\int\piassets\common_cfg\xls\[summary.xml]task'!R1C4:R65606C17,11,FALSE) -> 虚空先知1 | D49: =IF(VLOOKUP(RC[-3],'E:\mowen_game\int\piassets\common_cfg\xls\[summary.xml]task'!C4:C17,12,FALSE)=0,"",VLOOKUP(RC[-3],'E:\mowen_game\int\piassets\common_cfg\xls\[summary.xml]task'!C4:C17,12,FALSE)) -> 10012301 | E49: 25 | M49: 击败 | N49: =RC[-1]&"<"&LEFT(VLOOKUP(RC[-13],'E:\mowen_game\int\piassets\common_cfg\xls\[summary.xml]task'!R3C4:R100070C15,11,FALSE),LEN(VLOOKUP(RC[-13],'E:\mowen_game\int\piassets\common_cfg\xls\[summary.xml]task'!R3C4:R100070C15,11,FALSE))-1)&"|arg="&RC[-10]&">" -> 击败<虚空先知|arg=10012301>
A50: =task!R[6]C -> 10302013 | B50: =VLOOKUP(RC[-1],'E:\mowen_game\int\piassets\common_cfg\xls\[summary.xml]task'!R1C4:R65606C5,2,FALSE) -> 采集有物品 | C50: =VLOOKUP(RC[-2],'E:\mowen_game\int\piassets\common_cfg\xls\[summary.xml]task'!R1C4:R65606C17,11,FALSE) -> 晶体树枝1 | D50: =IF(VLOOKUP(RC[-3],'E:\mowen_game\int\piassets\common_cfg\xls\[summary.xml]task'!C4:C17,12,FALSE)=0,"",VLOOKUP(RC[-3],'E:\mowen_game\int\piassets\common_cfg\xls\[summary.xml]task'!C4:C17,12,FALSE)) -> 10012393 | E50: 5 | G50: 晶体树枝 | H50: 1012010 | I50: 100 | M50: 采集 | N50: =RC[-1]&"<"&LEFT(VLOOKUP(RC[-13],'E:\mowen_game\int\piassets\common_cfg\xls\[summary.xml]task'!R3C4:R100070C15,11,FALSE),LEN(VLOOKUP(RC[-13],'E:\mowen_game\int\piassets\common_cfg\xls\[summary.xml]task'!R3C4:R100070C15,11,FALSE))-1)&"|arg="&RC[-10]&">" -> 采集<晶体树枝|arg=10012393>
A51: =task!R[6]C -> 10302014 | B51: =VLOOKUP(RC[-1],'E:\mowen_game\int\piassets\common_cfg\xls\[summary.xml]task'!R1C4:R65606C5,2,FALSE) -> 采集有物品 | C51: =VLOOKUP(RC[-2],'E:\mowen_game\int\piassets\common_cfg\xls\[summary.xml]task'!R1C4:R65606C17,11,FALSE) -> 风暴水晶1 | D51: =IF(VLOOKUP(RC[-3],'E:\mowen_game\int\piassets\common_cfg\xls\[summary.xml]task'!C4:C17,12,FALSE)=0,"",VLOOKUP(RC[-3],'E:\mowen_game\int\piassets\common_cfg\xls\[summary.xml]task'!C4:C17,12,FALSE)) -> 10012394 | E51: 5 | G51: 风暴水晶 | H51: 1012011 | I51: 100 | M51: 收集 | N51: =RC[-1]&"<"&LEFT(VLOOKUP(RC[-13],'E:\mowen_game\int\piassets\common_cfg\xls\[summary.xml]task'!R3C4:R100070C15,11,FALSE),LEN(VLOOKUP(RC[-13],'E:\mowen_game\int\piassets\common_cfg\xls\[summary.xml]task'!R3C4:R100070C15,11,FALSE))-1)&"|arg="&RC[-10]&">" -> 收集<风暴水晶|arg=10012394>
A52: =task!R[6]C -> 10302021 | B52: =VLOOKUP(RC[-1],'E:\mowen_game\int\piassets\common_cfg\xls\[summary.xml]task'!R1C4:R65606C5,2,FALSE) -> 击杀npc | C52: =VLOOKUP(RC[-2],'E:\mowen_game\int\piassets\common_cfg\xls\[summary.xml]task'!R1C4:R65606C17,11,FALSE) -> 虚灵2 | D52: =IF(VLOOKUP(RC[-3],'E:\mowen_game\int\piassets\common_cfg\xls\[summary.xml]task'!C4:C17,12,FALSE)=0,"",VLOOKUP(RC[-3],'E:\mowen_game\int\piassets\common_cfg\xls\[summary.xml]task'!C4:C17,12,FALSE)) -> 10012320 | E52: 25 | M52: 击杀 | N52: =RC[-1]&"<"&LEFT(VLOOKUP(RC[-13],'E:\mowen_game\int\piassets\common_cfg\xls\[summary.xml]task'!R3C4:R100070C15,11,FALSE),LEN(VLOOKUP(RC[-13],'E:\mowen_game\int\piassets\common_cfg\xls\[summary.xml]task'!R3C4:R100070C15,11,FALSE))-1)&"|arg="&RC[-10]&">" -> 击杀<虚灵|arg=10012320>
A53: =task!R[6]C -> 10302022 | B53: =VLOOKUP(RC[-1],'E:\mowen_game\int\piassets\common_cfg\xls\[summary.xml]task'!R1C4:R65606C5,2,FALSE) -> 击杀npc | C53: =VLOOKUP(RC[-2],'E:\mowen_game\int\piassets\common_cfg\xls\[summary.xml]task'!R1C4:R65606C17,11,FALSE) -> 虚空先知2 | D53: =IF(VLOOKUP(RC[-3],'E:\mowen_game\int\piassets\common_cfg\xls\[summary.xml]task'!C4:C17,12,FALSE)=0,"",VLOOKUP(RC[-3],'E:\mowen_game\int\piassets\common_cfg\xls\[summary.xml]task'!C4:C17,12,FALSE)) -> 10012321 | E53: 25 | M53: 击败 | N53: =RC[-1]&"<"&LEFT(VLOOKUP(RC[-13],'E:\mowen_game\int\piassets\common_cfg\xls\[summary.xml]task'!R3C4:R100070C15,11,FALSE),LEN(VLOOKUP(RC[-13],'E:\mowen_game\int\piassets\common_cfg\xls\[summary.xml]task'!R3C4:R100070C15,11,FALSE))-1)&"|arg="&RC[-10]&">" -> 击败<虚空先知|arg=10012321>
A54: =task!R[6]C -> 10302023 | B54: =VLOOKUP(RC[-1],'E:\mowen_game\int\piassets\common_cfg\xls\[summary.xml]task'!R1C4:R65606C5,2,FALSE) -> 采集有物品 | C54: =VLOOKUP(RC[-2],'E:\mowen_game\int\piassets\common_cfg\xls\[summary.xml]task'!R1C4:R65606C17,11,FALSE) -> 晶体树枝2 | D54: =IF(VLOOKUP(RC[-3],'E:\mowen_game\int\piassets\common_cfg\xls\[summary.xml]task'!C4:C17,12,FALSE)=0,"",VLOOKUP(RC[-3],'E:\mowen_game\int\piassets\common_cfg\xls\[summary.xml]task'!C4:C17,12,FALSE)) -> 10012413 | E54: 5 | G54: 晶体树枝 | H54: 1012010 | I54: 100 | M54: 采集 | N54: =RC[-1]&"<"&LEFT(VLOOKUP(RC[-13],'E:\mowen_game\int\piassets\common_cfg\xls\[summary.xml]task'!R3C4:R100070C15,11,FALSE),LEN(VLOOKUP(RC[-13],'E:\mowen_game\int\piassets\common_cfg\xls\[summary.xml]task'!R3C4:R100070C15,11,FALSE))-1)&"|arg="&RC[-10]&">" -> 采集<晶体树枝|arg=10012413>
A55: =task!R[6]C -> 10302024 | B55: =VLOOKUP(RC[-1],'E:\mowen_game\int\piassets\common_cfg\xls\[summary.xml]task'!R1C4:R65606C5,2,FALSE) -> 采集有物品 | C55: =VLOOKUP(RC[-2],'E:\mowen_game\int\piassets\common_cfg\xls\[summary.xml]task'!R1C4:R65606C17,11,FALSE) -> 风暴水晶2 | D55: =IF(VLOOKUP(RC[-3],'E:\mowen_game\int\piassets\common_cfg\xls\[summary.xml]task'!C4:C17,12,FALSE)=0,"",VLOOKUP(RC[-3],'E:\mowen_game\int\piassets\common_cfg\xls\[summary.xml]task'!C4:C17,12,FALSE)) -> 10012414 | E55: 5 | G55: 风暴水晶 | H55: 1012011 | I55: 100 | M55: 收集 | N55: =RC[-1]&"<"&LEFT(VLOOKUP(RC[-13],'E:\mowen_game\int\piassets\common_cfg\xls\[summary.xml]task'!R3C4:R100070C15,11,FALSE),LEN(VLOOKUP(RC[-13],'E:\mowen_game\int\piassets\common_cfg\xls\[summary.xml]task'!R3C4:R100070C15,11,FALSE))-1)&"|arg="&RC[-10]&">" -> 收集<风暴水晶|arg=10012414>
A56: =task!R[6]C -> 10302025 | B56: =VLOOKUP(RC[-1],'E:\mowen_game\int\piassets\common_cfg\xls\[summary.xml]task'!R1C4:R65606C5,2,FALSE) -> 击杀npc | C56: =VLOOKUP(RC[-2],'E:\mowen_game\int\piassets\common_cfg\xls\[summary.xml]task'!R1C4:R65606C17,11,FALSE) -> 虚灵2 | D56: =IF(VLOOKUP(RC[-3],'E:\mowen_game\int\piassets\common_cfg\xls\[summary.xml]task'!C4:C17,12,FALSE)=0,"",VLOOKUP(RC[-3],'E:\mowen_game\int\piassets\common_cfg\xls\[summary.xml]task'!C4:C17,12,FALSE)) -> 10012320 | E56: 25 | M56: 击杀 | N56: =RC[-1]&"<"&LEFT(VLOOKUP(RC[-13],'E:\mowen_game\int\piassets\common_cfg\xls\[summary.xml]task'!R3C4:R100070C15,11,FALSE),LEN(VLOOKUP(RC[-13],'E:\mowen_game\int\piassets\common_cfg\xls\[summary.xml]task'!R3C4:R100070C15,11,FALSE))-1)&"|arg="&RC[-10]&">" -> 击杀<虚灵|arg=10012320>
A57: =task!R[6]C -> 10302026 | B57: =VLOOKUP(RC[-1],'E:\mowen_game\int\piassets\common_cfg\xls\[summary.xml]task'!R1C4:R65606C5,2,FALSE) -> 击杀npc | C57: =VLOOKUP(RC[-2],'E:\mowen_game\int\piassets\common_cfg\xls\[summary.xml]task'!R1C4:R65606C17,11,FALSE) -> 虚空先知2 | D57: =IF(VLOOKUP(RC[-3],'E:\mowen_game\int\piassets\common_cfg\xls\[summary.xml]task'!C4:C17,12,FALSE)=0,"",VLOOKUP(RC[-3],'E:\mowen_game\int\piassets\common_cfg\xls\[summary.xml]task'!C4:C17,12,FALSE)) -> 10012321 | E57: 25 | M57: 击败 | N57: =RC[-1]&"<"&LEFT(VLOOKUP(RC[-13],'E:\mowen_game\int\piassets\common_cfg\xls\[summary.xml]task'!R3C4:R100070C15,11,FALSE),LEN(VLOOKUP(RC[-13],'E:\mowen_game\int\piassets\common_cfg\xls\[summary.xml]task'!R3C4:R100070C15,11,FALSE))-1)&"|arg="&RC[-10]&">" -> 击败<虚空先知|arg=10012321>
A58: =task!R[6]C -> 10302027 | B58: =VLOOKUP(RC[-1],'E:\mowen_game\int\piassets\common_cfg\xls\[summary.xml]task'!R1C4:R65606C5,2,FALSE) -> 采集有物品 | C58: =VLOOKUP(RC[-2],'E:\mowen_game\int\piassets\common_cfg\xls\[summary.xml]task'!R1C4:R65606C17,11,FALSE) -> 晶体树枝2 | D58: =IF(VLOOKUP(RC[-3],'E:\mowen_game\int\piassets\common_cfg\xls\[summary.xml]task'!C4:C17,12,FALSE)=0,"",VLOOKUP(RC[-3],'E:\mowen_game\int\piassets\common_cfg\xls\[summary.xml]task'!C4:C17,12,FALSE)) -> 10012413 | E58: 5 | G58: 晶体树枝 | H58: 1012010 | I58: 100 | M58: 采集 | N58: =RC[-1]&"<"&LEFT(VLOOKUP(RC[-13],'E:\mowen_game\int\piassets\common_cfg\xls\[summary.xml]task'!R3C4:R100070C15,11,FALSE),LEN(VLOOKUP(RC[-13],'E:\mowen_game\int\piassets\common_cfg\xls\[summary.xml]task'!R3C4:R100070C15,11,FALSE))-1)&"|arg="&RC[-10]&">" -> 采集<晶体树枝|arg=10012413>
A59: =task!R[6]C -> 10302028 | B59: =VLOOKUP(RC[-1],'E:\mowen_game\int\piassets\common_cfg\xls\[summary.xml]task'!R1C4:R65606C5,2,FALSE) -> 采集有物品 | C59: =VLOOKUP(RC[-2],'E:\mowen_game\int\piassets\common_cfg\xls\[summary.xml]task'!R1C4:R65606C17,11,FALSE) -> 风暴水晶2 | D59: =IF(VLOOKUP(RC[-3],'E:\mowen_game\int\piassets\common_cfg\xls\[summary.xml]task'!C4:C17,12,FALSE)=0,"",VLOOKUP(RC[-3],'E:\mowen_game\int\piassets\common_cfg\xls\[summary.xml]task'!C4:C17,12,FALSE)) -> 10012414 | E59: 5 | G59: 风暴水晶 | H59: 1012011 | I59: 100 | M59: 收集 | N59: =RC[-1]&"<"&LEFT(VLOOKUP(RC[-13],'E:\mowen_game\int\piassets\common_cfg\xls\[summary.xml]task'!R3C4:R100070C15,11,FALSE),LEN(VLOOKUP(RC[-13],'E:\mowen_game\int\piassets\common_cfg\xls\[summary.xml]task'!R3C4:R100070C15,11,FALSE))-1)&"|arg="&RC[-10]&">" -> 收集<风暴水晶|arg=10012414>
A60: =task!R[6]C -> 10302041 | B60: =VLOOKUP(RC[-1],'E:\mowen_game\int\piassets\common_cfg\xls\[summary.xml]task'!R1C4:R65606C5,2,FALSE) -> 击杀npc | C60: =VLOOKUP(RC[-2],'E:\mowen_game\int\piassets\common_cfg\xls\[summary.xml]task'!R1C4:R65606C17,11,FALSE) -> 虚灵3 | D60: =IF(VLOOKUP(RC[-3],'E:\mowen_game\int\piassets\common_cfg\xls\[summary.xml]task'!C4:C17,12,FALSE)=0,"",VLOOKUP(RC[-3],'E:\mowen_game\int\piassets\common_cfg\xls\[summary.xml]task'!C4:C17,12,FALSE)) -> 10012340 | E60: 25 | M60: 击杀 | N60: =RC[-1]&"<"&LEFT(VLOOKUP(RC[-13],'E:\mowen_game\int\piassets\common_cfg\xls\[summary.xml]task'!R3C4:R100070C15,11,FALSE),LEN(VLOOKUP(RC[-13],'E:\mowen_game\int\piassets\common_cfg\xls\[summary.xml]task'!R3C4:R100070C15,11,FALSE))-1)&"|arg="&RC[-10]&">" -> 击杀<虚灵|arg=10012340>
A61: =task!R[6]C -> 10302042 | B61: =VLOOKUP(RC[-1],'E:\mowen_game\int\piassets\common_cfg\xls\[summary.xml]task'!R1C4:R65606C5,2,FALSE) -> 击杀npc | C61: =VLOOKUP(RC[-2],'E:\mowen_game\int\piassets\common_cfg\xls\[summary.xml]task'!R1C4:R65606C17,11,FALSE) -> 虚空先知3 | D61: =IF(VLOOKUP(RC[-3],'E:\mowen_game\int\piassets\common_cfg\xls\[summary.xml]task'!C4:C17,12,FALSE)=0,"",VLOOKUP(RC[-3],'E:\mowen_game\int\piassets\common_cfg\xls\[summary.xml]task'!C4:C17,12,FALSE)) -> 10012341 | E61: 25 | M61: 击败 | N61: =RC[-1]&"<"&LEFT(VLOOKUP(RC[-13],'E:\mowen_game\int\piassets\common_cfg\xls\[summary.xml]task'!R3C4:R100070C15,11,FALSE),LEN(VLOOKUP(RC[-13],'E:\mowen_game\int\piassets\common_cfg\xls\[summary.xml]task'!R3C4:R100070C15,11,FALSE))-1)&"|arg="&RC[-10]&">" -> 击败<虚空先知|arg=10012341>
A62: =task!R[6]C -> 10302043 | B62: =VLOOKUP(RC[-1],'E:\mowen_game\int\piassets\common_cfg\xls\[summary.xml]task'!R1C4:R65606C5,2,FALSE) -> 采集有物品 | C62: =VLOOKUP(RC[-2],'E:\mowen_game\int\piassets\common_cfg\xls\[summary.xml]task'!R1C4:R65606C17,11,FALSE) -> 晶体树枝3 | D62: =IF(VLOOKUP(RC[-3],'E:\mowen_game\int\piassets\common_cfg\xls\[summary.xml]task'!C4:C17,12,FALSE)=0,"",VLOOKUP(RC[-3],'E:\mowen_game\int\piassets\common_cfg\xls\[summary.xml]task'!C4:C17,12,FALSE)) -> 10012432 | E62: 5 | G62: 晶体树枝 | H62: 1012010 | I62: 100 | M62: 采集 | N62: =RC[-1]&"<"&LEFT(VLOOKUP(RC[-13],'E:\mowen_game\int\piassets\common_cfg\xls\[summary.xml]task'!R3C4:R100070C15,11,FALSE),LEN(VLOOKUP(RC[-13],'E:\mowen_game\int\piassets\common_cfg\xls\[summary.xml]task'!R3C4:R100070C15,11,FALSE))-1)&"|arg="&RC[-10]&">" -> 采集<晶体树枝|arg=10012432>
A63: =task!R[6]C -> 10302044 | B63: =VLOOKUP(RC[-1],'E:\mowen_game\int\piassets\common_cfg\xls\[summary.xml]task'!R1C4:R65606C5,2,FALSE) -> 采集有物品 | C63: =VLOOKUP(RC[-2],'E:\mowen_game\int\piassets\common_cfg\xls\[summary.xml]task'!R1C4:R65606C17,11,FALSE) -> 风暴水晶3 | D63: =IF(VLOOKUP(RC[-3],'E:\mowen_game\int\piassets\common_cfg\xls\[summary.xml]task'!C4:C17,12,FALSE)=0,"",VLOOKUP(RC[-3],'E:\mowen_game\int\piassets\common_cfg\xls\[summary.xml]task'!C4:C17,12,FALSE)) -> 10012433 | E63: 5 | G63: 风暴水晶 | H63: 1012011 | I63: 100 | M63: 收集 | N63: =RC[-1]&"<"&LEFT(VLOOKUP(RC[-13],'E:\mowen_game\int\piassets\common_cfg\xls\[summary.xml]task'!R3C4:R100070C15,11,FALSE),LEN(VLOOKUP(RC[-13],'E:\mowen_game\int\piassets\common_cfg\xls\[summary.xml]task'!R3C4:R100070C15,11,FALSE))-1)&"|arg="&RC[-10]&">" -> 收集<风暴水晶|arg=10012433>
A64: =task!R[6]C -> 10302051 | B64: =VLOOKUP(RC[-1],'E:\mowen_game\int\piassets\common_cfg\xls\[summary.xml]task'!R1C4:R65606C5,2,FALSE) -> 击杀npc | C64: =VLOOKUP(RC[-2],'E:\mowen_game\int\piassets\common_cfg\xls\[summary.xml]task'!R1C4:R65606C17,11,FALSE) -> 虚灵3 | D64: =IF(VLOOKUP(RC[-3],'E:\mowen_game\int\piassets\common_cfg\xls\[summary.xml]task'!C4:C17,12,FALSE)=0,"",VLOOKUP(RC[-3],'E:\mowen_game\int\piassets\common_cfg\xls\[summary.xml]task'!C4:C17,12,FALSE)) -> 10012340 | E64: 25 | M64: 击杀 | N64: =RC[-1]&"<"&LEFT(VLOOKUP(RC[-13],'E:\mowen_game\int\piassets\common_cfg\xls\[summary.xml]task'!R3C4:R100070C15,11,FALSE),LEN(VLOOKUP(RC[-13],'E:\mowen_game\int\piassets\common_cfg\xls\[summary.xml]task'!R3C4:R100070C15,11,FALSE))-1)&"|arg="&RC[-10]&">" -> 击杀<虚灵|arg=10012340>
A65: =task!R[6]C -> 10302052 | B65: =VLOOKUP(RC[-1],'E:\mowen_game\int\piassets\common_cfg\xls\[summary.xml]task'!R1C4:R65606C5,2,FALSE) -> 击杀npc | C65: =VLOOKUP(RC[-2],'E:\mowen_game\int\piassets\common_cfg\xls\[summary.xml]task'!R1C4:R65606C17,11,FALSE) -> 虚空先知3 | D65: =IF(VLOOKUP(RC[-3],'E:\mowen_game\int\piassets\common_cfg\xls\[summary.xml]task'!C4:C17,12,FALSE)=0,"",VLOOKUP(RC[-3],'E:\mowen_game\int\piassets\common_cfg\xls\[summary.xml]task'!C4:C17,12,FALSE)) -> 10012341 | E65: 25 | M65: 击败 | N65: =RC[-1]&"<"&LEFT(VLOOKUP(RC[-13],'E:\mowen_game\int\piassets\common_cfg\xls\[summary.xml]task'!R3C4:R100070C15,11,FALSE),LEN(VLOOKUP(RC[-13],'E:\mowen_game\int\piassets\common_cfg\xls\[summary.xml]task'!R3C4:R100070C15,11,FALSE))-1)&"|arg="&RC[-10]&">" -> 击败<虚空先知|arg=10012341>
A66: =task!R[6]C -> 10302053 | B66: =VLOOKUP(RC[-1],'E:\mowen_game\int\piassets\common_cfg\xls\[summary.xml]task'!R1C4:R65606C5,2,FALSE) -> 采集有物品 | C66: =VLOOKUP(RC[-2],'E:\mowen_game\int\piassets\common_cfg\xls\[summary.xml]task'!R1C4:R65606C17,11,FALSE) -> 晶体树枝3 | D66: =IF(VLOOKUP(RC[-3],'E:\mowen_game\int\piassets\common_cfg\xls\[summary.xml]task'!C4:C17,12,FALSE)=0,"",VLOOKUP(RC[-3],'E:\mowen_game\int\piassets\common_cfg\xls\[summary.xml]task'!C4:C17,12,FALSE)) -> 10012432 | E66: 5 | G66: 晶体树枝 | H66: 1012010 | I66: 100 | M66: 采集 | N66: =RC[-1]&"<"&LEFT(VLOOKUP(RC[-13],'E:\mowen_game\int\piassets\common_cfg\xls\[summary.xml]task'!R3C4:R100070C15,11,FALSE),LEN(VLOOKUP(RC[-13],'E:\mowen_game\int\piassets\common_cfg\xls\[summary.xml]task'!R3C4:R100070C15,11,FALSE))-1)&"|arg="&RC[-10]&">" -> 采集<晶体树枝|arg=10012432>
A67: =task!R[6]C -> 10302054 | B67: =VLOOKUP(RC[-1],'E:\mowen_game\int\piassets\common_cfg\xls\[summary.xml]task'!R1C4:R65606C5,2,FALSE) -> 采集有物品 | C67: =VLOOKUP(RC[-2],'E:\mowen_game\int\piassets\common_cfg\xls\[summary.xml]task'!R1C4:R65606C17,11,FALSE) -> 风暴水晶3 | D67: =IF(VLOOKUP(RC[-3],'E:\mowen_game\int\piassets\common_cfg\xls\[summary.xml]task'!C4:C17,12,FALSE)=0,"",VLOOKUP(RC[-3],'E:\mowen_game\int\piassets\common_cfg\xls\[summary.xml]task'!C4:C17,12,FALSE)) -> 10012433 | E67: 5 | G67: 风暴水晶 | H67: 1012011 | I67: 100 | M67: 收集 | N67: =RC[-1]&"<"&LEFT(VLOOKUP(RC[-13],'E:\mowen_game\int\piassets\common_cfg\xls\[summary.xml]task'!R3C4:R100070C15,11,FALSE),LEN(VLOOKUP(RC[-13],'E:\mowen_game\int\piassets\common_cfg\xls\[summary.xml]task'!R3C4:R100070C15,11,FALSE))-1)&"|arg="&RC[-10]&">" -> 收集<风暴水晶|arg=10012433>
A68: =task!R[6]C -> 10302061 | B68: =VLOOKUP(RC[-1],'E:\mowen_game\int\piassets\common_cfg\xls\[summary.xml]task'!R1C4:R65606C5,2,FALSE) -> 击杀npc | C68: =VLOOKUP(RC[-2],'E:\mowen_game\int\piassets\common_cfg\xls\[summary.xml]task'!R1C4:R65606C17,11,FALSE) -> 虚灵4 | D68: =IF(VLOOKUP(RC[-3],'E:\mowen_game\int\piassets\common_cfg\xls\[summary.xml]task'!C4:C17,12,FALSE)=0,"",VLOOKUP(RC[-3],'E:\mowen_game\int\piassets\common_cfg\xls\[summary.xml]task'!C4:C17,12,FALSE)) -> 10012360 | E68: 25 | M68: 击杀 | N68: =RC[-1]&"<"&LEFT(VLOOKUP(RC[-13],'E:\mowen_game\int\piassets\common_cfg\xls\[summary.xml]task'!R3C4:R100070C15,11,FALSE),LEN(VLOOKUP(RC[-13],'E:\mowen_game\int\piassets\common_cfg\xls\[summary.xml]task'!R3C4:R100070C15,11,FALSE))-1)&"|arg="&RC[-10]&">" -> 击杀<虚灵|arg=10012360>
A69: =task!R[6]C -> 10302062 | B69: =VLOOKUP(RC[-1],'E:\mowen_game\int\piassets\common_cfg\xls\[summary.xml]task'!R1C4:R65606C5,2,FALSE) -> 击杀npc | C69: =VLOOKUP(RC[-2],'E:\mowen_game\int\piassets\common_cfg\xls\[summary.xml]task'!R1C4:R65606C17,11,FALSE) -> 虚空先知4 | D69: =IF(VLOOKUP(RC[-3],'E:\mowen_game\int\piassets\common_cfg\xls\[summary.xml]task'!C4:C17,12,FALSE)=0,"",VLOOKUP(RC[-3],'E:\mowen_game\int\piassets\common_cfg\xls\[summary.xml]task'!C4:C17,12,FALSE)) -> 10012361 | E69: 25 | M69: 击败 | N69: =RC[-1]&"<"&LEFT(VLOOKUP(RC[-13],'E:\mowen_game\int\piassets\common_cfg\xls\[summary.xml]task'!R3C4:R100070C15,11,FALSE),LEN(VLOOKUP(RC[-13],'E:\mowen_game\int\piassets\common_cfg\xls\[summary.xml]task'!R3C4:R100070C15,11,FALSE))-1)&"|arg="&RC[-10]&">" -> 击败<虚空先知|arg=10012361>
A70: =task!R[6]C -> 10302063 | B70: =VLOOKUP(RC[-1],'E:\mowen_game\int\piassets\common_cfg\xls\[summary.xml]task'!R1C4:R65606C5,2,FALSE) -> 采集有物品 | C70: =VLOOKUP(RC[-2],'E:\mowen_game\int\piassets\common_cfg\xls\[summary.xml]task'!R1C4:R65606C17,11,FALSE) -> 晶体树枝4 | D70: =IF(VLOOKUP(RC[-3],'E:\mowen_game\int\piassets\common_cfg\xls\[summary.xml]task'!C4:C17,12,FALSE)=0,"",VLOOKUP(RC[-3],'E:\mowen_game\int\piassets\common_cfg\xls\[summary.xml]task'!C4:C17,12,FALSE)) -> 10012452 | E70: 5 | G70: 晶体树枝 | H70: 1012010 | I70: 100 | M70: 采集 | N70: =RC[-1]&"<"&LEFT(VLOOKUP(RC[-13],'E:\mowen_game\int\piassets\common_cfg\xls\[summary.xml]task'!R3C4:R100070C15,11,FALSE),LEN(VLOOKUP(RC[-13],'E:\mowen_game\int\piassets\common_cfg\xls\[summary.xml]task'!R3C4:R100070C15,11,FALSE))-1)&"|arg="&RC[-10]&">" -> 采集<晶体树枝|arg=10012452>
A71: =task!R[6]C -> 10302064 | B71: =VLOOKUP(RC[-1],'E:\mowen_game\int\piassets\common_cfg\xls\[summary.xml]task'!R1C4:R65606C5,2,FALSE) -> 采集有物品 | C71: =VLOOKUP(RC[-2],'E:\mowen_game\int\piassets\common_cfg\xls\[summary.xml]task'!R1C4:R65606C17,11,FALSE) -> 风暴水晶4 | D71: =IF(VLOOKUP(RC[-3],'E:\mowen_game\int\piassets\common_cfg\xls\[summary.xml]task'!C4:C17,12,FALSE)=0,"",VLOOKUP(RC[-3],'E:\mowen_game\int\piassets\common_cfg\xls\[summary.xml]task'!C4:C17,12,FALSE)) -> 10012453 | E71: 5 | G71: 风暴水晶 | H71: 1012011 | I71: 100 | M71: 收集 | N71: =RC[-1]&"<"&LEFT(VLOOKUP(RC[-13],'E:\mowen_game\int\piassets\common_cfg\xls\[summary.xml]task'!R3C4:R100070C15,11,FALSE),LEN(VLOOKUP(RC[-13],'E:\mowen_game\int\piassets\common_cfg\xls\[summary.xml]task'!R3C4:R100070C15,11,FALSE))-1)&"|arg="&RC[-10]&">" -> 收集<风暴水晶|arg=10012453>
A72: =task!R[6]C -> 10302071 | B72: =VLOOKUP(RC[-1],'E:\mowen_game\int\piassets\common_cfg\xls\[summary.xml]task'!R1C4:R65606C5,2,FALSE) -> 击杀npc | C72: =VLOOKUP(RC[-2],'E:\mowen_game\int\piassets\common_cfg\xls\[summary.xml]task'!R1C4:R65606C17,11,FALSE) -> 虚灵4 | D72: =IF(VLOOKUP(RC[-3],'E:\mowen_game\int\piassets\common_cfg\xls\[summary.xml]task'!C4:C17,12,FALSE)=0,"",VLOOKUP(RC[-3],'E:\mowen_game\int\piassets\common_cfg\xls\[summary.xml]task'!C4:C17,12,FALSE)) -> 10012360 | E72: 25 | M72: 击杀 | N72: =RC[-1]&"<"&LEFT(VLOOKUP(RC[-13],'E:\mowen_game\int\piassets\common_cfg\xls\[summary.xml]task'!R3C4:R100070C15,11,FALSE),LEN(VLOOKUP(RC[-13],'E:\mowen_game\int\piassets\common_cfg\xls\[summary.xml]task'!R3C4:R100070C15,11,FALSE))-1)&"|arg="&RC[-10]&">" -> 击杀<虚灵|arg=10012360>
A73: =task!R[6]C -> 10302072 | B73: =VLOOKUP(RC[-1],'E:\mowen_game\int\piassets\common_cfg\xls\[summary.xml]task'!R1C4:R65606C5,2,FALSE) -> 击杀npc | C73: =VLOOKUP(RC[-2],'E:\mowen_game\int\piassets\common_cfg\xls\[summary.xml]task'!R1C4:R65606C17,11,FALSE) -> 虚空先知4 | D73: =IF(VLOOKUP(RC[-3],'E:\mowen_game\int\piassets\common_cfg\xls\[summary.xml]task'!C4:C17,12,FALSE)=0,"",VLOOKUP(RC[-3],'E:\mowen_game\int\piassets\common_cfg\xls\[summary.xml]task'!C4:C17,12,FALSE)) -> 10012361 | E73: 25 | M73: 击败 | N73: =RC[-1]&"<"&LEFT(VLOOKUP(RC[-13],'E:\mowen_game\int\piassets\common_cfg\xls\[summary.xml]task'!R3C4:R100070C15,11,FALSE),LEN(VLOOKUP(RC[-13],'E:\mowen_game\int\piassets\common_cfg\xls\[summary.xml]task'!R3C4:R100070C15,11,FALSE))-1)&"|arg="&RC[-10]&">" -> 击败<虚空先知|arg=10012361>
A74: =task!R[6]C -> 10302073 | B74: =VLOOKUP(RC[-1],'E:\mowen_game\int\piassets\common_cfg\xls\[summary.xml]task'!R1C4:R65606C5,2,FALSE) -> 采集有物品 | C74: =VLOOKUP(RC[-2],'E:\mowen_game\int\piassets\common_cfg\xls\[summary.xml]task'!R1C4:R65606C17,11,FALSE) -> 晶体树枝4 | D74: =IF(VLOOKUP(RC[-3],'E:\mowen_game\int\piassets\common_cfg\xls\[summary.xml]task'!C4:C17,12,FALSE)=0,"",VLOOKUP(RC[-3],'E:\mowen_game\int\piassets\common_cfg\xls\[summary.xml]task'!C4:C17,12,FALSE)) -> 10012452 | E74: 5 | G74: 晶体树枝 | H74: 1012010 | I74: 100 | M74: 采集 | N74: =RC[-1]&"<"&LEFT(VLOOKUP(RC[-13],'E:\mowen_game\int\piassets\common_cfg\xls\[summary.xml]task'!R3C4:R100070C15,11,FALSE),LEN(VLOOKUP(RC[-13],'E:\mowen_game\int\piassets\common_cfg\xls\[summary.xml]task'!R3C4:R100070C15,11,FALSE))-1)&"|arg="&RC[-10]&">" -> 采集<晶体树枝|arg=10012452>
A75: =task!R[6]C -> 10302074 | B75: =VLOOKUP(RC[-1],'E:\mowen_game\int\piassets\common_cfg\xls\[summary.xml]task'!R1C4:R65606C5,2,FALSE) -> 采集有物品 | C75: =VLOOKUP(RC[-2],'E:\mowen_game\int\piassets\common_cfg\xls\[summary.xml]task'!R1C4:R65606C17,11,FALSE) -> 风暴水晶4 | D75: =IF(VLOOKUP(RC[-3],'E:\mowen_game\int\piassets\common_cfg\xls\[summary.xml]task'!C4:C17,12,FALSE)=0,"",VLOOKUP(RC[-3],'E:\mowen_game\int\piassets\common_cfg\xls\[summary.xml]task'!C4:C17,12,FALSE)) -> 10012453 | E75: 5 | G75: 风暴水晶 | H75: 1012011 | I75: 100 | M75: 收集 | N75: =RC[-1]&"<"&LEFT(VLOOKUP(RC[-13],'E:\mowen_game\int\piassets\common_cfg\xls\[summary.xml]task'!R3C4:R100070C15,11,FALSE),LEN(VLOOKUP(RC[-13],'E:\mowen_game\int\piassets\common_cfg\xls\[summary.xml]task'!R3C4:R100070C15,11,FALSE))-1)&"|arg="&RC[-10]&">" -> 收集<风暴水晶|arg=10012453>
A76: =task!R[6]C -> 10302081 | B76: =VLOOKUP(RC[-1],'E:\mowen_game\int\piassets\common_cfg\xls\[summary.xml]task'!R1C4:R65606C5,2,FALSE) -> 击杀npc | C76: =VLOOKUP(RC[-2],'E:\mowen_game\int\piassets\common_cfg\xls\[summary.xml]task'!R1C4:R65606C17,11,FALSE) -> 虚灵5 | D76: =IF(VLOOKUP(RC[-3],'E:\mowen_game\int\piassets\common_cfg\xls\[summary.xml]task'!C4:C17,12,FALSE)=0,"",VLOOKUP(RC[-3],'E:\mowen_game\int\piassets\common_cfg\xls\[summary.xml]task'!C4:C17,12,FALSE)) -> 10012480 | E76: 25 | M76: 击杀 | N76: =RC[-1]&"<"&LEFT(VLOOKUP(RC[-13],'E:\mowen_game\int\piassets\common_cfg\xls\[summary.xml]task'!R3C4:R100070C15,11,FALSE),LEN(VLOOKUP(RC[-13],'E:\mowen_game\int\piassets\common_cfg\xls\[summary.xml]task'!R3C4:R100070C15,11,FALSE))-1)&"|arg="&RC[-10]&">" -> 击杀<虚灵|arg=10012480>
A77: =task!R[6]C -> 10302082 | B77: =VLOOKUP(RC[-1],'E:\mowen_game\int\piassets\common_cfg\xls\[summary.xml]task'!R1C4:R65606C5,2,FALSE) -> 击杀npc | C77: =VLOOKUP(RC[-2],'E:\mowen_game\int\piassets\common_cfg\xls\[summary.xml]task'!R1C4:R65606C17,11,FALSE) -> 虚空先知5 | D77: =IF(VLOOKUP(RC[-3],'E:\mowen_game\int\piassets\common_cfg\xls\[summary.xml]task'!C4:C17,12,FALSE)=0,"",VLOOKUP(RC[-3],'E:\mowen_game\int\piassets\common_cfg\xls\[summary.xml]task'!C4:C17,12,FALSE)) -> 10012481 | E77: 25 | M77: 击败 | N77: =RC[-1]&"<"&LEFT(VLOOKUP(RC[-13],'E:\mowen_game\int\piassets\common_cfg\xls\[summary.xml]task'!R3C4:R100070C15,11,FALSE),LEN(VLOOKUP(RC[-13],'E:\mowen_game\int\piassets\common_cfg\xls\[summary.xml]task'!R3C4:R100070C15,11,FALSE))-1)&"|arg="&RC[-10]&">" -> 击败<虚空先知|arg=10012481>
A78: =task!R[6]C -> 10302083 | B78: =VLOOKUP(RC[-1],'E:\mowen_game\int\piassets\common_cfg\xls\[summary.xml]task'!R1C4:R65606C5,2,FALSE) -> 采集有物品 | C78: =VLOOKUP(RC[-2],'E:\mowen_game\int\piassets\common_cfg\xls\[summary.xml]task'!R1C4:R65606C17,11,FALSE) -> 晶体树枝5 | D78: =IF(VLOOKUP(RC[-3],'E:\mowen_game\int\piassets\common_cfg\xls\[summary.xml]task'!C4:C17,12,FALSE)=0,"",VLOOKUP(RC[-3],'E:\mowen_game\int\piassets\common_cfg\xls\[summary.xml]task'!C4:C17,12,FALSE)) -> 10012462 | E78: 5 | G78: 晶体树枝 | H78: 1012010 | I78: 100 | M78: 采集 | N78: =RC[-1]&"<"&LEFT(VLOOKUP(RC[-13],'E:\mowen_game\int\piassets\common_cfg\xls\[summary.xml]task'!R3C4:R100070C15,11,FALSE),LEN(VLOOKUP(RC[-13],'E:\mowen_game\int\piassets\common_cfg\xls\[summary.xml]task'!R3C4:R100070C15,11,FALSE))-1)&"|arg="&RC[-10]&">" -> 采集<晶体树枝|arg=10012462>
A79: =task!R[6]C -> 10302084 | B79: =VLOOKUP(RC[-1],'E:\mowen_game\int\piassets\common_cfg\xls\[summary.xml]task'!R1C4:R65606C5,2,FALSE) -> 采集有物品 | C79: =VLOOKUP(RC[-2],'E:\mowen_game\int\piassets\common_cfg\xls\[summary.xml]task'!R1C4:R65606C17,11,FALSE) -> 风暴水晶5 | D79: =IF(VLOOKUP(RC[-3],'E:\mowen_game\int\piassets\common_cfg\xls\[summary.xml]task'!C4:C17,12,FALSE)=0,"",VLOOKUP(RC[-3],'E:\mowen_game\int\piassets\common_cfg\xls\[summary.xml]task'!C4:C17,12,FALSE)) -> 10012463 | E79: 5 | G79: 风暴水晶 | H79: 1012011 | I79: 100 | M79: 收集 | N79: =RC[-1]&"<"&LEFT(VLOOKUP(RC[-13],'E:\mowen_game\int\piassets\common_cfg\xls\[summary.xml]task'!R3C4:R100070C15,11,FALSE),LEN(VLOOKUP(RC[-13],'E:\mowen_game\int\piassets\common_cfg\xls\[summary.xml]task'!R3C4:R100070C15,11,FALSE))-1)&"|arg="&RC[-10]&">" -> 收集<风暴水晶|arg=10012463>
A80: =task!R[6]C -> 10302091 | B80: =VLOOKUP(RC[-1],'E:\mowen_game\int\piassets\common_cfg\xls\[summary.xml]task'!R1C4:R65606C5,2,FALSE) -> 击杀npc | C80: =VLOOKUP(RC[-2],'E:\mowen_game\int\piassets\common_cfg\xls\[summary.xml]task'!R1C4:R65606C17,11,FALSE) -> 虚灵5 | D80: =IF(VLOOKUP(RC[-3],'E:\mowen_game\int\piassets\common_cfg\xls\[summary.xml]task'!C4:C17,12,FALSE)=0,"",VLOOKUP(RC[-3],'E:\mowen_game\int\piassets\common_cfg\xls\[summary.xml]task'!C4:C17,12,FALSE)) -> 10012480 | E80: 25 | M80: 击杀 | N80: =RC[-1]&"<"&LEFT(VLOOKUP(RC[-13],'E:\mowen_game\int\piassets\common_cfg\xls\[summary.xml]task'!R3C4:R100070C15,11,FALSE),LEN(VLOOKUP(RC[-13],'E:\mowen_game\int\piassets\common_cfg\xls\[summary.xml]task'!R3C4:R100070C15,11,FALSE))-1)&"|arg="&RC[-10]&">" -> 击杀<虚灵|arg=10012480>
A81: =task!R[6]C -> 10302092 | B81: =VLOOKUP(RC[-1],'E:\mowen_game\int\piassets\common_cfg\xls\[summary.xml]task'!R1C4:R65606C5,2,FALSE) -> 击杀npc | C81: =VLOOKUP(RC[-2],'E:\mowen_game\int\piassets\common_cfg\xls\[summary.xml]task'!R1C4:R65606C17,11,FALSE) -> 虚空先知5 | D81: =IF(VLOOKUP(RC[-3],'E:\mowen_game\int\piassets\common_cfg\xls\[summary.xml]task'!C4:C17,12,FALSE)=0,"",VLOOKUP(RC[-3],'E:\mowen_game\int\piassets\common_cfg\xls\[summary.xml]task'!C4:C17,12,FALSE)) -> 10012481 | E81: 25 | M81: 击败 | N81: =RC[-1]&"<"&LEFT(VLOOKUP(RC[-13],'E:\mowen_game\int\piassets\common_cfg\xls\[summary.xml]task'!R3C4:R100070C15,11,FALSE),LEN(VLOOKUP(RC[-13],'E:\mowen_game\int\piassets\common_cfg\xls\[summary.xml]task'!R3C4:R100070C15,11,FALSE))-1)&"|arg="&RC[-10]&">" -> 击败<虚空先知|arg=10012481>
A82: =task!R[6]C -> 10302093 | B82: =VLOOKUP(RC[-1],'E:\mowen_game\int\piassets\common_cfg\xls\[summary.xml]task'!R1C4:R65606C5,2,FALSE) -> 采集有物品 | C82: =VLOOKUP(RC[-2],'E:\mowen_game\int\piassets\common_cfg\xls\[summary.xml]task'!R1C4:R65606C17,11,FALSE) -> 晶体树枝5 | D82: =IF(VLOOKUP(RC[-3],'E:\mowen_game\int\piassets\common_cfg\xls\[summary.xml]task'!C4:C17,12,FALSE)=0,"",VLOOKUP(RC[-3],'E:\mowen_game\int\piassets\common_cfg\xls\[summary.xml]task'!C4:C17,12,FALSE)) -> 10012462 | E82: 5 | G82: 晶体树枝 | H82: 1012010 | I82: 100 | M82: 采集 | N82: =RC[-1]&"<"&LEFT(VLOOKUP(RC[-13],'E:\mowen_game\int\piassets\common_cfg\xls\[summary.xml]task'!R3C4:R100070C15,11,FALSE),LEN(VLOOKUP(RC[-13],'E:\mowen_game\int\piassets\common_cfg\xls\[summary.xml]task'!R3C4:R100070C15,11,FALSE))-1)&"|arg="&RC[-10]&">" -> 采集<晶体树枝|arg=10012462>
A83: =task!R[6]C -> 10302094 | B83: =VLOOKUP(RC[-1],'E:\mowen_game\int\piassets\common_cfg\xls\[summary.xml]task'!R1C4:R65606C5,2,FALSE) -> 采集有物品 | C83: =VLOOKUP(RC[-2],'E:\mowen_game\int\piassets\common_cfg\xls\[summary.xml]task'!R1C4:R65606C17,11,FALSE) -> 风暴水晶5 | D83: =IF(VLOOKUP(RC[-3],'E:\mowen_game\int\piassets\common_cfg\xls\[summary.xml]task'!C4:C17,12,FALSE)=0,"",VLOOKUP(RC[-3],'E:\mowen_game\int\piassets\common_cfg\xls\[summary.xml]task'!C4:C17,12,FALSE)) -> 10012463 | E83: 5 | G83: 风暴水晶 | H83: 1012011 | I83: 100 | M83: 收集 | N83: =RC[-1]&"<"&LEFT(VLOOKUP(RC[-13],'E:\mowen_game\int\piassets\common_cfg\xls\[summary.xml]task'!R3C4:R100070C15,11,FALSE),LEN(VLOOKUP(RC[-13],'E:\mowen_game\int\piassets\common_cfg\xls\[summary.xml]task'!R3C4:R100070C15,11,FALSE))-1)&"|arg="&RC[-10]&">" -> 收集<风暴水晶|arg=10012463>
A84: =task!R[6]C -> 10303001 | B84: =VLOOKUP(RC[-1],'E:\mowen_game\int\piassets\common_cfg\xls\[summary.xml]task'!R1C4:R65606C5,2,FALSE) -> 击杀npc | C84: =VLOOKUP(RC[-2],'E:\mowen_game\int\piassets\common_cfg\xls\[summary.xml]task'!R1C4:R65606C17,11,FALSE) -> 魔族飞蝠1 | D84: =IF(VLOOKUP(RC[-3],'E:\mowen_game\int\piassets\common_cfg\xls\[summary.xml]task'!C4:C17,12,FALSE)=0,"",VLOOKUP(RC[-3],'E:\mowen_game\int\piassets\common_cfg\xls\[summary.xml]task'!C4:C17,12,FALSE)) -> 10050500 | E84: 10 | M84: 击杀 | N84: =RC[-1]&"<"&LEFT(VLOOKUP(RC[-13],'E:\mowen_game\int\piassets\common_cfg\xls\[summary.xml]task'!R3C4:R100070C15,11,FALSE),LEN(VLOOKUP(RC[-13],'E:\mowen_game\int\piassets\common_cfg\xls\[summary.xml]task'!R3C4:R100070C15,11,FALSE))-1)&"|arg="&RC[-10]&">" -> 击杀<魔族飞蝠|arg=10050500>
A85: =task!R[6]C -> 10303002 | B85: =VLOOKUP(RC[-1],'E:\mowen_game\int\piassets\common_cfg\xls\[summary.xml]task'!R1C4:R65606C5,2,FALSE) -> 击杀npc | C85: =VLOOKUP(RC[-2],'E:\mowen_game\int\piassets\common_cfg\xls\[summary.xml]task'!R1C4:R65606C17,11,FALSE) -> 魔族巫师1 | D85: =IF(VLOOKUP(RC[-3],'E:\mowen_game\int\piassets\common_cfg\xls\[summary.xml]task'!C4:C17,12,FALSE)=0,"",VLOOKUP(RC[-3],'E:\mowen_game\int\piassets\common_cfg\xls\[summary.xml]task'!C4:C17,12,FALSE)) -> 10050501 | E85: 20 | M85: 击杀 | N85: =RC[-1]&"<"&LEFT(VLOOKUP(RC[-13],'E:\mowen_game\int\piassets\common_cfg\xls\[summary.xml]task'!R3C4:R100070C15,11,FALSE),LEN(VLOOKUP(RC[-13],'E:\mowen_game\int\piassets\common_cfg\xls\[summary.xml]task'!R3C4:R100070C15,11,FALSE))-1)&"|arg="&RC[-10]&">" -> 击杀<魔族巫师|arg=10050501>
A86: =task!R[6]C -> 10303003 | B86: =VLOOKUP(RC[-1],'E:\mowen_game\int\piassets\common_cfg\xls\[summary.xml]task'!R1C4:R65606C5,2,FALSE) -> 击杀npc | C86: =VLOOKUP(RC[-2],'E:\mowen_game\int\piassets\common_cfg\xls\[summary.xml]task'!R1C4:R65606C17,11,FALSE) -> 魔族先锋官1 | D86: =IF(VLOOKUP(RC[-3],'E:\mowen_game\int\piassets\common_cfg\xls\[summary.xml]task'!C4:C17,12,FALSE)=0,"",VLOOKUP(RC[-3],'E:\mowen_game\int\piassets\common_cfg\xls\[summary.xml]task'!C4:C17,12,FALSE)) -> 10050520 | E86: 1 | M86: 击杀 | N86: =RC[-1]&"<"&LEFT(VLOOKUP(RC[-13],'E:\mowen_game\int\piassets\common_cfg\xls\[summary.xml]task'!R3C4:R100070C15,11,FALSE),LEN(VLOOKUP(RC[-13],'E:\mowen_game\int\piassets\common_cfg\xls\[summary.xml]task'!R3C4:R100070C15,11,FALSE))-1)&"|arg="&RC[-10]&">" -> 击杀<魔族先锋官|arg=10050520>
A87: =task!R[6]C -> 10303021 | B87: =VLOOKUP(RC[-1],'E:\mowen_game\int\piassets\common_cfg\xls\[summary.xml]task'!R1C4:R65606C5,2,FALSE) -> 击杀npc | C87: =VLOOKUP(RC[-2],'E:\mowen_game\int\piassets\common_cfg\xls\[summary.xml]task'!R1C4:R65606C17,11,FALSE) -> 魔族飞蝠2 | D87: =IF(VLOOKUP(RC[-3],'E:\mowen_game\int\piassets\common_cfg\xls\[summary.xml]task'!C4:C17,12,FALSE)=0,"",VLOOKUP(RC[-3],'E:\mowen_game\int\piassets\common_cfg\xls\[summary.xml]task'!C4:C17,12,FALSE)) -> 10050530 | E87: 10 | M87: 击杀 | N87: =RC[-1]&"<"&LEFT(VLOOKUP(RC[-13],'E:\mowen_game\int\piassets\common_cfg\xls\[summary.xml]task'!R3C4:R100070C15,11,FALSE),LEN(VLOOKUP(RC[-13],'E:\mowen_game\int\piassets\common_cfg\xls\[summary.xml]task'!R3C4:R100070C15,11,FALSE))-1)&"|arg="&RC[-10]&">" -> 击杀<魔族飞蝠|arg=10050530>
A88: =task!R[6]C -> 10303022 | B88: =VLOOKUP(RC[-1],'E:\mowen_game\int\piassets\common_cfg\xls\[summary.xml]task'!R1C4:R65606C5,2,FALSE) -> 击杀npc | C88: =VLOOKUP(RC[-2],'E:\mowen_game\int\piassets\common_cfg\xls\[summary.xml]task'!R1C4:R65606C17,11,FALSE) -> 魔族巫师2 | D88: =IF(VLOOKUP(RC[-3],'E:\mowen_game\int\piassets\common_cfg\xls\[summary.xml]task'!C4:C17,12,FALSE)=0,"",VLOOKUP(RC[-3],'E:\mowen_game\int\piassets\common_cfg\xls\[summary.xml]task'!C4:C17,12,FALSE)) -> 10050531 | E88: 20 | M88: 击杀 | N88: =RC[-1]&"<"&LEFT(VLOOKUP(RC[-13],'E:\mowen_game\int\piassets\common_cfg\xls\[summary.xml]task'!R3C4:R100070C15,11,FALSE),LEN(VLOOKUP(RC[-13],'E:\mowen_game\int\piassets\common_cfg\xls\[summary.xml]task'!R3C4:R100070C15,11,FALSE))-1)&"|arg="&RC[-10]&">" -> 击杀<魔族巫师|arg=10050531>
A89: =task!R[6]C -> 10303023 | B89: =VLOOKUP(RC[-1],'E:\mowen_game\int\piassets\common_cfg\xls\[summary.xml]task'!R1C4:R65606C5,2,FALSE) -> 击杀npc | C89: =VLOOKUP(RC[-2],'E:\mowen_game\int\piassets\common_cfg\xls\[summary.xml]task'!R1C4:R65606C17,11,FALSE) -> 魔族守城官2 | D89: =IF(VLOOKUP(RC[-3],'E:\mowen_game\int\piassets\common_cfg\xls\[summary.xml]task'!C4:C17,12,FALSE)=0,"",VLOOKUP(RC[-3],'E:\mowen_game\int\piassets\common_cfg\xls\[summary.xml]task'!C4:C17,12,FALSE)) -> 10050539 | E89: 1 | M89: 击杀 | N89: =RC[-1]&"<"&LEFT(VLOOKUP(RC[-13],'E:\mowen_game\int\piassets\common_cfg\xls\[summary.xml]task'!R3C4:R100070C15,11,FALSE),LEN(VLOOKUP(RC[-13],'E:\mowen_game\int\piassets\common_cfg\xls\[summary.xml]task'!R3C4:R100070C15,11,FALSE))-1)&"|arg="&RC[-10]&">" -> 击杀<魔族守城官|arg=10050539>
A90: =task!R[6]C -> 10300351 | B90: =VLOOKUP(RC[-1],'E:\mowen_game\int\piassets\common_cfg\xls\[summary.xml]task'!R1C4:R65606C5,2,FALSE) -> 探索区域 | D90: =IF(VLOOKUP(RC[-3],'E:\mowen_game\int\piassets\common_cfg\xls\[summary.xml]task'!C4:C17,12,FALSE)=0,"",VLOOKUP(RC[-3],'E:\mowen_game\int\piassets\common_cfg\xls\[summary.xml]task'!C4:C17,12,FALSE)) ->  | E90: 1 | F90: {3001,{{255,248},{2,2}}} | M90: 前往 | N90: 前往<圣光城|arg=1212214>
A91: =task!R[6]C -> 10300352 | B91: 完成副本 | D91: =IF(VLOOKUP(RC[-3],'E:\mowen_game\int\piassets\common_cfg\xls\[summary.xml]task'!C4:C17,12,FALSE)=0,"",VLOOKUP(RC[-3],'E:\mowen_game\int\piassets\common_cfg\xls\[summary.xml]task'!C4:C17,12,FALSE)) ->  | E91: 30011 | F91: {3001,{{249,244},{4,4}}} | H91: 10300353 | M91: 进入 | N91: 前往<圣光城|arg=1212215>
A92: =task!R[7]C -> 10300354 | B92: =VLOOKUP(RC[-1],'E:\mowen_game\int\piassets\common_cfg\xls\[summary.xml]task'!R1C4:R65606C5,2,FALSE) -> 击杀npc | C92: =VLOOKUP(RC[-2],'E:\mowen_game\int\piassets\common_cfg\xls\[summary.xml]task'!R1C4:R65606C17,11,FALSE) -> 兵痞1 | D92: =IF(VLOOKUP(RC[-3],'E:\mowen_game\int\piassets\common_cfg\xls\[summary.xml]task'!C4:C17,12,FALSE)=0,"",VLOOKUP(RC[-3],'E:\mowen_game\int\piassets\common_cfg\xls\[summary.xml]task'!C4:C17,12,FALSE)) -> 10013140 | E92: 2 | M92: 击败 | N92: =RC[-1]&"<"&LEFT(VLOOKUP(RC[-13],'E:\mowen_game\int\piassets\common_cfg\xls\[summary.xml]task'!R3C4:R100070C15,11,FALSE),LEN(VLOOKUP(RC[-13],'E:\mowen_game\int\piassets\common_cfg\xls\[summary.xml]task'!R3C4:R100070C15,11,FALSE))-1)&"|arg="&RC[-10]&">" -> 击败<兵痞|arg=10013140>
A93: =task!R[8]C -> 10300356 | B93: 完成副本 | E93: 30012 | F93: {3001,{{211,112},{2,5}}} | H93: 10300357 | M93: 前往 | N93: 前往<议会大厦|arg=1212216>
A94: =task!R[9]C -> 10300358 | B94: =VLOOKUP(RC[-1],'E:\mowen_game\int\piassets\common_cfg\xls\[summary.xml]task'!R1C4:R65606C5,2,FALSE) -> 击杀npc | C94: =VLOOKUP(RC[-2],'E:\mowen_game\int\piassets\common_cfg\xls\[summary.xml]task'!R1C4:R65606C17,11,FALSE) -> 坚岩卫3 | D94: =IF(VLOOKUP(RC[-3],'E:\mowen_game\int\piassets\common_cfg\xls\[summary.xml]task'!C4:C17,12,FALSE)=0,"",VLOOKUP(RC[-3],'E:\mowen_game\int\piassets\common_cfg\xls\[summary.xml]task'!C4:C17,12,FALSE)) -> 10013141 | E94: 2 | M94: 击败 | N94: =RC[-1]&"<"&LEFT(VLOOKUP(RC[-13],'E:\mowen_game\int\piassets\common_cfg\xls\[summary.xml]task'!R3C4:R100070C15,11,FALSE),LEN(VLOOKUP(RC[-13],'E:\mowen_game\int\piassets\common_cfg\xls\[summary.xml]task'!R3C4:R100070C15,11,FALSE))-1)&"|arg="&RC[-10]&">" -> 击败<坚岩卫|arg=10013141>
A95: =task!R[11]C -> 10300361 | B95: =VLOOKUP(RC[-1],'E:\mowen_game\int\piassets\common_cfg\xls\[summary.xml]task'!R1C4:R65606C5,2,FALSE) -> 提升等级 | E95: 24 | M95: 提升 | N95: 提升<角色等级至24级|arg==expedition,type=openUI>
A96: =task!R[11]C -> 10300362 | B96: =VLOOKUP(RC[-1],'E:\mowen_game\int\piassets\common_cfg\xls\[summary.xml]task'!R1C4:R65606C5,2,FALSE) -> 击杀npc | C96: =VLOOKUP(RC[-2],'E:\mowen_game\int\piassets\common_cfg\xls\[summary.xml]task'!R1C4:R65606C17,11,FALSE) -> 紫兰魔鹰1 | D96: =IF(VLOOKUP(RC[-3],'E:\mowen_game\int\piassets\common_cfg\xls\[summary.xml]task'!C4:C17,12,FALSE)=0,"",VLOOKUP(RC[-3],'E:\mowen_game\int\piassets\common_cfg\xls\[summary.xml]task'!C4:C17,12,FALSE)) -> 10011201 | E96: 20 | M96: 击败 | N96: =RC[-1]&"<"&LEFT(VLOOKUP(RC[-13],'E:\mowen_game\int\piassets\common_cfg\xls\[summary.xml]task'!R3C4:R100070C15,11,FALSE),LEN(VLOOKUP(RC[-13],'E:\mowen_game\int\piassets\common_cfg\xls\[summary.xml]task'!R3C4:R100070C15,11,FALSE))-1)&"|arg="&RC[-10]&">" -> 击败<紫兰魔鹰|arg=10011201>
A97: =task!R[11]C -> 10300363 | B97: 完成副本 | D97: =IF(VLOOKUP(RC[-3],'E:\mowen_game\int\piassets\common_cfg\xls\[summary.xml]task'!C4:C17,12,FALSE)=0,"",VLOOKUP(RC[-3],'E:\mowen_game\int\piassets\common_cfg\xls\[summary.xml]task'!C4:C17,12,FALSE)) ->  | E97: 10061 | F97: {1006,{{76,112},{5,2}}} | H97: 10300364 | M97: 搜寻 | N97: 搜寻<鼠王|arg=1212217>
A98: =task!R[11]C -> 10300364 | B98: =VLOOKUP(RC[-1],'E:\mowen_game\int\piassets\common_cfg\xls\[summary.xml]task'!R1C4:R65606C5,2,FALSE) -> 击杀npc | C98: =VLOOKUP(RC[-2],'E:\mowen_game\int\piassets\common_cfg\xls\[summary.xml]task'!R1C4:R65606C17,11,FALSE) -> 灾厄巨鼠1 | D98: [10013142,10013144] | E98: 5 | M98: 击杀 | N98: 击杀<灾厄巨鼠和鼠魔|arg=10013142>
A99: =task!R[11]C -> 10300365 | B99: =VLOOKUP(RC[-1],'E:\mowen_game\int\piassets\common_cfg\xls\[summary.xml]task'!R1C4:R65606C5,2,FALSE) -> 采集无物品 | C99: =VLOOKUP(RC[-2],'E:\mowen_game\int\piassets\common_cfg\xls\[summary.xml]task'!R1C4:R65606C17,11,FALSE) -> 蓝魂草1 | D99: =IF(VLOOKUP(RC[-3],'E:\mowen_game\int\piassets\common_cfg\xls\[summary.xml]task'!C4:C17,12,FALSE)=0,"",VLOOKUP(RC[-3],'E:\mowen_game\int\piassets\common_cfg\xls\[summary.xml]task'!C4:C17,12,FALSE)) -> 10013055 | E99: 1 | G99: 蓝魂草 | H99: 1012100 | M99: 采集 | N99: =RC[-1]&"<"&LEFT(VLOOKUP(RC[-13],'E:\mowen_game\int\piassets\common_cfg\xls\[summary.xml]task'!R3C4:R100070C15,11,FALSE),LEN(VLOOKUP(RC[-13],'E:\mowen_game\int\piassets\common_cfg\xls\[summary.xml]task'!R3C4:R100070C15,11,FALSE))-1)&"|arg="&RC[-10]&">" -> 采集<蓝魂草|arg=10013055>
A100: =task!R[11]C -> 10300366 | B100: =VLOOKUP(RC[-1],'E:\mowen_game\int\piassets\common_cfg\xls\[summary.xml]task'!R1C4:R65606C5,2,FALSE) -> 使用无物品 | D100: =IF(VLOOKUP(RC[-3],'E:\mowen_game\int\piassets\common_cfg\xls\[summary.xml]task'!C4:C17,12,FALSE)=0,"",VLOOKUP(RC[-3],'E:\mowen_game\int\piassets\common_cfg\xls\[summary.xml]task'!C4:C17,12,FALSE)) ->  | E100: 1 | F100: {10061,{{93,94},{5,5}}} | G100: 蓝魂草 | H100: 1012100 | I100: 6 | M100: 治疗 | N100: 治疗<大魔导师|arg=1212218>
A101: =task!R[11]C -> 10300367 | B101: =VLOOKUP(RC[-1],'E:\mowen_game\int\piassets\common_cfg\xls\[summary.xml]task'!R1C4:R65606C5,2,FALSE) -> 击杀npc收集物品 | C101: =VLOOKUP(RC[-2],'E:\mowen_game\int\piassets\common_cfg\xls\[summary.xml]task'!R1C4:R65606C17,11,FALSE) -> 狮虎兽1 | D101: =IF(VLOOKUP(RC[-3],'E:\mowen_game\int\piassets\common_cfg\xls\[summary.xml]task'!C4:C17,12,FALSE)=0,"",VLOOKUP(RC[-3],'E:\mowen_game\int\piassets\common_cfg\xls\[summary.xml]task'!C4:C17,12,FALSE)) -> 10011204 | E101: 3 | G101: 狮虎兽牙 | H101: 1012102 | I101: 30 | M101: 收集 | N101: 收集<狮虎兽牙|arg=10011204>
A102: =task!R[11]C -> 10300368 | B102: =VLOOKUP(RC[-1],'E:\mowen_game\int\piassets\common_cfg\xls\[summary.xml]task'!R1C4:R65606C5,2,FALSE) -> 提升等级 | E102: 29 | M102: 提升 | N102: 提升<角色等级至29级|arg=10012395>
A103: =task!R[11]C -> 10300369 | B103: =VLOOKUP(RC[-1],'E:\mowen_game\int\piassets\common_cfg\xls\[summary.xml]task'!R1C4:R65606C5,2,FALSE) -> 使用有物品 | D103: =IF(VLOOKUP(RC[-3],'E:\mowen_game\int\piassets\common_cfg\xls\[summary.xml]task'!C4:C17,12,FALSE)=0,"",VLOOKUP(RC[-3],'E:\mowen_game\int\piassets\common_cfg\xls\[summary.xml]task'!C4:C17,12,FALSE)) ->  | E103: 1 | F103: {1006,{{140,182},{3,3}}} | G103: 狮虎兽牙 | H103: 1012102 | I103: 2 | M103: 布置 | N103: 布置<阵法|arg=1212219>
A104: =task!R[11]C -> 10300370 | B104: =VLOOKUP(RC[-1],'E:\mowen_game\int\piassets\common_cfg\xls\[summary.xml]task'!R1C4:R65606C5,2,FALSE) -> 使用有物品 | D104: =IF(VLOOKUP(RC[-3],'E:\mowen_game\int\piassets\common_cfg\xls\[summary.xml]task'!C4:C17,12,FALSE)=0,"",VLOOKUP(RC[-3],'E:\mowen_game\int\piassets\common_cfg\xls\[summary.xml]task'!C4:C17,12,FALSE)) ->  | E104: 1 | F104: {1006,{{146,181},{3,3}}} | G104: 狮虎兽牙 | H104: 1012102 | I104: 2 | M104: 加强 | N104: 加强<阵法|arg=1212220>
A105: =task!R[11]C -> 10300371 | B105: =VLOOKUP(RC[-1],'E:\mowen_game\int\piassets\common_cfg\xls\[summary.xml]task'!R1C4:R65606C5,2,FALSE) -> 使用有物品 | D105: =IF(VLOOKUP(RC[-3],'E:\mowen_game\int\piassets\common_cfg\xls\[summary.xml]task'!C4:C17,12,FALSE)=0,"",VLOOKUP(RC[-3],'E:\mowen_game\int\piassets\common_cfg\xls\[summary.xml]task'!C4:C17,12,FALSE)) ->  | E105: 1 | F105: {1006,{{151,182},{3,3}}} | G105: 狮虎兽牙 | H105: 1012102 | I105: 2 | M105: 启动 | N105: 启动<阵法|arg=1212221>
A106: =task!R[11]C -> 10300372 | B106: 完成副本 | D106: =IF(VLOOKUP(RC[-3],'E:\mowen_game\int\piassets\common_cfg\xls\[summary.xml]task'!C4:C17,12,FALSE)=0,"",VLOOKUP(RC[-3],'E:\mowen_game\int\piassets\common_cfg\xls\[summary.xml]task'!C4:C17,12,FALSE)) ->  | E106: 10062 | F106: {1006,{{136,171},{5,2}}} | H106: 10300373 | M106: 迫近 | N106: 迫近<结界|arg=1212222>
A107: =task!R[11]C -> 10300373 | B107: =VLOOKUP(RC[-1],'E:\mowen_game\int\piassets\common_cfg\xls\[summary.xml]task'!R1C4:R65606C5,2,FALSE) -> 击杀npc | C107: =VLOOKUP(RC[-2],'E:\mowen_game\int\piassets\common_cfg\xls\[summary.xml]task'!R1C4:R65606C17,11,FALSE) -> 结界1 | D107: =IF(VLOOKUP(RC[-3],'E:\mowen_game\int\piassets\common_cfg\xls\[summary.xml]task'!C4:C17,12,FALSE)=0,"",VLOOKUP(RC[-3],'E:\mowen_game\int\piassets\common_cfg\xls\[summary.xml]task'!C4:C17,12,FALSE)) -> 10013143 | E107: 1 | M107: 击碎 | N107: =RC[-1]&"<"&LEFT(VLOOKUP(RC[-13],'E:\mowen_game\int\piassets\common_cfg\xls\[summary.xml]task'!R3C4:R100070C15,11,FALSE),LEN(VLOOKUP(RC[-13],'E:\mowen_game\int\piassets\common_cfg\xls\[summary.xml]task'!R3C4:R100070C15,11,FALSE))-1)&"|arg="&RC[-10]&">" -> 击碎<结界|arg=10013143>
A108: =task!R[15]C -> 10301301 | B108: =VLOOKUP(RC[-1],'E:\mowen_game\int\piassets\common_cfg\xls\[summary.xml]task'!R1C4:R65606C5,2,FALSE) -> 支线任务 | D108: {refining,any} | E108: 3 | M108: 完成 | N108: 完成<3次属性洗炼|arg=refining,type=openUI>
A109: =task!R[15]C -> 10301302 | B109: =VLOOKUP(RC[-1],'E:\mowen_game\int\piassets\common_cfg\xls\[summary.xml]task'!R1C4:R65606C5,2,FALSE) -> 支线任务 | D109: {expedition,1,1} | M109: 通关 | N109: 通关<魔界远征第1关|arg=expedition,type=openUI>
A110: =task!R[15]C -> 10301303 | B110: =VLOOKUP(RC[-1],'E:\mowen_game\int\piassets\common_cfg\xls\[summary.xml]task'!R1C4:R65606C5,2,FALSE) -> 支线任务 | D110: cr_incident | E110: 4 | M110: 参与 | N110: 参与<4次跨服事件|arg=10012395,type=incident>
A111: =task!R[15]C -> 10301304 | B111: =VLOOKUP(RC[-1],'E:\mowen_game\int\piassets\common_cfg\xls\[summary.xml]task'!R1C4:R65606C5,2,FALSE) -> 支线任务 | D111: join_army | M111: 加入 | N111: 加入<军团|arg=join_army,type=openUI>
A112: =task!R[15]C -> 10300381 | B112: =VLOOKUP(RC[-1],'E:\mowen_game\int\piassets\common_cfg\xls\[summary.xml]task'!R1C4:R65606C5,2,FALSE) -> 提升等级 | E112: 33 | M112: 提升 | N112: 提升<角色等级至33级|arg=daily_activity,type=openUI>
A113: =task!R[17]C -> 10300384 | B113: =VLOOKUP(RC[-1],'E:\mowen_game\int\piassets\common_cfg\xls\[summary.xml]task'!R1C4:R65606C5,2,FALSE) -> 提升等级 | E113: 34 | M113: 提升 | N113: 提升<角色等级至34级|arg=daily_activity,type=openUI>
A114: =task!R[19]C -> 10300387 | B114: =VLOOKUP(RC[-1],'E:\mowen_game\int\piassets\common_cfg\xls\[summary.xml]task'!R1C4:R65606C5,2,FALSE) -> 提升等级 | E114: 40 | M114: 提升 | N114: 提升<角色等级至40级|arg=daily_activity,type=openUI>
A115: =task!R[21]C -> 10300390 | B115: =VLOOKUP(RC[-1],'E:\mowen_game\int\piassets\common_cfg\xls\[summary.xml]task'!R1C4:R65606C5,2,FALSE) -> 提升等级 | E115: 50 | M115: 提升 | N115: 提升<角色等级至50级|arg=daily_activity,type=openUI>
A116: =task!R[23]C -> 10300393 | B116: =VLOOKUP(RC[-1],'E:\mowen_game\int\piassets\common_cfg\xls\[summary.xml]task'!R1C4:R65606C5,2,FALSE) -> 提升等级 | E116: 55 | M116: 提升 | N116: 提升<角色等级至55级|arg=daily_activity,type=openUI>
A117: =task!R[25]C -> 10301305 | B117: =VLOOKUP(RC[-1],'E:\mowen_game\int\piassets\common_cfg\xls\[summary.xml]task'!R1C4:R65606C5,2,FALSE) -> 支线任务 | D117: {proving_ground,1} | E117: 1 | M117: 完成 | N117: 完成<领主试炼|arg=proving_ground,type=openUI>
A118: =task!R[25]C -> 10301306 | B118: =VLOOKUP(RC[-1],'E:\mowen_game\int\piassets\common_cfg\xls\[summary.xml]task'!R1C4:R65606C5,2,FALSE) -> 支线任务 | D118: {daily_activity,100} | M118: 达成 | N118: 达成<100活跃度|arg=daily_activity,type=openUI>
A119: =task!R[25]C -> 10301307 | B119: =VLOOKUP(RC[-1],'E:\mowen_game\int\piassets\common_cfg\xls\[summary.xml]task'!R1C4:R65606C5,2,FALSE) -> 支线任务 | D119: {rising,any,3} | M119: 提升 | N119: 提升<装备星级至+3|arg=rising,type=openUI>
A120: =task!R[25]C -> 10301308 | B120: =VLOOKUP(RC[-1],'E:\mowen_game\int\piassets\common_cfg\xls\[summary.xml]task'!R1C4:R65606C5,2,FALSE) -> 支线任务 | D120: {gem,5,2} | M120: 镶嵌 | N120: 镶嵌<5颗2级宝石|arg=gem,type=openUI>
A121: =task!R[25]C -> 10301309 | B121: =VLOOKUP(RC[-1],'E:\mowen_game\int\piassets\common_cfg\xls\[summary.xml]task'!R1C4:R65606C5,2,FALSE) -> 支线任务 | D121: {equip_bs,1,1} | M121: 镶嵌 | N121: 镶嵌<绿色战魂|arg=equip_bs,type=openUI>

Sheet: rewardTask
A1: 任务编号 | B1: 描述名称 | C1: 条件类型 | D1: 任务名称 | E1: 对话框显示名称 | F1: 名称参数 | G1: 前置任务 | H1: 接任务NPC | I1: 交任务NPC | J1: 自动接取后续任务 | K1: 等级下限 | L1: 等级上限 | M1: 接取后自动化 | N1: 完成后自动化 | O1: 任务类型 | P1: 接取任务传送 | Q1: 任务权重 | R1: 可放弃 | S1: 放弃不可重接 | T1: 任务不可见 | U1: 环任务类型 | V1: 父任务id | W1: 子任务列表 | X1: 完成后可重接 | Y1: 阵营 | Z1: 接取任务操作 | AA1: 放弃任务操作 | AB1: 提交任务操作 | AC1: 可接任务描述 | AD1: 任务图标 | AE1: 接受任务对话辅助列 | AF1: 接受任务对话 | AG1: 未完成对话 | AH1: 未完成对话参数 | AI1: 完成任务对话 | AJ1: 完成任务对话参数 | AK1: 完成任务对话1 | AL1: 提交任务提示辅助列 | AM1: 提交任务提示 | AN1: 任务等级 | AO1: 任务品质 | AP1: 金币奖励 | AQ1: 经验奖励 | AR1: 物品奖励 | AS1: fuz | AT1: 完成任务是否播放特效（0不播，默认播）
A2: sid | D2: name | E2: dialogName | F2: nameArg | G2: task_completed | H2: get_npc | I2: complete_npc | J2: succeed | K2: level_min | L2: level_max | M2: accept_auto | N2: complete_auto | O2: task_type | P2: scene_pos | Q2: task_weight | R2: can_giveup | S2: giveup_retained | T2: invisible | U2: round_type | V2: father_sid | W2: sidlist | X2: repeated_task | Y2: camp | Z2: get_mfa | AA2: giveup_mfa | AB2: succeed_mfa | AC2: accept_info | AD2: describe | AF2: get_talk | AG2: handle_talk | AH2: handle_arg | AI2: complete_talk | AJ2: complete_talk_arg | AK2: complete_talk1 | AM2: submit_guide | AN2: priority | AO2: quality | AP2: gold_award | AQ2: experience_award | AR2: items_award | AT2: showFlag
A3: 10304001 | B3: 癫狂树灵 | D3: 悬赏任务 | E3: 悬赏任务（剩余<span color:FFE21B1B>{0}</span>次） | F3: ["getTaskTimes",[10304000]] | H3: 10010200 | I3: 10010200 | J3: [] | K3: 31 | L3: 100 | M3: 0 | N3: 0 | O3: 日常 | Q3: 2 | U3: son | V3: 10304000 | AC3: 击杀45只癫狂树灵(31级) | AD3: reward_icon.tx_kuangnuzhanshi | AG3: 5 | AH3: ="["&RC[11]&","""&RC[-32]&"""]" -> [45,"癫狂树灵"] | AI3: 3 | AJ3: [["getTaskTimes",[10304000]]] | AK3: 4 | AL3: 找<佣兵长马塞尔|arg=10010200>领取奖励 | AM3: "找<佣兵长马塞尔|arg=10010200>领取奖励" | AN3: 1 | AO3: 0 | AQ3: 6900 | AS3: 45
A4: 10304002 | B4: 癫狂树灵 | D4: 悬赏任务 | E4: 悬赏任务（剩余<span color:FFE21B1B>{0}</span>次） | F4: ["getTaskTimes",[10304000]] | H4: 10010200 | I4: 10010200 | J4: [] | K4: 31 | L4: 100 | M4: 0 | N4: 0 | O4: 日常 | Q4: 2 | U4: son | V4: 10304000 | AC4: 击杀50只癫狂树灵(31级) | AD4: reward_icon.tx_kuangnuzhanshi | AG4: 5 | AH4: ="["&RC[11]&","""&RC[-32]&"""]" -> [50,"癫狂树灵"] | AI4: 3 | AJ4: [["getTaskTimes",[10304000]]] | AK4: 4 | AL4: 找<佣兵长马塞尔|arg=10010200>领取奖励 | AM4: "找<佣兵长马塞尔|arg=10010200>领取奖励" | AN4: 1 | AO4: 1 | AQ4: 9200 | AS4: 50
A5: 10304003 | B5: 癫狂树灵 | D5: 悬赏任务 | E5: 悬赏任务（剩余<span color:FFE21B1B>{0}</span>次） | F5: ["getTaskTimes",[10304000]] | H5: 10010200 | I5: 10010200 | J5: [] | K5: 31 | L5: 100 | M5: 0 | N5: 0 | O5: 日常 | Q5: 2 | U5: son | V5: 10304000 | AC5: 击杀55只癫狂树灵(31级) | AD5: reward_icon.tx_kuangnuzhanshi | AG5: 5 | AH5: ="["&RC[11]&","""&RC[-32]&"""]" -> [55,"癫狂树灵"] | AI5: 3 | AJ5: [["getTaskTimes",[10304000]]] | AK5: 4 | AL5: 找<佣兵长马塞尔|arg=10010200>领取奖励 | AM5: "找<佣兵长马塞尔|arg=10010200>领取奖励" | AN5: 1 | AO5: 2 | AQ5: 18400 | AR5: {enhance_money,20} | AS5: 55
A6: 10304004 | B6: 癫狂树灵 | D6: 悬赏任务 | E6: 悬赏任务（剩余<span color:FFE21B1B>{0}</span>次） | F6: ["getTaskTimes",[10304000]] | H6: 10010200 | I6: 10010200 | J6: [] | K6: 31 | L6: 100 | M6: 0 | N6: 0 | O6: 日常 | Q6: 2 | U6: son | V6: 10304000 | AC6: 击杀60只癫狂树灵(31级) | AD6: reward_icon.tx_kuangnuzhanshi | AG6: 5 | AH6: ="["&RC[11]&","""&RC[-32]&"""]" -> [60,"癫狂树灵"] | AI6: 3 | AJ6: [["getTaskTimes",[10304000]]] | AK6: 4 | AL6: 找<佣兵长马塞尔|arg=10010200>领取奖励 | AM6: "找<佣兵长马塞尔|arg=10010200>领取奖励" | AN6: 1 | AO6: 3 | AQ6: 36700 | AR6: {enhance_money,40},{item,{110059001,1}} | AS6: 60
A7: 10304005 | B7: 癫狂树灵 | D7: 悬赏任务 | E7: 悬赏任务（剩余<span color:FFE21B1B>{0}</span>次） | F7: ["getTaskTimes",[10304000]] | H7: 10010200 | I7: 10010200 | J7: [] | K7: 31 | L7: 100 | M7: 0 | N7: 0 | O7: 日常 | Q7: 2 | U7: son | V7: 10304000 | AC7: 击杀65只癫狂树灵(31级) | AD7: reward_icon.tx_kuangnuzhanshi | AG7: 5 | AH7: ="["&RC[11]&","""&RC[-32]&"""]" -> [65,"癫狂树灵"] | AI7: 3 | AJ7: [["getTaskTimes",[10304000]]] | AK7: 4 | AL7: 找<佣兵长马塞尔|arg=10010200>领取奖励 | AM7: "找<佣兵长马塞尔|arg=10010200>领取奖励" | AN7: 1 | AO7: 4 | AQ7: 55100 | AR7: {enhance_money,80},{item,{110059001,1}} | AS7: 65
A8: 10304006 | B8: 堕落精灵 | D8: 悬赏任务 | E8: 悬赏任务（剩余<span color:FFE21B1B>{0}</span>次） | F8: ["getTaskTimes",[10304000]] | H8: 10010200 | I8: 10010200 | J8: [] | K8: 39 | L8: 100 | M8: 0 | N8: 0 | O8: 日常 | Q8: 2 | U8: son | V8: 10304000 | AC8: 击杀45只堕落精灵(39级) | AD8: reward_icon.tx_anheijinglinchihou | AG8: 5 | AH8: ="["&RC[11]&","""&RC[-32]&"""]" -> [45,"堕落精灵"] | AI8: 3 | AJ8: [["getTaskTimes",[10304000]]] | AK8: 4 | AL8: 找<佣兵长马塞尔|arg=10010200>领取奖励 | AM8: "找<佣兵长马塞尔|arg=10010200>领取奖励" | AN8: 1 | AO8: 0 | AQ8: 8200 | AS8: 45
A9: 10304007 | B9: 堕落精灵 | D9: 悬赏任务 | E9: 悬赏任务（剩余<span color:FFE21B1B>{0}</span>次） | F9: ["getTaskTimes",[10304000]] | H9: 10010200 | I9: 10010200 | J9: [] | K9: 39 | L9: 100 | M9: 0 | N9: 0 | O9: 日常 | Q9: 2 | U9: son | V9: 10304000 | AC9: 击杀50只堕落精灵(39级) | AD9: reward_icon.tx_anheijinglinchihou | AG9: 5 | AH9: ="["&RC[11]&","""&RC[-32]&"""]" -> [50,"堕落精灵"] | AI9: 3 | AJ9: [["getTaskTimes",[10304000]]] | AK9: 4 | AL9: 找<佣兵长马塞尔|arg=10010200>领取奖励 | AM9: "找<佣兵长马塞尔|arg=10010200>领取奖励" | AN9: 1 | AO9: 1 | AQ9: 10900 | AS9: 50
A10: 10304008 | B10: 堕落精灵 | D10: 悬赏任务 | E10: 悬赏任务（剩余<span color:FFE21B1B>{0}</span>次） | F10: ["getTaskTimes",[10304000]] | H10: 10010200 | I10: 10010200 | J10: [] | K10: 39 | L10: 100 | M10: 0 | N10: 0 | O10: 日常 | Q10: 2 | U10: son | V10: 10304000 | AC10: 击杀55只堕落精灵(39级) | AD10: reward_icon.tx_anheijinglinchihou | AG10: 5 | AH10: ="["&RC[11]&","""&RC[-32]&"""]" -> [55,"堕落精灵"] | AI10: 3 | AJ10: [["getTaskTimes",[10304000]]] | AK10: 4 | AL10: 找<佣兵长马塞尔|arg=10010200>领取奖励 | AM10: "找<佣兵长马塞尔|arg=10010200>领取奖励" | AN10: 1 | AO10: 2 | AQ10: 21800 | AR10: {enhance_money,20} | AS10: 55
A11: 10304009 | B11: 堕落精灵 | D11: 悬赏任务 | E11: 悬赏任务（剩余<span color:FFE21B1B>{0}</span>次） | F11: ["getTaskTimes",[10304000]] | H11: 10010200 | I11: 10010200 | J11: [] | K11: 39 | L11: 100 | M11: 0 | N11: 0 | O11: 日常 | Q11: 2 | U11: son | V11: 10304000 | AC11: 击杀60只堕落精灵(39级) | AD11: reward_icon.tx_anheijinglinchihou | AG11: 5 | AH11: ="["&RC[11]&","""&RC[-32]&"""]" -> [60,"堕落精灵"] | AI11: 3 | AJ11: [["getTaskTimes",[10304000]]] | AK11: 4 | AL11: 找<佣兵长马塞尔|arg=10010200>领取奖励 | AM11: "找<佣兵长马塞尔|arg=10010200>领取奖励" | AN11: 1 | AO11: 3 | AQ11: 43600 | AR11: {enhance_money,40},{item,{110059001,1}} | AS11: 60
A12: 10304010 | B12: 堕落精灵 | D12: 悬赏任务 | E12: 悬赏任务（剩余<span color:FFE21B1B>{0}</span>次） | F12: ["getTaskTimes",[10304000]] | H12: 10010200 | I12: 10010200 | J12: [] | K12: 39 | L12: 100 | M12: 0 | N12: 0 | O12: 日常 | Q12: 2 | U12: son | V12: 10304000 | AC12: 击杀65只堕落精灵(39级) | AD12: reward_icon.tx_anheijinglinchihou | AG12: 5 | AH12: ="["&RC[11]&","""&RC[-32]&"""]" -> [65,"堕落精灵"] | AI12: 3 | AJ12: [["getTaskTimes",[10304000]]] | AK12: 4 | AL12: 找<佣兵长马塞尔|arg=10010200>领取奖励 | AM12: "找<佣兵长马塞尔|arg=10010200>领取奖励" | AN12: 1 | AO12: 4 | AQ12: 65300 | AR12: {enhance_money,80},{item,{110059001,1}} | AS12: 65
A13: 10304011 | B13: 魅惑魔女 | D13: 悬赏任务 | E13: 悬赏任务（剩余<span color:FFE21B1B>{0}</span>次） | F13: ["getTaskTimes",[10304000]] | H13: 10010200 | I13: 10010200 | J13: [] | K13: 33 | L13: 100 | M13: 0 | N13: 0 | O13: 日常 | Q13: 2 | U13: son | V13: 10304000 | AC13: 击杀45只魅惑魔女(33级) | AD13: reward_icon.tx_meihuomonv | AG13: 5 | AH13: ="["&RC[11]&","""&RC[-32]&"""]" -> [45,"魅惑魔女"] | AI13: 3 | AJ13: [["getTaskTimes",[10304000]]] | AK13: 4 | AL13: 找<佣兵长马塞尔|arg=10010200>领取奖励 | AM13: "找<佣兵长马塞尔|arg=10010200>领取奖励" | AN13: 1 | AO13: 0 | AQ13: 7000 | AS13: 45
A14: 10304012 | B14: 魅惑魔女 | D14: 悬赏任务 | E14: 悬赏任务（剩余<span color:FFE21B1B>{0}</span>次） | F14: ["getTaskTimes",[10304000]] | H14: 10010200 | I14: 10010200 | J14: [] | K14: 33 | L14: 100 | M14: 0 | N14: 0 | O14: 日常 | Q14: 2 | U14: son | V14: 10304000 | AC14: 击杀50只魅惑魔女(33级) | AD14: reward_icon.tx_meihuomonv | AG14: 5 | AH14: ="["&RC[11]&","""&RC[-32]&"""]" -> [50,"魅惑魔女"] | AI14: 3 | AJ14: [["getTaskTimes",[10304000]]] | AK14: 4 | AL14: 找<佣兵长马塞尔|arg=10010200>领取奖励 | AM14: "找<佣兵长马塞尔|arg=10010200>领取奖励" | AN14: 1 | AO14: 1 | AQ14: 9400 | AS14: 50
A15: 10304013 | B15: 魅惑魔女 | D15: 悬赏任务 | E15: 悬赏任务（剩余<span color:FFE21B1B>{0}</span>次） | F15: ["getTaskTimes",[10304000]] | H15: 10010200 | I15: 10010200 | J15: [] | K15: 33 | L15: 100 | M15: 0 | N15: 0 | O15: 日常 | Q15: 2 | U15: son | V15: 10304000 | AC15: 击杀55只魅惑魔女(33级) | AD15: reward_icon.tx_meihuomonv | AG15: 5 | AH15: ="["&RC[11]&","""&RC[-32]&"""]" -> [55,"魅惑魔女"] | AI15: 3 | AJ15: [["getTaskTimes",[10304000]]] | AK15: 4 | AL15: 找<佣兵长马塞尔|arg=10010200>领取奖励 | AM15: "找<佣兵长马塞尔|arg=10010200>领取奖励" | AN15: 1 | AO15: 2 | AQ15: 18700 | AR15: {enhance_money,20} | AS15: 55
A16: 10304014 | B16: 魅惑魔女 | D16: 悬赏任务 | E16: 悬赏任务（剩余<span color:FFE21B1B>{0}</span>次） | F16: ["getTaskTimes",[10304000]] | H16: 10010200 | I16: 10010200 | J16: [] | K16: 33 | L16: 100 | M16: 0 | N16: 0 | O16: 日常 | Q16: 2 | U16: son | V16: 10304000 | AC16: 击杀60只魅惑魔女(33级) | AD16: reward_icon.tx_meihuomonv | AG16: 5 | AH16: ="["&RC[11]&","""&RC[-32]&"""]" -> [60,"魅惑魔女"] | AI16: 3 | AJ16: [["getTaskTimes",[10304000]]] | AK16: 4 | AL16: 找<佣兵长马塞尔|arg=10010200>领取奖励 | AM16: "找<佣兵长马塞尔|arg=10010200>领取奖励" | AN16: 1 | AO16: 3 | AQ16: 37500 | AR16: {enhance_money,40},{item,{110059001,1}} | AS16: 60
A17: 10304015 | B17: 魅惑魔女 | D17: 悬赏任务 | E17: 悬赏任务（剩余<span color:FFE21B1B>{0}</span>次） | F17: ["getTaskTimes",[10304000]] | H17: 10010200 | I17: 10010200 | J17: [] | K17: 33 | L17: 100 | M17: 0 | N17: 0 | O17: 日常 | Q17: 2 | U17: son | V17: 10304000 | AC17: 击杀65只魅惑魔女(33级) | AD17: reward_icon.tx_meihuomonv | AG17: 5 | AH17: ="["&RC[11]&","""&RC[-32]&"""]" -> [65,"魅惑魔女"] | AI17: 3 | AJ17: [["getTaskTimes",[10304000]]] | AK17: 4 | AL17: 找<佣兵长马塞尔|arg=10010200>领取奖励 | AM17: "找<佣兵长马塞尔|arg=10010200>领取奖励" | AN17: 1 | AO17: 4 | AQ17: 56200 | AR17: {enhance_money,80},{item,{110059001,1}} | AS17: 65
A18: 10304016 | B18: 枯树妖 | D18: 悬赏任务 | E18: 悬赏任务（剩余<span color:FFE21B1B>{0}</span>次） | F18: ["getTaskTimes",[10304000]] | H18: 10010200 | I18: 10010200 | J18: [] | K18: 37 | L18: 100 | M18: 0 | N18: 0 | O18: 日常 | Q18: 2 | U18: son | V18: 10304000 | AC18: 击杀45只枯树妖(37级) | AD18: reward_icon.tx_kushuyao | AG18: 5 | AH18: ="["&RC[11]&","""&RC[-32]&"""]" -> [45,"枯树妖"] | AI18: 3 | AJ18: [["getTaskTimes",[10304000]]] | AK18: 4 | AL18: 找<佣兵长马塞尔|arg=10010200>领取奖励 | AM18: "找<佣兵长马塞尔|arg=10010200>领取奖励" | AN18: 1 | AO18: 0 | AQ18: 8000 | AS18: 45
A19: 10304017 | B19: 枯树妖 | D19: 悬赏任务 | E19: 悬赏任务（剩余<span color:FFE21B1B>{0}</span>次） | F19: ["getTaskTimes",[10304000]] | H19: 10010200 | I19: 10010200 | J19: [] | K19: 37 | L19: 100 | M19: 0 | N19: 0 | O19: 日常 | Q19: 2 | U19: son | V19: 10304000 | AC19: 击杀50只枯树妖(37级) | AD19: reward_icon.tx_kushuyao | AG19: 5 | AH19: ="["&RC[11]&","""&RC[-32]&"""]" -> [50,"枯树妖"] | AI19: 3 | AJ19: [["getTaskTimes",[10304000]]] | AK19: 4 | AL19: 找<佣兵长马塞尔|arg=10010200>领取奖励 | AM19: "找<佣兵长马塞尔|arg=10010200>领取奖励" | AN19: 1 | AO19: 1 | AQ19: 10700 | AS19: 50
A20: 10304018 | B20: 枯树妖 | D20: 悬赏任务 | E20: 悬赏任务（剩余<span color:FFE21B1B>{0}</span>次） | F20: ["getTaskTimes",[10304000]] | H20: 10010200 | I20: 10010200 | J20: [] | K20: 37 | L20: 100 | M20: 0 | N20: 0 | O20: 日常 | Q20: 2 | U20: son | V20: 10304000 | AC20: 击杀55只枯树妖(37级) | AD20: reward_icon.tx_kushuyao | AG20: 5 | AH20: ="["&RC[11]&","""&RC[-32]&"""]" -> [55,"枯树妖"] | AI20: 3 | AJ20: [["getTaskTimes",[10304000]]] | AK20: 4 | AL20: 找<佣兵长马塞尔|arg=10010200>领取奖励 | AM20: "找<佣兵长马塞尔|arg=10010200>领取奖励" | AN20: 1 | AO20: 2 | AQ20: 21500 | AR20: {enhance_money,20} | AS20: 55
A21: 10304019 | B21: 枯树妖 | D21: 悬赏任务 | E21: 悬赏任务（剩余<span color:FFE21B1B>{0}</span>次） | F21: ["getTaskTimes",[10304000]] | H21: 10010200 | I21: 10010200 | J21: [] | K21: 37 | L21: 100 | M21: 0 | N21: 0 | O21: 日常 | Q21: 2 | U21: son | V21: 10304000 | AC21: 击杀60只枯树妖(37级) | AD21: reward_icon.tx_kushuyao | AG21: 5 | AH21: ="["&RC[11]&","""&RC[-32]&"""]" -> [60,"枯树妖"] | AI21: 3 | AJ21: [["getTaskTimes",[10304000]]] | AK21: 4 | AL21: 找<佣兵长马塞尔|arg=10010200>领取奖励 | AM21: "找<佣兵长马塞尔|arg=10010200>领取奖励" | AN21: 1 | AO21: 3 | AQ21: 42900 | AR21: {enhance_money,40},{item,{110059001,1}} | AS21: 60
A22: 10304020 | B22: 枯树妖 | D22: 悬赏任务 | E22: 悬赏任务（剩余<span color:FFE21B1B>{0}</span>次） | F22: ["getTaskTimes",[10304000]] | H22: 10010200 | I22: 10010200 | J22: [] | K22: 37 | L22: 100 | M22: 0 | N22: 0 | O22: 日常 | Q22: 2 | U22: son | V22: 10304000 | AC22: 击杀65只枯树妖(37级) | AD22: reward_icon.tx_kushuyao | AG22: 5 | AH22: ="["&RC[11]&","""&RC[-32]&"""]" -> [65,"枯树妖"] | AI22: 3 | AJ22: [["getTaskTimes",[10304000]]] | AK22: 4 | AL22: 找<佣兵长马塞尔|arg=10010200>领取奖励 | AM22: "找<佣兵长马塞尔|arg=10010200>领取奖励" | AN22: 1 | AO22: 4 | AQ22: 64400 | AR22: {enhance_money,80},{item,{110059001,1}} | AS22: 65
A23: 10304021 | B23: 林地妖精 | D23: 悬赏任务 | E23: 悬赏任务（剩余<span color:FFE21B1B>{0}</span>次） | F23: ["getTaskTimes",[10304000]] | H23: 10010200 | I23: 10010200 | J23: [] | K23: 35 | L23: 100 | M23: 0 | N23: 0 | O23: 日常 | Q23: 2 | U23: son | V23: 10304000 | AC23: 击杀45只林地妖精(35级) | AD23: reward_icon.tx_lindiyaojing | AG23: 5 | AH23: ="["&RC[11]&","""&RC[-32]&"""]" -> [45,"林地妖精"] | AI23: 3 | AJ23: [["getTaskTimes",[10304000]]] | AK23: 4 | AL23: 找<佣兵长马塞尔|arg=10010200>领取奖励 | AM23: "找<佣兵长马塞尔|arg=10010200>领取奖励" | AN23: 1 | AO23: 0 | AQ23: 7900 | AS23: 45
A24: 10304022 | B24: 林地妖精 | D24: 悬赏任务 | E24: 悬赏任务（剩余<span color:FFE21B1B>{0}</span>次） | F24: ["getTaskTimes",[10304000]] | H24: 10010200 | I24: 10010200 | J24: [] | K24: 35 | L24: 100 | M24: 0 | N24: 0 | O24: 日常 | Q24: 2 | U24: son | V24: 10304000 | AC24: 击杀50只林地妖精(35级) | AD24: reward_icon.tx_lindiyaojing | AG24: 5 | AH24: ="["&RC[11]&","""&RC[-32]&"""]" -> [50,"林地妖精"] | AI24: 3 | AJ24: [["getTaskTimes",[10304000]]] | AK24: 4 | AL24: 找<佣兵长马塞尔|arg=10010200>领取奖励 | AM24: "找<佣兵长马塞尔|arg=10010200>领取奖励" | AN24: 1 | AO24: 1 | AQ24: 10600 | AS24: 50
A25: 10304023 | B25: 林地妖精 | D25: 悬赏任务 | E25: 悬赏任务（剩余<span color:FFE21B1B>{0}</span>次） | F25: ["getTaskTimes",[10304000]] | H25: 10010200 | I25: 10010200 | J25: [] | K25: 35 | L25: 100 | M25: 0 | N25: 0 | O25: 日常 | Q25: 2 | U25: son | V25: 10304000 | AC25: 击杀55只林地妖精(35级) | AD25: reward_icon.tx_lindiyaojing | AG25: 5 | AH25: ="["&RC[11]&","""&RC[-32]&"""]" -> [55,"林地妖精"] | AI25: 3 | AJ25: [["getTaskTimes",[10304000]]] | AK25: 4 | AL25: 找<佣兵长马塞尔|arg=10010200>领取奖励 | AM25: "找<佣兵长马塞尔|arg=10010200>领取奖励" | AN25: 1 | AO25: 2 | AQ25: 21200 | AR25: {enhance_money,20} | AS25: 55
A26: 10304024 | B26: 林地妖精 | D26: 悬赏任务 | E26: 悬赏任务（剩余<span color:FFE21B1B>{0}</span>次） | F26: ["getTaskTimes",[10304000]] | H26: 10010200 | I26: 10010200 | J26: [] | K26: 35 | L26: 100 | M26: 0 | N26: 0 | O26: 日常 | Q26: 2 | U26: son | V26: 10304000 | AC26: 击杀60只林地妖精(35级) | AD26: reward_icon.tx_lindiyaojing | AG26: 5 | AH26: ="["&RC[11]&","""&RC[-32]&"""]" -> [60,"林地妖精"] | AI26: 3 | AJ26: [["getTaskTimes",[10304000]]] | AK26: 4 | AL26: 找<佣兵长马塞尔|arg=10010200>领取奖励 | AM26: "找<佣兵长马塞尔|arg=10010200>领取奖励" | AN26: 1 | AO26: 3 | AQ26: 42400 | AR26: {enhance_money,40},{item,{110059001,1}} | AS26: 60
A27: 10304025 | B27: 林地妖精 | D27: 悬赏任务 | E27: 悬赏任务（剩余<span color:FFE21B1B>{0}</span>次） | F27: ["getTaskTimes",[10304000]] | H27: 10010200 | I27: 10010200 | J27: [] | K27: 35 | L27: 100 | M27: 0 | N27: 0 | O27: 日常 | Q27: 2 | U27: son | V27: 10304000 | AC27: 击杀65只林地妖精(35级) | AD27: reward_icon.tx_lindiyaojing | AG27: 5 | AH27: ="["&RC[11]&","""&RC[-32]&"""]" -> [65,"林地妖精"] | AI27: 3 | AJ27: [["getTaskTimes",[10304000]]] | AK27: 4 | AL27: 找<佣兵长马塞尔|arg=10010200>领取奖励 | AM27: "找<佣兵长马塞尔|arg=10010200>领取奖励" | AN27: 1 | AO27: 4 | AQ27: 63600 | AR27: {enhance_money,80},{item,{110059001,1}} | AS27: 65
A28: 10304026 | B28: 黑龙 | D28: 悬赏任务 | E28: 悬赏任务（剩余<span color:FFE21B1B>{0}</span>次） | F28: ["getTaskTimes",[10304000]] | H28: 10010200 | I28: 10010200 | J28: [] | K28: 1 | L28: 100 | M28: 0 | N28: 0 | O28: 日常 | Q28: 2 | U28: son | V28: 10304000 | AC28: 击杀65只黑龙(1级) | AD28: reward_icon.tx_anheijinglingchihou | AG28: 5 | AH28: ="["&RC[11]&","""&RC[-32]&"""]" -> [65,"黑龙"] | AI28: 3 | AJ28: [["getTaskTimes",[10304000]]] | AK28: 4 | AL28: 找<佣兵长马塞尔|arg=10010200>领取奖励 | AM28: "找<佣兵长马塞尔|arg=10010200>领取奖励" | AN28: 1 | AO28: 0 | AQ28: 1700 | AS28: 65
A29: 10304027 | B29: 黑龙 | D29: 悬赏任务 | E29: 悬赏任务（剩余<span color:FFE21B1B>{0}</span>次） | F29: ["getTaskTimes",[10304000]] | H29: 10010200 | I29: 10010200 | J29: [] | K29: 1 | L29: 100 | M29: 0 | N29: 0 | O29: 日常 | Q29: 2 | U29: son | V29: 10304000 | AC29: 击杀70只黑龙(1级) | AD29: reward_icon.tx_anheijinglingchihou | AG29: 5 | AH29: ="["&RC[11]&","""&RC[-32]&"""]" -> [70,"黑龙"] | AI29: 3 | AJ29: [["getTaskTimes",[10304000]]] | AK29: 4 | AL29: 找<佣兵长马塞尔|arg=10010200>领取奖励 | AM29: "找<佣兵长马塞尔|arg=10010200>领取奖励" | AN29: 1 | AO29: 1 | AQ29: 2300 | AS29: 70
A30: 10304028 | B30: 黑龙 | D30: 悬赏任务 | E30: 悬赏任务（剩余<span color:FFE21B1B>{0}</span>次） | F30: ["getTaskTimes",[10304000]] | H30: 10010200 | I30: 10010200 | J30: [] | K30: 1 | L30: 100 | M30: 0 | N30: 0 | O30: 日常 | Q30: 2 | U30: son | V30: 10304000 | AC30: 击杀75只黑龙(1级) | AD30: reward_icon.tx_anheijinglingchihou | AG30: 5 | AH30: ="["&RC[11]&","""&RC[-32]&"""]" -> [75,"黑龙"] | AI30: 3 | AJ30: [["getTaskTimes",[10304000]]] | AK30: 4 | AL30: 找<佣兵长马塞尔|arg=10010200>领取奖励 | AM30: "找<佣兵长马塞尔|arg=10010200>领取奖励" | AN30: 1 | AO30: 2 | AQ30: 4500 | AR30: {enhance_money,20} | AS30: 75
A31: 10304029 | B31: 黑龙 | D31: 悬赏任务 | E31: 悬赏任务（剩余<span color:FFE21B1B>{0}</span>次） | F31: ["getTaskTimes",[10304000]] | H31: 10010200 | I31: 10010200 | J31: [] | K31: 1 | L31: 100 | M31: 0 | N31: 0 | O31: 日常 | Q31: 2 | U31: son | V31: 10304000 | AC31: 击杀80只黑龙(1级) | AD31: reward_icon.tx_anheijinglingchihou | AG31: 5 | AH31: ="["&RC[11]&","""&RC[-32]&"""]" -> [80,"黑龙"] | AI31: 3 | AJ31: [["getTaskTimes",[10304000]]] | AK31: 4 | AL31: 找<佣兵长马塞尔|arg=10010200>领取奖励 | AM31: "找<佣兵长马塞尔|arg=10010200>领取奖励" | AN31: 1 | AO31: 3 | AQ31: 9100 | AR31: {enhance_money,40},{item,{110059001,1}} | AS31: 80
A32: 10304030 | B32: 黑龙 | D32: 悬赏任务 | E32: 悬赏任务（剩余<span color:FFE21B1B>{0}</span>次） | F32: ["getTaskTimes",[10304000]] | H32: 10010200 | I32: 10010200 | J32: [] | K32: 1 | L32: 100 | M32: 0 | N32: 0 | O32: 日常 | Q32: 2 | U32: son | V32: 10304000 | AC32: 击杀85只黑龙(1级) | AD32: reward_icon.tx_anheijinglingchihou | AG32: 5 | AH32: ="["&RC[11]&","""&RC[-32]&"""]" -> [85,"黑龙"] | AI32: 3 | AJ32: [["getTaskTimes",[10304000]]] | AK32: 4 | AL32: 找<佣兵长马塞尔|arg=10010200>领取奖励 | AM32: "找<佣兵长马塞尔|arg=10010200>领取奖励" | AN32: 1 | AO32: 4 | AQ32: 13600 | AR32: {enhance_money,80},{item,{110059001,1}} | AS32: 85
A33: 10304031 | B33: 蜥蜴人仆从 | D33: 悬赏任务 | E33: 悬赏任务（剩余<span color:FFE21B1B>{0}</span>次） | F33: ["getTaskTimes",[10304000]] | H33: 10010200 | I33: 10010200 | J33: [] | K33: 1 | L33: 100 | M33: 0 | N33: 0 | O33: 日常 | Q33: 2 | U33: son | V33: 10304000 | AC33: 击杀65只蜥蜴人仆从(1级) | AD33: reward_icon.tx_xiyiren | AG33: 5 | AH33: ="["&RC[11]&","""&RC[-32]&"""]" -> [65,"蜥蜴人仆从"] | AI33: 3 | AJ33: [["getTaskTimes",[10304000]]] | AK33: 4 | AL33: 找<佣兵长马塞尔|arg=10010200>领取奖励 | AM33: "找<佣兵长马塞尔|arg=10010200>领取奖励" | AN33: 1 | AO33: 0 | AQ33: 1700 | AS33: 65
A34: 10304032 | B34: 蜥蜴人仆从 | D34: 悬赏任务 | E34: 悬赏任务（剩余<span color:FFE21B1B>{0}</span>次） | F34: ["getTaskTimes",[10304000]] | H34: 10010200 | I34: 10010200 | J34: [] | K34: 1 | L34: 100 | M34: 0 | N34: 0 | O34: 日常 | Q34: 2 | U34: son | V34: 10304000 | AC34: 击杀70只蜥蜴人仆从(1级) | AD34: reward_icon.tx_xiyiren | AG34: 5 | AH34: ="["&RC[11]&","""&RC[-32]&"""]" -> [70,"蜥蜴人仆从"] | AI34: 3 | AJ34: [["getTaskTimes",[10304000]]] | AK34: 4 | AL34: 找<佣兵长马塞尔|arg=10010200>领取奖励 | AM34: "找<佣兵长马塞尔|arg=10010200>领取奖励" | AN34: 1 | AO34: 1 | AQ34: 2300 | AS34: 70
A35: 10304033 | B35: 蜥蜴人仆从 | D35: 悬赏任务 | E35: 悬赏任务（剩余<span color:FFE21B1B>{0}</span>次） | F35: ["getTaskTimes",[10304000]] | H35: 10010200 | I35: 10010200 | J35: [] | K35: 1 | L35: 100 | M35: 0 | N35: 0 | O35: 日常 | Q35: 2 | U35: son | V35: 10304000 | AC35: 击杀75只蜥蜴人仆从(1级) | AD35: reward_icon.tx_xiyiren | AG35: 5 | AH35: ="["&RC[11]&","""&RC[-32]&"""]" -> [75,"蜥蜴人仆从"] | AI35: 3 | AJ35: [["getTaskTimes",[10304000]]] | AK35: 4 | AL35: 找<佣兵长马塞尔|arg=10010200>领取奖励 | AM35: "找<佣兵长马塞尔|arg=10010200>领取奖励" | AN35: 1 | AO35: 2 | AQ35: 4500 | AR35: {enhance_money,20} | AS35: 75
A36: 10304034 | B36: 蜥蜴人仆从 | D36: 悬赏任务 | E36: 悬赏任务（剩余<span color:FFE21B1B>{0}</span>次） | F36: ["getTaskTimes",[10304000]] | H36: 10010200 | I36: 10010200 | J36: [] | K36: 1 | L36: 100 | M36: 0 | N36: 0 | O36: 日常 | Q36: 2 | U36: son | V36: 10304000 | AC36: 击杀80只蜥蜴人仆从(1级) | AD36: reward_icon.tx_xiyiren | AG36: 5 | AH36: ="["&RC[11]&","""&RC[-32]&"""]" -> [80,"蜥蜴人仆从"] | AI36: 3 | AJ36: [["getTaskTimes",[10304000]]] | AK36: 4 | AL36: 找<佣兵长马塞尔|arg=10010200>领取奖励 | AM36: "找<佣兵长马塞尔|arg=10010200>领取奖励" | AN36: 1 | AO36: 3 | AQ36: 9100 | AR36: {enhance_money,40},{item,{110059001,1}} | AS36: 80
A37: 10304035 | B37: 蜥蜴人仆从 | D37: 悬赏任务 | E37: 悬赏任务（剩余<span color:FFE21B1B>{0}</span>次） | F37: ["getTaskTimes",[10304000]] | H37: 10010200 | I37: 10010200 | J37: [] | K37: 1 | L37: 100 | M37: 0 | N37: 0 | O37: 日常 | Q37: 2 | U37: son | V37: 10304000 | AC37: 击杀85只蜥蜴人仆从(1级) | AD37: reward_icon.tx_xiyiren | AG37: 5 | AH37: ="["&RC[11]&","""&RC[-32]&"""]" -> [85,"蜥蜴人仆从"] | AI37: 3 | AJ37: [["getTaskTimes",[10304000]]] | AK37: 4 | AL37: 找<佣兵长马塞尔|arg=10010200>领取奖励 | AM37: "找<佣兵长马塞尔|arg=10010200>领取奖励" | AN37: 1 | AO37: 4 | AQ37: 13600 | AR37: {enhance_money,80},{item,{110059001,1}} | AS37: 85
A38: 10304036 | B38: 黑岩红蝎 | D38: 悬赏任务 | E38: 悬赏任务（剩余<span color:FFE21B1B>{0}</span>次） | F38: ["getTaskTimes",[10304000]] | H38: 10010200 | I38: 10010200 | J38: [] | K38: 47 | L38: 100 | M38: 0 | N38: 0 | O38: 日常 | Q38: 2 | U38: son | V38: 10304000 | AC38: 击杀55只黑岩红蝎(47级) | AD38: reward_icon.tx_heiyanhongxie | AG38: 5 | AH38: ="["&RC[11]&","""&RC[-32]&"""]" -> [55,"黑岩红蝎"] | AI38: 3 | AJ38: [["getTaskTimes",[10304000]]] | AK38: 4 | AL38: 找<佣兵长马塞尔|arg=10010200>领取奖励 | AM38: "找<佣兵长马塞尔|arg=10010200>领取奖励" | AN38: 1 | AO38: 0 | AQ38: 12900 | AS38: 55
A39: 10304037 | B39: 黑岩红蝎 | D39: 悬赏任务 | E39: 悬赏任务（剩余<span color:FFE21B1B>{0}</span>次） | F39: ["getTaskTimes",[10304000]] | H39: 10010200 | I39: 10010200 | J39: [] | K39: 47 | L39: 100 | M39: 0 | N39: 0 | O39: 日常 | Q39: 2 | U39: son | V39: 10304000 | AC39: 击杀60只黑岩红蝎(47级) | AD39: reward_icon.tx_heiyanhongxie | AG39: 5 | AH39: ="["&RC[11]&","""&RC[-32]&"""]" -> [60,"黑岩红蝎"] | AI39: 3 | AJ39: [["getTaskTimes",[10304000]]] | AK39: 4 | AL39: 找<佣兵长马塞尔|arg=10010200>领取奖励 | AM39: "找<佣兵长马塞尔|arg=10010200>领取奖励" | AN39: 1 | AO39: 1 | AQ39: 17200 | AS39: 60
A40: 10304038 | B40: 黑岩红蝎 | D40: 悬赏任务 | E40: 悬赏任务（剩余<span color:FFE21B1B>{0}</span>次） | F40: ["getTaskTimes",[10304000]] | H40: 10010200 | I40: 10010200 | J40: [] | K40: 47 | L40: 100 | M40: 0 | N40: 0 | O40: 日常 | Q40: 2 | U40: son | V40: 10304000 | AC40: 击杀65只黑岩红蝎(47级) | AD40: reward_icon.tx_heiyanhongxie | AG40: 5 | AH40: ="["&RC[11]&","""&RC[-32]&"""]" -> [65,"黑岩红蝎"] | AI40: 3 | AJ40: [["getTaskTimes",[10304000]]] | AK40: 4 | AL40: 找<佣兵长马塞尔|arg=10010200>领取奖励 | AM40: "找<佣兵长马塞尔|arg=10010200>领取奖励" | AN40: 1 | AO40: 2 | AQ40: 34400 | AR40: {enhance_money,20} | AS40: 65
A41: 10304039 | B41: 黑岩红蝎 | D41: 悬赏任务 | E41: 悬赏任务（剩余<span color:FFE21B1B>{0}</span>次） | F41: ["getTaskTimes",[10304000]] | H41: 10010200 | I41: 10010200 | J41: [] | K41: 47 | L41: 100 | M41: 0 | N41: 0 | O41: 日常 | Q41: 2 | U41: son | V41: 10304000 | AC41: 击杀70只黑岩红蝎(47级) | AD41: reward_icon.tx_heiyanhongxie | AG41: 5 | AH41: ="["&RC[11]&","""&RC[-32]&"""]" -> [70,"黑岩红蝎"] | AI41: 3 | AJ41: [["getTaskTimes",[10304000]]] | AK41: 4 | AL41: 找<佣兵长马塞尔|arg=10010200>领取奖励 | AM41: "找<佣兵长马塞尔|arg=10010200>领取奖励" | AN41: 1 | AO41: 3 | AQ41: 68800 | AR41: {enhance_money,40},{item,{110059001,1}} | AS41: 70
A42: 10304040 | B42: 黑岩红蝎 | D42: 悬赏任务 | E42: 悬赏任务（剩余<span color:FFE21B1B>{0}</span>次） | F42: ["getTaskTimes",[10304000]] | H42: 10010200 | I42: 10010200 | J42: [] | K42: 47 | L42: 100 | M42: 0 | N42: 0 | O42: 日常 | Q42: 2 | U42: son | V42: 10304000 | AC42: 击杀75只黑岩红蝎(47级) | AD42: reward_icon.tx_heiyanhongxie | AG42: 5 | AH42: ="["&RC[11]&","""&RC[-32]&"""]" -> [75,"黑岩红蝎"] | AI42: 3 | AJ42: [["getTaskTimes",[10304000]]] | AK42: 4 | AL42: 找<佣兵长马塞尔|arg=10010200>领取奖励 | AM42: "找<佣兵长马塞尔|arg=10010200>领取奖励" | AN42: 1 | AO42: 4 | AQ42: 103100 | AR42: {enhance_money,80},{item,{110059001,1}} | AS42: 75
A43: 10304041 | B43: 嗜血魔狼 | D43: 悬赏任务 | E43: 悬赏任务（剩余<span color:FFE21B1B>{0}</span>次） | F43: ["getTaskTimes",[10304000]] | H43: 10010200 | I43: 10010200 | J43: [] | K43: 41 | L43: 100 | M43: 0 | N43: 0 | O43: 日常 | Q43: 2 | U43: son | V43: 10304000 | AC43: 击杀55只嗜血魔狼(41级) | AD43: reward_icon.tx_shixuemolang | AG43: 5 | AH43: ="["&RC[11]&","""&RC[-32]&"""]" -> [55,"嗜血魔狼"] | AI43: 3 | AJ43: [["getTaskTimes",[10304000]]] | AK43: 4 | AL43: 找<佣兵长马塞尔|arg=10010200>领取奖励 | AM43: "找<佣兵长马塞尔|arg=10010200>领取奖励" | AN43: 1 | AO43: 0 | AQ43: 9200 | AS43: 55
A44: 10304042 | B44: 嗜血魔狼 | D44: 悬赏任务 | E44: 悬赏任务（剩余<span color:FFE21B1B>{0}</span>次） | F44: ["getTaskTimes",[10304000]] | H44: 10010200 | I44: 10010200 | J44: [] | K44: 41 | L44: 100 | M44: 0 | N44: 0 | O44: 日常 | Q44: 2 | U44: son | V44: 10304000 | AC44: 击杀60只嗜血魔狼(41级) | AD44: reward_icon.tx_shixuemolang | AG44: 5 | AH44: ="["&RC[11]&","""&RC[-32]&"""]" -> [60,"嗜血魔狼"] | AI44: 3 | AJ44: [["getTaskTimes",[10304000]]] | AK44: 4 | AL44: 找<佣兵长马塞尔|arg=10010200>领取奖励 | AM44: "找<佣兵长马塞尔|arg=10010200>领取奖励" | AN44: 1 | AO44: 1 | AQ44: 12200 | AS44: 60
A45: 10304043 | B45: 嗜血魔狼 | D45: 悬赏任务 | E45: 悬赏任务（剩余<span color:FFE21B1B>{0}</span>次） | F45: ["getTaskTimes",[10304000]] | H45: 10010200 | I45: 10010200 | J45: [] | K45: 41 | L45: 100 | M45: 0 | N45: 0 | O45: 日常 | Q45: 2 | U45: son | V45: 10304000 | AC45: 击杀65只嗜血魔狼(41级) | AD45: reward_icon.tx_shixuemolang | AG45: 5 | AH45: ="["&RC[11]&","""&RC[-32]&"""]" -> [65,"嗜血魔狼"] | AI45: 3 | AJ45: [["getTaskTimes",[10304000]]] | AK45: 4 | AL45: 找<佣兵长马塞尔|arg=10010200>领取奖励 | AM45: "找<佣兵长马塞尔|arg=10010200>领取奖励" | AN45: 1 | AO45: 2 | AQ45: 24500 | AR45: {enhance_money,20} | AS45: 65
A46: 10304044 | B46: 嗜血魔狼 | D46: 悬赏任务 | E46: 悬赏任务（剩余<span color:FFE21B1B>{0}</span>次） | F46: ["getTaskTimes",[10304000]] | H46: 10010200 | I46: 10010200 | J46: [] | K46: 41 | L46: 100 | M46: 0 | N46: 0 | O46: 日常 | Q46: 2 | U46: son | V46: 10304000 | AC46: 击杀70只嗜血魔狼(41级) | AD46: reward_icon.tx_shixuemolang | AG46: 5 | AH46: ="["&RC[11]&","""&RC[-32]&"""]" -> [70,"嗜血魔狼"] | AI46: 3 | AJ46: [["getTaskTimes",[10304000]]] | AK46: 4 | AL46: 找<佣兵长马塞尔|arg=10010200>领取奖励 | AM46: "找<佣兵长马塞尔|arg=10010200>领取奖励" | AN46: 1 | AO46: 3 | AQ46: 48900 | AR46: {enhance_money,40},{item,{110059001,1}} | AS46: 70
A47: 10304045 | B47: 嗜血魔狼 | D47: 悬赏任务 | E47: 悬赏任务（剩余<span color:FFE21B1B>{0}</span>次） | F47: ["getTaskTimes",[10304000]] | H47: 10010200 | I47: 10010200 | J47: [] | K47: 41 | L47: 100 | M47: 0 | N47: 0 | O47: 日常 | Q47: 2 | U47: son | V47: 10304000 | AC47: 击杀75只嗜血魔狼(41级) | AD47: reward_icon.tx_shixuemolang | AG47: 5 | AH47: ="["&RC[11]&","""&RC[-32]&"""]" -> [75,"嗜血魔狼"] | AI47: 3 | AJ47: [["getTaskTimes",[10304000]]] | AK47: 4 | AL47: 找<佣兵长马塞尔|arg=10010200>领取奖励 | AM47: "找<佣兵长马塞尔|arg=10010200>领取奖励" | AN47: 1 | AO47: 4 | AQ47: 73400 | AR47: {enhance_money,80},{item,{110059001,1}} | AS47: 75
A48: 10304046 | B48: 沙尘魔像 | D48: 悬赏任务 | E48: 悬赏任务（剩余<span color:FFE21B1B>{0}</span>次） | F48: ["getTaskTimes",[10304000]] | H48: 10010200 | I48: 10010200 | J48: [] | K48: 49 | L48: 100 | M48: 0 | N48: 0 | O48: 日常 | Q48: 2 | U48: son | V48: 10304000 | AC48: 击杀55只沙尘魔像(49级) | AD48: reward_icon.tx_shachenmoxiang | AG48: 5 | AH48: ="["&RC[11]&","""&RC[-32]&"""]" -> [55,"沙尘魔像"] | AI48: 3 | AJ48: [["getTaskTimes",[10304000]]] | AK48: 4 | AL48: 找<佣兵长马塞尔|arg=10010200>领取奖励 | AM48: "找<佣兵长马塞尔|arg=10010200>领取奖励" | AN48: 1 | AO48: 0 | AQ48: 13300 | AS48: 55
A49: 10304047 | B49: 沙尘魔像 | D49: 悬赏任务 | E49: 悬赏任务（剩余<span color:FFE21B1B>{0}</span>次） | F49: ["getTaskTimes",[10304000]] | H49: 10010200 | I49: 10010200 | J49: [] | K49: 49 | L49: 100 | M49: 0 | N49: 0 | O49: 日常 | Q49: 2 | U49: son | V49: 10304000 | AC49: 击杀60只沙尘魔像(49级) | AD49: reward_icon.tx_shachenmoxiang | AG49: 5 | AH49: ="["&RC[11]&","""&RC[-32]&"""]" -> [60,"沙尘魔像"] | AI49: 3 | AJ49: [["getTaskTimes",[10304000]]] | AK49: 4 | AL49: 找<佣兵长马塞尔|arg=10010200>领取奖励 | AM49: "找<佣兵长马塞尔|arg=10010200>领取奖励" | AN49: 1 | AO49: 1 | AQ49: 17700 | AS49: 60
A50: 10304048 | B50: 沙尘魔像 | D50: 悬赏任务 | E50: 悬赏任务（剩余<span color:FFE21B1B>{0}</span>次） | F50: ["getTaskTimes",[10304000]] | H50: 10010200 | I50: 10010200 | J50: [] | K50: 49 | L50: 100 | M50: 0 | N50: 0 | O50: 日常 | Q50: 2 | U50: son | V50: 10304000 | AC50: 击杀65只沙尘魔像(49级) | AD50: reward_icon.tx_shachenmoxiang | AG50: 5 | AH50: ="["&RC[11]&","""&RC[-32]&"""]" -> [65,"沙尘魔像"] | AI50: 3 | AJ50: [["getTaskTimes",[10304000]]] | AK50: 4 | AL50: 找<佣兵长马塞尔|arg=10010200>领取奖励 | AM50: "找<佣兵长马塞尔|arg=10010200>领取奖励" | AN50: 1 | AO50: 2 | AQ50: 35400 | AR50: {enhance_money,20} | AS50: 65
A51: 10304049 | B51: 沙尘魔像 | D51: 悬赏任务 | E51: 悬赏任务（剩余<span color:FFE21B1B>{0}</span>次） | F51: ["getTaskTimes",[10304000]] | H51: 10010200 | I51: 10010200 | J51: [] | K51: 49 | L51: 100 | M51: 0 | N51: 0 | O51: 日常 | Q51: 2 | U51: son | V51: 10304000 | AC51: 击杀70只沙尘魔像(49级) | AD51: reward_icon.tx_shachenmoxiang | AG51: 5 | AH51: ="["&RC[11]&","""&RC[-32]&"""]" -> [70,"沙尘魔像"] | AI51: 3 | AJ51: [["getTaskTimes",[10304000]]] | AK51: 4 | AL51: 找<佣兵长马塞尔|arg=10010200>领取奖励 | AM51: "找<佣兵长马塞尔|arg=10010200>领取奖励" | AN51: 1 | AO51: 3 | AQ51: 70900 | AR51: {enhance_money,40},{item,{110059001,1}} | AS51: 70
A52: 10304050 | B52: 沙尘魔像 | D52: 悬赏任务 | E52: 悬赏任务（剩余<span color:FFE21B1B>{0}</span>次） | F52: ["getTaskTimes",[10304000]] | H52: 10010200 | I52: 10010200 | J52: [] | K52: 49 | L52: 100 | M52: 0 | N52: 0 | O52: 日常 | Q52: 2 | U52: son | V52: 10304000 | AC52: 击杀75只沙尘魔像(49级) | AD52: reward_icon.tx_shachenmoxiang | AG52: 5 | AH52: ="["&RC[11]&","""&RC[-32]&"""]" -> [75,"沙尘魔像"] | AI52: 3 | AJ52: [["getTaskTimes",[10304000]]] | AK52: 4 | AL52: 找<佣兵长马塞尔|arg=10010200>领取奖励 | AM52: "找<佣兵长马塞尔|arg=10010200>领取奖励" | AN52: 1 | AO52: 4 | AQ52: 106300 | AR52: {enhance_money,80},{item,{110059001,1}} | AS52: 75
A53: 10304051 | B53: 兽人屠戮者 | D53: 悬赏任务 | E53: 悬赏任务（剩余<span color:FFE21B1B>{0}</span>次） | F53: ["getTaskTimes",[10304000]] | H53: 10010200 | I53: 10010200 | J53: [] | K53: 45 | L53: 100 | M53: 0 | N53: 0 | O53: 日常 | Q53: 2 | U53: son | V53: 10304000 | AC53: 击杀55只兽人屠戮者(45级) | AD53: reward_icon.tx_shourentushazhe | AG53: 5 | AH53: ="["&RC[11]&","""&RC[-32]&"""]" -> [55,"兽人屠戮者"] | AI53: 3 | AJ53: [["getTaskTimes",[10304000]]] | AK53: 4 | AL53: 找<佣兵长马塞尔|arg=10010200>领取奖励 | AM53: "找<佣兵长马塞尔|arg=10010200>领取奖励" | AN53: 1 | AO53: 0 | AQ53: 11700 | AS53: 55
A54: 10304052 | B54: 兽人屠戮者 | D54: 悬赏任务 | E54: 悬赏任务（剩余<span color:FFE21B1B>{0}</span>次） | F54: ["getTaskTimes",[10304000]] | H54: 10010200 | I54: 10010200 | J54: [] | K54: 45 | L54: 100 | M54: 0 | N54: 0 | O54: 日常 | Q54: 2 | U54: son | V54: 10304000 | AC54: 击杀60只兽人屠戮者(45级) | AD54: reward_icon.tx_shourentushazhe | AG54: 5 | AH54: ="["&RC[11]&","""&RC[-32]&"""]" -> [60,"兽人屠戮者"] | AI54: 3 | AJ54: [["getTaskTimes",[10304000]]] | AK54: 4 | AL54: 找<佣兵长马塞尔|arg=10010200>领取奖励 | AM54: "找<佣兵长马塞尔|arg=10010200>领取奖励" | AN54: 1 | AO54: 1 | AQ54: 15600 | AS54: 60
A55: 10304053 | B55: 兽人屠戮者 | D55: 悬赏任务 | E55: 悬赏任务（剩余<span color:FFE21B1B>{0}</span>次） | F55: ["getTaskTimes",[10304000]] | H55: 10010200 | I55: 10010200 | J55: [] | K55: 45 | L55: 100 | M55: 0 | N55: 0 | O55: 日常 | Q55: 2 | U55: son | V55: 10304000 | AC55: 击杀65只兽人屠戮者(45级) | AD55: reward_icon.tx_shourentushazhe | AG55: 5 | AH55: ="["&RC[11]&","""&RC[-32]&"""]" -> [65,"兽人屠戮者"] | AI55: 3 | AJ55: [["getTaskTimes",[10304000]]] | AK55: 4 | AL55: 找<佣兵长马塞尔|arg=10010200>领取奖励 | AM55: "找<佣兵长马塞尔|arg=10010200>领取奖励" | AN55: 1 | AO55: 2 | AQ55: 31200 | AR55: {enhance_money,20} | AS55: 65
A56: 10304054 | B56: 兽人屠戮者 | D56: 悬赏任务 | E56: 悬赏任务（剩余<span color:FFE21B1B>{0}</span>次） | F56: ["getTaskTimes",[10304000]] | H56: 10010200 | I56: 10010200 | J56: [] | K56: 45 | L56: 100 | M56: 0 | N56: 0 | O56: 日常 | Q56: 2 | U56: son | V56: 10304000 | AC56: 击杀70只兽人屠戮者(45级) | AD56: reward_icon.tx_shourentushazhe | AG56: 5 | AH56: ="["&RC[11]&","""&RC[-32]&"""]" -> [70,"兽人屠戮者"] | AI56: 3 | AJ56: [["getTaskTimes",[10304000]]] | AK56: 4 | AL56: 找<佣兵长马塞尔|arg=10010200>领取奖励 | AM56: "找<佣兵长马塞尔|arg=10010200>领取奖励" | AN56: 1 | AO56: 3 | AQ56: 62300 | AR56: {enhance_money,40},{item,{110059001,1}} | AS56: 70
A57: 10304055 | B57: 兽人屠戮者 | D57: 悬赏任务 | E57: 悬赏任务（剩余<span color:FFE21B1B>{0}</span>次） | F57: ["getTaskTimes",[10304000]] | H57: 10010200 | I57: 10010200 | J57: [] | K57: 45 | L57: 100 | M57: 0 | N57: 0 | O57: 日常 | Q57: 2 | U57: son | V57: 10304000 | AC57: 击杀75只兽人屠戮者(45级) | AD57: reward_icon.tx_shourentushazhe | AG57: 5 | AH57: ="["&RC[11]&","""&RC[-32]&"""]" -> [75,"兽人屠戮者"] | AI57: 3 | AJ57: [["getTaskTimes",[10304000]]] | AK57: 4 | AL57: 找<佣兵长马塞尔|arg=10010200>领取奖励 | AM57: "找<佣兵长马塞尔|arg=10010200>领取奖励" | AN57: 1 | AO57: 4 | AQ57: 93500 | AR57: {enhance_money,80},{item,{110059001,1}} | AS57: 75
A58: 10304056 | B58: 荒岩龙虫 | D58: 悬赏任务 | E58: 悬赏任务（剩余<span color:FFE21B1B>{0}</span>次） | F58: ["getTaskTimes",[10304000]] | H58: 10010200 | I58: 10010200 | J58: [] | K58: 43 | L58: 100 | M58: 0 | N58: 0 | O58: 日常 | Q58: 2 | U58: son | V58: 10304000 | AC58: 击杀55只荒岩龙虫(43级) | AD58: reward_icon.tx_huanyanlongchong | AG58: 5 | AH58: ="["&RC[11]&","""&RC[-32]&"""]" -> [55,"荒岩龙虫"] | AI58: 3 | AJ58: [["getTaskTimes",[10304000]]] | AK58: 4 | AL58: 找<佣兵长马塞尔|arg=10010200>领取奖励 | AM58: "找<佣兵长马塞尔|arg=10010200>领取奖励" | AN58: 1 | AO58: 0 | AQ58: 10400 | AS58: 55
A59: 10304057 | B59: 荒岩龙虫 | D59: 悬赏任务 | E59: 悬赏任务（剩余<span color:FFE21B1B>{0}</span>次） | F59: ["getTaskTimes",[10304000]] | H59: 10010200 | I59: 10010200 | J59: [] | K59: 43 | L59: 100 | M59: 0 | N59: 0 | O59: 日常 | Q59: 2 | U59: son | V59: 10304000 | AC59: 击杀60只荒岩龙虫(43级) | AD59: reward_icon.tx_huanyanlongchong | AG59: 5 | AH59: ="["&RC[11]&","""&RC[-32]&"""]" -> [60,"荒岩龙虫"] | AI59: 3 | AJ59: [["getTaskTimes",[10304000]]] | AK59: 4 | AL59: 找<佣兵长马塞尔|arg=10010200>领取奖励 | AM59: "找<佣兵长马塞尔|arg=10010200>领取奖励" | AN59: 1 | AO59: 1 | AQ59: 13800 | AS59: 60
A60: 10304058 | B60: 荒岩龙虫 | D60: 悬赏任务 | E60: 悬赏任务（剩余<span color:FFE21B1B>{0}</span>次） | F60: ["getTaskTimes",[10304000]] | H60: 10010200 | I60: 10010200 | J60: [] | K60: 43 | L60: 100 | M60: 0 | N60: 0 | O60: 日常 | Q60: 2 | U60: son | V60: 10304000 | AC60: 击杀65只荒岩龙虫(43级) | AD60: reward_icon.tx_huanyanlongchong | AG60: 5 | AH60: ="["&RC[11]&","""&RC[-32]&"""]" -> [65,"荒岩龙虫"] | AI60: 3 | AJ60: [["getTaskTimes",[10304000]]] | AK60: 4 | AL60: 找<佣兵长马塞尔|arg=10010200>领取奖励 | AM60: "找<佣兵长马塞尔|arg=10010200>领取奖励" | AN60: 1 | AO60: 2 | AQ60: 27700 | AR60: {enhance_money,20} | AS60: 65
A61: 10304059 | B61: 荒岩龙虫 | D61: 悬赏任务 | E61: 悬赏任务（剩余<span color:FFE21B1B>{0}</span>次） | F61: ["getTaskTimes",[10304000]] | H61: 10010200 | I61: 10010200 | J61: [] | K61: 43 | L61: 100 | M61: 0 | N61: 0 | O61: 日常 | Q61: 2 | U61: son | V61: 10304000 | AC61: 击杀70只荒岩龙虫(43级) | AD61: reward_icon.tx_huanyanlongchong | AG61: 5 | AH61: ="["&RC[11]&","""&RC[-32]&"""]" -> [70,"荒岩龙虫"] | AI61: 3 | AJ61: [["getTaskTimes",[10304000]]] | AK61: 4 | AL61: 找<佣兵长马塞尔|arg=10010200>领取奖励 | AM61: "找<佣兵长马塞尔|arg=10010200>领取奖励" | AN61: 1 | AO61: 3 | AQ61: 55400 | AR61: {enhance_money,40},{item,{110059001,1}} | AS61: 70
A62: 10304060 | B62: 荒岩龙虫 | D62: 悬赏任务 | E62: 悬赏任务（剩余<span color:FFE21B1B>{0}</span>次） | F62: ["getTaskTimes",[10304000]] | H62: 10010200 | I62: 10010200 | J62: [] | K62: 43 | L62: 100 | M62: 0 | N62: 0 | O62: 日常 | Q62: 2 | U62: son | V62: 10304000 | AC62: 击杀75只荒岩龙虫(43级) | AD62: reward_icon.tx_huanyanlongchong | AG62: 5 | AH62: ="["&RC[11]&","""&RC[-32]&"""]" -> [75,"荒岩龙虫"] | AI62: 3 | AJ62: [["getTaskTimes",[10304000]]] | AK62: 4 | AL62: 找<佣兵长马塞尔|arg=10010200>领取奖励 | AM62: "找<佣兵长马塞尔|arg=10010200>领取奖励" | AN62: 1 | AO62: 4 | AQ62: 83000 | AR62: {enhance_money,80},{item,{110059001,1}} | AS62: 75
A63: 10304061 | B63: 紫兰魔鹰 | D63: 悬赏任务 | E63: 悬赏任务（剩余<span color:FFE21B1B>{0}</span>次） | F63: ["getTaskTimes",[10304000]] | H63: 10010200 | I63: 10010200 | J63: [] | K63: 21 | L63: 100 | M63: 0 | N63: 0 | O63: 日常 | Q63: 2 | U63: son | V63: 10304000 | AC63: 击杀45只紫兰魔鹰(21级) | AD63: reward_icon.tx_zilanmoying | AG63: 5 | AH63: ="["&RC[11]&","""&RC[-32]&"""]" -> [45,"紫兰魔鹰"] | AI63: 3 | AJ63: [["getTaskTimes",[10304000]]] | AK63: 4 | AL63: 找<佣兵长马塞尔|arg=10010200>领取奖励 | AM63: "找<佣兵长马塞尔|arg=10010200>领取奖励" | AN63: 1 | AO63: 0 | AQ63: 5400 | AS63: 45
A64: 10304062 | B64: 紫兰魔鹰 | D64: 悬赏任务 | E64: 悬赏任务（剩余<span color:FFE21B1B>{0}</span>次） | F64: ["getTaskTimes",[10304000]] | H64: 10010200 | I64: 10010200 | J64: [] | K64: 21 | L64: 100 | M64: 0 | N64: 0 | O64: 日常 | Q64: 2 | U64: son | V64: 10304000 | AC64: 击杀50只紫兰魔鹰(21级) | AD64: reward_icon.tx_zilanmoying | AG64: 5 | AH64: ="["&RC[11]&","""&RC[-32]&"""]" -> [50,"紫兰魔鹰"] | AI64: 3 | AJ64: [["getTaskTimes",[10304000]]] | AK64: 4 | AL64: 找<佣兵长马塞尔|arg=10010200>领取奖励 | AM64: "找<佣兵长马塞尔|arg=10010200>领取奖励" | AN64: 1 | AO64: 1 | AQ64: 7200 | AS64: 50
A65: 10304063 | B65: 紫兰魔鹰 | D65: 悬赏任务 | E65: 悬赏任务（剩余<span color:FFE21B1B>{0}</span>次） | F65: ["getTaskTimes",[10304000]] | H65: 10010200 | I65: 10010200 | J65: [] | K65: 21 | L65: 100 | M65: 0 | N65: 0 | O65: 日常 | Q65: 2 | U65: son | V65: 10304000 | AC65: 击杀55只紫兰魔鹰(21级) | AD65: reward_icon.tx_zilanmoying | AG65: 5 | AH65: ="["&RC[11]&","""&RC[-32]&"""]" -> [55,"紫兰魔鹰"] | AI65: 3 | AJ65: [["getTaskTimes",[10304000]]] | AK65: 4 | AL65: 找<佣兵长马塞尔|arg=10010200>领取奖励 | AM65: "找<佣兵长马塞尔|arg=10010200>领取奖励" | AN65: 1 | AO65: 2 | AQ65: 14500 | AR65: {enhance_money,20} | AS65: 55
A66: 10304064 | B66: 紫兰魔鹰 | D66: 悬赏任务 | E66: 悬赏任务（剩余<span color:FFE21B1B>{0}</span>次） | F66: ["getTaskTimes",[10304000]] | H66: 10010200 | I66: 10010200 | J66: [] | K66: 21 | L66: 100 | M66: 0 | N66: 0 | O66: 日常 | Q66: 2 | U66: son | V66: 10304000 | AC66: 击杀60只紫兰魔鹰(21级) | AD66: reward_icon.tx_zilanmoying | AG66: 5 | AH66: ="["&RC[11]&","""&RC[-32]&"""]" -> [60,"紫兰魔鹰"] | AI66: 3 | AJ66: [["getTaskTimes",[10304000]]] | AK66: 4 | AL66: 找<佣兵长马塞尔|arg=10010200>领取奖励 | AM66: "找<佣兵长马塞尔|arg=10010200>领取奖励" | AN66: 1 | AO66: 3 | AQ66: 28900 | AR66: {enhance_money,40},{item,{110059001,1}} | AS66: 60
A67: 10304065 | B67: 紫兰魔鹰 | D67: 悬赏任务 | E67: 悬赏任务（剩余<span color:FFE21B1B>{0}</span>次） | F67: ["getTaskTimes",[10304000]] | H67: 10010200 | I67: 10010200 | J67: [] | K67: 21 | L67: 100 | M67: 0 | N67: 0 | O67: 日常 | Q67: 2 | U67: son | V67: 10304000 | AC67: 击杀65只紫兰魔鹰(21级) | AD67: reward_icon.tx_zilanmoying | AG67: 5 | AH67: ="["&RC[11]&","""&RC[-32]&"""]" -> [65,"紫兰魔鹰"] | AI67: 3 | AJ67: [["getTaskTimes",[10304000]]] | AK67: 4 | AL67: 找<佣兵长马塞尔|arg=10010200>领取奖励 | AM67: "找<佣兵长马塞尔|arg=10010200>领取奖励" | AN67: 1 | AO67: 4 | AQ67: 43400 | AR67: {enhance_money,80},{item,{110059001,1}} | AS67: 65
A68: 10304066 | B68: 平原陆行鸟 | D68: 悬赏任务 | E68: 悬赏任务（剩余<span color:FFE21B1B>{0}</span>次） | F68: ["getTaskTimes",[10304000]] | H68: 10010200 | I68: 10010200 | J68: [] | K68: 25 | L68: 100 | M68: 0 | N68: 0 | O68: 日常 | Q68: 2 | U68: son | V68: 10304000 | AC68: 击杀45只平原陆行鸟(25级) | AD68: reward_icon.tx_pingyuanluxingniao | AG68: 5 | AH68: ="["&RC[11]&","""&RC[-32]&"""]" -> [45,"平原陆行鸟"] | AI68: 3 | AJ68: [["getTaskTimes",[10304000]]] | AK68: 4 | AL68: 找<佣兵长马塞尔|arg=10010200>领取奖励 | AM68: "找<佣兵长马塞尔|arg=10010200>领取奖励" | AN68: 1 | AO68: 0 | AQ68: 5800 | AS68: 45
A69: 10304067 | B69: 平原陆行鸟 | D69: 悬赏任务 | E69: 悬赏任务（剩余<span color:FFE21B1B>{0}</span>次） | F69: ["getTaskTimes",[10304000]] | H69: 10010200 | I69: 10010200 | J69: [] | K69: 25 | L69: 100 | M69: 0 | N69: 0 | O69: 日常 | Q69: 2 | U69: son | V69: 10304000 | AC69: 击杀50只平原陆行鸟(25级) | AD69: reward_icon.tx_pingyuanluxingniao | AG69: 5 | AH69: ="["&RC[11]&","""&RC[-32]&"""]" -> [50,"平原陆行鸟"] | AI69: 3 | AJ69: [["getTaskTimes",[10304000]]] | AK69: 4 | AL69: 找<佣兵长马塞尔|arg=10010200>领取奖励 | AM69: "找<佣兵长马塞尔|arg=10010200>领取奖励" | AN69: 1 | AO69: 1 | AQ69: 7700 | AS69: 50
A70: 10304068 | B70: 平原陆行鸟 | D70: 悬赏任务 | E70: 悬赏任务（剩余<span color:FFE21B1B>{0}</span>次） | F70: ["getTaskTimes",[10304000]] | H70: 10010200 | I70: 10010200 | J70: [] | K70: 25 | L70: 100 | M70: 0 | N70: 0 | O70: 日常 | Q70: 2 | U70: son | V70: 10304000 | AC70: 击杀55只平原陆行鸟(25级) | AD70: reward_icon.tx_pingyuanluxingniao | AG70: 5 | AH70: ="["&RC[11]&","""&RC[-32]&"""]" -> [55,"平原陆行鸟"] | AI70: 3 | AJ70: [["getTaskTimes",[10304000]]] | AK70: 4 | AL70: 找<佣兵长马塞尔|arg=10010200>领取奖励 | AM70: "找<佣兵长马塞尔|arg=10010200>领取奖励" | AN70: 1 | AO70: 2 | AQ70: 15400 | AR70: {enhance_money,20} | AS70: 55
A71: 10304069 | B71: 平原陆行鸟 | D71: 悬赏任务 | E71: 悬赏任务（剩余<span color:FFE21B1B>{0}</span>次） | F71: ["getTaskTimes",[10304000]] | H71: 10010200 | I71: 10010200 | J71: [] | K71: 25 | L71: 100 | M71: 0 | N71: 0 | O71: 日常 | Q71: 2 | U71: son | V71: 10304000 | AC71: 击杀60只平原陆行鸟(25级) | AD71: reward_icon.tx_pingyuanluxingniao | AG71: 5 | AH71: ="["&RC[11]&","""&RC[-32]&"""]" -> [60,"平原陆行鸟"] | AI71: 3 | AJ71: [["getTaskTimes",[10304000]]] | AK71: 4 | AL71: 找<佣兵长马塞尔|arg=10010200>领取奖励 | AM71: "找<佣兵长马塞尔|arg=10010200>领取奖励" | AN71: 1 | AO71: 3 | AQ71: 30800 | AR71: {enhance_money,40},{item,{110059001,1}} | AS71: 60
A72: 10304070 | B72: 平原陆行鸟 | D72: 悬赏任务 | E72: 悬赏任务（剩余<span color:FFE21B1B>{0}</span>次） | F72: ["getTaskTimes",[10304000]] | H72: 10010200 | I72: 10010200 | J72: [] | K72: 25 | L72: 100 | M72: 0 | N72: 0 | O72: 日常 | Q72: 2 | U72: son | V72: 10304000 | AC72: 击杀65只平原陆行鸟(25级) | AD72: reward_icon.tx_pingyuanluxingniao | AG72: 5 | AH72: ="["&RC[11]&","""&RC[-32]&"""]" -> [65,"平原陆行鸟"] | AI72: 3 | AJ72: [["getTaskTimes",[10304000]]] | AK72: 4 | AL72: 找<佣兵长马塞尔|arg=10010200>领取奖励 | AM72: "找<佣兵长马塞尔|arg=10010200>领取奖励" | AN72: 1 | AO72: 4 | AQ72: 46100 | AR72: {enhance_money,80},{item,{110059001,1}} | AS72: 65
A73: 10304071 | B73: 裂爪巨鼠 | D73: 悬赏任务 | E73: 悬赏任务（剩余<span color:FFE21B1B>{0}</span>次） | F73: ["getTaskTimes",[10304000]] | H73: 10010200 | I73: 10010200 | J73: [] | K73: 23 | L73: 100 | M73: 0 | N73: 0 | O73: 日常 | Q73: 2 | U73: son | V73: 10304000 | AC73: 击杀45只裂爪巨鼠(23级) | AD73: reward_icon.tx_liezhuajushu | AG73: 5 | AH73: ="["&RC[11]&","""&RC[-32]&"""]" -> [45,"裂爪巨鼠"] | AI73: 3 | AJ73: [["getTaskTimes",[10304000]]] | AK73: 4 | AL73: 找<佣兵长马塞尔|arg=10010200>领取奖励 | AM73: "找<佣兵长马塞尔|arg=10010200>领取奖励" | AN73: 1 | AO73: 0 | AQ73: 5600 | AS73: 45
A74: 10304072 | B74: 裂爪巨鼠 | D74: 悬赏任务 | E74: 悬赏任务（剩余<span color:FFE21B1B>{0}</span>次） | F74: ["getTaskTimes",[10304000]] | H74: 10010200 | I74: 10010200 | J74: [] | K74: 23 | L74: 100 | M74: 0 | N74: 0 | O74: 日常 | Q74: 2 | U74: son | V74: 10304000 | AC74: 击杀50只裂爪巨鼠(23级) | AD74: reward_icon.tx_liezhuajushu | AG74: 5 | AH74: ="["&RC[11]&","""&RC[-32]&"""]" -> [50,"裂爪巨鼠"] | AI74: 3 | AJ74: [["getTaskTimes",[10304000]]] | AK74: 4 | AL74: 找<佣兵长马塞尔|arg=10010200>领取奖励 | AM74: "找<佣兵长马塞尔|arg=10010200>领取奖励" | AN74: 1 | AO74: 1 | AQ74: 7500 | AS74: 50
A75: 10304073 | B75: 裂爪巨鼠 | D75: 悬赏任务 | E75: 悬赏任务（剩余<span color:FFE21B1B>{0}</span>次） | F75: ["getTaskTimes",[10304000]] | H75: 10010200 | I75: 10010200 | J75: [] | K75: 23 | L75: 100 | M75: 0 | N75: 0 | O75: 日常 | Q75: 2 | U75: son | V75: 10304000 | AC75: 击杀55只裂爪巨鼠(23级) | AD75: reward_icon.tx_liezhuajushu | AG75: 5 | AH75: ="["&RC[11]&","""&RC[-32]&"""]" -> [55,"裂爪巨鼠"] | AI75: 3 | AJ75: [["getTaskTimes",[10304000]]] | AK75: 4 | AL75: 找<佣兵长马塞尔|arg=10010200>领取奖励 | AM75: "找<佣兵长马塞尔|arg=10010200>领取奖励" | AN75: 1 | AO75: 2 | AQ75: 15000 | AR75: {enhance_money,20} | AS75: 55
A76: 10304074 | B76: 裂爪巨鼠 | D76: 悬赏任务 | E76: 悬赏任务（剩余<span color:FFE21B1B>{0}</span>次） | F76: ["getTaskTimes",[10304000]] | H76: 10010200 | I76: 10010200 | J76: [] | K76: 23 | L76: 100 | M76: 0 | N76: 0 | O76: 日常 | Q76: 2 | U76: son | V76: 10304000 | AC76: 击杀60只裂爪巨鼠(23级) | AD76: reward_icon.tx_liezhuajushu | AG76: 5 | AH76: ="["&RC[11]&","""&RC[-32]&"""]" -> [60,"裂爪巨鼠"] | AI76: 3 | AJ76: [["getTaskTimes",[10304000]]] | AK76: 4 | AL76: 找<佣兵长马塞尔|arg=10010200>领取奖励 | AM76: "找<佣兵长马塞尔|arg=10010200>领取奖励" | AN76: 1 | AO76: 3 | AQ76: 29900 | AR76: {enhance_money,40},{item,{110059001,1}} | AS76: 60
A77: 10304075 | B77: 裂爪巨鼠 | D77: 悬赏任务 | E77: 悬赏任务（剩余<span color:FFE21B1B>{0}</span>次） | F77: ["getTaskTimes",[10304000]] | H77: 10010200 | I77: 10010200 | J77: [] | K77: 23 | L77: 100 | M77: 0 | N77: 0 | O77: 日常 | Q77: 2 | U77: son | V77: 10304000 | AC77: 击杀65只裂爪巨鼠(23级) | AD77: reward_icon.tx_liezhuajushu | AG77: 5 | AH77: ="["&RC[11]&","""&RC[-32]&"""]" -> [65,"裂爪巨鼠"] | AI77: 3 | AJ77: [["getTaskTimes",[10304000]]] | AK77: 4 | AL77: 找<佣兵长马塞尔|arg=10010200>领取奖励 | AM77: "找<佣兵长马塞尔|arg=10010200>领取奖励" | AN77: 1 | AO77: 4 | AQ77: 44900 | AR77: {enhance_money,80},{item,{110059001,1}} | AS77: 65
A78: 10304076 | B78: 狮虎兽 | D78: 悬赏任务 | E78: 悬赏任务（剩余<span color:FFE21B1B>{0}</span>次） | F78: ["getTaskTimes",[10304000]] | H78: 10010200 | I78: 10010200 | J78: [] | K78: 27 | L78: 100 | M78: 0 | N78: 0 | O78: 日常 | Q78: 2 | U78: son | V78: 10304000 | AC78: 击杀45只狮虎兽(27级) | AD78: reward_icon.tx_shihushou | AG78: 5 | AH78: ="["&RC[11]&","""&RC[-32]&"""]" -> [45,"狮虎兽"] | AI78: 3 | AJ78: [["getTaskTimes",[10304000]]] | AK78: 4 | AL78: 找<佣兵长马塞尔|arg=10010200>领取奖励 | AM78: "找<佣兵长马塞尔|arg=10010200>领取奖励" | AN78: 1 | AO78: 0 | AQ78: 5900 | AS78: 45
A79: 10304077 | B79: 狮虎兽 | D79: 悬赏任务 | E79: 悬赏任务（剩余<span color:FFE21B1B>{0}</span>次） | F79: ["getTaskTimes",[10304000]] | H79: 10010200 | I79: 10010200 | J79: [] | K79: 27 | L79: 100 | M79: 0 | N79: 0 | O79: 日常 | Q79: 2 | U79: son | V79: 10304000 | AC79: 击杀50只狮虎兽(27级) | AD79: reward_icon.tx_shihushou | AG79: 5 | AH79: ="["&RC[11]&","""&RC[-32]&"""]" -> [50,"狮虎兽"] | AI79: 3 | AJ79: [["getTaskTimes",[10304000]]] | AK79: 4 | AL79: 找<佣兵长马塞尔|arg=10010200>领取奖励 | AM79: "找<佣兵长马塞尔|arg=10010200>领取奖励" | AN79: 1 | AO79: 1 | AQ79: 7800 | AS79: 50
A80: 10304078 | B80: 狮虎兽 | D80: 悬赏任务 | E80: 悬赏任务（剩余<span color:FFE21B1B>{0}</span>次） | F80: ["getTaskTimes",[10304000]] | H80: 10010200 | I80: 10010200 | J80: [] | K80: 27 | L80: 100 | M80: 0 | N80: 0 | O80: 日常 | Q80: 2 | U80: son | V80: 10304000 | AC80: 击杀55只狮虎兽(27级) | AD80: reward_icon.tx_shihushou | AG80: 5 | AH80: ="["&RC[11]&","""&RC[-32]&"""]" -> [55,"狮虎兽"] | AI80: 3 | AJ80: [["getTaskTimes",[10304000]]] | AK80: 4 | AL80: 找<佣兵长马塞尔|arg=10010200>领取奖励 | AM80: "找<佣兵长马塞尔|arg=10010200>领取奖励" | AN80: 1 | AO80: 2 | AQ80: 15700 | AR80: {enhance_money,20} | AS80: 55
A81: 10304079 | B81: 狮虎兽 | D81: 悬赏任务 | E81: 悬赏任务（剩余<span color:FFE21B1B>{0}</span>次） | F81: ["getTaskTimes",[10304000]] | H81: 10010200 | I81: 10010200 | J81: [] | K81: 27 | L81: 100 | M81: 0 | N81: 0 | O81: 日常 | Q81: 2 | U81: son | V81: 10304000 | AC81: 击杀60只狮虎兽(27级) | AD81: reward_icon.tx_shihushou | AG81: 5 | AH81: ="["&RC[11]&","""&RC[-32]&"""]" -> [60,"狮虎兽"] | AI81: 3 | AJ81: [["getTaskTimes",[10304000]]] | AK81: 4 | AL81: 找<佣兵长马塞尔|arg=10010200>领取奖励 | AM81: "找<佣兵长马塞尔|arg=10010200>领取奖励" | AN81: 1 | AO81: 3 | AQ81: 31400 | AR81: {enhance_money,40},{item,{110059001,1}} | AS81: 60
A82: 10304080 | B82: 狮虎兽 | D82: 悬赏任务 | E82: 悬赏任务（剩余<span color:FFE21B1B>{0}</span>次） | F82: ["getTaskTimes",[10304000]] | H82: 10010200 | I82: 10010200 | J82: [] | K82: 27 | L82: 100 | M82: 0 | N82: 0 | O82: 日常 | Q82: 2 | U82: son | V82: 10304000 | AC82: 击杀65只狮虎兽(27级) | AD82: reward_icon.tx_shihushou | AG82: 5 | AH82: ="["&RC[11]&","""&RC[-32]&"""]" -> [65,"狮虎兽"] | AI82: 3 | AJ82: [["getTaskTimes",[10304000]]] | AK82: 4 | AL82: 找<佣兵长马塞尔|arg=10010200>领取奖励 | AM82: "找<佣兵长马塞尔|arg=10010200>领取奖励" | AN82: 1 | AO82: 4 | AQ82: 47100 | AR82: {enhance_money,80},{item,{110059001,1}} | AS82: 65
A83: 10304081 | B83: 劈山兽 | D83: 悬赏任务 | E83: 悬赏任务（剩余<span color:FFE21B1B>{0}</span>次） | F83: ["getTaskTimes",[10304000]] | H83: 10010200 | I83: 10010200 | J83: [] | K83: 29 | L83: 100 | M83: 0 | N83: 0 | O83: 日常 | Q83: 2 | U83: son | V83: 10304000 | AC83: 击杀45只劈山兽(29级) | AD83: reward_icon.tx_pishangshou | AG83: 5 | AH83: ="["&RC[11]&","""&RC[-32]&"""]" -> [45,"劈山兽"] | AI83: 3 | AJ83: [["getTaskTimes",[10304000]]] | AK83: 4 | AL83: 找<佣兵长马塞尔|arg=10010200>领取奖励 | AM83: "找<佣兵长马塞尔|arg=10010200>领取奖励" | AN83: 1 | AO83: 0 | AQ83: 6000 | AS83: 45
A84: 10304082 | B84: 劈山兽 | D84: 悬赏任务 | E84: 悬赏任务（剩余<span color:FFE21B1B>{0}</span>次） | F84: ["getTaskTimes",[10304000]] | H84: 10010200 | I84: 10010200 | J84: [] | K84: 29 | L84: 100 | M84: 0 | N84: 0 | O84: 日常 | Q84: 2 | U84: son | V84: 10304000 | AC84: 击杀50只劈山兽(29级) | AD84: reward_icon.tx_pishangshou | AG84: 5 | AH84: ="["&RC[11]&","""&RC[-32]&"""]" -> [50,"劈山兽"] | AI84: 3 | AJ84: [["getTaskTimes",[10304000]]] | AK84: 4 | AL84: 找<佣兵长马塞尔|arg=10010200>领取奖励 | AM84: "找<佣兵长马塞尔|arg=10010200>领取奖励" | AN84: 1 | AO84: 1 | AQ84: 8000 | AS84: 50
A85: 10304083 | B85: 劈山兽 | D85: 悬赏任务 | E85: 悬赏任务（剩余<span color:FFE21B1B>{0}</span>次） | F85: ["getTaskTimes",[10304000]] | H85: 10010200 | I85: 10010200 | J85: [] | K85: 29 | L85: 100 | M85: 0 | N85: 0 | O85: 日常 | Q85: 2 | U85: son | V85: 10304000 | AC85: 击杀55只劈山兽(29级) | AD85: reward_icon.tx_pishangshou | AG85: 5 | AH85: ="["&RC[11]&","""&RC[-32]&"""]" -> [55,"劈山兽"] | AI85: 3 | AJ85: [["getTaskTimes",[10304000]]] | AK85: 4 | AL85: 找<佣兵长马塞尔|arg=10010200>领取奖励 | AM85: "找<佣兵长马塞尔|arg=10010200>领取奖励" | AN85: 1 | AO85: 2 | AQ85: 16100 | AR85: {enhance_money,20} | AS85: 55
A86: 10304084 | B86: 劈山兽 | D86: 悬赏任务 | E86: 悬赏任务（剩余<span color:FFE21B1B>{0}</span>次） | F86: ["getTaskTimes",[10304000]] | H86: 10010200 | I86: 10010200 | J86: [] | K86: 29 | L86: 100 | M86: 0 | N86: 0 | O86: 日常 | Q86: 2 | U86: son | V86: 10304000 | AC86: 击杀60只劈山兽(29级) | AD86: reward_icon.tx_pishangshou | AG86: 5 | AH86: ="["&RC[11]&","""&RC[-32]&"""]" -> [60,"劈山兽"] | AI86: 3 | AJ86: [["getTaskTimes",[10304000]]] | AK86: 4 | AL86: 找<佣兵长马塞尔|arg=10010200>领取奖励 | AM86: "找<佣兵长马塞尔|arg=10010200>领取奖励" | AN86: 1 | AO86: 3 | AQ86: 32200 | AR86: {enhance_money,40},{item,{110059001,1}} | AS86: 60
A87: 10304085 | B87: 劈山兽 | D87: 悬赏任务 | E87: 悬赏任务（剩余<span color:FFE21B1B>{0}</span>次） | F87: ["getTaskTimes",[10304000]] | H87: 10010200 | I87: 10010200 | J87: [] | K87: 29 | L87: 100 | M87: 0 | N87: 0 | O87: 日常 | Q87: 2 | U87: son | V87: 10304000 | AC87: 击杀65只劈山兽(29级) | AD87: reward_icon.tx_pishangshou | AG87: 5 | AH87: ="["&RC[11]&","""&RC[-32]&"""]" -> [65,"劈山兽"] | AI87: 3 | AJ87: [["getTaskTimes",[10304000]]] | AK87: 4 | AL87: 找<佣兵长马塞尔|arg=10010200>领取奖励 | AM87: "找<佣兵长马塞尔|arg=10010200>领取奖励" | AN87: 1 | AO87: 4 | AQ87: 48200 | AR87: {enhance_money,80},{item,{110059001,1}} | AS87: 65
A88: 10304086 | B88: 骷髅战士 | D88: 悬赏任务 | E88: 悬赏任务（剩余<span color:FFE21B1B>{0}</span>次） | F88: ["getTaskTimes",[10304000]] | H88: 10010200 | I88: 10010200 | J88: [] | K88: 1 | L88: 100 | M88: 0 | N88: 0 | O88: 日常 | Q88: 2 | U88: son | V88: 10304000 | AC88: 击杀65只骷髅战士(1级) | AD88: reward_icon.tx_kulouzhanshi | AG88: 5 | AH88: ="["&RC[11]&","""&RC[-32]&"""]" -> [65,"骷髅战士"] | AI88: 3 | AJ88: [["getTaskTimes",[10304000]]] | AK88: 4 | AL88: 找<佣兵长马塞尔|arg=10010200>领取奖励 | AM88: "找<佣兵长马塞尔|arg=10010200>领取奖励" | AN88: 1 | AO88: 0 | AQ88: 1700 | AS88: 65
A89: 10304087 | B89: 骷髅战士 | D89: 悬赏任务 | E89: 悬赏任务（剩余<span color:FFE21B1B>{0}</span>次） | F89: ["getTaskTimes",[10304000]] | H89: 10010200 | I89: 10010200 | J89: [] | K89: 1 | L89: 100 | M89: 0 | N89: 0 | O89: 日常 | Q89: 2 | U89: son | V89: 10304000 | AC89: 击杀70只骷髅战士(1级) | AD89: reward_icon.tx_kulouzhanshi | AG89: 5 | AH89: ="["&RC[11]&","""&RC[-32]&"""]" -> [70,"骷髅战士"] | AI89: 3 | AJ89: [["getTaskTimes",[10304000]]] | AK89: 4 | AL89: 找<佣兵长马塞尔|arg=10010200>领取奖励 | AM89: "找<佣兵长马塞尔|arg=10010200>领取奖励" | AN89: 1 | AO89: 1 | AQ89: 2300 | AS89: 70
A90: 10304088 | B90: 骷髅战士 | D90: 悬赏任务 | E90: 悬赏任务（剩余<span color:FFE21B1B>{0}</span>次） | F90: ["getTaskTimes",[10304000]] | H90: 10010200 | I90: 10010200 | J90: [] | K90: 1 | L90: 100 | M90: 0 | N90: 0 | O90: 日常 | Q90: 2 | U90: son | V90: 10304000 | AC90: 击杀75只骷髅战士(1级) | AD90: reward_icon.tx_kulouzhanshi | AG90: 5 | AH90: ="["&RC[11]&","""&RC[-32]&"""]" -> [75,"骷髅战士"] | AI90: 3 | AJ90: [["getTaskTimes",[10304000]]] | AK90: 4 | AL90: 找<佣兵长马塞尔|arg=10010200>领取奖励 | AM90: "找<佣兵长马塞尔|arg=10010200>领取奖励" | AN90: 1 | AO90: 2 | AQ90: 4500 | AR90: {enhance_money,20} | AS90: 75
A91: 10304089 | B91: 骷髅战士 | D91: 悬赏任务 | E91: 悬赏任务（剩余<span color:FFE21B1B>{0}</span>次） | F91: ["getTaskTimes",[10304000]] | H91: 10010200 | I91: 10010200 | J91: [] | K91: 1 | L91: 100 | M91: 0 | N91: 0 | O91: 日常 | Q91: 2 | U91: son | V91: 10304000 | AC91: 击杀80只骷髅战士(1级) | AD91: reward_icon.tx_kulouzhanshi | AG91: 5 | AH91: ="["&RC[11]&","""&RC[-32]&"""]" -> [80,"骷髅战士"] | AI91: 3 | AJ91: [["getTaskTimes",[10304000]]] | AK91: 4 | AL91: 找<佣兵长马塞尔|arg=10010200>领取奖励 | AM91: "找<佣兵长马塞尔|arg=10010200>领取奖励" | AN91: 1 | AO91: 3 | AQ91: 9100 | AR91: {enhance_money,40},{item,{110059001,1}} | AS91: 80
A92: 10304090 | B92: 骷髅战士 | D92: 悬赏任务 | E92: 悬赏任务（剩余<span color:FFE21B1B>{0}</span>次） | F92: ["getTaskTimes",[10304000]] | H92: 10010200 | I92: 10010200 | J92: [] | K92: 1 | L92: 100 | M92: 0 | N92: 0 | O92: 日常 | Q92: 2 | U92: son | V92: 10304000 | AC92: 击杀85只骷髅战士(1级) | AD92: reward_icon.tx_kulouzhanshi | AG92: 5 | AH92: ="["&RC[11]&","""&RC[-32]&"""]" -> [85,"骷髅战士"] | AI92: 3 | AJ92: [["getTaskTimes",[10304000]]] | AK92: 4 | AL92: 找<佣兵长马塞尔|arg=10010200>领取奖励 | AM92: "找<佣兵长马塞尔|arg=10010200>领取奖励" | AN92: 1 | AO92: 4 | AQ92: 13600 | AR92: {enhance_money,80},{item,{110059001,1}} | AS92: 85
A93: 10304091 | B93: 哀鸣游魂 | D93: 悬赏任务 | E93: 悬赏任务（剩余<span color:FFE21B1B>{0}</span>次） | F93: ["getTaskTimes",[10304000]] | H93: 10010200 | I93: 10010200 | J93: [] | K93: 1 | L93: 100 | M93: 0 | N93: 0 | O93: 日常 | Q93: 2 | U93: son | V93: 10304000 | AC93: 击杀65只哀鸣游魂(1级) | AD93: reward_icon.tx_aimingyouhun | AG93: 5 | AH93: ="["&RC[11]&","""&RC[-32]&"""]" -> [65,"哀鸣游魂"] | AI93: 3 | AJ93: [["getTaskTimes",[10304000]]] | AK93: 4 | AL93: 找<佣兵长马塞尔|arg=10010200>领取奖励 | AM93: "找<佣兵长马塞尔|arg=10010200>领取奖励" | AN93: 1 | AO93: 0 | AQ93: 1700 | AS93: 65
A94: 10304092 | B94: 哀鸣游魂 | D94: 悬赏任务 | E94: 悬赏任务（剩余<span color:FFE21B1B>{0}</span>次） | F94: ["getTaskTimes",[10304000]] | H94: 10010200 | I94: 10010200 | J94: [] | K94: 1 | L94: 100 | M94: 0 | N94: 0 | O94: 日常 | Q94: 2 | U94: son | V94: 10304000 | AC94: 击杀70只哀鸣游魂(1级) | AD94: reward_icon.tx_aimingyouhun | AG94: 5 | AH94: ="["&RC[11]&","""&RC[-32]&"""]" -> [70,"哀鸣游魂"] | AI94: 3 | AJ94: [["getTaskTimes",[10304000]]] | AK94: 4 | AL94: 找<佣兵长马塞尔|arg=10010200>领取奖励 | AM94: "找<佣兵长马塞尔|arg=10010200>领取奖励" | AN94: 1 | AO94: 1 | AQ94: 2300 | AS94: 70
A95: 10304093 | B95: 哀鸣游魂 | D95: 悬赏任务 | E95: 悬赏任务（剩余<span color:FFE21B1B>{0}</span>次） | F95: ["getTaskTimes",[10304000]] | H95: 10010200 | I95: 10010200 | J95: [] | K95: 1 | L95: 100 | M95: 0 | N95: 0 | O95: 日常 | Q95: 2 | U95: son | V95: 10304000 | AC95: 击杀75只哀鸣游魂(1级) | AD95: reward_icon.tx_aimingyouhun | AG95: 5 | AH95: ="["&RC[11]&","""&RC[-32]&"""]" -> [75,"哀鸣游魂"] | AI95: 3 | AJ95: [["getTaskTimes",[10304000]]] | AK95: 4 | AL95: 找<佣兵长马塞尔|arg=10010200>领取奖励 | AM95: "找<佣兵长马塞尔|arg=10010200>领取奖励" | AN95: 1 | AO95: 2 | AQ95: 4500 | AR95: {enhance_money,20} | AS95: 75
A96: 10304094 | B96: 哀鸣游魂 | D96: 悬赏任务 | E96: 悬赏任务（剩余<span color:FFE21B1B>{0}</span>次） | F96: ["getTaskTimes",[10304000]] | H96: 10010200 | I96: 10010200 | J96: [] | K96: 1 | L96: 100 | M96: 0 | N96: 0 | O96: 日常 | Q96: 2 | U96: son | V96: 10304000 | AC96: 击杀80只哀鸣游魂(1级) | AD96: reward_icon.tx_aimingyouhun | AG96: 5 | AH96: ="["&RC[11]&","""&RC[-32]&"""]" -> [80,"哀鸣游魂"] | AI96: 3 | AJ96: [["getTaskTimes",[10304000]]] | AK96: 4 | AL96: 找<佣兵长马塞尔|arg=10010200>领取奖励 | AM96: "找<佣兵长马塞尔|arg=10010200>领取奖励" | AN96: 1 | AO96: 3 | AQ96: 9100 | AR96: {enhance_money,40},{item,{110059001,1}} | AS96: 80
A97: 10304095 | B97: 哀鸣游魂 | D97: 悬赏任务 | E97: 悬赏任务（剩余<span color:FFE21B1B>{0}</span>次） | F97: ["getTaskTimes",[10304000]] | H97: 10010200 | I97: 10010200 | J97: [] | K97: 1 | L97: 100 | M97: 0 | N97: 0 | O97: 日常 | Q97: 2 | U97: son | V97: 10304000 | AC97: 击杀85只哀鸣游魂(1级) | AD97: reward_icon.tx_aimingyouhun | AG97: 5 | AH97: ="["&RC[11]&","""&RC[-32]&"""]" -> [85,"哀鸣游魂"] | AI97: 3 | AJ97: [["getTaskTimes",[10304000]]] | AK97: 4 | AL97: 找<佣兵长马塞尔|arg=10010200>领取奖励 | AM97: "找<佣兵长马塞尔|arg=10010200>领取奖励" | AN97: 1 | AO97: 4 | AQ97: 13600 | AR97: {enhance_money,80},{item,{110059001,1}} | AS97: 85
A98: 10304096 | B98: 火炎亡者 | D98: 悬赏任务 | E98: 悬赏任务（剩余<span color:FFE21B1B>{0}</span>次） | F98: ["getTaskTimes",[10304000]] | H98: 10010200 | I98: 10010200 | J98: [] | K98: 1 | L98: 100 | M98: 0 | N98: 0 | O98: 日常 | Q98: 2 | U98: son | V98: 10304000 | AC98: 击杀65只火炎亡者(1级) | AD98: reward_icon.tx_huoyanwangzhe | AG98: 5 | AH98: ="["&RC[11]&","""&RC[-32]&"""]" -> [65,"火炎亡者"] | AI98: 3 | AJ98: [["getTaskTimes",[10304000]]] | AK98: 4 | AL98: 找<佣兵长马塞尔|arg=10010200>领取奖励 | AM98: "找<佣兵长马塞尔|arg=10010200>领取奖励" | AN98: 1 | AO98: 0 | AQ98: 1700 | AS98: 65
A99: 10304097 | B99: 火炎亡者 | D99: 悬赏任务 | E99: 悬赏任务（剩余<span color:FFE21B1B>{0}</span>次） | F99: ["getTaskTimes",[10304000]] | H99: 10010200 | I99: 10010200 | J99: [] | K99: 1 | L99: 100 | M99: 0 | N99: 0 | O99: 日常 | Q99: 2 | U99: son | V99: 10304000 | AC99: 击杀70只火炎亡者(1级) | AD99: reward_icon.tx_huoyanwangzhe | AG99: 5 | AH99: ="["&RC[11]&","""&RC[-32]&"""]" -> [70,"火炎亡者"] | AI99: 3 | AJ99: [["getTaskTimes",[10304000]]] | AK99: 4 | AL99: 找<佣兵长马塞尔|arg=10010200>领取奖励 | AM99: "找<佣兵长马塞尔|arg=10010200>领取奖励" | AN99: 1 | AO99: 1 | AQ99: 2300 | AS99: 70
A100: 10304098 | B100: 火炎亡者 | D100: 悬赏任务 | E100: 悬赏任务（剩余<span color:FFE21B1B>{0}</span>次） | F100: ["getTaskTimes",[10304000]] | H100: 10010200 | I100: 10010200 | J100: [] | K100: 1 | L100: 100 | M100: 0 | N100: 0 | O100: 日常 | Q100: 2 | U100: son | V100: 10304000 | AC100: 击杀75只火炎亡者(1级) | AD100: reward_icon.tx_huoyanwangzhe | AG100: 5 | AH100: ="["&RC[11]&","""&RC[-32]&"""]" -> [75,"火炎亡者"] | AI100: 3 | AJ100: [["getTaskTimes",[10304000]]] | AK100: 4 | AL100: 找<佣兵长马塞尔|arg=10010200>领取奖励 | AM100: "找<佣兵长马塞尔|arg=10010200>领取奖励" | AN100: 1 | AO100: 2 | AQ100: 4500 | AR100: {enhance_money,20} | AS100: 75
A101: 10304099 | B101: 火炎亡者 | D101: 悬赏任务 | E101: 悬赏任务（剩余<span color:FFE21B1B>{0}</span>次） | F101: ["getTaskTimes",[10304000]] | H101: 10010200 | I101: 10010200 | J101: [] | K101: 1 | L101: 100 | M101: 0 | N101: 0 | O101: 日常 | Q101: 2 | U101: son | V101: 10304000 | AC101: 击杀80只火炎亡者(1级) | AD101: reward_icon.tx_huoyanwangzhe | AG101: 5 | AH101: ="["&RC[11]&","""&RC[-32]&"""]" -> [80,"火炎亡者"] | AI101: 3 | AJ101: [["getTaskTimes",[10304000]]] | AK101: 4 | AL101: 找<佣兵长马塞尔|arg=10010200>领取奖励 | AM101: "找<佣兵长马塞尔|arg=10010200>领取奖励" | AN101: 1 | AO101: 3 | AQ101: 9100 | AR101: {enhance_money,40},{item,{110059001,1}} | AS101: 80
A102: 10304100 | B102: 火炎亡者 | D102: 悬赏任务 | E102: 悬赏任务（剩余<span color:FFE21B1B>{0}</span>次） | F102: ["getTaskTimes",[10304000]] | H102: 10010200 | I102: 10010200 | J102: [] | K102: 1 | L102: 100 | M102: 0 | N102: 0 | O102: 日常 | Q102: 2 | U102: son | V102: 10304000 | AC102: 击杀85只火炎亡者(1级) | AD102: reward_icon.tx_huoyanwangzhe | AG102: 5 | AH102: ="["&RC[11]&","""&RC[-32]&"""]" -> [85,"火炎亡者"] | AI102: 3 | AJ102: [["getTaskTimes",[10304000]]] | AK102: 4 | AL102: 找<佣兵长马塞尔|arg=10010200>领取奖励 | AM102: "找<佣兵长马塞尔|arg=10010200>领取奖励" | AN102: 1 | AO102: 4 | AQ102: 13600 | AR102: {enhance_money,80},{item,{110059001,1}} | AS102: 85
A103: 10304101 | B103: 痛苦女妖 | D103: 悬赏任务 | E103: 悬赏任务（剩余<span color:FFE21B1B>{0}</span>次） | F103: ["getTaskTimes",[10304000]] | H103: 10010200 | I103: 10010200 | J103: [] | K103: 1 | L103: 100 | M103: 0 | N103: 0 | O103: 日常 | Q103: 2 | U103: son | V103: 10304000 | AC103: 击杀65只痛苦女妖(1级) | AD103: reward_icon.tx_tongkunvyao | AG103: 5 | AH103: ="["&RC[11]&","""&RC[-32]&"""]" -> [65,"痛苦女妖"] | AI103: 3 | AJ103: [["getTaskTimes",[10304000]]] | AK103: 4 | AL103: 找<佣兵长马塞尔|arg=10010200>领取奖励 | AM103: "找<佣兵长马塞尔|arg=10010200>领取奖励" | AN103: 1 | AO103: 0 | AQ103: 1700 | AS103: 65
A104: 10304102 | B104: 痛苦女妖 | D104: 悬赏任务 | E104: 悬赏任务（剩余<span color:FFE21B1B>{0}</span>次） | F104: ["getTaskTimes",[10304000]] | H104: 10010200 | I104: 10010200 | J104: [] | K104: 1 | L104: 100 | M104: 0 | N104: 0 | O104: 日常 | Q104: 2 | U104: son | V104: 10304000 | AC104: 击杀70只痛苦女妖(1级) | AD104: reward_icon.tx_tongkunvyao | AG104: 5 | AH104: ="["&RC[11]&","""&RC[-32]&"""]" -> [70,"痛苦女妖"] | AI104: 3 | AJ104: [["getTaskTimes",[10304000]]] | AK104: 4 | AL104: 找<佣兵长马塞尔|arg=10010200>领取奖励 | AM104: "找<佣兵长马塞尔|arg=10010200>领取奖励" | AN104: 1 | AO104: 1 | AQ104: 2300 | AS104: 70
A105: 10304103 | B105: 痛苦女妖 | D105: 悬赏任务 | E105: 悬赏任务（剩余<span color:FFE21B1B>{0}</span>次） | F105: ["getTaskTimes",[10304000]] | H105: 10010200 | I105: 10010200 | J105: [] | K105: 1 | L105: 100 | M105: 0 | N105: 0 | O105: 日常 | Q105: 2 | U105: son | V105: 10304000 | AC105: 击杀75只痛苦女妖(1级) | AD105: reward_icon.tx_tongkunvyao | AG105: 5 | AH105: ="["&RC[11]&","""&RC[-32]&"""]" -> [75,"痛苦女妖"] | AI105: 3 | AJ105: [["getTaskTimes",[10304000]]] | AK105: 4 | AL105: 找<佣兵长马塞尔|arg=10010200>领取奖励 | AM105: "找<佣兵长马塞尔|arg=10010200>领取奖励" | AN105: 1 | AO105: 2 | AQ105: 4500 | AR105: {enhance_money,20} | AS105: 75
A106: 10304104 | B106: 痛苦女妖 | D106: 悬赏任务 | E106: 悬赏任务（剩余<span color:FFE21B1B>{0}</span>次） | F106: ["getTaskTimes",[10304000]] | H106: 10010200 | I106: 10010200 | J106: [] | K106: 1 | L106: 100 | M106: 0 | N106: 0 | O106: 日常 | Q106: 2 | U106: son | V106: 10304000 | AC106: 击杀80只痛苦女妖(1级) | AD106: reward_icon.tx_tongkunvyao | AG106: 5 | AH106: ="["&RC[11]&","""&RC[-32]&"""]" -> [80,"痛苦女妖"] | AI106: 3 | AJ106: [["getTaskTimes",[10304000]]] | AK106: 4 | AL106: 找<佣兵长马塞尔|arg=10010200>领取奖励 | AM106: "找<佣兵长马塞尔|arg=10010200>领取奖励" | AN106: 1 | AO106: 3 | AQ106: 9100 | AR106: {enhance_money,40},{item,{110059001,1}} | AS106: 80
A107: 10304105 | B107: 痛苦女妖 | D107: 悬赏任务 | E107: 悬赏任务（剩余<span color:FFE21B1B>{0}</span>次） | F107: ["getTaskTimes",[10304000]] | H107: 10010200 | I107: 10010200 | J107: [] | K107: 1 | L107: 100 | M107: 0 | N107: 0 | O107: 日常 | Q107: 2 | U107: son | V107: 10304000 | AC107: 击杀85只痛苦女妖(1级) | AD107: reward_icon.tx_tongkunvyao | AG107: 5 | AH107: ="["&RC[11]&","""&RC[-32]&"""]" -> [85,"痛苦女妖"] | AI107: 3 | AJ107: [["getTaskTimes",[10304000]]] | AK107: 4 | AL107: 找<佣兵长马塞尔|arg=10010200>领取奖励 | AM107: "找<佣兵长马塞尔|arg=10010200>领取奖励" | AN107: 1 | AO107: 4 | AQ107: 13600 | AR107: {enhance_money,80},{item,{110059001,1}} | AS107: 85
A108: 10304106 | B108: 屠杀者哈坎 | D108: 悬赏任务 | E108: 悬赏任务（剩余<span color:FFE21B1B>{0}</span>次） | F108: ["getTaskTimes",[10304000]] | H108: 10010200 | I108: 10010200 | J108: [] | K108: 1 | L108: 100 | M108: 0 | N108: 0 | O108: 日常 | Q108: 2 | U108: son | V108: 10304000 | AC108: 击杀65只屠杀者哈坎(1级) | AD108: reward_icon.tx_tushazhehakan | AG108: 5 | AH108: ="["&RC[11]&","""&RC[-32]&"""]" -> [65,"屠杀者哈坎"] | AI108: 3 | AJ108: [["getTaskTimes",[10304000]]] | AK108: 4 | AL108: 找<佣兵长马塞尔|arg=10010200>领取奖励 | AM108: "找<佣兵长马塞尔|arg=10010200>领取奖励" | AN108: 1 | AO108: 0 | AQ108: 1700 | AS108: 65
A109: 10304107 | B109: 屠杀者哈坎 | D109: 悬赏任务 | E109: 悬赏任务（剩余<span color:FFE21B1B>{0}</span>次） | F109: ["getTaskTimes",[10304000]] | H109: 10010200 | I109: 10010200 | J109: [] | K109: 1 | L109: 100 | M109: 0 | N109: 0 | O109: 日常 | Q109: 2 | U109: son | V109: 10304000 | AC109: 击杀70只屠杀者哈坎(1级) | AD109: reward_icon.tx_tushazhehakan | AG109: 5 | AH109: ="["&RC[11]&","""&RC[-32]&"""]" -> [70,"屠杀者哈坎"] | AI109: 3 | AJ109: [["getTaskTimes",[10304000]]] | AK109: 4 | AL109: 找<佣兵长马塞尔|arg=10010200>领取奖励 | AM109: "找<佣兵长马塞尔|arg=10010200>领取奖励" | AN109: 1 | AO109: 1 | AQ109: 2300 | AS109: 70
A110: 10304108 | B110: 屠杀者哈坎 | D110: 悬赏任务 | E110: 悬赏任务（剩余<span color:FFE21B1B>{0}</span>次） | F110: ["getTaskTimes",[10304000]] | H110: 10010200 | I110: 10010200 | J110: [] | K110: 1 | L110: 100 | M110: 0 | N110: 0 | O110: 日常 | Q110: 2 | U110: son | V110: 10304000 | AC110: 击杀75只屠杀者哈坎(1级) | AD110: reward_icon.tx_tushazhehakan | AG110: 5 | AH110: ="["&RC[11]&","""&RC[-32]&"""]" -> [75,"屠杀者哈坎"] | AI110: 3 | AJ110: [["getTaskTimes",[10304000]]] | AK110: 4 | AL110: 找<佣兵长马塞尔|arg=10010200>领取奖励 | AM110: "找<佣兵长马塞尔|arg=10010200>领取奖励" | AN110: 1 | AO110: 2 | AQ110: 4500 | AR110: {enhance_money,20} | AS110: 75
A111: 10304109 | B111: 屠杀者哈坎 | D111: 悬赏任务 | E111: 悬赏任务（剩余<span color:FFE21B1B>{0}</span>次） | F111: ["getTaskTimes",[10304000]] | H111: 10010200 | I111: 10010200 | J111: [] | K111: 1 | L111: 100 | M111: 0 | N111: 0 | O111: 日常 | Q111: 2 | U111: son | V111: 10304000 | AC111: 击杀80只屠杀者哈坎(1级) | AD111: reward_icon.tx_tushazhehakan | AG111: 5 | AH111: ="["&RC[11]&","""&RC[-32]&"""]" -> [80,"屠杀者哈坎"] | AI111: 3 | AJ111: [["getTaskTimes",[10304000]]] | AK111: 4 | AL111: 找<佣兵长马塞尔|arg=10010200>领取奖励 | AM111: "找<佣兵长马塞尔|arg=10010200>领取奖励" | AN111: 1 | AO111: 3 | AQ111: 9100 | AR111: {enhance_money,40},{item,{110059001,1}} | AS111: 80
A112: 10304110 | B112: 屠杀者哈坎 | D112: 悬赏任务 | E112: 悬赏任务（剩余<span color:FFE21B1B>{0}</span>次） | F112: ["getTaskTimes",[10304000]] | H112: 10010200 | I112: 10010200 | J112: [] | K112: 1 | L112: 100 | M112: 0 | N112: 0 | O112: 日常 | Q112: 2 | U112: son | V112: 10304000 | AC112: 击杀85只屠杀者哈坎(1级) | AD112: reward_icon.tx_tushazhehakan | AG112: 5 | AH112: ="["&RC[11]&","""&RC[-32]&"""]" -> [85,"屠杀者哈坎"] | AI112: 3 | AJ112: [["getTaskTimes",[10304000]]] | AK112: 4 | AL112: 找<佣兵长马塞尔|arg=10010200>领取奖励 | AM112: "找<佣兵长马塞尔|arg=10010200>领取奖励" | AN112: 1 | AO112: 4 | AQ112: 13600 | AR112: {enhance_money,80},{item,{110059001,1}} | AS112: 85
A113: 10304111 | B113: 丛林碎地者 | D113: 悬赏任务 | E113: 悬赏任务（剩余<span color:FFE21B1B>{0}</span>次） | F113: ["getTaskTimes",[10304000]] | H113: 10010200 | I113: 10010200 | J113: [] | K113: 55 | L113: 100 | M113: 0 | N113: 0 | O113: 日常 | Q113: 2 | U113: son | V113: 10304000 | AC113: 击杀65只丛林碎地者(55级) | AD113: reward_icon.tx_conglinsuidizhe | AG113: 5 | AH113: ="["&RC[11]&","""&RC[-32]&"""]" -> [65,"丛林碎地者"] | AI113: 3 | AJ113: [["getTaskTimes",[10304000]]] | AK113: 4 | AL113: 找<佣兵长马塞尔|arg=10010200>领取奖励 | AM113: "找<佣兵长马塞尔|arg=10010200>领取奖励" | AN113: 1 | AO113: 0 | AQ113: 16500 | AS113: 65
A114: 10304112 | B114: 丛林碎地者 | D114: 悬赏任务 | E114: 悬赏任务（剩余<span color:FFE21B1B>{0}</span>次） | F114: ["getTaskTimes",[10304000]] | H114: 10010200 | I114: 10010200 | J114: [] | K114: 55 | L114: 100 | M114: 0 | N114: 0 | O114: 日常 | Q114: 2 | U114: son | V114: 10304000 | AC114: 击杀70只丛林碎地者(55级) | AD114: reward_icon.tx_conglinsuidizhe | AG114: 5 | AH114: ="["&RC[11]&","""&RC[-32]&"""]" -> [70,"丛林碎地者"] | AI114: 3 | AJ114: [["getTaskTimes",[10304000]]] | AK114: 4 | AL114: 找<佣兵长马塞尔|arg=10010200>领取奖励 | AM114: "找<佣兵长马塞尔|arg=10010200>领取奖励" | AN114: 1 | AO114: 1 | AQ114: 22000 | AS114: 70
A115: 10304113 | B115: 丛林碎地者 | D115: 悬赏任务 | E115: 悬赏任务（剩余<span color:FFE21B1B>{0}</span>次） | F115: ["getTaskTimes",[10304000]] | H115: 10010200 | I115: 10010200 | J115: [] | K115: 55 | L115: 100 | M115: 0 | N115: 0 | O115: 日常 | Q115: 2 | U115: son | V115: 10304000 | AC115: 击杀75只丛林碎地者(55级) | AD115: reward_icon.tx_conglinsuidizhe | AG115: 5 | AH115: ="["&RC[11]&","""&RC[-32]&"""]" -> [75,"丛林碎地者"] | AI115: 3 | AJ115: [["getTaskTimes",[10304000]]] | AK115: 4 | AL115: 找<佣兵长马塞尔|arg=10010200>领取奖励 | AM115: "找<佣兵长马塞尔|arg=10010200>领取奖励" | AN115: 1 | AO115: 2 | AQ115: 43900 | AR115: {enhance_money,20} | AS115: 75
A116: 10304114 | B116: 丛林碎地者 | D116: 悬赏任务 | E116: 悬赏任务（剩余<span color:FFE21B1B>{0}</span>次） | F116: ["getTaskTimes",[10304000]] | H116: 10010200 | I116: 10010200 | J116: [] | K116: 55 | L116: 100 | M116: 0 | N116: 0 | O116: 日常 | Q116: 2 | U116: son | V116: 10304000 | AC116: 击杀80只丛林碎地者(55级) | AD116: reward_icon.tx_conglinsuidizhe | AG116: 5 | AH116: ="["&RC[11]&","""&RC[-32]&"""]" -> [80,"丛林碎地者"] | AI116: 3 | AJ116: [["getTaskTimes",[10304000]]] | AK116: 4 | AL116: 找<佣兵长马塞尔|arg=10010200>领取奖励 | AM116: "找<佣兵长马塞尔|arg=10010200>领取奖励" | AN116: 1 | AO116: 3 | AQ116: 87900 | AR116: {enhance_money,40},{item,{110059001,1}} | AS116: 80
A117: 10304115 | B117: 丛林碎地者 | D117: 悬赏任务 | E117: 悬赏任务（剩余<span color:FFE21B1B>{0}</span>次） | F117: ["getTaskTimes",[10304000]] | H117: 10010200 | I117: 10010200 | J117: [] | K117: 55 | L117: 100 | M117: 0 | N117: 0 | O117: 日常 | Q117: 2 | U117: son | V117: 10304000 | AC117: 击杀85只丛林碎地者(55级) | AD117: reward_icon.tx_conglinsuidizhe | AG117: 5 | AH117: ="["&RC[11]&","""&RC[-32]&"""]" -> [85,"丛林碎地者"] | AI117: 3 | AJ117: [["getTaskTimes",[10304000]]] | AK117: 4 | AL117: 找<佣兵长马塞尔|arg=10010200>领取奖励 | AM117: "找<佣兵长马塞尔|arg=10010200>领取奖励" | AN117: 1 | AO117: 4 | AQ117: 131800 | AR117: {enhance_money,80},{item,{110059001,1}} | AS117: 85
A118: 10304116 | B118: 撼地神牛 | D118: 悬赏任务 | E118: 悬赏任务（剩余<span color:FFE21B1B>{0}</span>次） | F118: ["getTaskTimes",[10304000]] | H118: 10010200 | I118: 10010200 | J118: [] | K118: 57 | L118: 100 | M118: 0 | N118: 0 | O118: 日常 | Q118: 2 | U118: son | V118: 10304000 | AC118: 击杀65只撼地神牛(57级) | AD118: reward_icon.tx_handishenniu | AG118: 5 | AH118: ="["&RC[11]&","""&RC[-32]&"""]" -> [65,"撼地神牛"] | AI118: 3 | AJ118: [["getTaskTimes",[10304000]]] | AK118: 4 | AL118: 找<佣兵长马塞尔|arg=10010200>领取奖励 | AM118: "找<佣兵长马塞尔|arg=10010200>领取奖励" | AN118: 1 | AO118: 0 | AQ118: 16900 | AS118: 65
A119: 10304117 | B119: 撼地神牛 | D119: 悬赏任务 | E119: 悬赏任务（剩余<span color:FFE21B1B>{0}</span>次） | F119: ["getTaskTimes",[10304000]] | H119: 10010200 | I119: 10010200 | J119: [] | K119: 57 | L119: 100 | M119: 0 | N119: 0 | O119: 日常 | Q119: 2 | U119: son | V119: 10304000 | AC119: 击杀70只撼地神牛(57级) | AD119: reward_icon.tx_handishenniu | AG119: 5 | AH119: ="["&RC[11]&","""&RC[-32]&"""]" -> [70,"撼地神牛"] | AI119: 3 | AJ119: [["getTaskTimes",[10304000]]] | AK119: 4 | AL119: 找<佣兵长马塞尔|arg=10010200>领取奖励 | AM119: "找<佣兵长马塞尔|arg=10010200>领取奖励" | AN119: 1 | AO119: 1 | AQ119: 22500 | AS119: 70
A120: 10304118 | B120: 撼地神牛 | D120: 悬赏任务 | E120: 悬赏任务（剩余<span color:FFE21B1B>{0}</span>次） | F120: ["getTaskTimes",[10304000]] | H120: 10010200 | I120: 10010200 | J120: [] | K120: 57 | L120: 100 | M120: 0 | N120: 0 | O120: 日常 | Q120: 2 | U120: son | V120: 10304000 | AC120: 击杀75只撼地神牛(57级) | AD120: reward_icon.tx_handishenniu | AG120: 5 | AH120: ="["&RC[11]&","""&RC[-32]&"""]" -> [75,"撼地神牛"] | AI120: 3 | AJ120: [["getTaskTimes",[10304000]]] | AK120: 4 | AL120: 找<佣兵长马塞尔|arg=10010200>领取奖励 | AM120: "找<佣兵长马塞尔|arg=10010200>领取奖励" | AN120: 1 | AO120: 2 | AQ120: 45000 | AR120: {enhance_money,20} | AS120: 75
A121: 10304119 | B121: 撼地神牛 | D121: 悬赏任务 | E121: 悬赏任务（剩余<span color:FFE21B1B>{0}</span>次） | F121: ["getTaskTimes",[10304000]] | H121: 10010200 | I121: 10010200 | J121: [] | K121: 57 | L121: 100 | M121: 0 | N121: 0 | O121: 日常 | Q121: 2 | U121: son | V121: 10304000 | AC121: 击杀80只撼地神牛(57级) | AD121: reward_icon.tx_handishenniu | AG121: 5 | AH121: ="["&RC[11]&","""&RC[-32]&"""]" -> [80,"撼地神牛"] | AI121: 3 | AJ121: [["getTaskTimes",[10304000]]] | AK121: 4 | AL121: 找<佣兵长马塞尔|arg=10010200>领取奖励 | AM121: "找<佣兵长马塞尔|arg=10010200>领取奖励" | AN121: 1 | AO121: 3 | AQ121: 89900 | AR121: {enhance_money,40},{item,{110059001,1}} | AS121: 80
A122: 10304120 | B122: 撼地神牛 | D122: 悬赏任务 | E122: 悬赏任务（剩余<span color:FFE21B1B>{0}</span>次） | F122: ["getTaskTimes",[10304000]] | H122: 10010200 | I122: 10010200 | J122: [] | K122: 57 | L122: 100 | M122: 0 | N122: 0 | O122: 日常 | Q122: 2 | U122: son | V122: 10304000 | AC122: 击杀85只撼地神牛(57级) | AD122: reward_icon.tx_handishenniu | AG122: 5 | AH122: ="["&RC[11]&","""&RC[-32]&"""]" -> [85,"撼地神牛"] | AI122: 3 | AJ122: [["getTaskTimes",[10304000]]] | AK122: 4 | AL122: 找<佣兵长马塞尔|arg=10010200>领取奖励 | AM122: "找<佣兵长马塞尔|arg=10010200>领取奖励" | AN122: 1 | AO122: 4 | AQ122: 134900 | AR122: {enhance_money,80},{item,{110059001,1}} | AS122: 85
A123: 10304121 | B123: 丛林掷矛者 | D123: 悬赏任务 | E123: 悬赏任务（剩余<span color:FFE21B1B>{0}</span>次） | F123: ["getTaskTimes",[10304000]] | H123: 10010200 | I123: 10010200 | J123: [] | K123: 53 | L123: 100 | M123: 0 | N123: 0 | O123: 日常 | Q123: 2 | U123: son | V123: 10304000 | AC123: 击杀65只丛林掷矛者(53级) | AD123: reward_icon.tx_conglinzhimaozhe | AG123: 5 | AH123: ="["&RC[11]&","""&RC[-32]&"""]" -> [65,"丛林掷矛者"] | AI123: 3 | AJ123: [["getTaskTimes",[10304000]]] | AK123: 4 | AL123: 找<佣兵长马塞尔|arg=10010200>领取奖励 | AM123: "找<佣兵长马塞尔|arg=10010200>领取奖励" | AN123: 1 | AO123: 0 | AQ123: 15000 | AS123: 65
A124: 10304122 | B124: 丛林掷矛者 | D124: 悬赏任务 | E124: 悬赏任务（剩余<span color:FFE21B1B>{0}</span>次） | F124: ["getTaskTimes",[10304000]] | H124: 10010200 | I124: 10010200 | J124: [] | K124: 53 | L124: 100 | M124: 0 | N124: 0 | O124: 日常 | Q124: 2 | U124: son | V124: 10304000 | AC124: 击杀70只丛林掷矛者(53级) | AD124: reward_icon.tx_conglinzhimaozhe | AG124: 5 | AH124: ="["&RC[11]&","""&RC[-32]&"""]" -> [70,"丛林掷矛者"] | AI124: 3 | AJ124: [["getTaskTimes",[10304000]]] | AK124: 4 | AL124: 找<佣兵长马塞尔|arg=10010200>领取奖励 | AM124: "找<佣兵长马塞尔|arg=10010200>领取奖励" | AN124: 1 | AO124: 1 | AQ124: 20000 | AS124: 70
A125: 10304123 | B125: 丛林掷矛者 | D125: 悬赏任务 | E125: 悬赏任务（剩余<span color:FFE21B1B>{0}</span>次） | F125: ["getTaskTimes",[10304000]] | H125: 10010200 | I125: 10010200 | J125: [] | K125: 53 | L125: 100 | M125: 0 | N125: 0 | O125: 日常 | Q125: 2 | U125: son | V125: 10304000 | AC125: 击杀75只丛林掷矛者(53级) | AD125: reward_icon.tx_conglinzhimaozhe | AG125: 5 | AH125: ="["&RC[11]&","""&RC[-32]&"""]" -> [75,"丛林掷矛者"] | AI125: 3 | AJ125: [["getTaskTimes",[10304000]]] | AK125: 4 | AL125: 找<佣兵长马塞尔|arg=10010200>领取奖励 | AM125: "找<佣兵长马塞尔|arg=10010200>领取奖励" | AN125: 1 | AO125: 2 | AQ125: 40100 | AR125: {enhance_money,20} | AS125: 75
A126: 10304124 | B126: 丛林掷矛者 | D126: 悬赏任务 | E126: 悬赏任务（剩余<span color:FFE21B1B>{0}</span>次） | F126: ["getTaskTimes",[10304000]] | H126: 10010200 | I126: 10010200 | J126: [] | K126: 53 | L126: 100 | M126: 0 | N126: 0 | O126: 日常 | Q126: 2 | U126: son | V126: 10304000 | AC126: 击杀80只丛林掷矛者(53级) | AD126: reward_icon.tx_conglinzhimaozhe | AG126: 5 | AH126: ="["&RC[11]&","""&RC[-32]&"""]" -> [80,"丛林掷矛者"] | AI126: 3 | AJ126: [["getTaskTimes",[10304000]]] | AK126: 4 | AL126: 找<佣兵长马塞尔|arg=10010200>领取奖励 | AM126: "找<佣兵长马塞尔|arg=10010200>领取奖励" | AN126: 1 | AO126: 3 | AQ126: 80200 | AR126: {enhance_money,40},{item,{110059001,1}} | AS126: 80
A127: 10304125 | B127: 丛林掷矛者 | D127: 悬赏任务 | E127: 悬赏任务（剩余<span color:FFE21B1B>{0}</span>次） | F127: ["getTaskTimes",[10304000]] | H127: 10010200 | I127: 10010200 | J127: [] | K127: 53 | L127: 100 | M127: 0 | N127: 0 | O127: 日常 | Q127: 2 | U127: son | V127: 10304000 | AC127: 击杀85只丛林掷矛者(53级) | AD127: reward_icon.tx_conglinzhimaozhe | AG127: 5 | AH127: ="["&RC[11]&","""&RC[-32]&"""]" -> [85,"丛林掷矛者"] | AI127: 3 | AJ127: [["getTaskTimes",[10304000]]] | AK127: 4 | AL127: 找<佣兵长马塞尔|arg=10010200>领取奖励 | AM127: "找<佣兵长马塞尔|arg=10010200>领取奖励" | AN127: 1 | AO127: 4 | AQ127: 120300 | AR127: {enhance_money,80},{item,{110059001,1}} | AS127: 85
A128: 10304126 | B128: 丛林巫师 | D128: 悬赏任务 | E128: 悬赏任务（剩余<span color:FFE21B1B>{0}</span>次） | F128: ["getTaskTimes",[10304000]] | H128: 10010200 | I128: 10010200 | J128: [] | K128: 59 | L128: 100 | M128: 0 | N128: 0 | O128: 日常 | Q128: 2 | U128: son | V128: 10304000 | AC128: 击杀65只丛林巫师(59级) | AD128: reward_icon.tx_conglinwushi | AG128: 5 | AH128: ="["&RC[11]&","""&RC[-32]&"""]" -> [65,"丛林巫师"] | AI128: 3 | AJ128: [["getTaskTimes",[10304000]]] | AK128: 4 | AL128: 找<佣兵长马塞尔|arg=10010200>领取奖励 | AM128: "找<佣兵长马塞尔|arg=10010200>领取奖励" | AN128: 1 | AO128: 0 | AQ128: 17300 | AS128: 65
A129: 10304127 | B129: 丛林巫师 | D129: 悬赏任务 | E129: 悬赏任务（剩余<span color:FFE21B1B>{0}</span>次） | F129: ["getTaskTimes",[10304000]] | H129: 10010200 | I129: 10010200 | J129: [] | K129: 59 | L129: 100 | M129: 0 | N129: 0 | O129: 日常 | Q129: 2 | U129: son | V129: 10304000 | AC129: 击杀70只丛林巫师(59级) | AD129: reward_icon.tx_conglinwushi | AG129: 5 | AH129: ="["&RC[11]&","""&RC[-32]&"""]" -> [70,"丛林巫师"] | AI129: 3 | AJ129: [["getTaskTimes",[10304000]]] | AK129: 4 | AL129: 找<佣兵长马塞尔|arg=10010200>领取奖励 | AM129: "找<佣兵长马塞尔|arg=10010200>领取奖励" | AN129: 1 | AO129: 1 | AQ129: 23000 | AS129: 70
A130: 10304128 | B130: 丛林巫师 | D130: 悬赏任务 | E130: 悬赏任务（剩余<span color:FFE21B1B>{0}</span>次） | F130: ["getTaskTimes",[10304000]] | H130: 10010200 | I130: 10010200 | J130: [] | K130: 59 | L130: 100 | M130: 0 | N130: 0 | O130: 日常 | Q130: 2 | U130: son | V130: 10304000 | AC130: 击杀75只丛林巫师(59级) | AD130: reward_icon.tx_conglinwushi | AG130: 5 | AH130: ="["&RC[11]&","""&RC[-32]&"""]" -> [75,"丛林巫师"] | AI130: 3 | AJ130: [["getTaskTimes",[10304000]]] | AK130: 4 | AL130: 找<佣兵长马塞尔|arg=10010200>领取奖励 | AM130: "找<佣兵长马塞尔|arg=10010200>领取奖励" | AN130: 1 | AO130: 2 | AQ130: 46100 | AR130: {enhance_money,20} | AS130: 75
A131: 10304129 | B131: 丛林巫师 | D131: 悬赏任务 | E131: 悬赏任务（剩余<span color:FFE21B1B>{0}</span>次） | F131: ["getTaskTimes",[10304000]] | H131: 10010200 | I131: 10010200 | J131: [] | K131: 59 | L131: 100 | M131: 0 | N131: 0 | O131: 日常 | Q131: 2 | U131: son | V131: 10304000 | AC131: 击杀80只丛林巫师(59级) | AD131: reward_icon.tx_conglinwushi | AG131: 5 | AH131: ="["&RC[11]&","""&RC[-32]&"""]" -> [80,"丛林巫师"] | AI131: 3 | AJ131: [["getTaskTimes",[10304000]]] | AK131: 4 | AL131: 找<佣兵长马塞尔|arg=10010200>领取奖励 | AM131: "找<佣兵长马塞尔|arg=10010200>领取奖励" | AN131: 1 | AO131: 3 | AQ131: 92200 | AR131: {enhance_money,40},{item,{110059001,1}} | AS131: 80
A132: 10304130 | B132: 丛林巫师 | D132: 悬赏任务 | E132: 悬赏任务（剩余<span color:FFE21B1B>{0}</span>次） | F132: ["getTaskTimes",[10304000]] | H132: 10010200 | I132: 10010200 | J132: [] | K132: 59 | L132: 100 | M132: 0 | N132: 0 | O132: 日常 | Q132: 2 | U132: son | V132: 10304000 | AC132: 击杀85只丛林巫师(59级) | AD132: reward_icon.tx_conglinwushi | AG132: 5 | AH132: ="["&RC[11]&","""&RC[-32]&"""]" -> [85,"丛林巫师"] | AI132: 3 | AJ132: [["getTaskTimes",[10304000]]] | AK132: 4 | AL132: 找<佣兵长马塞尔|arg=10010200>领取奖励 | AM132: "找<佣兵长马塞尔|arg=10010200>领取奖励" | AN132: 1 | AO132: 4 | AQ132: 138200 | AR132: {enhance_money,80},{item,{110059001,1}} | AS132: 85
A133: 10304131 | B133: 巨刃螳螂 | D133: 悬赏任务 | E133: 悬赏任务（剩余<span color:FFE21B1B>{0}</span>次） | F133: ["getTaskTimes",[10304000]] | H133: 10010200 | I133: 10010200 | J133: [] | K133: 51 | L133: 100 | M133: 0 | N133: 0 | O133: 日常 | Q133: 2 | U133: son | V133: 10304000 | AC133: 击杀65只巨刃螳螂(51级) | AD133: reward_icon.tx_jurentanglang | AG133: 5 | AH133: ="["&RC[11]&","""&RC[-32]&"""]" -> [65,"巨刃螳螂"] | AI133: 3 | AJ133: [["getTaskTimes",[10304000]]] | AK133: 4 | AL133: 找<佣兵长马塞尔|arg=10010200>领取奖励 | AM133: "找<佣兵长马塞尔|arg=10010200>领取奖励" | AN133: 1 | AO133: 0 | AQ133: 14600 | AS133: 65
A134: 10304132 | B134: 巨刃螳螂 | D134: 悬赏任务 | E134: 悬赏任务（剩余<span color:FFE21B1B>{0}</span>次） | F134: ["getTaskTimes",[10304000]] | H134: 10010200 | I134: 10010200 | J134: [] | K134: 51 | L134: 100 | M134: 0 | N134: 0 | O134: 日常 | Q134: 2 | U134: son | V134: 10304000 | AC134: 击杀70只巨刃螳螂(51级) | AD134: reward_icon.tx_jurentanglang | AG134: 5 | AH134: ="["&RC[11]&","""&RC[-32]&"""]" -> [70,"巨刃螳螂"] | AI134: 3 | AJ134: [["getTaskTimes",[10304000]]] | AK134: 4 | AL134: 找<佣兵长马塞尔|arg=10010200>领取奖励 | AM134: "找<佣兵长马塞尔|arg=10010200>领取奖励" | AN134: 1 | AO134: 1 | AQ134: 19500 | AS134: 70
A135: 10304133 | B135: 巨刃螳螂 | D135: 悬赏任务 | E135: 悬赏任务（剩余<span color:FFE21B1B>{0}</span>次） | F135: ["getTaskTimes",[10304000]] | H135: 10010200 | I135: 10010200 | J135: [] | K135: 51 | L135: 100 | M135: 0 | N135: 0 | O135: 日常 | Q135: 2 | U135: son | V135: 10304000 | AC135: 击杀75只巨刃螳螂(51级) | AD135: reward_icon.tx_jurentanglang | AG135: 5 | AH135: ="["&RC[11]&","""&RC[-32]&"""]" -> [75,"巨刃螳螂"] | AI135: 3 | AJ135: [["getTaskTimes",[10304000]]] | AK135: 4 | AL135: 找<佣兵长马塞尔|arg=10010200>领取奖励 | AM135: "找<佣兵长马塞尔|arg=10010200>领取奖励" | AN135: 1 | AO135: 2 | AQ135: 39000 | AR135: {enhance_money,20} | AS135: 75
A136: 10304134 | B136: 巨刃螳螂 | D136: 悬赏任务 | E136: 悬赏任务（剩余<span color:FFE21B1B>{0}</span>次） | F136: ["getTaskTimes",[10304000]] | H136: 10010200 | I136: 10010200 | J136: [] | K136: 51 | L136: 100 | M136: 0 | N136: 0 | O136: 日常 | Q136: 2 | U136: son | V136: 10304000 | AC136: 击杀80只巨刃螳螂(51级) | AD136: reward_icon.tx_jurentanglang | AG136: 5 | AH136: ="["&RC[11]&","""&RC[-32]&"""]" -> [80,"巨刃螳螂"] | AI136: 3 | AJ136: [["getTaskTimes",[10304000]]] | AK136: 4 | AL136: 找<佣兵长马塞尔|arg=10010200>领取奖励 | AM136: "找<佣兵长马塞尔|arg=10010200>领取奖励" | AN136: 1 | AO136: 3 | AQ136: 78000 | AR136: {enhance_money,40},{item,{110059001,1}} | AS136: 80
A137: 10304135 | B137: 巨刃螳螂 | D137: 悬赏任务 | E137: 悬赏任务（剩余<span color:FFE21B1B>{0}</span>次） | F137: ["getTaskTimes",[10304000]] | H137: 10010200 | I137: 10010200 | J137: [] | K137: 51 | L137: 100 | M137: 0 | N137: 0 | O137: 日常 | Q137: 2 | U137: son | V137: 10304000 | AC137: 击杀85只巨刃螳螂(51级) | AD137: reward_icon.tx_jurentanglang | AG137: 5 | AH137: ="["&RC[11]&","""&RC[-32]&"""]" -> [85,"巨刃螳螂"] | AI137: 3 | AJ137: [["getTaskTimes",[10304000]]] | AK137: 4 | AL137: 找<佣兵长马塞尔|arg=10010200>领取奖励 | AM137: "找<佣兵长马塞尔|arg=10010200>领取奖励" | AN137: 1 | AO137: 4 | AQ137: 117000 | AR137: {enhance_money,80},{item,{110059001,1}} | AS137: 85
A138: 10304136 | B138: 深海恐鱼 | D138: 悬赏任务 | E138: 悬赏任务（剩余<span color:FFE21B1B>{0}</span>次） | F138: ["getTaskTimes",[10304000]] | H138: 10010200 | I138: 10010200 | J138: [] | K138: 61 | L138: 100 | M138: 0 | N138: 0 | O138: 日常 | Q138: 2 | U138: son | V138: 10304000 | AC138: 击杀75只深海恐鱼(61级) | AD138: reward_icon.tx_shenhaikongyu | AG138: 5 | AH138: ="["&RC[11]&","""&RC[-32]&"""]" -> [75,"深海恐鱼"] | AI138: 3 | AJ138: [["getTaskTimes",[10304000]]] | AK138: 4 | AL138: 找<佣兵长马塞尔|arg=10010200>领取奖励 | AM138: "找<佣兵长马塞尔|arg=10010200>领取奖励" | AN138: 1 | AO138: 0 | AQ138: 19900 | AS138: 75
A139: 10304137 | B139: 深海恐鱼 | D139: 悬赏任务 | E139: 悬赏任务（剩余<span color:FFE21B1B>{0}</span>次） | F139: ["getTaskTimes",[10304000]] | H139: 10010200 | I139: 10010200 | J139: [] | K139: 61 | L139: 100 | M139: 0 | N139: 0 | O139: 日常 | Q139: 2 | U139: son | V139: 10304000 | AC139: 击杀80只深海恐鱼(61级) | AD139: reward_icon.tx_shenhaikongyu | AG139: 5 | AH139: ="["&RC[11]&","""&RC[-32]&"""]" -> [80,"深海恐鱼"] | AI139: 3 | AJ139: [["getTaskTimes",[10304000]]] | AK139: 4 | AL139: 找<佣兵长马塞尔|arg=10010200>领取奖励 | AM139: "找<佣兵长马塞尔|arg=10010200>领取奖励" | AN139: 1 | AO139: 1 | AQ139: 26500 | AS139: 80
A140: 10304138 | B140: 深海恐鱼 | D140: 悬赏任务 | E140: 悬赏任务（剩余<span color:FFE21B1B>{0}</span>次） | F140: ["getTaskTimes",[10304000]] | H140: 10010200 | I140: 10010200 | J140: [] | K140: 61 | L140: 100 | M140: 0 | N140: 0 | O140: 日常 | Q140: 2 | U140: son | V140: 10304000 | AC140: 击杀85只深海恐鱼(61级) | AD140: reward_icon.tx_shenhaikongyu | AG140: 5 | AH140: ="["&RC[11]&","""&RC[-32]&"""]" -> [85,"深海恐鱼"] | AI140: 3 | AJ140: [["getTaskTimes",[10304000]]] | AK140: 4 | AL140: 找<佣兵长马塞尔|arg=10010200>领取奖励 | AM140: "找<佣兵长马塞尔|arg=10010200>领取奖励" | AN140: 1 | AO140: 2 | AQ140: 53000 | AR140: {enhance_money,20} | AS140: 85
A141: 10304139 | B141: 深海恐鱼 | D141: 悬赏任务 | E141: 悬赏任务（剩余<span color:FFE21B1B>{0}</span>次） | F141: ["getTaskTimes",[10304000]] | H141: 10010200 | I141: 10010200 | J141: [] | K141: 61 | L141: 100 | M141: 0 | N141: 0 | O141: 日常 | Q141: 2 | U141: son | V141: 10304000 | AC141: 击杀90只深海恐鱼(61级) | AD141: reward_icon.tx_shenhaikongyu | AG141: 5 | AH141: ="["&RC[11]&","""&RC[-32]&"""]" -> [90,"深海恐鱼"] | AI141: 3 | AJ141: [["getTaskTimes",[10304000]]] | AK141: 4 | AL141: 找<佣兵长马塞尔|arg=10010200>领取奖励 | AM141: "找<佣兵长马塞尔|arg=10010200>领取奖励" | AN141: 1 | AO141: 3 | AQ141: 105900 | AR141: {enhance_money,40},{item,{110059001,1}} | AS141: 90
A142: 10304140 | B142: 深海恐鱼 | D142: 悬赏任务 | E142: 悬赏任务（剩余<span color:FFE21B1B>{0}</span>次） | F142: ["getTaskTimes",[10304000]] | H142: 10010200 | I142: 10010200 | J142: [] | K142: 61 | L142: 100 | M142: 0 | N142: 0 | O142: 日常 | Q142: 2 | U142: son | V142: 10304000 | AC142: 击杀95只深海恐鱼(61级) | AD142: reward_icon.tx_shenhaikongyu | AG142: 5 | AH142: ="["&RC[11]&","""&RC[-32]&"""]" -> [95,"深海恐鱼"] | AI142: 3 | AJ142: [["getTaskTimes",[10304000]]] | AK142: 4 | AL142: 找<佣兵长马塞尔|arg=10010200>领取奖励 | AM142: "找<佣兵长马塞尔|arg=10010200>领取奖励" | AN142: 1 | AO142: 4 | AQ142: 158900 | AR142: {enhance_money,80},{item,{110059001,1}} | AS142: 95
A143: 10304141 | B143: 深蓝海妖 | D143: 悬赏任务 | E143: 悬赏任务（剩余<span color:FFE21B1B>{0}</span>次） | F143: ["getTaskTimes",[10304000]] | H143: 10010200 | I143: 10010200 | J143: [] | K143: 63 | L143: 100 | M143: 0 | N143: 0 | O143: 日常 | Q143: 2 | U143: son | V143: 10304000 | AC143: 击杀75只深蓝海妖(63级) | AD143: reward_icon.tx_shenhaihaiyao | AG143: 5 | AH143: ="["&RC[11]&","""&RC[-32]&"""]" -> [75,"深蓝海妖"] | AI143: 3 | AJ143: [["getTaskTimes",[10304000]]] | AK143: 4 | AL143: 找<佣兵长马塞尔|arg=10010200>领取奖励 | AM143: "找<佣兵长马塞尔|arg=10010200>领取奖励" | AN143: 1 | AO143: 0 | AQ143: 20300 | AS143: 75
A144: 10304142 | B144: 深蓝海妖 | D144: 悬赏任务 | E144: 悬赏任务（剩余<span color:FFE21B1B>{0}</span>次） | F144: ["getTaskTimes",[10304000]] | H144: 10010200 | I144: 10010200 | J144: [] | K144: 63 | L144: 100 | M144: 0 | N144: 0 | O144: 日常 | Q144: 2 | U144: son | V144: 10304000 | AC144: 击杀80只深蓝海妖(63级) | AD144: reward_icon.tx_shenhaihaiyao | AG144: 5 | AH144: ="["&RC[11]&","""&RC[-32]&"""]" -> [80,"深蓝海妖"] | AI144: 3 | AJ144: [["getTaskTimes",[10304000]]] | AK144: 4 | AL144: 找<佣兵长马塞尔|arg=10010200>领取奖励 | AM144: "找<佣兵长马塞尔|arg=10010200>领取奖励" | AN144: 1 | AO144: 1 | AQ144: 27100 | AS144: 80
A145: 10304143 | B145: 深蓝海妖 | D145: 悬赏任务 | E145: 悬赏任务（剩余<span color:FFE21B1B>{0}</span>次） | F145: ["getTaskTimes",[10304000]] | H145: 10010200 | I145: 10010200 | J145: [] | K145: 63 | L145: 100 | M145: 0 | N145: 0 | O145: 日常 | Q145: 2 | U145: son | V145: 10304000 | AC145: 击杀85只深蓝海妖(63级) | AD145: reward_icon.tx_shenhaihaiyao | AG145: 5 | AH145: ="["&RC[11]&","""&RC[-32]&"""]" -> [85,"深蓝海妖"] | AI145: 3 | AJ145: [["getTaskTimes",[10304000]]] | AK145: 4 | AL145: 找<佣兵长马塞尔|arg=10010200>领取奖励 | AM145: "找<佣兵长马塞尔|arg=10010200>领取奖励" | AN145: 1 | AO145: 2 | AQ145: 54200 | AR145: {enhance_money,20} | AS145: 85
A146: 10304144 | B146: 深蓝海妖 | D146: 悬赏任务 | E146: 悬赏任务（剩余<span color:FFE21B1B>{0}</span>次） | F146: ["getTaskTimes",[10304000]] | H146: 10010200 | I146: 10010200 | J146: [] | K146: 63 | L146: 100 | M146: 0 | N146: 0 | O146: 日常 | Q146: 2 | U146: son | V146: 10304000 | AC146: 击杀90只深蓝海妖(63级) | AD146: reward_icon.tx_shenhaihaiyao | AG146: 5 | AH146: ="["&RC[11]&","""&RC[-32]&"""]" -> [90,"深蓝海妖"] | AI146: 3 | AJ146: [["getTaskTimes",[10304000]]] | AK146: 4 | AL146: 找<佣兵长马塞尔|arg=10010200>领取奖励 | AM146: "找<佣兵长马塞尔|arg=10010200>领取奖励" | AN146: 1 | AO146: 3 | AQ146: 108400 | AR146: {enhance_money,40},{item,{110059001,1}} | AS146: 90
A147: 10304145 | B147: 深蓝海妖 | D147: 悬赏任务 | E147: 悬赏任务（剩余<span color:FFE21B1B>{0}</span>次） | F147: ["getTaskTimes",[10304000]] | H147: 10010200 | I147: 10010200 | J147: [] | K147: 63 | L147: 100 | M147: 0 | N147: 0 | O147: 日常 | Q147: 2 | U147: son | V147: 10304000 | AC147: 击杀95只深蓝海妖(63级) | AD147: reward_icon.tx_shenhaihaiyao | AG147: 5 | AH147: ="["&RC[11]&","""&RC[-32]&"""]" -> [95,"深蓝海妖"] | AI147: 3 | AJ147: [["getTaskTimes",[10304000]]] | AK147: 4 | AL147: 找<佣兵长马塞尔|arg=10010200>领取奖励 | AM147: "找<佣兵长马塞尔|arg=10010200>领取奖励" | AN147: 1 | AO147: 4 | AQ147: 162500 | AR147: {enhance_money,80},{item,{110059001,1}} | AS147: 95
A148: 10304146 | B148: 深海守卫者 | D148: 悬赏任务 | E148: 悬赏任务（剩余<span color:FFE21B1B>{0}</span>次） | F148: ["getTaskTimes",[10304000]] | H148: 10010200 | I148: 10010200 | J148: [] | K148: 69 | L148: 100 | M148: 0 | N148: 0 | O148: 日常 | Q148: 2 | U148: son | V148: 10304000 | AC148: 击杀75只深海守卫者(69级) | AD148: reward_icon.tx_shenhaishouweizhe | AG148: 5 | AH148: ="["&RC[11]&","""&RC[-32]&"""]" -> [75,"深海守卫者"] | AI148: 3 | AJ148: [["getTaskTimes",[10304000]]] | AK148: 4 | AL148: 找<佣兵长马塞尔|arg=10010200>领取奖励 | AM148: "找<佣兵长马塞尔|arg=10010200>领取奖励" | AN148: 1 | AO148: 0 | AQ148: 24000 | AS148: 75
A149: 10304147 | B149: 深海守卫者 | D149: 悬赏任务 | E149: 悬赏任务（剩余<span color:FFE21B1B>{0}</span>次） | F149: ["getTaskTimes",[10304000]] | H149: 10010200 | I149: 10010200 | J149: [] | K149: 69 | L149: 100 | M149: 0 | N149: 0 | O149: 日常 | Q149: 2 | U149: son | V149: 10304000 | AC149: 击杀80只深海守卫者(69级) | AD149: reward_icon.tx_shenhaishouweizhe | AG149: 5 | AH149: ="["&RC[11]&","""&RC[-32]&"""]" -> [80,"深海守卫者"] | AI149: 3 | AJ149: [["getTaskTimes",[10304000]]] | AK149: 4 | AL149: 找<佣兵长马塞尔|arg=10010200>领取奖励 | AM149: "找<佣兵长马塞尔|arg=10010200>领取奖励" | AN149: 1 | AO149: 1 | AQ149: 32000 | AS149: 80
A150: 10304148 | B150: 深海守卫者 | D150: 悬赏任务 | E150: 悬赏任务（剩余<span color:FFE21B1B>{0}</span>次） | F150: ["getTaskTimes",[10304000]] | H150: 10010200 | I150: 10010200 | J150: [] | K150: 69 | L150: 100 | M150: 0 | N150: 0 | O150: 日常 | Q150: 2 | U150: son | V150: 10304000 | AC150: 击杀85只深海守卫者(69级) | AD150: reward_icon.tx_shenhaishouweizhe | AG150: 5 | AH150: ="["&RC[11]&","""&RC[-32]&"""]" -> [85,"深海守卫者"] | AI150: 3 | AJ150: [["getTaskTimes",[10304000]]] | AK150: 4 | AL150: 找<佣兵长马塞尔|arg=10010200>领取奖励 | AM150: "找<佣兵长马塞尔|arg=10010200>领取奖励" | AN150: 1 | AO150: 2 | AQ150: 64000 | AR150: {enhance_money,20} | AS150: 85
A151: 10304149 | B151: 深海守卫者 | D151: 悬赏任务 | E151: 悬赏任务（剩余<span color:FFE21B1B>{0}</span>次） | F151: ["getTaskTimes",[10304000]] | H151: 10010200 | I151: 10010200 | J151: [] | K151: 69 | L151: 100 | M151: 0 | N151: 0 | O151: 日常 | Q151: 2 | U151: son | V151: 10304000 | AC151: 击杀90只深海守卫者(69级) | AD151: reward_icon.tx_shenhaishouweizhe | AG151: 5 | AH151: ="["&RC[11]&","""&RC[-32]&"""]" -> [90,"深海守卫者"] | AI151: 3 | AJ151: [["getTaskTimes",[10304000]]] | AK151: 4 | AL151: 找<佣兵长马塞尔|arg=10010200>领取奖励 | AM151: "找<佣兵长马塞尔|arg=10010200>领取奖励" | AN151: 1 | AO151: 3 | AQ151: 128000 | AR151: {enhance_money,40},{item,{110059001,1}} | AS151: 90
A152: 10304150 | B152: 深海守卫者 | D152: 悬赏任务 | E152: 悬赏任务（剩余<span color:FFE21B1B>{0}</span>次） | F152: ["getTaskTimes",[10304000]] | H152: 10010200 | I152: 10010200 | J152: [] | K152: 69 | L152: 100 | M152: 0 | N152: 0 | O152: 日常 | Q152: 2 | U152: son | V152: 10304000 | AC152: 击杀95只深海守卫者(69级) | AD152: reward_icon.tx_shenhaishouweizhe | AG152: 5 | AH152: ="["&RC[11]&","""&RC[-32]&"""]" -> [95,"深海守卫者"] | AI152: 3 | AJ152: [["getTaskTimes",[10304000]]] | AK152: 4 | AL152: 找<佣兵长马塞尔|arg=10010200>领取奖励 | AM152: "找<佣兵长马塞尔|arg=10010200>领取奖励" | AN152: 1 | AO152: 4 | AQ152: 192100 | AR152: {enhance_money,80},{item,{110059001,1}} | AS152: 95
A153: 10304151 | B153: 晶蓝海马 | D153: 悬赏任务 | E153: 悬赏任务（剩余<span color:FFE21B1B>{0}</span>次） | F153: ["getTaskTimes",[10304000]] | H153: 10010200 | I153: 10010200 | J153: [] | K153: 65 | L153: 100 | M153: 0 | N153: 0 | O153: 日常 | Q153: 2 | U153: son | V153: 10304000 | AC153: 击杀75只晶蓝海马(65级) | AD153: reward_icon.tx_jinglanhaima | AG153: 5 | AH153: ="["&RC[11]&","""&RC[-32]&"""]" -> [75,"晶蓝海马"] | AI153: 3 | AJ153: [["getTaskTimes",[10304000]]] | AK153: 4 | AL153: 找<佣兵长马塞尔|arg=10010200>领取奖励 | AM153: "找<佣兵长马塞尔|arg=10010200>领取奖励" | AN153: 1 | AO153: 0 | AQ153: 23200 | AS153: 75
A154: 10304152 | B154: 晶蓝海马 | D154: 悬赏任务 | E154: 悬赏任务（剩余<span color:FFE21B1B>{0}</span>次） | F154: ["getTaskTimes",[10304000]] | H154: 10010200 | I154: 10010200 | J154: [] | K154: 65 | L154: 100 | M154: 0 | N154: 0 | O154: 日常 | Q154: 2 | U154: son | V154: 10304000 | AC154: 击杀80只晶蓝海马(65级) | AD154: reward_icon.tx_jinglanhaima | AG154: 5 | AH154: ="["&RC[11]&","""&RC[-32]&"""]" -> [80,"晶蓝海马"] | AI154: 3 | AJ154: [["getTaskTimes",[10304000]]] | AK154: 4 | AL154: 找<佣兵长马塞尔|arg=10010200>领取奖励 | AM154: "找<佣兵长马塞尔|arg=10010200>领取奖励" | AN154: 1 | AO154: 1 | AQ154: 30900 | AS154: 80
A155: 10304153 | B155: 晶蓝海马 | D155: 悬赏任务 | E155: 悬赏任务（剩余<span color:FFE21B1B>{0}</span>次） | F155: ["getTaskTimes",[10304000]] | H155: 10010200 | I155: 10010200 | J155: [] | K155: 65 | L155: 100 | M155: 0 | N155: 0 | O155: 日常 | Q155: 2 | U155: son | V155: 10304000 | AC155: 击杀85只晶蓝海马(65级) | AD155: reward_icon.tx_jinglanhaima | AG155: 5 | AH155: ="["&RC[11]&","""&RC[-32]&"""]" -> [85,"晶蓝海马"] | AI155: 3 | AJ155: [["getTaskTimes",[10304000]]] | AK155: 4 | AL155: 找<佣兵长马塞尔|arg=10010200>领取奖励 | AM155: "找<佣兵长马塞尔|arg=10010200>领取奖励" | AN155: 1 | AO155: 2 | AQ155: 61800 | AR155: {enhance_money,20} | AS155: 85
A156: 10304154 | B156: 晶蓝海马 | D156: 悬赏任务 | E156: 悬赏任务（剩余<span color:FFE21B1B>{0}</span>次） | F156: ["getTaskTimes",[10304000]] | H156: 10010200 | I156: 10010200 | J156: [] | K156: 65 | L156: 100 | M156: 0 | N156: 0 | O156: 日常 | Q156: 2 | U156: son | V156: 10304000 | AC156: 击杀90只晶蓝海马(65级) | AD156: reward_icon.tx_jinglanhaima | AG156: 5 | AH156: ="["&RC[11]&","""&RC[-32]&"""]" -> [90,"晶蓝海马"] | AI156: 3 | AJ156: [["getTaskTimes",[10304000]]] | AK156: 4 | AL156: 找<佣兵长马塞尔|arg=10010200>领取奖励 | AM156: "找<佣兵长马塞尔|arg=10010200>领取奖励" | AN156: 1 | AO156: 3 | AQ156: 123600 | AR156: {enhance_money,40},{item,{110059001,1}} | AS156: 90
A157: 10304155 | B157: 晶蓝海马 | D157: 悬赏任务 | E157: 悬赏任务（剩余<span color:FFE21B1B>{0}</span>次） | F157: ["getTaskTimes",[10304000]] | H157: 10010200 | I157: 10010200 | J157: [] | K157: 65 | L157: 100 | M157: 0 | N157: 0 | O157: 日常 | Q157: 2 | U157: son | V157: 10304000 | AC157: 击杀95只晶蓝海马(65级) | AD157: reward_icon.tx_jinglanhaima | AG157: 5 | AH157: ="["&RC[11]&","""&RC[-32]&"""]" -> [95,"晶蓝海马"] | AI157: 3 | AJ157: [["getTaskTimes",[10304000]]] | AK157: 4 | AL157: 找<佣兵长马塞尔|arg=10010200>领取奖励 | AM157: "找<佣兵长马塞尔|arg=10010200>领取奖励" | AN157: 1 | AO157: 4 | AQ157: 185500 | AR157: {enhance_money,80},{item,{110059001,1}} | AS157: 95
A158: 10304156 | B158: 潮汐海魔 | D158: 悬赏任务 | E158: 悬赏任务（剩余<span color:FFE21B1B>{0}</span>次） | F158: ["getTaskTimes",[10304000]] | H158: 10010200 | I158: 10010200 | J158: [] | K158: 67 | L158: 100 | M158: 0 | N158: 0 | O158: 日常 | Q158: 2 | U158: son | V158: 10304000 | AC158: 击杀75只潮汐海魔(67级) | AD158: reward_icon.tx_chaoxihaimo | AG158: 5 | AH158: ="["&RC[11]&","""&RC[-32]&"""]" -> [75,"潮汐海魔"] | AI158: 3 | AJ158: [["getTaskTimes",[10304000]]] | AK158: 4 | AL158: 找<佣兵长马塞尔|arg=10010200>领取奖励 | AM158: "找<佣兵长马塞尔|arg=10010200>领取奖励" | AN158: 1 | AO158: 0 | AQ158: 23800 | AS158: 75
A159: 10304157 | B159: 潮汐海魔 | D159: 悬赏任务 | E159: 悬赏任务（剩余<span color:FFE21B1B>{0}</span>次） | F159: ["getTaskTimes",[10304000]] | H159: 10010200 | I159: 10010200 | J159: [] | K159: 67 | L159: 100 | M159: 0 | N159: 0 | O159: 日常 | Q159: 2 | U159: son | V159: 10304000 | AC159: 击杀80只潮汐海魔(67级) | AD159: reward_icon.tx_chaoxihaimo | AG159: 5 | AH159: ="["&RC[11]&","""&RC[-32]&"""]" -> [80,"潮汐海魔"] | AI159: 3 | AJ159: [["getTaskTimes",[10304000]]] | AK159: 4 | AL159: 找<佣兵长马塞尔|arg=10010200>领取奖励 | AM159: "找<佣兵长马塞尔|arg=10010200>领取奖励" | AN159: 1 | AO159: 1 | AQ159: 31700 | AS159: 80
A160: 10304158 | B160: 潮汐海魔 | D160: 悬赏任务 | E160: 悬赏任务（剩余<span color:FFE21B1B>{0}</span>次） | F160: ["getTaskTimes",[10304000]] | H160: 10010200 | I160: 10010200 | J160: [] | K160: 67 | L160: 100 | M160: 0 | N160: 0 | O160: 日常 | Q160: 2 | U160: son | V160: 10304000 | AC160: 击杀85只潮汐海魔(67级) | AD160: reward_icon.tx_chaoxihaimo | AG160: 5 | AH160: ="["&RC[11]&","""&RC[-32]&"""]" -> [85,"潮汐海魔"] | AI160: 3 | AJ160: [["getTaskTimes",[10304000]]] | AK160: 4 | AL160: 找<佣兵长马塞尔|arg=10010200>领取奖励 | AM160: "找<佣兵长马塞尔|arg=10010200>领取奖励" | AN160: 1 | AO160: 2 | AQ160: 63500 | AR160: {enhance_money,20} | AS160: 85
A161: 10304159 | B161: 潮汐海魔 | D161: 悬赏任务 | E161: 悬赏任务（剩余<span color:FFE21B1B>{0}</span>次） | F161: ["getTaskTimes",[10304000]] | H161: 10010200 | I161: 10010200 | J161: [] | K161: 67 | L161: 100 | M161: 0 | N161: 0 | O161: 日常 | Q161: 2 | U161: son | V161: 10304000 | AC161: 击杀90只潮汐海魔(67级) | AD161: reward_icon.tx_chaoxihaimo | AG161: 5 | AH161: ="["&RC[11]&","""&RC[-32]&"""]" -> [90,"潮汐海魔"] | AI161: 3 | AJ161: [["getTaskTimes",[10304000]]] | AK161: 4 | AL161: 找<佣兵长马塞尔|arg=10010200>领取奖励 | AM161: "找<佣兵长马塞尔|arg=10010200>领取奖励" | AN161: 1 | AO161: 3 | AQ161: 127000 | AR161: {enhance_money,40},{item,{110059001,1}} | AS161: 90
A162: 10304160 | B162: 潮汐海魔 | D162: 悬赏任务 | E162: 悬赏任务（剩余<span color:FFE21B1B>{0}</span>次） | F162: ["getTaskTimes",[10304000]] | H162: 10010200 | I162: 10010200 | J162: [] | K162: 67 | L162: 100 | M162: 0 | N162: 0 | O162: 日常 | Q162: 2 | U162: son | V162: 10304000 | AC162: 击杀95只潮汐海魔(67级) | AD162: reward_icon.tx_chaoxihaimo | AG162: 5 | AH162: ="["&RC[11]&","""&RC[-32]&"""]" -> [95,"潮汐海魔"] | AI162: 3 | AJ162: [["getTaskTimes",[10304000]]] | AK162: 4 | AL162: 找<佣兵长马塞尔|arg=10010200>领取奖励 | AM162: "找<佣兵长马塞尔|arg=10010200>领取奖励" | AN162: 1 | AO162: 4 | AQ162: 190400 | AR162: {enhance_money,80},{item,{110059001,1}} | AS162: 95
A163: 10304161 | B163: 鱼人战士 | D163: 悬赏任务 | E163: 悬赏任务（剩余<span color:FFE21B1B>{0}</span>次） | F163: ["getTaskTimes",[10304000]] | H163: 10010200 | I163: 10010200 | J163: [] | K163: 1 | L163: 100 | M163: 0 | N163: 0 | O163: 日常 | Q163: 2 | U163: son | V163: 10304000 | AC163: 击杀65只鱼人战士(1级) | AD163: reward_icon.tx_yurenzhanshi | AG163: 5 | AH163: ="["&RC[11]&","""&RC[-32]&"""]" -> [65,"鱼人战士"] | AI163: 3 | AJ163: [["getTaskTimes",[10304000]]] | AK163: 4 | AL163: 找<佣兵长马塞尔|arg=10010200>领取奖励 | AM163: "找<佣兵长马塞尔|arg=10010200>领取奖励" | AN163: 1 | AO163: 0 | AQ163: 1700 | AS163: 65
A164: 10304162 | B164: 鱼人战士 | D164: 悬赏任务 | E164: 悬赏任务（剩余<span color:FFE21B1B>{0}</span>次） | F164: ["getTaskTimes",[10304000]] | H164: 10010200 | I164: 10010200 | J164: [] | K164: 1 | L164: 100 | M164: 0 | N164: 0 | O164: 日常 | Q164: 2 | U164: son | V164: 10304000 | AC164: 击杀70只鱼人战士(1级) | AD164: reward_icon.tx_yurenzhanshi | AG164: 5 | AH164: ="["&RC[11]&","""&RC[-32]&"""]" -> [70,"鱼人战士"] | AI164: 3 | AJ164: [["getTaskTimes",[10304000]]] | AK164: 4 | AL164: 找<佣兵长马塞尔|arg=10010200>领取奖励 | AM164: "找<佣兵长马塞尔|arg=10010200>领取奖励" | AN164: 1 | AO164: 1 | AQ164: 2300 | AS164: 70
A165: 10304163 | B165: 鱼人战士 | D165: 悬赏任务 | E165: 悬赏任务（剩余<span color:FFE21B1B>{0}</span>次） | F165: ["getTaskTimes",[10304000]] | H165: 10010200 | I165: 10010200 | J165: [] | K165: 1 | L165: 100 | M165: 0 | N165: 0 | O165: 日常 | Q165: 2 | U165: son | V165: 10304000 | AC165: 击杀75只鱼人战士(1级) | AD165: reward_icon.tx_yurenzhanshi | AG165: 5 | AH165: ="["&RC[11]&","""&RC[-32]&"""]" -> [75,"鱼人战士"] | AI165: 3 | AJ165: [["getTaskTimes",[10304000]]] | AK165: 4 | AL165: 找<佣兵长马塞尔|arg=10010200>领取奖励 | AM165: "找<佣兵长马塞尔|arg=10010200>领取奖励" | AN165: 1 | AO165: 2 | AQ165: 4500 | AR165: {enhance_money,20} | AS165: 75
A166: 10304164 | B166: 鱼人战士 | D166: 悬赏任务 | E166: 悬赏任务（剩余<span color:FFE21B1B>{0}</span>次） | F166: ["getTaskTimes",[10304000]] | H166: 10010200 | I166: 10010200 | J166: [] | K166: 1 | L166: 100 | M166: 0 | N166: 0 | O166: 日常 | Q166: 2 | U166: son | V166: 10304000 | AC166: 击杀80只鱼人战士(1级) | AD166: reward_icon.tx_yurenzhanshi | AG166: 5 | AH166: ="["&RC[11]&","""&RC[-32]&"""]" -> [80,"鱼人战士"] | AI166: 3 | AJ166: [["getTaskTimes",[10304000]]] | AK166: 4 | AL166: 找<佣兵长马塞尔|arg=10010200>领取奖励 | AM166: "找<佣兵长马塞尔|arg=10010200>领取奖励" | AN166: 1 | AO166: 3 | AQ166: 9100 | AR166: {enhance_money,40},{item,{110059001,1}} | AS166: 80
A167: 10304165 | B167: 鱼人战士 | D167: 悬赏任务 | E167: 悬赏任务（剩余<span color:FFE21B1B>{0}</span>次） | F167: ["getTaskTimes",[10304000]] | H167: 10010200 | I167: 10010200 | J167: [] | K167: 1 | L167: 100 | M167: 0 | N167: 0 | O167: 日常 | Q167: 2 | U167: son | V167: 10304000 | AC167: 击杀85只鱼人战士(1级) | AD167: reward_icon.tx_yurenzhanshi | AG167: 5 | AH167: ="["&RC[11]&","""&RC[-32]&"""]" -> [85,"鱼人战士"] | AI167: 3 | AJ167: [["getTaskTimes",[10304000]]] | AK167: 4 | AL167: 找<佣兵长马塞尔|arg=10010200>领取奖励 | AM167: "找<佣兵长马塞尔|arg=10010200>领取奖励" | AN167: 1 | AO167: 4 | AQ167: 13600 | AR167: {enhance_money,80},{item,{110059001,1}} | AS167: 85
A168: 10304166 | B168: 娜迦海妖 | D168: 悬赏任务 | E168: 悬赏任务（剩余<span color:FFE21B1B>{0}</span>次） | F168: ["getTaskTimes",[10304000]] | H168: 10010200 | I168: 10010200 | J168: [] | K168: 1 | L168: 100 | M168: 0 | N168: 0 | O168: 日常 | Q168: 2 | U168: son | V168: 10304000 | AC168: 击杀65只娜迦海妖(1级) | AD168: reward_icon.tx_nijiahaiyao | AG168: 5 | AH168: ="["&RC[11]&","""&RC[-32]&"""]" -> [65,"娜迦海妖"] | AI168: 3 | AJ168: [["getTaskTimes",[10304000]]] | AK168: 4 | AL168: 找<佣兵长马塞尔|arg=10010200>领取奖励 | AM168: "找<佣兵长马塞尔|arg=10010200>领取奖励" | AN168: 1 | AO168: 0 | AQ168: 1700 | AS168: 65
A169: 10304167 | B169: 娜迦海妖 | D169: 悬赏任务 | E169: 悬赏任务（剩余<span color:FFE21B1B>{0}</span>次） | F169: ["getTaskTimes",[10304000]] | H169: 10010200 | I169: 10010200 | J169: [] | K169: 1 | L169: 100 | M169: 0 | N169: 0 | O169: 日常 | Q169: 2 | U169: son | V169: 10304000 | AC169: 击杀70只娜迦海妖(1级) | AD169: reward_icon.tx_nijiahaiyao | AG169: 5 | AH169: ="["&RC[11]&","""&RC[-32]&"""]" -> [70,"娜迦海妖"] | AI169: 3 | AJ169: [["getTaskTimes",[10304000]]] | AK169: 4 | AL169: 找<佣兵长马塞尔|arg=10010200>领取奖励 | AM169: "找<佣兵长马塞尔|arg=10010200>领取奖励" | AN169: 1 | AO169: 1 | AQ169: 2300 | AS169: 70
A170: 10304168 | B170: 娜迦海妖 | D170: 悬赏任务 | E170: 悬赏任务（剩余<span color:FFE21B1B>{0}</span>次） | F170: ["getTaskTimes",[10304000]] | H170: 10010200 | I170: 10010200 | J170: [] | K170: 1 | L170: 100 | M170: 0 | N170: 0 | O170: 日常 | Q170: 2 | U170: son | V170: 10304000 | AC170: 击杀75只娜迦海妖(1级) | AD170: reward_icon.tx_nijiahaiyao | AG170: 5 | AH170: ="["&RC[11]&","""&RC[-32]&"""]" -> [75,"娜迦海妖"] | AI170: 3 | AJ170: [["getTaskTimes",[10304000]]] | AK170: 4 | AL170: 找<佣兵长马塞尔|arg=10010200>领取奖励 | AM170: "找<佣兵长马塞尔|arg=10010200>领取奖励" | AN170: 1 | AO170: 2 | AQ170: 4500 | AR170: {enhance_money,20} | AS170: 75
A171: 10304169 | B171: 娜迦海妖 | D171: 悬赏任务 | E171: 悬赏任务（剩余<span color:FFE21B1B>{0}</span>次） | F171: ["getTaskTimes",[10304000]] | H171: 10010200 | I171: 10010200 | J171: [] | K171: 1 | L171: 100 | M171: 0 | N171: 0 | O171: 日常 | Q171: 2 | U171: son | V171: 10304000 | AC171: 击杀80只娜迦海妖(1级) | AD171: reward_icon.tx_nijiahaiyao | AG171: 5 | AH171: ="["&RC[11]&","""&RC[-32]&"""]" -> [80,"娜迦海妖"] | AI171: 3 | AJ171: [["getTaskTimes",[10304000]]] | AK171: 4 | AL171: 找<佣兵长马塞尔|arg=10010200>领取奖励 | AM171: "找<佣兵长马塞尔|arg=10010200>领取奖励" | AN171: 1 | AO171: 3 | AQ171: 9100 | AR171: {enhance_money,40},{item,{110059001,1}} | AS171: 80
A172: 10304170 | B172: 娜迦海妖 | D172: 悬赏任务 | E172: 悬赏任务（剩余<span color:FFE21B1B>{0}</span>次） | F172: ["getTaskTimes",[10304000]] | H172: 10010200 | I172: 10010200 | J172: [] | K172: 1 | L172: 100 | M172: 0 | N172: 0 | O172: 日常 | Q172: 2 | U172: son | V172: 10304000 | AC172: 击杀85只娜迦海妖(1级) | AD172: reward_icon.tx_nijiahaiyao | AG172: 5 | AH172: ="["&RC[11]&","""&RC[-32]&"""]" -> [85,"娜迦海妖"] | AI172: 3 | AJ172: [["getTaskTimes",[10304000]]] | AK172: 4 | AL172: 找<佣兵长马塞尔|arg=10010200>领取奖励 | AM172: "找<佣兵长马塞尔|arg=10010200>领取奖励" | AN172: 1 | AO172: 4 | AQ172: 13600 | AR172: {enhance_money,80},{item,{110059001,1}} | AS172: 85
A173: 10304171 | B173: 海皇守卫 | D173: 悬赏任务 | E173: 悬赏任务（剩余<span color:FFE21B1B>{0}</span>次） | F173: ["getTaskTimes",[10304000]] | H173: 10010200 | I173: 10010200 | J173: [] | K173: 1 | L173: 100 | M173: 0 | N173: 0 | O173: 日常 | Q173: 2 | U173: son | V173: 10304000 | AC173: 击杀65只海皇守卫(1级) | AD173: reward_icon.tx_haihuangshouwei | AG173: 5 | AH173: ="["&RC[11]&","""&RC[-32]&"""]" -> [65,"海皇守卫"] | AI173: 3 | AJ173: [["getTaskTimes",[10304000]]] | AK173: 4 | AL173: 找<佣兵长马塞尔|arg=10010200>领取奖励 | AM173: "找<佣兵长马塞尔|arg=10010200>领取奖励" | AN173: 1 | AO173: 0 | AQ173: 1700 | AS173: 65
A174: 10304172 | B174: 海皇守卫 | D174: 悬赏任务 | E174: 悬赏任务（剩余<span color:FFE21B1B>{0}</span>次） | F174: ["getTaskTimes",[10304000]] | H174: 10010200 | I174: 10010200 | J174: [] | K174: 1 | L174: 100 | M174: 0 | N174: 0 | O174: 日常 | Q174: 2 | U174: son | V174: 10304000 | AC174: 击杀70只海皇守卫(1级) | AD174: reward_icon.tx_haihuangshouwei | AG174: 5 | AH174: ="["&RC[11]&","""&RC[-32]&"""]" -> [70,"海皇守卫"] | AI174: 3 | AJ174: [["getTaskTimes",[10304000]]] | AK174: 4 | AL174: 找<佣兵长马塞尔|arg=10010200>领取奖励 | AM174: "找<佣兵长马塞尔|arg=10010200>领取奖励" | AN174: 1 | AO174: 1 | AQ174: 2300 | AS174: 70
A175: 10304173 | B175: 海皇守卫 | D175: 悬赏任务 | E175: 悬赏任务（剩余<span color:FFE21B1B>{0}</span>次） | F175: ["getTaskTimes",[10304000]] | H175: 10010200 | I175: 10010200 | J175: [] | K175: 1 | L175: 100 | M175: 0 | N175: 0 | O175: 日常 | Q175: 2 | U175: son | V175: 10304000 | AC175: 击杀75只海皇守卫(1级) | AD175: reward_icon.tx_haihuangshouwei | AG175: 5 | AH175: ="["&RC[11]&","""&RC[-32]&"""]" -> [75,"海皇守卫"] | AI175: 3 | AJ175: [["getTaskTimes",[10304000]]] | AK175: 4 | AL175: 找<佣兵长马塞尔|arg=10010200>领取奖励 | AM175: "找<佣兵长马塞尔|arg=10010200>领取奖励" | AN175: 1 | AO175: 2 | AQ175: 4500 | AR175: {enhance_money,20} | AS175: 75
A176: 10304174 | B176: 海皇守卫 | D176: 悬赏任务 | E176: 悬赏任务（剩余<span color:FFE21B1B>{0}</span>次） | F176: ["getTaskTimes",[10304000]] | H176: 10010200 | I176: 10010200 | J176: [] | K176: 1 | L176: 100 | M176: 0 | N176: 0 | O176: 日常 | Q176: 2 | U176: son | V176: 10304000 | AC176: 击杀80只海皇守卫(1级) | AD176: reward_icon.tx_haihuangshouwei | AG176: 5 | AH176: ="["&RC[11]&","""&RC[-32]&"""]" -> [80,"海皇守卫"] | AI176: 3 | AJ176: [["getTaskTimes",[10304000]]] | AK176: 4 | AL176: 找<佣兵长马塞尔|arg=10010200>领取奖励 | AM176: "找<佣兵长马塞尔|arg=10010200>领取奖励" | AN176: 1 | AO176: 3 | AQ176: 9100 | AR176: {enhance_money,40},{item,{110059001,1}} | AS176: 80
A177: 10304175 | B177: 海皇守卫 | D177: 悬赏任务 | E177: 悬赏任务（剩余<span color:FFE21B1B>{0}</span>次） | F177: ["getTaskTimes",[10304000]] | H177: 10010200 | I177: 10010200 | J177: [] | K177: 1 | L177: 100 | M177: 0 | N177: 0 | O177: 日常 | Q177: 2 | U177: son | V177: 10304000 | AC177: 击杀85只海皇守卫(1级) | AD177: reward_icon.tx_haihuangshouwei | AG177: 5 | AH177: ="["&RC[11]&","""&RC[-32]&"""]" -> [85,"海皇守卫"] | AI177: 3 | AJ177: [["getTaskTimes",[10304000]]] | AK177: 4 | AL177: 找<佣兵长马塞尔|arg=10010200>领取奖励 | AM177: "找<佣兵长马塞尔|arg=10010200>领取奖励" | AN177: 1 | AO177: 4 | AQ177: 13600 | AR177: {enhance_money,80},{item,{110059001,1}} | AS177: 85
A178: 10304176 | B178: 裂齿海魔 | D178: 悬赏任务 | E178: 悬赏任务（剩余<span color:FFE21B1B>{0}</span>次） | F178: ["getTaskTimes",[10304000]] | H178: 10010200 | I178: 10010200 | J178: [] | K178: 1 | L178: 100 | M178: 0 | N178: 0 | O178: 日常 | Q178: 2 | U178: son | V178: 10304000 | AC178: 击杀65只裂齿海魔(1级) | AD178: reward_icon.tx_liechihaimo | AG178: 5 | AH178: ="["&RC[11]&","""&RC[-32]&"""]" -> [65,"裂齿海魔"] | AI178: 3 | AJ178: [["getTaskTimes",[10304000]]] | AK178: 4 | AL178: 找<佣兵长马塞尔|arg=10010200>领取奖励 | AM178: "找<佣兵长马塞尔|arg=10010200>领取奖励" | AN178: 1 | AO178: 0 | AQ178: 1700 | AS178: 65
A179: 10304177 | B179: 裂齿海魔 | D179: 悬赏任务 | E179: 悬赏任务（剩余<span color:FFE21B1B>{0}</span>次） | F179: ["getTaskTimes",[10304000]] | H179: 10010200 | I179: 10010200 | J179: [] | K179: 1 | L179: 100 | M179: 0 | N179: 0 | O179: 日常 | Q179: 2 | U179: son | V179: 10304000 | AC179: 击杀70只裂齿海魔(1级) | AD179: reward_icon.tx_liechihaimo | AG179: 5 | AH179: ="["&RC[11]&","""&RC[-32]&"""]" -> [70,"裂齿海魔"] | AI179: 3 | AJ179: [["getTaskTimes",[10304000]]] | AK179: 4 | AL179: 找<佣兵长马塞尔|arg=10010200>领取奖励 | AM179: "找<佣兵长马塞尔|arg=10010200>领取奖励" | AN179: 1 | AO179: 1 | AQ179: 2300 | AS179: 70
A180: 10304178 | B180: 裂齿海魔 | D180: 悬赏任务 | E180: 悬赏任务（剩余<span color:FFE21B1B>{0}</span>次） | F180: ["getTaskTimes",[10304000]] | H180: 10010200 | I180: 10010200 | J180: [] | K180: 1 | L180: 100 | M180: 0 | N180: 0 | O180: 日常 | Q180: 2 | U180: son | V180: 10304000 | AC180: 击杀75只裂齿海魔(1级) | AD180: reward_icon.tx_liechihaimo | AG180: 5 | AH180: ="["&RC[11]&","""&RC[-32]&"""]" -> [75,"裂齿海魔"] | AI180: 3 | AJ180: [["getTaskTimes",[10304000]]] | AK180: 4 | AL180: 找<佣兵长马塞尔|arg=10010200>领取奖励 | AM180: "找<佣兵长马塞尔|arg=10010200>领取奖励" | AN180: 1 | AO180: 2 | AQ180: 4500 | AR180: {enhance_money,20} | AS180: 75
A181: 10304179 | B181: 裂齿海魔 | D181: 悬赏任务 | E181: 悬赏任务（剩余<span color:FFE21B1B>{0}</span>次） | F181: ["getTaskTimes",[10304000]] | H181: 10010200 | I181: 10010200 | J181: [] | K181: 1 | L181: 100 | M181: 0 | N181: 0 | O181: 日常 | Q181: 2 | U181: son | V181: 10304000 | AC181: 击杀80只裂齿海魔(1级) | AD181: reward_icon.tx_liechihaimo | AG181: 5 | AH181: ="["&RC[11]&","""&RC[-32]&"""]" -> [80,"裂齿海魔"] | AI181: 3 | AJ181: [["getTaskTimes",[10304000]]] | AK181: 4 | AL181: 找<佣兵长马塞尔|arg=10010200>领取奖励 | AM181: "找<佣兵长马塞尔|arg=10010200>领取奖励" | AN181: 1 | AO181: 3 | AQ181: 9100 | AR181: {enhance_money,40},{item,{110059001,1}} | AS181: 80
A182: 10304180 | B182: 裂齿海魔 | D182: 悬赏任务 | E182: 悬赏任务（剩余<span color:FFE21B1B>{0}</span>次） | F182: ["getTaskTimes",[10304000]] | H182: 10010200 | I182: 10010200 | J182: [] | K182: 1 | L182: 100 | M182: 0 | N182: 0 | O182: 日常 | Q182: 2 | U182: son | V182: 10304000 | AC182: 击杀85只裂齿海魔(1级) | AD182: reward_icon.tx_liechihaimo | AG182: 5 | AH182: ="["&RC[11]&","""&RC[-32]&"""]" -> [85,"裂齿海魔"] | AI182: 3 | AJ182: [["getTaskTimes",[10304000]]] | AK182: 4 | AL182: 找<佣兵长马塞尔|arg=10010200>领取奖励 | AM182: "找<佣兵长马塞尔|arg=10010200>领取奖励" | AN182: 1 | AO182: 4 | AQ182: 13600 | AR182: {enhance_money,80},{item,{110059001,1}} | AS182: 85
A183: 10304181 | B183: 铁爪龙鳄 | D183: 悬赏任务 | E183: 悬赏任务（剩余<span color:FFE21B1B>{0}</span>次） | F183: ["getTaskTimes",[10304000]] | H183: 10010200 | I183: 10010200 | J183: [] | K183: 1 | L183: 100 | M183: 0 | N183: 0 | O183: 日常 | Q183: 2 | U183: son | V183: 10304000 | AC183: 击杀65只铁爪龙鳄(1级) | AD183: reward_icon.tx_tiezhualonge | AG183: 5 | AH183: ="["&RC[11]&","""&RC[-32]&"""]" -> [65,"铁爪龙鳄"] | AI183: 3 | AJ183: [["getTaskTimes",[10304000]]] | AK183: 4 | AL183: 找<佣兵长马塞尔|arg=10010200>领取奖励 | AM183: "找<佣兵长马塞尔|arg=10010200>领取奖励" | AN183: 1 | AO183: 0 | AQ183: 1700 | AS183: 65
A184: 10304182 | B184: 铁爪龙鳄 | D184: 悬赏任务 | E184: 悬赏任务（剩余<span color:FFE21B1B>{0}</span>次） | F184: ["getTaskTimes",[10304000]] | H184: 10010200 | I184: 10010200 | J184: [] | K184: 1 | L184: 100 | M184: 0 | N184: 0 | O184: 日常 | Q184: 2 | U184: son | V184: 10304000 | AC184: 击杀70只铁爪龙鳄(1级) | AD184: reward_icon.tx_tiezhualonge | AG184: 5 | AH184: ="["&RC[11]&","""&RC[-32]&"""]" -> [70,"铁爪龙鳄"] | AI184: 3 | AJ184: [["getTaskTimes",[10304000]]] | AK184: 4 | AL184: 找<佣兵长马塞尔|arg=10010200>领取奖励 | AM184: "找<佣兵长马塞尔|arg=10010200>领取奖励" | AN184: 1 | AO184: 1 | AQ184: 2300 | AS184: 70
A185: 10304183 | B185: 铁爪龙鳄 | D185: 悬赏任务 | E185: 悬赏任务（剩余<span color:FFE21B1B>{0}</span>次） | F185: ["getTaskTimes",[10304000]] | H185: 10010200 | I185: 10010200 | J185: [] | K185: 1 | L185: 100 | M185: 0 | N185: 0 | O185: 日常 | Q185: 2 | U185: son | V185: 10304000 | AC185: 击杀75只铁爪龙鳄(1级) | AD185: reward_icon.tx_tiezhualonge | AG185: 5 | AH185: ="["&RC[11]&","""&RC[-32]&"""]" -> [75,"铁爪龙鳄"] | AI185: 3 | AJ185: [["getTaskTimes",[10304000]]] | AK185: 4 | AL185: 找<佣兵长马塞尔|arg=10010200>领取奖励 | AM185: "找<佣兵长马塞尔|arg=10010200>领取奖励" | AN185: 1 | AO185: 2 | AQ185: 4500 | AR185: {enhance_money,20} | AS185: 75
A186: 10304184 | B186: 铁爪龙鳄 | D186: 悬赏任务 | E186: 悬赏任务（剩余<span color:FFE21B1B>{0}</span>次） | F186: ["getTaskTimes",[10304000]] | H186: 10010200 | I186: 10010200 | J186: [] | K186: 1 | L186: 100 | M186: 0 | N186: 0 | O186: 日常 | Q186: 2 | U186: son | V186: 10304000 | AC186: 击杀80只铁爪龙鳄(1级) | AD186: reward_icon.tx_tiezhualonge | AG186: 5 | AH186: ="["&RC[11]&","""&RC[-32]&"""]" -> [80,"铁爪龙鳄"] | AI186: 3 | AJ186: [["getTaskTimes",[10304000]]] | AK186: 4 | AL186: 找<佣兵长马塞尔|arg=10010200>领取奖励 | AM186: "找<佣兵长马塞尔|arg=10010200>领取奖励" | AN186: 1 | AO186: 3 | AQ186: 9100 | AR186: {enhance_money,40},{item,{110059001,1}} | AS186: 80
A187: 10304185 | B187: 铁爪龙鳄 | D187: 悬赏任务 | E187: 悬赏任务（剩余<span color:FFE21B1B>{0}</span>次） | F187: ["getTaskTimes",[10304000]] | H187: 10010200 | I187: 10010200 | J187: [] | K187: 1 | L187: 100 | M187: 0 | N187: 0 | O187: 日常 | Q187: 2 | U187: son | V187: 10304000 | AC187: 击杀85只铁爪龙鳄(1级) | AD187: reward_icon.tx_tiezhualonge | AG187: 5 | AH187: ="["&RC[11]&","""&RC[-32]&"""]" -> [85,"铁爪龙鳄"] | AI187: 3 | AJ187: [["getTaskTimes",[10304000]]] | AK187: 4 | AL187: 找<佣兵长马塞尔|arg=10010200>领取奖励 | AM187: "找<佣兵长马塞尔|arg=10010200>领取奖励" | AN187: 1 | AO187: 4 | AQ187: 13600 | AR187: {enhance_money,80},{item,{110059001,1}} | AS187: 85
A188: 10304186 | B188: 蓝鳞蛇龙 | D188: 悬赏任务 | E188: 悬赏任务（剩余<span color:FFE21B1B>{0}</span>次） | F188: ["getTaskTimes",[10304000]] | H188: 10010200 | I188: 10010200 | J188: [] | K188: 1 | L188: 100 | M188: 0 | N188: 0 | O188: 日常 | Q188: 2 | U188: son | V188: 10304000 | AC188: 击杀65只蓝鳞蛇龙(1级) | AD188: reward_icon.tx_lanlinshelong | AG188: 5 | AH188: ="["&RC[11]&","""&RC[-32]&"""]" -> [65,"蓝鳞蛇龙"] | AI188: 3 | AJ188: [["getTaskTimes",[10304000]]] | AK188: 4 | AL188: 找<佣兵长马塞尔|arg=10010200>领取奖励 | AM188: "找<佣兵长马塞尔|arg=10010200>领取奖励" | AN188: 1 | AO188: 0 | AQ188: 1700 | AS188: 65
A189: 10304187 | B189: 蓝鳞蛇龙 | D189: 悬赏任务 | E189: 悬赏任务（剩余<span color:FFE21B1B>{0}</span>次） | F189: ["getTaskTimes",[10304000]] | H189: 10010200 | I189: 10010200 | J189: [] | K189: 1 | L189: 100 | M189: 0 | N189: 0 | O189: 日常 | Q189: 2 | U189: son | V189: 10304000 | AC189: 击杀70只蓝鳞蛇龙(1级) | AD189: reward_icon.tx_lanlinshelong | AG189: 5 | AH189: ="["&RC[11]&","""&RC[-32]&"""]" -> [70,"蓝鳞蛇龙"] | AI189: 3 | AJ189: [["getTaskTimes",[10304000]]] | AK189: 4 | AL189: 找<佣兵长马塞尔|arg=10010200>领取奖励 | AM189: "找<佣兵长马塞尔|arg=10010200>领取奖励" | AN189: 1 | AO189: 1 | AQ189: 2300 | AS189: 70
A190: 10304188 | B190: 蓝鳞蛇龙 | D190: 悬赏任务 | E190: 悬赏任务（剩余<span color:FFE21B1B>{0}</span>次） | F190: ["getTaskTimes",[10304000]] | H190: 10010200 | I190: 10010200 | J190: [] | K190: 1 | L190: 100 | M190: 0 | N190: 0 | O190: 日常 | Q190: 2 | U190: son | V190: 10304000 | AC190: 击杀75只蓝鳞蛇龙(1级) | AD190: reward_icon.tx_lanlinshelong | AG190: 5 | AH190: ="["&RC[11]&","""&RC[-32]&"""]" -> [75,"蓝鳞蛇龙"] | AI190: 3 | AJ190: [["getTaskTimes",[10304000]]] | AK190: 4 | AL190: 找<佣兵长马塞尔|arg=10010200>领取奖励 | AM190: "找<佣兵长马塞尔|arg=10010200>领取奖励" | AN190: 1 | AO190: 2 | AQ190: 4500 | AR190: {enhance_money,20} | AS190: 75
A191: 10304189 | B191: 蓝鳞蛇龙 | D191: 悬赏任务 | E191: 悬赏任务（剩余<span color:FFE21B1B>{0}</span>次） | F191: ["getTaskTimes",[10304000]] | H191: 10010200 | I191: 10010200 | J191: [] | K191: 1 | L191: 100 | M191: 0 | N191: 0 | O191: 日常 | Q191: 2 | U191: son | V191: 10304000 | AC191: 击杀80只蓝鳞蛇龙(1级) | AD191: reward_icon.tx_lanlinshelong | AG191: 5 | AH191: ="["&RC[11]&","""&RC[-32]&"""]" -> [80,"蓝鳞蛇龙"] | AI191: 3 | AJ191: [["getTaskTimes",[10304000]]] | AK191: 4 | AL191: 找<佣兵长马塞尔|arg=10010200>领取奖励 | AM191: "找<佣兵长马塞尔|arg=10010200>领取奖励" | AN191: 1 | AO191: 3 | AQ191: 9100 | AR191: {enhance_money,40},{item,{110059001,1}} | AS191: 80
A192: 10304190 | B192: 蓝鳞蛇龙 | D192: 悬赏任务 | E192: 悬赏任务（剩余<span color:FFE21B1B>{0}</span>次） | F192: ["getTaskTimes",[10304000]] | H192: 10010200 | I192: 10010200 | J192: [] | K192: 1 | L192: 100 | M192: 0 | N192: 0 | O192: 日常 | Q192: 2 | U192: son | V192: 10304000 | AC192: 击杀85只蓝鳞蛇龙(1级) | AD192: reward_icon.tx_lanlinshelong | AG192: 5 | AH192: ="["&RC[11]&","""&RC[-32]&"""]" -> [85,"蓝鳞蛇龙"] | AI192: 3 | AJ192: [["getTaskTimes",[10304000]]] | AK192: 4 | AL192: 找<佣兵长马塞尔|arg=10010200>领取奖励 | AM192: "找<佣兵长马塞尔|arg=10010200>领取奖励" | AN192: 1 | AO192: 4 | AQ192: 13600 | AR192: {enhance_money,80},{item,{110059001,1}} | AS192: 85
A193: 10304191 | B193: 梦魇 | D193: 悬赏任务 | E193: 悬赏任务（剩余<span color:FFE21B1B>{0}</span>次） | F193: ["getTaskTimes",[10304000]] | H193: 10010200 | I193: 10010200 | J193: [] | K193: 1 | L193: 100 | M193: 0 | N193: 0 | O193: 日常 | Q193: 2 | U193: son | V193: 10304000 | AC193: 击杀65只梦魇(1级) | AD193: reward_icon.tx_mengyan | AG193: 5 | AH193: ="["&RC[11]&","""&RC[-32]&"""]" -> [65,"梦魇"] | AI193: 3 | AJ193: [["getTaskTimes",[10304000]]] | AK193: 4 | AL193: 找<佣兵长马塞尔|arg=10010200>领取奖励 | AM193: "找<佣兵长马塞尔|arg=10010200>领取奖励" | AN193: 1 | AO193: 0 | AQ193: 1700 | AS193: 65
A194: 10304192 | B194: 梦魇 | D194: 悬赏任务 | E194: 悬赏任务（剩余<span color:FFE21B1B>{0}</span>次） | F194: ["getTaskTimes",[10304000]] | H194: 10010200 | I194: 10010200 | J194: [] | K194: 1 | L194: 100 | M194: 0 | N194: 0 | O194: 日常 | Q194: 2 | U194: son | V194: 10304000 | AC194: 击杀70只梦魇(1级) | AD194: reward_icon.tx_mengyan | AG194: 5 | AH194: ="["&RC[11]&","""&RC[-32]&"""]" -> [70,"梦魇"] | AI194: 3 | AJ194: [["getTaskTimes",[10304000]]] | AK194: 4 | AL194: 找<佣兵长马塞尔|arg=10010200>领取奖励 | AM194: "找<佣兵长马塞尔|arg=10010200>领取奖励" | AN194: 1 | AO194: 1 | AQ194: 2300 | AS194: 70
A195: 10304193 | B195: 梦魇 | D195: 悬赏任务 | E195: 悬赏任务（剩余<span color:FFE21B1B>{0}</span>次） | F195: ["getTaskTimes",[10304000]] | H195: 10010200 | I195: 10010200 | J195: [] | K195: 1 | L195: 100 | M195: 0 | N195: 0 | O195: 日常 | Q195: 2 | U195: son | V195: 10304000 | AC195: 击杀75只梦魇(1级) | AD195: reward_icon.tx_mengyan | AG195: 5 | AH195: ="["&RC[11]&","""&RC[-32]&"""]" -> [75,"梦魇"] | AI195: 3 | AJ195: [["getTaskTimes",[10304000]]] | AK195: 4 | AL195: 找<佣兵长马塞尔|arg=10010200>领取奖励 | AM195: "找<佣兵长马塞尔|arg=10010200>领取奖励" | AN195: 1 | AO195: 2 | AQ195: 4500 | AR195: {enhance_money,20} | AS195: 75
A196: 10304194 | B196: 梦魇 | D196: 悬赏任务 | E196: 悬赏任务（剩余<span color:FFE21B1B>{0}</span>次） | F196: ["getTaskTimes",[10304000]] | H196: 10010200 | I196: 10010200 | J196: [] | K196: 1 | L196: 100 | M196: 0 | N196: 0 | O196: 日常 | Q196: 2 | U196: son | V196: 10304000 | AC196: 击杀80只梦魇(1级) | AD196: reward_icon.tx_mengyan | AG196: 5 | AH196: ="["&RC[11]&","""&RC[-32]&"""]" -> [80,"梦魇"] | AI196: 3 | AJ196: [["getTaskTimes",[10304000]]] | AK196: 4 | AL196: 找<佣兵长马塞尔|arg=10010200>领取奖励 | AM196: "找<佣兵长马塞尔|arg=10010200>领取奖励" | AN196: 1 | AO196: 3 | AQ196: 9100 | AR196: {enhance_money,40},{item,{110059001,1}} | AS196: 80
A197: 10304195 | B197: 梦魇 | D197: 悬赏任务 | E197: 悬赏任务（剩余<span color:FFE21B1B>{0}</span>次） | F197: ["getTaskTimes",[10304000]] | H197: 10010200 | I197: 10010200 | J197: [] | K197: 1 | L197: 100 | M197: 0 | N197: 0 | O197: 日常 | Q197: 2 | U197: son | V197: 10304000 | AC197: 击杀85只梦魇(1级) | AD197: reward_icon.tx_mengyan | AG197: 5 | AH197: ="["&RC[11]&","""&RC[-32]&"""]" -> [85,"梦魇"] | AI197: 3 | AJ197: [["getTaskTimes",[10304000]]] | AK197: 4 | AL197: 找<佣兵长马塞尔|arg=10010200>领取奖励 | AM197: "找<佣兵长马塞尔|arg=10010200>领取奖励" | AN197: 1 | AO197: 4 | AQ197: 13600 | AR197: {enhance_money,80},{item,{110059001,1}} | AS197: 85
A198: 10304000 | D198: 悬赏任务 | E198: 悬赏任务（剩余<span color:FFE21B1B>{0}</span>次） | F198: ["getTaskTimes",[10304000]] | H198: 10010200 | I198: 10010200 | J198: [] | K198: 30 | L198: 100 | M198: 0 | N198: 0 | O198: 父任务 | Q198: 2 | T198: 1 | U198: father | W198: all | AF198: 6 | AI198: 7 | AL198: 明天再找<佣兵长马塞尔|arg=10010200>去领任务 | AM198: "明天再找<佣兵长马塞尔|arg=10010200>去领任务" | AN198: 1 | AO198: 0

Sheet: curtain
A1: 任务编号 | B1: 提交压幕对话1 | C1: 提交压幕对话2 | D1: 提交压幕对话3 | E1: 提交压幕对话4 | F1: 提交压幕对话5 | G1: 提交压幕对话6 | H1: 提交压幕对话7 | I1: 接取压幕对话1 | J1: 接取压幕对话2 | K1: 接取压幕对话3 | L1: 接取压幕对话4 | M1: 接取压幕对话5 | N1: 接取压幕对话6 | O1: 接取压幕对话7
A2: sid | B2: submit1 | C2: submit2 | D2: submit3 | E2: submit4 | F2: submit5 | G2: submit6 | H2: submit7 | I2: accept1 | J2: accept2 | K2: accept3 | L2: accept4 | M2: accept5 | N2: accept6 | O2: accept7
A3: =task!RC -> 10300301 | B3: <希德|10013000>嗨，<player>，你来得可真早，不知道在冬天睡懒觉是一件多么美妙的事情吗？ | C3: <player>行了，希德，今天可是轮到我们执勤巡逻，我可不想被队长责罚。这样吧，我们分头巡视，我负责雪山脚下那片区域。 | D3: <希德|10013000>没问题，你是老大你说了算。
A4: =task!RC -> 10300302
A5: =task!RC -> 10300303
A6: =task!RC -> 10300304 | B6: <player>冰霜食人魔？！不好，希德有危险！
A7: =task!RC -> 10300305 | B7: <player>希德，你没事吧？ | C7: <希德|10013001>我没事，小伤而已，这些凶残的怪物居然离开了雪山，你快去通知巴尔大叔，村庄可能有危险！
A8: =task!RC -> 10300306 | B8: <player>巴尔大叔，我们遇到了雪地食人魔！ | C8: <巴尔大叔|10013002>糟了，可能要出大事，我先带人去查探一下，你去通知村长让村庄做好防备。
A9: =task!RC -> 10300307 | B9: <player>村长，我和希德巡查时发现雪山附近的怪物充满了攻击性，巴尔大叔让我来通知你，冰霜食人魔可能将要袭击村庄。 | C9: <村长|10013004>嗯？难道说……唉，这也许只是开始……走吧，跟我去祭坛那边。
A10: =task!RC -> 10300308
A11: =task!RC -> 10300309 | B11: <村长|10013005>刚刚试图破坏祭坛的应该是魔族,看来魔族又要入侵了，必须使用祭坛召唤援手了。 | C11: <player>好的，我立刻就去。
A12: =task!RC -> 10300310 | B12: <村长|10013005>援军应该很快就会到，接下来还要敲响警钟，通知村民们集合。 | C12: <player>没问题，交给我了。
A13: =task!RC -> 10300311 | B13: <村长|10013006>好了，村民们已经做好准备了，你现在去村口探查一下，如果发现有异常状况就立刻回来，注意安全，不要恋战。 | C13: <player>放心吧，我会保护好村庄的！
A14: =task!RC -> 10300312 | B14: <player>铁匠比尔叔叔？你怎么样，发生什么事了？伤的重不重？ | C14: <受伤的村民|10013009>我去雪岩山挖铁矿，却突然被袭击了，村外有好多突然出现的怪物！ | D14: <player>魔族这么快就出现了？！你先去找村长跟其他村民集合，我去看看！ | E14: <受伤的村民|10013009>哎，等等，小家伙，那群怪物凶残的很，你这身轻装出去可是太危险了，哎，叔叔我也没别的本事，不过对这装备强化倒是略懂一些，你把身上的装备强化一番再去吧。
A15: =task!RC -> 10300313
A16: =task!RC -> 10300314
A17: =task!RC -> 10300315 | B17: <黑袍人|10013008>该死的，你居然是魔纹者！怪不得我的分身都不是你的对手。可惜，没落的魔纹者最终依然要湮灭在历史的尘埃中…… | C17: <player>难道这就是村长说的魔纹者？我感受到了强大的力量！ | D17: <黑袍人|10013008>桀桀桀……是吗？或许，你更应该关注一下村子里的情况，看看我的传奇禁忌魔法吧，黑暗之门已经构建完成，我族大军将源源不断的降临此处！ | E17: <player>什么？！
A18: =task!RC -> 10300316
A19: =task!RC -> 10300317 | B19: <巴尔大叔|10013003><player>，你回来了！村里出现黑暗传送门，召唤出大量的魔怪，护卫队已经激战多时了。 | C19: <player>情况如此糟糕了么？ | D19: <巴尔大叔|10013003>村长被围困了，快去消灭围困村长的唤魔师并摧毁黑暗传送门，阻止魔族继续通过传送门入侵村庄。 | E19: <player>村长被困？！好的，我立刻就去！
A20: =task!RC -> 10300318
A21: =task!RC -> 10300319 | B21: <村长|10013007>孩子，你还活着，太好了！咳咳咳…… | C21: <player>村长，你没事吧？到底发生了什么？什么是魔纹者？ | D21: <村长|10013007>情势紧急，我们长话短说。上古魔神大战并不是传说，我们都是魔纹者的后裔，拥有极其强大的潜力，魔族因为惧怕所以要消灭我们。 | E21: <player>魔纹者…… 也许就是刚刚那股神奇的力量？ | F21: <村长|10013007>现在不是说这个的时候，你尽快去圣树那边接应援军，这是我们最后的希望了。
A22: =task!RC -> 10300320
A23: =task!RC -> 10300321 | B23: <player>你们就是村长说的援军吗？ | C23: <英勇斗士|10013010>是的，我们都来自帝国雷霆军。 | D23: <毁灭魔导|10013012>我们接到求援信号，匆忙赶来，现在情况如何？ | E23: <猎魔神射|10013011>长话短说，后面食人花妖紧追不舍，我们先解决这些怪物再说吧。
A24: =task!RC -> 10300322 | B24: <毁灭魔导|10013016>没想到这些魔怪已经入侵到这里了。 | C24: <英勇斗士|10013014>看现在外围的情况，恐怕情况比我们想象的更糟糕。 | D24: <player>村子已经被魔族毁了，大家需要你的救援，村子就在南面，你们赶紧过去吧，我就不回去了，我要去消灭这些魔物！ | E24: <猎魔神射|10013015>嗯，你是一个觉醒的魔纹者，应该没问题，拿上这个魔气追踪仪，或许对你有所帮助！
A25: =task!RC -> 10300323
A26: =task!RC -> 10300324
A27: =task!RC -> 10300325 | B27: <player>这里仿佛是一个独立的破碎空间，嗯？前面好像有动静！
A28: =task!RC -> 10300326
A29: =task!RC -> 10300327 | B29: <player>嗯？这虚空之桥竟然会自动复原，难道是魔法驱动的半位面？
A30: =task!RC -> 10300328 | B30: <player>难道是传说中恐怖的魔眼？
A31: =task!RC -> 10300329 | B31: <上古魔纹战魂|10013030>等待了数千年后终于又见到了魔纹者！ | C31: <player>前辈也是魔纹者？ | D31: <上古魔纹战魂|10013030>我是上古魔纹战将残留下的战魂，这个地方是第二次神魔大战崩碎的漂浮大陆之一，被魔族的虚空魔龙占据数千年，此刻它正在后方疗伤，你该趁机将其击杀！ | E31: <player>多谢前辈指引！
A32: =task!RC -> 10300330
A33: =task!RC -> 10300331
A34: =task!RC -> 10300332
A35: =task!RC -> 10300333
A36: =task!RC -> 10300334
A37: =task!RC -> 10300335 | B37: <player>桥断了？退路已绝，看来必须击败神秘黑袍人了！
A38: =task!RC -> 10300336
A39: =task!RC -> 10300337 | B39: <player>你们也来了这里？ | C39: <猎魔神射|10013018>我们去了村庄，受伤的村长已经带领村民们离开前往另一个隐居地点。 | D39: <player>那我该怎么找到他们？ | E39: <猎魔神射|10013018>他说是时候让魔纹者走出隐居地了，这是村长托我带给你的信物，他让你带着这个信物前往帝国圣光城微风议长寻求帮助。
A40: =task!RC -> 10300338 | B40: <player>嗯？这里怎么有股奇怪的气味？不好！是迅影龙！
A41: =task!RC -> 10300339 | B41: <player>前面那些是什么人？嗯？这些神秘人浑身透着邪恶的气息，必须先阻止他们！
A42: =task!RC -> 10300340 | B42: <player>村民所说就是在此处遭到袭击的，怎么不见异常？嗯？前面有强烈的邪恶的魔气波动气息！
A43: =task!RC -> 10300341 | B43: <player>村口出现这么多小恶魔，不好！村子里肯定情况更糟！
A44: =task!RC -> 10300342 | B44: <player>前面这些温顺的精灵龙扎堆出现，看起来非常狂躁，难道也被魔化了？！
A45: 10300343 | B45: <player>哼！派些爪牙就想阻挡我，痴心妄想！ | C45: <黑袍人|10013031>上古魔纹战将残魂的出现的确出乎我的意料，不过既然你执意找死，那么我就成全你，让你看看我的最终形态！
A46: 10300344 | B46: <player>这里一向都是哥布林的居住地，前面这些哥布林怎么满脸戾气，难道也被魔化了？
A47: 10300345 | B47: <哥布林村长|10013022>别紧张，年轻人。我是此处哥布林村庄的村长。 | C47: <player>这里的哥布林都被魔化了，你竟然没事？ | D47: <哥布林村长|10013022>哎，我外出访友刚归来，也是才发现村民都已魔化。刚才经过迷雾冰原的时候发觉那里魔气汹涌，里面恐怕暗藏魔物啊。 | E47: <player>（心里嘀咕：魔气汹涌？难道黑袍人逃到那里去了？）谢谢，你赶紧离开吧，这里不安全了，我继续追查。
A48: 10300346 | B48: <player>村长说过这处迷雾冰原异常险恶，看来要格外小心才是，那是什么？怎么会有这么多吸血蝙蝠？！
A49: 10300347 | B49: <player>此处魔物聚集，看来黑袍人定在此处，该使用魔气追踪仪了。
A50: 10300351 | B50: <player>这里就是帝国首都圣光城？果然恢弘大气！咦？前面有守卫，正好向他们打听打听！
A51: 10300352
A52: 10300353 | B52: <player>请问…… | C52: <兵痞右|10013040>站住！不知道进城的规矩嘛？ | D52: <兵痞左|10013041>瞧你身上的破烂装备，哪个乡下来的土鳖！我怀疑你是魔族派来的奸细，乖乖束手就擒吧！ | E52: <player>拔剑吧！这种侮辱只能用鲜血来洗刷！
A53: 10300354 | B53: <兵痞右|10013040>哼！年轻人！你惹大祸了，等着，有你好看！ | C53: <兵痞左|10013041>就是，得罪了我们帝国最精锐的坚岩军团，你将寸步难行！ | D53: <猎魔神射|10013042>住手！ | E53: <player>这是什么情况？难道帝国军队中的士兵都是这种素质吗，可以随意刁难羞辱一个入城武者？ | F53: <猎魔神射|10013042>现在帝国内部格局混乱，军方也派系争斗不休，并不是所有的帝国士兵都这么无理，以后你会明白的。 | G53: <player>…… | H53: <猎魔神射|10013042>小家伙，你刚来到圣光城就得罪了最强势的坚岩军团，我建议你去找登记官卡尔登记一下，获得一个合法的身份，或许这对你会有帮助。
A54: 10300355 | B54: <登记官卡尔|10013043>年轻人，你所来何事啊？ | C54: <player>您好，我是来自神佑之地的<player>，第一次来到圣光城，麻烦您帮我做一下入城登记。 | D54: <登记官卡尔|10013043>你不就是刚刚跟城门守卫起冲突的小家伙么...咦？你脖子上的项链吊坠看起来相当古老，在吊坠下方还残留着淡淡的魔力...嗯？这竟然是千年前荆棘花帝国议会的标志！ | E54: <player>我此行就是遵照长辈的要求前来求见微风议长大人的。 | F54: <登记官卡尔|10013043>幸运的小家伙，有议长大人出面，相信坚岩军团那点小麻烦根本不算什么，好了，登记完成了。 | G54: <player>好的，非常感谢。 | H54: <登记官卡尔|10013043>别着急，小家伙。我看你身上这几件装备都很粗糙，门口的铁匠罗德可是圣光城里出了名的装备大师，你去找他让他帮你看看能不能将你的装备改造一番。
A55: 10300356
A56: 10300357 | B56: <player>您好，将军阁下，请问…… | C56: <侍卫长|10013044>哼！刚才就是你在城门口撒野，我的下属岂是你有资格教训的，现在你要为你的行为付出代价！ | D56: <player>这……我想将军阁下对您手下的管教也确实让我无法恭维…… | E56: <侍卫长|10013044>哼！从你的战斗反馈来看，也是个魔纹者，一个被历史抛弃的血脉后裔，也敢在帝国内放肆！你们俩上，让他见识一下什么是帝国精锐！
A57: 10300358 | B57: <player>这就是号称帝国最精锐的坚岩军团？不堪一击！ | C57: <侍卫长|10013044>年轻人，太嚣张可是会寸步难行的，你这是在挑衅坚岩军团吗？ | D57: <微风剑士|10013047>快住手，在议会大厦门口斗殴，成何体统！（转头面向主角）阁下为何事而来？ | E57: <player>您好，我来自神佑之地，此行奉长辈的嘱托前来拜见议长大人。 | F57: <侍卫长|10013044>哼！议长大人岂是你想见就能见的…… | G57: <player>事情重要，我希望能够面见议长大人并亲自告诉他。 | H57: <微风剑士|10013047>好吧，那你随我来。
A58: 10300359 | B58: <player>议长阁下，不知道您是否认识这个物件？ | C58: <微风议长|10013048>魔纹吊坠？你来自神佑之地？老村长他？ | D58: <player>是的，村庄遭到魔族的突袭毁于一旦，村长受伤了，不过无大碍，他让我带上这个项链来圣光城找一个故人，说他会帮助我。 | E58: <微风议长|10013048>魔纹者是神魔大战中的关键角色。因为帝国势力格局的原因...嗯，这个说来话长，魔族再次入侵，你可以找烈焰将军，他是帝国军方唯一对魔纹者持中立态度的实权者，去吧孩子，他会给你足够帮助的。 | F58: <player>非常感谢，我不会让您失望的！
A59: 10300360 | B59: <烈焰将军|10013049>你就是议长阁下推荐的魔纹者吧？作为一支隐秘的抗魔中军，雷霆军团是所有魔纹者的家，欢迎你加入！ | C59: <player>非常感谢！ | D59: <烈焰将军|10013049>身为魔纹者，就不可不知道魔界远征，准确的说这是一个诸神陨落前创造的一个破碎镜像虚空，用来磨练、验证魔纹者战力，作为一个刚觉醒的魔纹者，正适合你。 | E59: <player>（心里嘀咕：还有这样神奇的事物？），诸神的力量真是让人惊叹，那就麻烦将军将我送进去吧。 | F59: <烈焰将军|10013049>嗯，我现在送你进去，出来后你就去找我的副官，他会详细记录每个魔纹者的战斗数据，这对你们以后对抗魔族也有巨大的帮助。
A60: 10300361 | B60: <烈焰将军|10013049>你的成长快的超出我的预料，不错！刚得到情报，微风平原的当地巡逻士兵遭到魔鹰的围攻，你先前往微风平原救援被困的士兵，援军稍后便到，这也是对你的一种考验。 | C60: <player>您的赏识是我的荣耀，这个任务交给我吧，我不会让阁下失望的。
A61: 10300362 | B61: <player>我奉烈焰将军阁下的命令前来调查微风平原，现在情况如何？ | C61: <巡逻士兵|10013050>非常感谢，我是本地驻军的巡逻士兵，中央山脉出现由鼠王带领的大量裂爪巨鼠，它们正试图破坏平原地基。 | D61: <player>这件事情交给我吧，你伤的不轻，先回军部汇报这里的情况，我继续调查看看。
A62: 10300363
A63: 10300364 | B63: <player>你没事吧？ | C63: <大魔导师|10013051>裂爪鼠王的爪牙带有剧烈的暗属性毒性，它会持续腐蚀我的魔力，你可以帮我到中央山脉附近采些蓝魂草吗？只有蓝魂草的汁才能清除这种毒素。 | D63: <player>好的，您稍等。
A64: 10300365 | B64: <player>你要的蓝魂草我已经准备好了。 | C64: <大魔导师|10013051>好的，非常感谢，现在还要麻烦你帮我将蓝魂草的汁液提取出来浇在我的伤口，这样我的毒就能解决了。
A65: 10300366 | B65: <大魔导师|10013051>非常感谢，我奉命前往日暮森林给精灵预警，却发现传送门被魔族结界封印，我已使用魔力水晶在结界三个方位布置了法阵，现在我还需要3颗具有破魔效果的狮虎兽牙用来加强我的法阵。 | C65: <player>你会得到3颗狮虎兽牙的！ | D65: <大魔导师|10013051>嗯，我当然相信一个觉醒了血脉力量的魔纹者。
A66: 10300367 | B66: <大魔导师|10013052>兽牙收集好了？干的漂亮！不过听说其他位面又通过位面裂隙侵入本位面了，你速速回圣光城找风暴战区传送官进入风暴战区拦截入侵者！ | C66: <player>那精灵族那边？ | D66: <大魔导师|10013052>无妨，结界封印的魔力还很强，我正好需要时间固化之前布下的法阵。 | E66: <player>这样，那我先去迎击入侵者，击退它们后立刻回来助你。
A67: 10300368 | B67: <大魔导师|10013052>年轻人，这次其他位面的裂隙入侵，听闻你的表现非常优异，后生可畏啊！现在将兽牙分别插在结界周围3个方向，我随后开始施法。 | C67: <player>大师你过奖了，看来艾丁大陆的威胁不仅来自魔族，也来自其他位面啊。 | D67: <大魔导师|10013052>这也是诸神陨落前故意为之的，目的就是通过竞争提升各位面种族的战斗力，现在只要将兽牙分别插在结界周围3个方位，我布下的法阵就会显现出来。
A68: 10300369
A69: 10300370
A70: 10300371 | B70: <player>大师，我已将传送阵布置完毕。 | C70: <大魔导师|10013052>很好！接下来被隐藏的结界封印将会出现，那是魔法力量被削弱后的表现，这时就需要你全力攻击并摧毁它！ | D70: <player>没问题，交给我了！
A71: 10300372
A72: 10300373 | B72: <player>魔族此次声东击西，真正目的应该是想在帝国未察觉的情况下消灭精灵族。 | C72: <大魔导师|10013053>嗯，接下来交给我吧，不过我建议你尽快加入一个军团，魔族入侵在即，落单的魔纹者总是更容易受到袭击。 | D72: <player>好的，非常感谢您的忠告。
A73: 10300374 | B73: <烈焰将军|10013049>你的成长快的超出我的预料，不错！刚得到情报，微风平原的当地巡逻士兵遭到魔鹰的围攻，你先前往微风平原救援被困的士兵，援军稍后便到，这也是对你的一种考验。
A74: 10300375 | B74: <大魔导师|10013052>年轻人，这次其他位面的裂隙入侵，听闻你的表现非常优异，后生可畏啊！现在将兽牙分别插在结界周围3个方向，我随后开始施法。
A75: 10300376 | B75: <风暴战区传送官|10012395>年轻人，你的速度太慢了，在你之前已经有大批魔纹者进入风暴战区抵抗入侵者了，准备好，我现在送你进入风暴战区！
A76: 10300377 | B76: <player>您好，老卡尔说您是这座城里最出名的装备大师，我想…… | C76: <铁匠罗德|10010051>嘿！这老头，又在给我找事做了。来，小家伙，让我看看你的装备……嗯，都是大路货色，没有强化价值，不过倒是可以先进行洗练一番，略微增加一点威力，你看好了，我给你演示一遍洗炼方法。 | D76: <player>非常感谢！ | E76: <铁匠罗德|10010051>不用谢我，我也不亲自动手，刚刚给你演示了如何洗炼装备，下次就自己动手吧，想来你也还有事情要办，我就不留你了，慢走。 | F76: <player>额…再次表示诚挚的感谢。
A77: 10300381 | B77: <大魔导师|10013052>不错，你的成长很快，现在我相信你已经有能力独自前往日暮森林了，快去把情报送给我们的盟友精灵族吧。
A78: 10300382 | B78: <大魔导师|10013052>不错，你的成长很快，现在我相信你已经有能力独自前往日暮森林了，快去把情报送给我们的盟友精灵族吧。
A79: 10300383 | B79: <奥莉拉|10013061>什么人！人类？你来日暮森林何事？ | C79: <player>微风平原传送门的结界封印已经被我打破，魔族的真正阴谋是要瞒过人类先毁灭精灵族，我是来此地向精灵族报信的，我看此处森林意志诡异，难道说… | D79: <奥莉拉|10013061>最近森林中出现一股带有邪恶气息的扭曲森林意志，不过我看你级别尚低，装备也不怎么样，日暮森林处处危险，我听说魔纹者可以参加领主试炼获取装备，你不妨试试，然后提升自身等级再来。 | E79: <player>感谢您的忠告，优雅的精灵女士。
A80: 10300384 | B80: <奥莉拉|10013061>人类魔纹者果然名不虚传，这么快就成长到这个地步，接下来你可以直接去找我族大祭司了解日暮森林的情况了。
A81: 10300385 | B81: <奥莉拉|10013061>人类魔纹者果然名不虚传，这么快就成长到这个地步，接下来你可以直接去找我族大祭司了解日暮森林的情况了。
A82: 10300386 | B82: <player>尊敬的精灵大祭司，作为尊贵的精灵族不变的盟友，魔族已经入侵，且有计划瞒过人类先消灭精灵族，我特意前来报信。 | C82: <大祭司|10013062>非常感谢你的及时报信，魔族入侵在即，我发觉日暮森林也有不少魔纹者出没，都在努力战斗执行任务提高自身战力，你的战力不错，不过还可以提高，不如学学其他同辈？ | D82: <player>嗯，非常感谢大祭司的提醒。
A83: 10300387 | B83: <大祭司|10013062>哎，当年因为有了魔纹者，艾丁大陆赢得了第二次神魔大战，看到你今天的表现，我才真正感受到魔纹者当年的辉煌啊！ | C83: <player>大祭司，您过奖了，复现先辈的荣光是我辈的使命！ | D83: <大祭司|10013062>呵呵，不错、不错。对了，神佑之地哥布林草原的哥布林村长日前刚抵达日暮森林，你们来自同一个地方，何不去见见他？
A84: 10300388 | B84: <大祭司|10013062>哎，当年因为有了魔纹者，艾丁大陆赢得了第二次神魔大战，看到你今天的表现，我才真正感受到魔纹者当年的辉煌啊！ | C84: <player>大祭司，您过奖了，复现先辈的荣光是我辈的使命！ | D84: <大祭司|10013062>呵呵，不错、不错。对了，神佑之地哥布林草原的哥布林村长日前刚抵达日暮森林，你们来自同一个地方，何不去见见他？
A85: 10300389 | B85: <player>哥布林村长，你果然在这里。 | C85: <哥布林村长|10013063>是你啊，年轻人，嗯...根据精灵大祭司的推断，现在世界树的意志遭到了严重的削弱，造成这种情况的唯一原因就是森林中应该出现了第二棵世界树，还是黑暗精灵的黑暗世界树。 | D85: <player>黑暗精灵？黑暗世界树？ | E85: <哥布林村长|10013063>嗯，这个说来话长，不过我看你身上的装备都还没有进行升星，升星可以大幅度提高装备的属性，自身级别也太低，年轻人，还要多多努力啊！
A86: 10300390 | B86: <哥布林村长|10013063>后生可畏啊，现在你可以去找精灵族的实际掌权者，也就是精灵公主，她那里应该掌握着现在日暮森林具体情况。
A87: 10300391 | B87: <哥布林村长|10013063>后生可畏啊，现在你可以去找精灵族的实际掌权者，也就是精灵公主，她那里应该掌握着现在日暮森林具体情况。
A88: 10300392 | B88: <player>尊敬的精灵公主殿下，我是来自人类帝国的魔纹者，特意前来向您通报关于魔族入侵的信息。 | C88: <精灵公主|10013065>勇士您辛苦了，现在日暮森林乱象频频，想来与魔族的渗透不无关系。 | D88: <player>的确如此，我从微风平原得到的情报正是魔族计划瞒过人族先消灭精灵族…… | E88: <精灵公主|10013065>嗯，看来情况确实比想象的严重，不过我看勇士身上的装备都还未镶嵌任何宝石，等级也稍显不足。宝石不仅美丽，还能给装备提供不俗的属性加成，你还不试试？
A89: 10300393 | B89: <精灵公主|10013065>魔纹者一如传说中的那般可怕，您的成长速度出乎我的意料。对了，日前收到人族帝国传来的消息，帝国前线巨岩沙海发生兽人暴乱，军方正在召集所有魔纹者前往支援。 | C89: <player>能得到公主殿下的称赞是我的荣耀。 | D89: <精灵公主|10013065>对了，日前收到人族帝国传来的消息，帝国前线巨岩沙海发生兽人暴乱，军方正在召集所有魔纹者前往支援。 | E89: <player>什么？！那我必须立刻动身前去增援！ | F89: <精灵公主|10013065>不忙，我的侍女林奈手中有详细的情报，你先去找她吧，她会告诉你详细情况的。
A90: 10300394 | B90: <精灵公主|10013065>魔纹者一如传说中的那般可怕，您的成长速度出乎我的意料。对了，日前收到人族帝国传来的消息，帝国前线巨岩沙海发生兽人暴乱，军方正在召集所有魔纹者前往支援。 | C90: <player>能得到公主殿下的称赞是我的荣耀。 | D90: <精灵公主|10013065>对了，日前收到人族帝国传来的消息，帝国前线巨岩沙海发生兽人暴乱，军方正在召集所有魔纹者前往支援。 | E90: <player>什么？！那我必须立刻动身前去增援！ | F90: <精灵公主|10013065>不忙，我的侍女林奈手中有详细的情报，你先去找她吧，她会告诉你详细情况的。
A91: 10300395 | B91: <侍女林奈|10013064>这份就是人族帝国传来的召集令。不过前线异常凶险，你身为魔纹者，应当给自身镶嵌合适的战魂再上前线或许胜算能多不少。

Sheet: rewardCondition
A1: 任务编号 | B1: 条件类型 | C1: 需找的NPC | D1: NPC编号 | E1: NPC数量 | F1: 对应目标辅助列 | G1: 对应目标
A2: sid | B2: type | D2: v1 | E2: v2 | G2: demand
A3: 10304001 | B3: 击杀npc | C3: 癫狂树灵 | D3: [10010600,10015800] | E3: 45 | F3: 击杀<癫狂树灵|arg=10010600> | G3: 击杀<癫狂树灵|arg=10010600>
A4: 10304002 | B4: 击杀npc | C4: 癫狂树灵 | D4: [10010600,10015800] | E4: 50 | F4: 击杀<癫狂树灵|arg=10010600> | G4: 击杀<癫狂树灵|arg=10010600>
A5: 10304003 | B5: 击杀npc | C5: 癫狂树灵 | D5: [10010600,10015800] | E5: 55 | F5: 击杀<癫狂树灵|arg=10010600> | G5: 击杀<癫狂树灵|arg=10010600>
A6: 10304004 | B6: 击杀npc | C6: 癫狂树灵 | D6: [10010600,10015800] | E6: 60 | F6: 击杀<癫狂树灵|arg=10010600> | G6: 击杀<癫狂树灵|arg=10010600>
A7: 10304005 | B7: 击杀npc | C7: 癫狂树灵 | D7: [10010600,10015800] | E7: 65 | F7: 击杀<癫狂树灵|arg=10010600> | G7: 击杀<癫狂树灵|arg=10010600>
A8: 10304006 | B8: 击杀npc | C8: 堕落精灵 | D8: [10010601,10015801] | E8: 45 | F8: 击杀<堕落精灵|arg=10010601> | G8: 击杀<堕落精灵|arg=10010601>
A9: 10304007 | B9: 击杀npc | C9: 堕落精灵 | D9: [10010601,10015801] | E9: 50 | F9: 击杀<堕落精灵|arg=10010601> | G9: 击杀<堕落精灵|arg=10010601>
A10: 10304008 | B10: 击杀npc | C10: 堕落精灵 | D10: [10010601,10015801] | E10: 55 | F10: 击杀<堕落精灵|arg=10010601> | G10: 击杀<堕落精灵|arg=10010601>
A11: 10304009 | B11: 击杀npc | C11: 堕落精灵 | D11: [10010601,10015801] | E11: 60 | F11: 击杀<堕落精灵|arg=10010601> | G11: 击杀<堕落精灵|arg=10010601>
A12: 10304010 | B12: 击杀npc | C12: 堕落精灵 | D12: [10010601,10015801] | E12: 65 | F12: 击杀<堕落精灵|arg=10010601> | G12: 击杀<堕落精灵|arg=10010601>
A13: 10304011 | B13: 击杀npc | C13: 魅惑魔女 | D13: [10010603,10015802] | E13: 45 | F13: 击杀<魅惑魔女|arg=10010603> | G13: 击杀<魅惑魔女|arg=10010603>
A14: 10304012 | B14: 击杀npc | C14: 魅惑魔女 | D14: [10010603,10015802] | E14: 50 | F14: 击杀<魅惑魔女|arg=10010603> | G14: 击杀<魅惑魔女|arg=10010603>
A15: 10304013 | B15: 击杀npc | C15: 魅惑魔女 | D15: [10010603,10015802] | E15: 55 | F15: 击杀<魅惑魔女|arg=10010603> | G15: 击杀<魅惑魔女|arg=10010603>
A16: 10304014 | B16: 击杀npc | C16: 魅惑魔女 | D16: [10010603,10015802] | E16: 60 | F16: 击杀<魅惑魔女|arg=10010603> | G16: 击杀<魅惑魔女|arg=10010603>
A17: 10304015 | B17: 击杀npc | C17: 魅惑魔女 | D17: [10010603,10015802] | E17: 65 | F17: 击杀<魅惑魔女|arg=10010603> | G17: 击杀<魅惑魔女|arg=10010603>
A18: 10304016 | B18: 击杀npc | C18: 枯树妖 | D18: [10010606,10015803] | E18: 45 | F18: 击杀<枯树妖|arg=10010606> | G18: 击杀<枯树妖|arg=10010606>
A19: 10304017 | B19: 击杀npc | C19: 枯树妖 | D19: [10010606,10015803] | E19: 50 | F19: 击杀<枯树妖|arg=10010606> | G19: 击杀<枯树妖|arg=10010606>
A20: 10304018 | B20: 击杀npc | C20: 枯树妖 | D20: [10010606,10015803] | E20: 55 | F20: 击杀<枯树妖|arg=10010606> | G20: 击杀<枯树妖|arg=10010606>
A21: 10304019 | B21: 击杀npc | C21: 枯树妖 | D21: [10010606,10015803] | E21: 60 | F21: 击杀<枯树妖|arg=10010606> | G21: 击杀<枯树妖|arg=10010606>
A22: 10304020 | B22: 击杀npc | C22: 枯树妖 | D22: [10010606,10015803] | E22: 65 | F22: 击杀<枯树妖|arg=10010606> | G22: 击杀<枯树妖|arg=10010606>
A23: 10304021 | B23: 击杀npc | C23: 林地妖精 | D23: [10010608,10015804] | E23: 45 | F23: 击杀<林地妖精|arg=10010608> | G23: 击杀<林地妖精|arg=10010608>
A24: 10304022 | B24: 击杀npc | C24: 林地妖精 | D24: [10010608,10015804] | E24: 50 | F24: 击杀<林地妖精|arg=10010608> | G24: 击杀<林地妖精|arg=10010608>
A25: 10304023 | B25: 击杀npc | C25: 林地妖精 | D25: [10010608,10015804] | E25: 55 | F25: 击杀<林地妖精|arg=10010608> | G25: 击杀<林地妖精|arg=10010608>
A26: 10304024 | B26: 击杀npc | C26: 林地妖精 | D26: [10010608,10015804] | E26: 60 | F26: 击杀<林地妖精|arg=10010608> | G26: 击杀<林地妖精|arg=10010608>
A27: 10304025 | B27: 击杀npc | C27: 林地妖精 | D27: [10010608,10015804] | E27: 65 | F27: 击杀<林地妖精|arg=10010608> | G27: 击杀<林地妖精|arg=10010608>
A28: 10304026 | B28: 击杀npc | C28: 黑龙 | D28: [10010803] | E28: 65 | F28: 击杀<黑龙|arg=10010803> | G28: 击杀<黑龙|arg=10010803>
A29: 10304027 | B29: 击杀npc | C29: 黑龙 | D29: [10010803] | E29: 70 | F29: 击杀<黑龙|arg=10010803> | G29: 击杀<黑龙|arg=10010803>
A30: 10304028 | B30: 击杀npc | C30: 黑龙 | D30: [10010803] | E30: 75 | F30: 击杀<黑龙|arg=10010803> | G30: 击杀<黑龙|arg=10010803>
A31: 10304029 | B31: 击杀npc | C31: 黑龙 | D31: [10010803] | E31: 80 | F31: 击杀<黑龙|arg=10010803> | G31: 击杀<黑龙|arg=10010803>
A32: 10304030 | B32: 击杀npc | C32: 黑龙 | D32: [10010803] | E32: 85 | F32: 击杀<黑龙|arg=10010803> | G32: 击杀<黑龙|arg=10010803>
A33: 10304031 | B33: 击杀npc | C33: 蜥蜴人仆从 | D33: [10010806] | E33: 65 | F33: 击杀<蜥蜴人仆从|arg=10010806> | G33: 击杀<蜥蜴人仆从|arg=10010806>
A34: 10304032 | B34: 击杀npc | C34: 蜥蜴人仆从 | D34: [10010806] | E34: 70 | F34: 击杀<蜥蜴人仆从|arg=10010806> | G34: 击杀<蜥蜴人仆从|arg=10010806>
A35: 10304033 | B35: 击杀npc | C35: 蜥蜴人仆从 | D35: [10010806] | E35: 75 | F35: 击杀<蜥蜴人仆从|arg=10010806> | G35: 击杀<蜥蜴人仆从|arg=10010806>
A36: 10304034 | B36: 击杀npc | C36: 蜥蜴人仆从 | D36: [10010806] | E36: 80 | F36: 击杀<蜥蜴人仆从|arg=10010806> | G36: 击杀<蜥蜴人仆从|arg=10010806>
A37: 10304035 | B37: 击杀npc | C37: 蜥蜴人仆从 | D37: [10010806] | E37: 85 | F37: 击杀<蜥蜴人仆从|arg=10010806> | G37: 击杀<蜥蜴人仆从|arg=10010806>
A38: 10304036 | B38: 击杀npc | C38: 黑岩红蝎 | D38: [10011000,10015200] | E38: 55 | F38: 击杀<黑岩红蝎|arg=10011000> | G38: 击杀<黑岩红蝎|arg=10011000>
A39: 10304037 | B39: 击杀npc | C39: 黑岩红蝎 | D39: [10011000,10015200] | E39: 60 | F39: 击杀<黑岩红蝎|arg=10011000> | G39: 击杀<黑岩红蝎|arg=10011000>
A40: 10304038 | B40: 击杀npc | C40: 黑岩红蝎 | D40: [10011000,10015200] | E40: 65 | F40: 击杀<黑岩红蝎|arg=10011000> | G40: 击杀<黑岩红蝎|arg=10011000>
A41: 10304039 | B41: 击杀npc | C41: 黑岩红蝎 | D41: [10011000,10015200] | E41: 70 | F41: 击杀<黑岩红蝎|arg=10011000> | G41: 击杀<黑岩红蝎|arg=10011000>
A42: 10304040 | B42: 击杀npc | C42: 黑岩红蝎 | D42: [10011000,10015200] | E42: 75 | F42: 击杀<黑岩红蝎|arg=10011000> | G42: 击杀<黑岩红蝎|arg=10011000>
A43: 10304041 | B43: 击杀npc | C43: 嗜血魔狼 | D43: [10011001,10015201] | E43: 55 | F43: 击杀<嗜血魔狼|arg=10011001> | G43: 击杀<嗜血魔狼|arg=10011001>
A44: 10304042 | B44: 击杀npc | C44: 嗜血魔狼 | D44: [10011001,10015201] | E44: 60 | F44: 击杀<嗜血魔狼|arg=10011001> | G44: 击杀<嗜血魔狼|arg=10011001>
A45: 10304043 | B45: 击杀npc | C45: 嗜血魔狼 | D45: [10011001,10015201] | E45: 65 | F45: 击杀<嗜血魔狼|arg=10011001> | G45: 击杀<嗜血魔狼|arg=10011001>
A46: 10304044 | B46: 击杀npc | C46: 嗜血魔狼 | D46: [10011001,10015201] | E46: 70 | F46: 击杀<嗜血魔狼|arg=10011001> | G46: 击杀<嗜血魔狼|arg=10011001>
A47: 10304045 | B47: 击杀npc | C47: 嗜血魔狼 | D47: [10011001,10015201] | E47: 75 | F47: 击杀<嗜血魔狼|arg=10011001> | G47: 击杀<嗜血魔狼|arg=10011001>
A48: 10304046 | B48: 击杀npc | C48: 沙尘魔像 | D48: [10011002,10015202] | E48: 55 | F48: 击杀<沙尘魔像|arg=10011002> | G48: 击杀<沙尘魔像|arg=10011002>
A49: 10304047 | B49: 击杀npc | C49: 沙尘魔像 | D49: [10011002,10015202] | E49: 60 | F49: 击杀<沙尘魔像|arg=10011002> | G49: 击杀<沙尘魔像|arg=10011002>
A50: 10304048 | B50: 击杀npc | C50: 沙尘魔像 | D50: [10011002,10015202] | E50: 65 | F50: 击杀<沙尘魔像|arg=10011002> | G50: 击杀<沙尘魔像|arg=10011002>
A51: 10304049 | B51: 击杀npc | C51: 沙尘魔像 | D51: [10011002,10015202] | E51: 70 | F51: 击杀<沙尘魔像|arg=10011002> | G51: 击杀<沙尘魔像|arg=10011002>
A52: 10304050 | B52: 击杀npc | C52: 沙尘魔像 | D52: [10011002,10015202] | E52: 75 | F52: 击杀<沙尘魔像|arg=10011002> | G52: 击杀<沙尘魔像|arg=10011002>
A53: 10304051 | B53: 击杀npc | C53: 兽人屠戮者 | D53: [10011003,10015203] | E53: 55 | F53: 击杀<兽人屠戮者|arg=10011003> | G53: 击杀<兽人屠戮者|arg=10011003>
A54: 10304052 | B54: 击杀npc | C54: 兽人屠戮者 | D54: [10011003,10015203] | E54: 60 | F54: 击杀<兽人屠戮者|arg=10011003> | G54: 击杀<兽人屠戮者|arg=10011003>
A55: 10304053 | B55: 击杀npc | C55: 兽人屠戮者 | D55: [10011003,10015203] | E55: 65 | F55: 击杀<兽人屠戮者|arg=10011003> | G55: 击杀<兽人屠戮者|arg=10011003>
A56: 10304054 | B56: 击杀npc | C56: 兽人屠戮者 | D56: [10011003,10015203] | E56: 70 | F56: 击杀<兽人屠戮者|arg=10011003> | G56: 击杀<兽人屠戮者|arg=10011003>
A57: 10304055 | B57: 击杀npc | C57: 兽人屠戮者 | D57: [10011003,10015203] | E57: 75 | F57: 击杀<兽人屠戮者|arg=10011003> | G57: 击杀<兽人屠戮者|arg=10011003>
A58: 10304056 | B58: 击杀npc | C58: 荒岩龙虫 | D58: [10011004,10015204] | E58: 55 | F58: 击杀<荒岩龙虫|arg=10011004> | G58: 击杀<荒岩龙虫|arg=10011004>
A59: 10304057 | B59: 击杀npc | C59: 荒岩龙虫 | D59: [10011004,10015204] | E59: 60 | F59: 击杀<荒岩龙虫|arg=10011004> | G59: 击杀<荒岩龙虫|arg=10011004>
A60: 10304058 | B60: 击杀npc | C60: 荒岩龙虫 | D60: [10011004,10015204] | E60: 65 | F60: 击杀<荒岩龙虫|arg=10011004> | G60: 击杀<荒岩龙虫|arg=10011004>
A61: 10304059 | B61: 击杀npc | C61: 荒岩龙虫 | D61: [10011004,10015204] | E61: 70 | F61: 击杀<荒岩龙虫|arg=10011004> | G61: 击杀<荒岩龙虫|arg=10011004>
A62: 10304060 | B62: 击杀npc | C62: 荒岩龙虫 | D62: [10011004,10015204] | E62: 75 | F62: 击杀<荒岩龙虫|arg=10011004> | G62: 击杀<荒岩龙虫|arg=10011004>
A63: 10304061 | B63: 击杀npc | C63: 紫兰魔鹰 | D63: [10011201] | E63: 45 | F63: 击杀<紫兰魔鹰|arg=10011201> | G63: 击杀<紫兰魔鹰|arg=10011201>
A64: 10304062 | B64: 击杀npc | C64: 紫兰魔鹰 | D64: [10011201] | E64: 50 | F64: 击杀<紫兰魔鹰|arg=10011201> | G64: 击杀<紫兰魔鹰|arg=10011201>
A65: 10304063 | B65: 击杀npc | C65: 紫兰魔鹰 | D65: [10011201] | E65: 55 | F65: 击杀<紫兰魔鹰|arg=10011201> | G65: 击杀<紫兰魔鹰|arg=10011201>
A66: 10304064 | B66: 击杀npc | C66: 紫兰魔鹰 | D66: [10011201] | E66: 60 | F66: 击杀<紫兰魔鹰|arg=10011201> | G66: 击杀<紫兰魔鹰|arg=10011201>
A67: 10304065 | B67: 击杀npc | C67: 紫兰魔鹰 | D67: [10011201] | E67: 65 | F67: 击杀<紫兰魔鹰|arg=10011201> | G67: 击杀<紫兰魔鹰|arg=10011201>
A68: 10304066 | B68: 击杀npc | C68: 平原陆行鸟 | D68: [10011202] | E68: 45 | F68: 击杀<平原陆行鸟|arg=10011202> | G68: 击杀<平原陆行鸟|arg=10011202>
A69: 10304067 | B69: 击杀npc | C69: 平原陆行鸟 | D69: [10011202] | E69: 50 | F69: 击杀<平原陆行鸟|arg=10011202> | G69: 击杀<平原陆行鸟|arg=10011202>
A70: 10304068 | B70: 击杀npc | C70: 平原陆行鸟 | D70: [10011202] | E70: 55 | F70: 击杀<平原陆行鸟|arg=10011202> | G70: 击杀<平原陆行鸟|arg=10011202>
A71: 10304069 | B71: 击杀npc | C71: 平原陆行鸟 | D71: [10011202] | E71: 60 | F71: 击杀<平原陆行鸟|arg=10011202> | G71: 击杀<平原陆行鸟|arg=10011202>
A72: 10304070 | B72: 击杀npc | C72: 平原陆行鸟 | D72: [10011202] | E72: 65 | F72: 击杀<平原陆行鸟|arg=10011202> | G72: 击杀<平原陆行鸟|arg=10011202>
A73: 10304071 | B73: 击杀npc | C73: 裂爪巨鼠 | D73: [10011203] | E73: 45 | F73: 击杀<裂爪巨鼠|arg=10011203> | G73: 击杀<裂爪巨鼠|arg=10011203>
A74: 10304072 | B74: 击杀npc | C74: 裂爪巨鼠 | D74: [10011203] | E74: 50 | F74: 击杀<裂爪巨鼠|arg=10011203> | G74: 击杀<裂爪巨鼠|arg=10011203>
A75: 10304073 | B75: 击杀npc | C75: 裂爪巨鼠 | D75: [10011203] | E75: 55 | F75: 击杀<裂爪巨鼠|arg=10011203> | G75: 击杀<裂爪巨鼠|arg=10011203>
A76: 10304074 | B76: 击杀npc | C76: 裂爪巨鼠 | D76: [10011203] | E76: 60 | F76: 击杀<裂爪巨鼠|arg=10011203> | G76: 击杀<裂爪巨鼠|arg=10011203>
A77: 10304075 | B77: 击杀npc | C77: 裂爪巨鼠 | D77: [10011203] | E77: 65 | F77: 击杀<裂爪巨鼠|arg=10011203> | G77: 击杀<裂爪巨鼠|arg=10011203>
A78: 10304076 | B78: 击杀npc | C78: 狮虎兽 | D78: [10011204] | E78: 45 | F78: 击杀<狮虎兽|arg=10011204> | G78: 击杀<狮虎兽|arg=10011204>
A79: 10304077 | B79: 击杀npc | C79: 狮虎兽 | D79: [10011204] | E79: 50 | F79: 击杀<狮虎兽|arg=10011204> | G79: 击杀<狮虎兽|arg=10011204>
A80: 10304078 | B80: 击杀npc | C80: 狮虎兽 | D80: [10011204] | E80: 55 | F80: 击杀<狮虎兽|arg=10011204> | G80: 击杀<狮虎兽|arg=10011204>
A81: 10304079 | B81: 击杀npc | C81: 狮虎兽 | D81: [10011204] | E81: 60 | F81: 击杀<狮虎兽|arg=10011204> | G81: 击杀<狮虎兽|arg=10011204>
A82: 10304080 | B82: 击杀npc | C82: 狮虎兽 | D82: [10011204] | E82: 65 | F82: 击杀<狮虎兽|arg=10011204> | G82: 击杀<狮虎兽|arg=10011204>
A83: 10304081 | B83: 击杀npc | C83: 劈山兽 | D83: [10011205] | E83: 45 | F83: 击杀<劈山兽|arg=10011205> | G83: 击杀<劈山兽|arg=10011205>
A84: 10304082 | B84: 击杀npc | C84: 劈山兽 | D84: [10011205] | E84: 50 | F84: 击杀<劈山兽|arg=10011205> | G84: 击杀<劈山兽|arg=10011205>
A85: 10304083 | B85: 击杀npc | C85: 劈山兽 | D85: [10011205] | E85: 55 | F85: 击杀<劈山兽|arg=10011205> | G85: 击杀<劈山兽|arg=10011205>
A86: 10304084 | B86: 击杀npc | C86: 劈山兽 | D86: [10011205] | E86: 60 | F86: 击杀<劈山兽|arg=10011205> | G86: 击杀<劈山兽|arg=10011205>
A87: 10304085 | B87: 击杀npc | C87: 劈山兽 | D87: [10011205] | E87: 65 | F87: 击杀<劈山兽|arg=10011205> | G87: 击杀<劈山兽|arg=10011205>
A88: 10304086 | B88: 击杀npc | C88: 骷髅战士 | D88: [10011401,10015400] | E88: 65 | F88: 击杀<骷髅战士|arg=10011401> | G88: 击杀<骷髅战士|arg=10011401>
A89: 10304087 | B89: 击杀npc | C89: 骷髅战士 | D89: [10011401,10015400] | E89: 70 | F89: 击杀<骷髅战士|arg=10011401> | G89: 击杀<骷髅战士|arg=10011401>
A90: 10304088 | B90: 击杀npc | C90: 骷髅战士 | D90: [10011401,10015400] | E90: 75 | F90: 击杀<骷髅战士|arg=10011401> | G90: 击杀<骷髅战士|arg=10011401>
A91: 10304089 | B91: 击杀npc | C91: 骷髅战士 | D91: [10011401,10015400] | E91: 80 | F91: 击杀<骷髅战士|arg=10011401> | G91: 击杀<骷髅战士|arg=10011401>
A92: 10304090 | B92: 击杀npc | C92: 骷髅战士 | D92: [10011401,10015400] | E92: 85 | F92: 击杀<骷髅战士|arg=10011401> | G92: 击杀<骷髅战士|arg=10011401>
A93: 10304091 | B93: 击杀npc | C93: 哀鸣游魂 | D93: [10011402,10015401] | E93: 65 | F93: 击杀<哀鸣游魂|arg=10011402> | G93: 击杀<哀鸣游魂|arg=10011402>
A94: 10304092 | B94: 击杀npc | C94: 哀鸣游魂 | D94: [10011402,10015401] | E94: 70 | F94: 击杀<哀鸣游魂|arg=10011402> | G94: 击杀<哀鸣游魂|arg=10011402>
A95: 10304093 | B95: 击杀npc | C95: 哀鸣游魂 | D95: [10011402,10015401] | E95: 75 | F95: 击杀<哀鸣游魂|arg=10011402> | G95: 击杀<哀鸣游魂|arg=10011402>
A96: 10304094 | B96: 击杀npc | C96: 哀鸣游魂 | D96: [10011402,10015401] | E96: 80 | F96: 击杀<哀鸣游魂|arg=10011402> | G96: 击杀<哀鸣游魂|arg=10011402>
A97: 10304095 | B97: 击杀npc | C97: 哀鸣游魂 | D97: [10011402,10015401] | E97: 85 | F97: 击杀<哀鸣游魂|arg=10011402> | G97: 击杀<哀鸣游魂|arg=10011402>
A98: 10304096 | B98: 击杀npc | C98: 火炎亡者 | D98: [10011403,10015402] | E98: 65 | F98: 击杀<火炎亡者|arg=10011403> | G98: 击杀<火炎亡者|arg=10011403>
A99: 10304097 | B99: 击杀npc | C99: 火炎亡者 | D99: [10011403,10015402] | E99: 70 | F99: 击杀<火炎亡者|arg=10011403> | G99: 击杀<火炎亡者|arg=10011403>
A100: 10304098 | B100: 击杀npc | C100: 火炎亡者 | D100: [10011403,10015402] | E100: 75 | F100: 击杀<火炎亡者|arg=10011403> | G100: 击杀<火炎亡者|arg=10011403>
A101: 10304099 | B101: 击杀npc | C101: 火炎亡者 | D101: [10011403,10015402] | E101: 80 | F101: 击杀<火炎亡者|arg=10011403> | G101: 击杀<火炎亡者|arg=10011403>
A102: 10304100 | B102: 击杀npc | C102: 火炎亡者 | D102: [10011403,10015402] | E102: 85 | F102: 击杀<火炎亡者|arg=10011403> | G102: 击杀<火炎亡者|arg=10011403>
A103: 10304101 | B103: 击杀npc | C103: 痛苦女妖 | D103: [10011404,10015403] | E103: 65 | F103: 击杀<痛苦女妖|arg=10011404> | G103: 击杀<痛苦女妖|arg=10011404>
A104: 10304102 | B104: 击杀npc | C104: 痛苦女妖 | D104: [10011404,10015403] | E104: 70 | F104: 击杀<痛苦女妖|arg=10011404> | G104: 击杀<痛苦女妖|arg=10011404>
A105: 10304103 | B105: 击杀npc | C105: 痛苦女妖 | D105: [10011404,10015403] | E105: 75 | F105: 击杀<痛苦女妖|arg=10011404> | G105: 击杀<痛苦女妖|arg=10011404>
A106: 10304104 | B106: 击杀npc | C106: 痛苦女妖 | D106: [10011404,10015403] | E106: 80 | F106: 击杀<痛苦女妖|arg=10011404> | G106: 击杀<痛苦女妖|arg=10011404>
A107: 10304105 | B107: 击杀npc | C107: 痛苦女妖 | D107: [10011404,10015403] | E107: 85 | F107: 击杀<痛苦女妖|arg=10011404> | G107: 击杀<痛苦女妖|arg=10011404>
A108: 10304106 | B108: 击杀npc | C108: 屠杀者哈坎 | D108: [10011405,10015404] | E108: 65 | F108: 击杀<屠杀者哈坎|arg=10011405> | G108: 击杀<屠杀者哈坎|arg=10011405>
A109: 10304107 | B109: 击杀npc | C109: 屠杀者哈坎 | D109: [10011405,10015404] | E109: 70 | F109: 击杀<屠杀者哈坎|arg=10011405> | G109: 击杀<屠杀者哈坎|arg=10011405>
A110: 10304108 | B110: 击杀npc | C110: 屠杀者哈坎 | D110: [10011405,10015404] | E110: 75 | F110: 击杀<屠杀者哈坎|arg=10011405> | G110: 击杀<屠杀者哈坎|arg=10011405>
A111: 10304109 | B111: 击杀npc | C111: 屠杀者哈坎 | D111: [10011405,10015404] | E111: 80 | F111: 击杀<屠杀者哈坎|arg=10011405> | G111: 击杀<屠杀者哈坎|arg=10011405>
A112: 10304110 | B112: 击杀npc | C112: 屠杀者哈坎 | D112: [10011405,10015404] | E112: 85 | F112: 击杀<屠杀者哈坎|arg=10011405> | G112: 击杀<屠杀者哈坎|arg=10011405>
A113: 10304111 | B113: 击杀npc | C113: 丛林碎地者 | D113: [10011600,10015500] | E113: 65 | F113: 击杀<丛林碎地者|arg=10011600> | G113: 击杀<丛林碎地者|arg=10011600>
A114: 10304112 | B114: 击杀npc | C114: 丛林碎地者 | D114: [10011600,10015500] | E114: 70 | F114: 击杀<丛林碎地者|arg=10011600> | G114: 击杀<丛林碎地者|arg=10011600>
A115: 10304113 | B115: 击杀npc | C115: 丛林碎地者 | D115: [10011600,10015500] | E115: 75 | F115: 击杀<丛林碎地者|arg=10011600> | G115: 击杀<丛林碎地者|arg=10011600>
A116: 10304114 | B116: 击杀npc | C116: 丛林碎地者 | D116: [10011600,10015500] | E116: 80 | F116: 击杀<丛林碎地者|arg=10011600> | G116: 击杀<丛林碎地者|arg=10011600>
A117: 10304115 | B117: 击杀npc | C117: 丛林碎地者 | D117: [10011600,10015500] | E117: 85 | F117: 击杀<丛林碎地者|arg=10011600> | G117: 击杀<丛林碎地者|arg=10011600>
A118: 10304116 | B118: 击杀npc | C118: 撼地神牛 | D118: [10011601,10015501] | E118: 65 | F118: 击杀<撼地神牛|arg=10011601> | G118: 击杀<撼地神牛|arg=10011601>
A119: 10304117 | B119: 击杀npc | C119: 撼地神牛 | D119: [10011601,10015501] | E119: 70 | F119: 击杀<撼地神牛|arg=10011601> | G119: 击杀<撼地神牛|arg=10011601>
A120: 10304118 | B120: 击杀npc | C120: 撼地神牛 | D120: [10011601,10015501] | E120: 75 | F120: 击杀<撼地神牛|arg=10011601> | G120: 击杀<撼地神牛|arg=10011601>
A121: 10304119 | B121: 击杀npc | C121: 撼地神牛 | D121: [10011601,10015501] | E121: 80 | F121: 击杀<撼地神牛|arg=10011601> | G121: 击杀<撼地神牛|arg=10011601>
A122: 10304120 | B122: 击杀npc | C122: 撼地神牛 | D122: [10011601,10015501] | E122: 85 | F122: 击杀<撼地神牛|arg=10011601> | G122: 击杀<撼地神牛|arg=10011601>
A123: 10304121 | B123: 击杀npc | C123: 丛林掷矛者 | D123: [10011602,10015502] | E123: 65 | F123: 击杀<丛林掷矛者|arg=10011602> | G123: 击杀<丛林掷矛者|arg=10011602>
A124: 10304122 | B124: 击杀npc | C124: 丛林掷矛者 | D124: [10011602,10015502] | E124: 70 | F124: 击杀<丛林掷矛者|arg=10011602> | G124: 击杀<丛林掷矛者|arg=10011602>
A125: 10304123 | B125: 击杀npc | C125: 丛林掷矛者 | D125: [10011602,10015502] | E125: 75 | F125: 击杀<丛林掷矛者|arg=10011602> | G125: 击杀<丛林掷矛者|arg=10011602>
A126: 10304124 | B126: 击杀npc | C126: 丛林掷矛者 | D126: [10011602,10015502] | E126: 80 | F126: 击杀<丛林掷矛者|arg=10011602> | G126: 击杀<丛林掷矛者|arg=10011602>
A127: 10304125 | B127: 击杀npc | C127: 丛林掷矛者 | D127: [10011602,10015502] | E127: 85 | F127: 击杀<丛林掷矛者|arg=10011602> | G127: 击杀<丛林掷矛者|arg=10011602>
A128: 10304126 | B128: 击杀npc | C128: 丛林巫师 | D128: [10011603,10015503] | E128: 65 | F128: 击杀<丛林巫师|arg=10011603> | G128: 击杀<丛林巫师|arg=10011603>
A129: 10304127 | B129: 击杀npc | C129: 丛林巫师 | D129: [10011603,10015503] | E129: 70 | F129: 击杀<丛林巫师|arg=10011603> | G129: 击杀<丛林巫师|arg=10011603>
A130: 10304128 | B130: 击杀npc | C130: 丛林巫师 | D130: [10011603,10015503] | E130: 75 | F130: 击杀<丛林巫师|arg=10011603> | G130: 击杀<丛林巫师|arg=10011603>
A131: 10304129 | B131: 击杀npc | C131: 丛林巫师 | D131: [10011603,10015503] | E131: 80 | F131: 击杀<丛林巫师|arg=10011603> | G131: 击杀<丛林巫师|arg=10011603>
A132: 10304130 | B132: 击杀npc | C132: 丛林巫师 | D132: [10011603,10015503] | E132: 85 | F132: 击杀<丛林巫师|arg=10011603> | G132: 击杀<丛林巫师|arg=10011603>
A133: 10304131 | B133: 击杀npc | C133: 巨刃螳螂 | D133: [10011604,10015504] | E133: 65 | F133: 击杀<巨刃螳螂|arg=10011604> | G133: 击杀<巨刃螳螂|arg=10011604>
A134: 10304132 | B134: 击杀npc | C134: 巨刃螳螂 | D134: [10011604,10015504] | E134: 70 | F134: 击杀<巨刃螳螂|arg=10011604> | G134: 击杀<巨刃螳螂|arg=10011604>
A135: 10304133 | B135: 击杀npc | C135: 巨刃螳螂 | D135: [10011604,10015504] | E135: 75 | F135: 击杀<巨刃螳螂|arg=10011604> | G135: 击杀<巨刃螳螂|arg=10011604>
A136: 10304134 | B136: 击杀npc | C136: 巨刃螳螂 | D136: [10011604,10015504] | E136: 80 | F136: 击杀<巨刃螳螂|arg=10011604> | G136: 击杀<巨刃螳螂|arg=10011604>
A137: 10304135 | B137: 击杀npc | C137: 巨刃螳螂 | D137: [10011604,10015504] | E137: 85 | F137: 击杀<巨刃螳螂|arg=10011604> | G137: 击杀<巨刃螳螂|arg=10011604>
A138: 10304136 | B138: 击杀npc | C138: 深海恐鱼 | D138: [10011800,10015600] | E138: 75 | F138: 击杀<深海恐鱼|arg=10011800> | G138: 击杀<深海恐鱼|arg=10011800>
A139: 10304137 | B139: 击杀npc | C139: 深海恐鱼 | D139: [10011800,10015600] | E139: 80 | F139: 击杀<深海恐鱼|arg=10011800> | G139: 击杀<深海恐鱼|arg=10011800>
A140: 10304138 | B140: 击杀npc | C140: 深海恐鱼 | D140: [10011800,10015600] | E140: 85 | F140: 击杀<深海恐鱼|arg=10011800> | G140: 击杀<深海恐鱼|arg=10011800>
A141: 10304139 | B141: 击杀npc | C141: 深海恐鱼 | D141: [10011800,10015600] | E141: 90 | F141: 击杀<深海恐鱼|arg=10011800> | G141: 击杀<深海恐鱼|arg=10011800>
A142: 10304140 | B142: 击杀npc | C142: 深海恐鱼 | D142: [10011800,10015600] | E142: 95 | F142: 击杀<深海恐鱼|arg=10011800> | G142: 击杀<深海恐鱼|arg=10011800>
A143: 10304141 | B143: 击杀npc | C143: 深蓝海妖 | D143: [10011801,10015601] | E143: 75 | F143: 击杀<深蓝海妖|arg=10011801> | G143: 击杀<深蓝海妖|arg=10011801>
A144: 10304142 | B144: 击杀npc | C144: 深蓝海妖 | D144: [10011801,10015601] | E144: 80 | F144: 击杀<深蓝海妖|arg=10011801> | G144: 击杀<深蓝海妖|arg=10011801>
A145: 10304143 | B145: 击杀npc | C145: 深蓝海妖 | D145: [10011801,10015601] | E145: 85 | F145: 击杀<深蓝海妖|arg=10011801> | G145: 击杀<深蓝海妖|arg=10011801>
A146: 10304144 | B146: 击杀npc | C146: 深蓝海妖 | D146: [10011801,10015601] | E146: 90 | F146: 击杀<深蓝海妖|arg=10011801> | G146: 击杀<深蓝海妖|arg=10011801>
A147: 10304145 | B147: 击杀npc | C147: 深蓝海妖 | D147: [10011801,10015601] | E147: 95 | F147: 击杀<深蓝海妖|arg=10011801> | G147: 击杀<深蓝海妖|arg=10011801>
A148: 10304146 | B148: 击杀npc | C148: 深海守卫者 | D148: [10011802,10015602] | E148: 75 | F148: 击杀<深海守卫者|arg=10011802> | G148: 击杀<深海守卫者|arg=10011802>
A149: 10304147 | B149: 击杀npc | C149: 深海守卫者 | D149: [10011802,10015602] | E149: 80 | F149: 击杀<深海守卫者|arg=10011802> | G149: 击杀<深海守卫者|arg=10011802>
A150: 10304148 | B150: 击杀npc | C150: 深海守卫者 | D150: [10011802,10015602] | E150: 85 | F150: 击杀<深海守卫者|arg=10011802> | G150: 击杀<深海守卫者|arg=10011802>
A151: 10304149 | B151: 击杀npc | C151: 深海守卫者 | D151: [10011802,10015602] | E151: 90 | F151: 击杀<深海守卫者|arg=10011802> | G151: 击杀<深海守卫者|arg=10011802>
A152: 10304150 | B152: 击杀npc | C152: 深海守卫者 | D152: [10011802,10015602] | E152: 95 | F152: 击杀<深海守卫者|arg=10011802> | G152: 击杀<深海守卫者|arg=10011802>
A153: 10304151 | B153: 击杀npc | C153: 晶蓝海马 | D153: [10011803,10015603] | E153: 75 | F153: 击杀<晶蓝海马|arg=10011803> | G153: 击杀<晶蓝海马|arg=10011803>
A154: 10304152 | B154: 击杀npc | C154: 晶蓝海马 | D154: [10011803,10015603] | E154: 80 | F154: 击杀<晶蓝海马|arg=10011803> | G154: 击杀<晶蓝海马|arg=10011803>
A155: 10304153 | B155: 击杀npc | C155: 晶蓝海马 | D155: [10011803,10015603] | E155: 85 | F155: 击杀<晶蓝海马|arg=10011803> | G155: 击杀<晶蓝海马|arg=10011803>
A156: 10304154 | B156: 击杀npc | C156: 晶蓝海马 | D156: [10011803,10015603] | E156: 90 | F156: 击杀<晶蓝海马|arg=10011803> | G156: 击杀<晶蓝海马|arg=10011803>
A157: 10304155 | B157: 击杀npc | C157: 晶蓝海马 | D157: [10011803,10015603] | E157: 95 | F157: 击杀<晶蓝海马|arg=10011803> | G157: 击杀<晶蓝海马|arg=10011803>
A158: 10304156 | B158: 击杀npc | C158: 潮汐海魔 | D158: [10011804,10015604] | E158: 75 | F158: 击杀<潮汐海魔|arg=10011804> | G158: 击杀<潮汐海魔|arg=10011804>
A159: 10304157 | B159: 击杀npc | C159: 潮汐海魔 | D159: [10011804,10015604] | E159: 80 | F159: 击杀<潮汐海魔|arg=10011804> | G159: 击杀<潮汐海魔|arg=10011804>
A160: 10304158 | B160: 击杀npc | C160: 潮汐海魔 | D160: [10011804,10015604] | E160: 85 | F160: 击杀<潮汐海魔|arg=10011804> | G160: 击杀<潮汐海魔|arg=10011804>
A161: 10304159 | B161: 击杀npc | C161: 潮汐海魔 | D161: [10011804,10015604] | E161: 90 | F161: 击杀<潮汐海魔|arg=10011804> | G161: 击杀<潮汐海魔|arg=10011804>
A162: 10304160 | B162: 击杀npc | C162: 潮汐海魔 | D162: [10011804,10015604] | E162: 95 | F162: 击杀<潮汐海魔|arg=10011804> | G162: 击杀<潮汐海魔|arg=10011804>
A163: 10304161 | B163: 击杀npc | C163: 鱼人战士 | D163: [10012000,10015700] | E163: 65 | F163: 击杀<鱼人战士|arg=10012000> | G163: 击杀<鱼人战士|arg=10012000>
A164: 10304162 | B164: 击杀npc | C164: 鱼人战士 | D164: [10012000,10015700] | E164: 70 | F164: 击杀<鱼人战士|arg=10012000> | G164: 击杀<鱼人战士|arg=10012000>
A165: 10304163 | B165: 击杀npc | C165: 鱼人战士 | D165: [10012000,10015700] | E165: 75 | F165: 击杀<鱼人战士|arg=10012000> | G165: 击杀<鱼人战士|arg=10012000>
A166: 10304164 | B166: 击杀npc | C166: 鱼人战士 | D166: [10012000,10015700] | E166: 80 | F166: 击杀<鱼人战士|arg=10012000> | G166: 击杀<鱼人战士|arg=10012000>
A167: 10304165 | B167: 击杀npc | C167: 鱼人战士 | D167: [10012000,10015700] | E167: 85 | F167: 击杀<鱼人战士|arg=10012000> | G167: 击杀<鱼人战士|arg=10012000>
A168: 10304166 | B168: 击杀npc | C168: 娜迦海妖 | D168: [10012001,10015701] | E168: 65 | F168: 击杀<娜迦海妖|arg=10012001> | G168: 击杀<娜迦海妖|arg=10012001>
A169: 10304167 | B169: 击杀npc | C169: 娜迦海妖 | D169: [10012001,10015701] | E169: 70 | F169: 击杀<娜迦海妖|arg=10012001> | G169: 击杀<娜迦海妖|arg=10012001>
A170: 10304168 | B170: 击杀npc | C170: 娜迦海妖 | D170: [10012001,10015701] | E170: 75 | F170: 击杀<娜迦海妖|arg=10012001> | G170: 击杀<娜迦海妖|arg=10012001>
A171: 10304169 | B171: 击杀npc | C171: 娜迦海妖 | D171: [10012001,10015701] | E171: 80 | F171: 击杀<娜迦海妖|arg=10012001> | G171: 击杀<娜迦海妖|arg=10012001>
A172: 10304170 | B172: 击杀npc | C172: 娜迦海妖 | D172: [10012001,10015701] | E172: 85 | F172: 击杀<娜迦海妖|arg=10012001> | G172: 击杀<娜迦海妖|arg=10012001>
A173: 10304171 | B173: 击杀npc | C173: 海皇守卫 | D173: [10012002,10015702] | E173: 65 | F173: 击杀<海皇守卫|arg=10012002> | G173: 击杀<海皇守卫|arg=10012002>
A174: 10304172 | B174: 击杀npc | C174: 海皇守卫 | D174: [10012002,10015702] | E174: 70 | F174: 击杀<海皇守卫|arg=10012002> | G174: 击杀<海皇守卫|arg=10012002>
A175: 10304173 | B175: 击杀npc | C175: 海皇守卫 | D175: [10012002,10015702] | E175: 75 | F175: 击杀<海皇守卫|arg=10012002> | G175: 击杀<海皇守卫|arg=10012002>
A176: 10304174 | B176: 击杀npc | C176: 海皇守卫 | D176: [10012002,10015702] | E176: 80 | F176: 击杀<海皇守卫|arg=10012002> | G176: 击杀<海皇守卫|arg=10012002>
A177: 10304175 | B177: 击杀npc | C177: 海皇守卫 | D177: [10012002,10015702] | E177: 85 | F177: 击杀<海皇守卫|arg=10012002> | G177: 击杀<海皇守卫|arg=10012002>
A178: 10304176 | B178: 击杀npc | C178: 裂齿海魔 | D178: [10012003,10015703] | E178: 65 | F178: 击杀<裂齿海魔|arg=10012003> | G178: 击杀<裂齿海魔|arg=10012003>
A179: 10304177 | B179: 击杀npc | C179: 裂齿海魔 | D179: [10012003,10015703] | E179: 70 | F179: 击杀<裂齿海魔|arg=10012003> | G179: 击杀<裂齿海魔|arg=10012003>
A180: 10304178 | B180: 击杀npc | C180: 裂齿海魔 | D180: [10012003,10015703] | E180: 75 | F180: 击杀<裂齿海魔|arg=10012003> | G180: 击杀<裂齿海魔|arg=10012003>
A181: 10304179 | B181: 击杀npc | C181: 裂齿海魔 | D181: [10012003,10015703] | E181: 80 | F181: 击杀<裂齿海魔|arg=10012003> | G181: 击杀<裂齿海魔|arg=10012003>
A182: 10304180 | B182: 击杀npc | C182: 裂齿海魔 | D182: [10012003,10015703] | E182: 85 | F182: 击杀<裂齿海魔|arg=10012003> | G182: 击杀<裂齿海魔|arg=10012003>
A183: 10304181 | B183: 击杀npc | C183: 铁爪龙鳄 | D183: [10012004,10015704] | E183: 65 | F183: 击杀<铁爪龙鳄|arg=10012004> | G183: 击杀<铁爪龙鳄|arg=10012004>
A184: 10304182 | B184: 击杀npc | C184: 铁爪龙鳄 | D184: [10012004,10015704] | E184: 70 | F184: 击杀<铁爪龙鳄|arg=10012004> | G184: 击杀<铁爪龙鳄|arg=10012004>
A185: 10304183 | B185: 击杀npc | C185: 铁爪龙鳄 | D185: [10012004,10015704] | E185: 75 | F185: 击杀<铁爪龙鳄|arg=10012004> | G185: 击杀<铁爪龙鳄|arg=10012004>
A186: 10304184 | B186: 击杀npc | C186: 铁爪龙鳄 | D186: [10012004,10015704] | E186: 80 | F186: 击杀<铁爪龙鳄|arg=10012004> | G186: 击杀<铁爪龙鳄|arg=10012004>
A187: 10304185 | B187: 击杀npc | C187: 铁爪龙鳄 | D187: [10012004,10015704] | E187: 85 | F187: 击杀<铁爪龙鳄|arg=10012004> | G187: 击杀<铁爪龙鳄|arg=10012004>
A188: 10304186 | B188: 击杀npc | C188: 蓝鳞蛇龙 | D188: [10012005,10015705] | E188: 65 | F188: 击杀<蓝鳞蛇龙|arg=10012005> | G188: 击杀<蓝鳞蛇龙|arg=10012005>
A189: 10304187 | B189: 击杀npc | C189: 蓝鳞蛇龙 | D189: [10012005,10015705] | E189: 70 | F189: 击杀<蓝鳞蛇龙|arg=10012005> | G189: 击杀<蓝鳞蛇龙|arg=10012005>
A190: 10304188 | B190: 击杀npc | C190: 蓝鳞蛇龙 | D190: [10012005,10015705] | E190: 75 | F190: 击杀<蓝鳞蛇龙|arg=10012005> | G190: 击杀<蓝鳞蛇龙|arg=10012005>
A191: 10304189 | B191: 击杀npc | C191: 蓝鳞蛇龙 | D191: [10012005,10015705] | E191: 80 | F191: 击杀<蓝鳞蛇龙|arg=10012005> | G191: 击杀<蓝鳞蛇龙|arg=10012005>
A192: 10304190 | B192: 击杀npc | C192: 蓝鳞蛇龙 | D192: [10012005,10015705] | E192: 85 | F192: 击杀<蓝鳞蛇龙|arg=10012005> | G192: 击杀<蓝鳞蛇龙|arg=10012005>
A193: 10304191 | B193: 击杀npc | C193: 梦魇 | D193: [10011406,10015405] | E193: 65 | F193: 击杀<梦魇|arg=10011406> | G193: 击杀<梦魇|arg=10011406>
A194: 10304192 | B194: 击杀npc | C194: 梦魇 | D194: [10011406,10015405] | E194: 70 | F194: 击杀<梦魇|arg=10011406> | G194: 击杀<梦魇|arg=10011406>
A195: 10304193 | B195: 击杀npc | C195: 梦魇 | D195: [10011406,10015405] | E195: 75 | F195: 击杀<梦魇|arg=10011406> | G195: 击杀<梦魇|arg=10011406>
A196: 10304194 | B196: 击杀npc | C196: 梦魇 | D196: [10011406,10015405] | E196: 80 | F196: 击杀<梦魇|arg=10011406> | G196: 击杀<梦魇|arg=10011406>
A197: 10304195 | B197: 击杀npc | C197: 梦魇 | D197: [10011406,10015405] | E197: 85 | F197: 击杀<梦魇|arg=10011406> | G197: 击杀<梦魇|arg=10011406>
A198: 10304000 | B198: 完成环任务 | D198: day | E198: 5 | F198: 找<佣兵长马塞尔|arg=10010200>去领任务 | G198: 找<佣兵长马塞尔|arg=10010200>去领任务

Sheet: special_award
A1: 关联ID | B1: 等级需求 | C1: 职业需求 | D1: 性别需求 | E1: 奖励
A2: id | B2: level | C2: career | D2: sex | E2: award
A3: 10300312 | C3: 战士 | E3: [{equip,10300010},{equip,10300010},{equip,10300010},{equip,10300010},{equip,10300010}]
A4: 10300312 | C4: 法师 | E4: [{equip,10300011},{equip,10300011},{equip,10300011},{equip,10300011},{equip,10300011}]
A5: 10300312 | C5: 弓手 | E5: [{equip,10300012},{equip,10300012},{equip,10300012},{equip,10300012},{equip,10300012}]
A6: 10300377 | C6: 战士 | E6: [{equip,10300025},{equip,10300025},{equip,10300025},{equip,10300025},{equip,10300025}]
A7: 10300377 | C7: 法师 | E7: [{equip,10300026},{equip,10300026},{equip,10300026},{equip,10300026},{equip,10300026}]
A8: 10300377 | C8: 弓手 | E8: [{equip,10300027},{equip,10300027},{equip,10300027},{equip,10300027},{equip,10300027}]
A9: 10300352 | C9: 战士 | E9: [{equip,10300031}]
A10: 10300352 | C10: 法师 | E10: [{equip,10300032}]
A11: 10300352 | C11: 弓手 | E11: [{equip,10300033}]
A12: 10300355 | C12: 战士 | E12: [{equip,10300034}]
A13: 10300355 | C13: 法师 | E13: [{equip,10300035}]
A14: 10300355 | C14: 弓手 | E14: [{equip,10300036}]
A15: 10300351 | C15: 战士 | E15: [{equip,10300028},{equip,10300040}]
A16: 10300351 | C16: 法师 | E16: [{equip,10300029},{equip,10300041}]
A17: 10300351 | C17: 弓手 | E17: [{equip,10300030},{equip,10300042}]
A18: 10300313 | C18: 战士 | E18: [{equip,10300010},{equip,10300010},{equip,10300010},{equip,10300010},{equip,10300010}]
A19: 10300313 | C19: 法师 | E19: [{equip,10300011},{equip,10300011},{equip,10300011},{equip,10300011},{equip,10300011}]
A20: 10300313 | C20: 弓手 | E20: [{equip,10300012},{equip,10300012},{equip,10300012},{equip,10300012},{equip,10300012}]
A21: 10300317 | C21: 战士 | E21: [{equip,10300010},{equip,10300010},{equip,10300010},{equip,10300010},{equip,10300010}]
A22: 10300317 | C22: 法师 | E22: [{equip,10300011},{equip,10300011},{equip,10300011},{equip,10300011},{equip,10300011}]
A23: 10300317 | C23: 弓手 | E23: [{equip,10300012},{equip,10300012},{equip,10300012},{equip,10300012},{equip,10300012}]
A24: 10300321 | C24: 战士 | E24: [{equip,10300010},{equip,10300010},{equip,10300010},{equip,10300010},{equip,10300010}]
A25: 10300321 | C25: 法师 | E25: [{equip,10300011},{equip,10300011},{equip,10300011},{equip,10300011},{equip,10300011}]
A26: 10300321 | C26: 弓手 | E26: [{equip,10300012},{equip,10300012},{equip,10300012},{equip,10300012},{equip,10300012}]
A27: 10301303 | B27: 1 | C27: 27000 | E27: ="[{exp,"&RC[-2]&"}]" -> [{exp,27000}]
A28: 10301303 | B28: 2 | C28: 31000 | E28: ="[{exp,"&RC[-2]&"}]" -> [{exp,31000}]
A29: 10301303 | B29: 3 | C29: 34000 | E29: ="[{exp,"&RC[-2]&"}]" -> [{exp,34000}]
A30: 10301303 | B30: 4 | C30: 37000 | E30: ="[{exp,"&RC[-2]&"}]" -> [{exp,37000}]
A31: 10301303 | B31: 5 | C31: 53000 | E31: ="[{exp,"&RC[-2]&"}]" -> [{exp,53000}]
A32: 10301303 | B32: 6 | C32: 55000 | E32: ="[{exp,"&RC[-2]&"}]" -> [{exp,55000}]
A33: 10301303 | B33: 7 | C33: 59000 | E33: ="[{exp,"&RC[-2]&"}]" -> [{exp,59000}]
A34: 10301303 | B34: 8 | C34: 62000 | E34: ="[{exp,"&RC[-2]&"}]" -> [{exp,62000}]
A35: 10301303 | B35: 9 | C35: 65000 | E35: ="[{exp,"&RC[-2]&"}]" -> [{exp,65000}]
A36: 10301303 | B36: 10 | C36: 67000 | E36: ="[{exp,"&RC[-2]&"}]" -> [{exp,67000}]
A37: 10301303 | B37: 11 | C37: 69000 | E37: ="[{exp,"&RC[-2]&"}]" -> [{exp,69000}]
A38: 10301303 | B38: 12 | C38: 71000 | E38: ="[{exp,"&RC[-2]&"}]" -> [{exp,71000}]
A39: 10301303 | B39: 13 | C39: 74000 | E39: ="[{exp,"&RC[-2]&"}]" -> [{exp,74000}]
A40: 10301303 | B40: 14 | C40: 76000 | E40: ="[{exp,"&RC[-2]&"}]" -> [{exp,76000}]
A41: 10301303 | B41: 15 | C41: 78000 | E41: ="[{exp,"&RC[-2]&"}]" -> [{exp,78000}]
A42: 10301303 | B42: 16 | C42: 79000 | E42: ="[{exp,"&RC[-2]&"}]" -> [{exp,79000}]
A43: 10301303 | B43: 17 | C43: 81000 | E43: ="[{exp,"&RC[-2]&"}]" -> [{exp,81000}]
A44: 10301303 | B44: 18 | C44: 83000 | E44: ="[{exp,"&RC[-2]&"}]" -> [{exp,83000}]
A45: 10301303 | B45: 19 | C45: 84000 | E45: ="[{exp,"&RC[-2]&"}]" -> [{exp,84000}]
A46: 10301303 | B46: 20 | C46: 86000 | E46: ="[{exp,"&RC[-2]&"}]" -> [{exp,86000}]
A47: 10301303 | B47: 21 | C47: 87000 | E47: ="[{exp,"&RC[-2]&"}]" -> [{exp,87000}]
A48: 10301303 | B48: 22 | C48: 88000 | E48: ="[{exp,"&RC[-2]&"}]" -> [{exp,88000}]
A49: 10301303 | B49: 23 | C49: 90000 | E49: ="[{exp,"&RC[-2]&"}]" -> [{exp,90000}]
A50: 10301303 | B50: 24 | C50: 91000 | E50: ="[{exp,"&RC[-2]&"}]" -> [{exp,91000}]
A51: 10301303 | B51: 25 | C51: 92000 | E51: ="[{exp,"&RC[-2]&"}]" -> [{exp,92000}]
A52: 10301303 | B52: 26 | C52: 93000 | E52: ="[{exp,"&RC[-2]&"}]" -> [{exp,93000}]
A53: 10301303 | B53: 27 | C53: 94000 | E53: ="[{exp,"&RC[-2]&"}]" -> [{exp,94000}]
A54: 10301303 | B54: 28 | C54: 95000 | E54: ="[{exp,"&RC[-2]&"}]" -> [{exp,95000}]
A55: 10301303 | B55: 29 | C55: 96000 | E55: ="[{exp,"&RC[-2]&"}]" -> [{exp,96000}]
A56: 10301303 | B56: 30 | C56: 110000 | E56: ="[{exp,"&RC[-2]&"}]" -> [{exp,110000}]
A57: 10301303 | B57: 31 | C57: 110000 | E57: ="[{exp,"&RC[-2]&"}]" -> [{exp,110000}]
A58: 10301303 | B58: 32 | C58: 110000 | E58: ="[{exp,"&RC[-2]&"}]" -> [{exp,110000}]
A59: 10301303 | B59: 33 | C59: 110000 | E59: ="[{exp,"&RC[-2]&"}]" -> [{exp,110000}]
A60: 10301303 | B60: 34 | C60: 110000 | E60: ="[{exp,"&RC[-2]&"}]" -> [{exp,110000}]
A61: 10301303 | B61: 35 | C61: 130000 | E61: ="[{exp,"&RC[-2]&"}]" -> [{exp,130000}]
A62: 10301303 | B62: 36 | C62: 130000 | E62: ="[{exp,"&RC[-2]&"}]" -> [{exp,130000}]
A63: 10301303 | B63: 37 | C63: 130000 | E63: ="[{exp,"&RC[-2]&"}]" -> [{exp,130000}]
A64: 10301303 | B64: 38 | C64: 130000 | E64: ="[{exp,"&RC[-2]&"}]" -> [{exp,130000}]
A65: 10301303 | B65: 39 | C65: 130000 | E65: ="[{exp,"&RC[-2]&"}]" -> [{exp,130000}]
A66: 10301303 | B66: 40 | C66: 140000 | E66: ="[{exp,"&RC[-2]&"}]" -> [{exp,140000}]
A67: 10301303 | B67: 41 | C67: 150000 | E67: ="[{exp,"&RC[-2]&"}]" -> [{exp,150000}]
A68: 10301303 | B68: 42 | C68: 160000 | E68: ="[{exp,"&RC[-2]&"}]" -> [{exp,160000}]
A69: 10301303 | B69: 43 | C69: 170000 | E69: ="[{exp,"&RC[-2]&"}]" -> [{exp,170000}]
A70: 10301303 | B70: 44 | C70: 180000 | E70: ="[{exp,"&RC[-2]&"}]" -> [{exp,180000}]
A71: 10301303 | B71: 45 | C71: 190000 | E71: ="[{exp,"&RC[-2]&"}]" -> [{exp,190000}]
A72: 10301303 | B72: 46 | C72: 200000 | E72: ="[{exp,"&RC[-2]&"}]" -> [{exp,200000}]
A73: 10301303 | B73: 47 | C73: 210000 | E73: ="[{exp,"&RC[-2]&"}]" -> [{exp,210000}]
A74: 10301303 | B74: 48 | C74: 210000 | E74: ="[{exp,"&RC[-2]&"}]" -> [{exp,210000}]
A75: 10301303 | B75: 49 | C75: 210000 | E75: ="[{exp,"&RC[-2]&"}]" -> [{exp,210000}]
A76: 10301303 | B76: 50 | C76: 230000 | E76: ="[{exp,"&RC[-2]&"}]" -> [{exp,230000}]
A77: 10301303 | B77: 51 | C77: 230000 | E77: ="[{exp,"&RC[-2]&"}]" -> [{exp,230000}]
A78: 10301303 | B78: 52 | C78: 240000 | E78: ="[{exp,"&RC[-2]&"}]" -> [{exp,240000}]
A79: 10301303 | B79: 53 | C79: 240000 | E79: ="[{exp,"&RC[-2]&"}]" -> [{exp,240000}]
A80: 10301303 | B80: 54 | C80: 240000 | E80: ="[{exp,"&RC[-2]&"}]" -> [{exp,240000}]
A81: 10301303 | B81: 55 | C81: 260000 | E81: ="[{exp,"&RC[-2]&"}]" -> [{exp,260000}]
A82: 10301303 | B82: 56 | C82: 270000 | E82: ="[{exp,"&RC[-2]&"}]" -> [{exp,270000}]
A83: 10301303 | B83: 57 | C83: 270000 | E83: ="[{exp,"&RC[-2]&"}]" -> [{exp,270000}]
A84: 10301303 | B84: 58 | C84: 270000 | E84: ="[{exp,"&RC[-2]&"}]" -> [{exp,270000}]
A85: 10301303 | B85: 59 | C85: 280000 | E85: ="[{exp,"&RC[-2]&"}]" -> [{exp,280000}]
A86: 10301303 | B86: 60 | C86: 320000 | E86: ="[{exp,"&RC[-2]&"}]" -> [{exp,320000}]
A87: 10301303 | B87: 61 | C87: 320000 | E87: ="[{exp,"&RC[-2]&"}]" -> [{exp,320000}]
A88: 10301303 | B88: 62 | C88: 320000 | E88: ="[{exp,"&RC[-2]&"}]" -> [{exp,320000}]
A89: 10301303 | B89: 63 | C89: 330000 | E89: ="[{exp,"&RC[-2]&"}]" -> [{exp,330000}]
A90: 10301303 | B90: 64 | C90: 330000 | E90: ="[{exp,"&RC[-2]&"}]" -> [{exp,330000}]
A91: 10301303 | B91: 65 | C91: 370000 | E91: ="[{exp,"&RC[-2]&"}]" -> [{exp,370000}]
A92: 10301303 | B92: 66 | C92: 380000 | E92: ="[{exp,"&RC[-2]&"}]" -> [{exp,380000}]
A93: 10301303 | B93: 67 | C93: 380000 | E93: ="[{exp,"&RC[-2]&"}]" -> [{exp,380000}]
A94: 10301303 | B94: 68 | C94: 380000 | E94: ="[{exp,"&RC[-2]&"}]" -> [{exp,380000}]
A95: 10301303 | B95: 69 | C95: 380000 | E95: ="[{exp,"&RC[-2]&"}]" -> [{exp,380000}]
A96: 10301303 | B96: 70 | C96: 430000 | E96: ="[{exp,"&RC[-2]&"}]" -> [{exp,430000}]
A97: 10301303 | B97: 71 | C97: 430000 | E97: ="[{exp,"&RC[-2]&"}]" -> [{exp,430000}]
A98: 10301303 | B98: 72 | C98: 430000 | E98: ="[{exp,"&RC[-2]&"}]" -> [{exp,430000}]
A99: 10301303 | B99: 73 | C99: 440000 | E99: ="[{exp,"&RC[-2]&"}]" -> [{exp,440000}]
A100: 10301303 | B100: 74 | C100: 440000 | E100: ="[{exp,"&RC[-2]&"}]" -> [{exp,440000}]
A101: 10301303 | B101: 75 | C101: 490000 | E101: ="[{exp,"&RC[-2]&"}]" -> [{exp,490000}]
A102: 10301303 | B102: 76 | C102: 490000 | E102: ="[{exp,"&RC[-2]&"}]" -> [{exp,490000}]
A103: 10301303 | B103: 77 | C103: 500000 | E103: ="[{exp,"&RC[-2]&"}]" -> [{exp,500000}]
A104: 10301303 | B104: 78 | C104: 500000 | E104: ="[{exp,"&RC[-2]&"}]" -> [{exp,500000}]
A105: 10301303 | B105: 79 | C105: 500000 | E105: ="[{exp,"&RC[-2]&"}]" -> [{exp,500000}]
A106: 10301303 | B106: 80 | C106: 550000 | E106: ="[{exp,"&RC[-2]&"}]" -> [{exp,550000}]
A107: 10301303 | B107: 81 | C107: 550000 | E107: ="[{exp,"&RC[-2]&"}]" -> [{exp,550000}]
A108: 10301303 | B108: 82 | C108: 560000 | E108: ="[{exp,"&RC[-2]&"}]" -> [{exp,560000}]
A109: 10301303 | B109: 83 | C109: 560000 | E109: ="[{exp,"&RC[-2]&"}]" -> [{exp,560000}]
A110: 10301303 | B110: 84 | C110: 570000 | E110: ="[{exp,"&RC[-2]&"}]" -> [{exp,570000}]
A111: 10301303 | B111: 85 | C111: 620000 | E111: ="[{exp,"&RC[-2]&"}]" -> [{exp,620000}]
A112: 10301303 | B112: 86 | C112: 620000 | E112: ="[{exp,"&RC[-2]&"}]" -> [{exp,620000}]
A113: 10301303 | B113: 87 | C113: 620000 | E113: ="[{exp,"&RC[-2]&"}]" -> [{exp,620000}]
A114: 10301303 | B114: 88 | C114: 630000 | E114: ="[{exp,"&RC[-2]&"}]" -> [{exp,630000}]
A115: 10301303 | B115: 89 | C115: 630000 | E115: ="[{exp,"&RC[-2]&"}]" -> [{exp,630000}]
A116: 10301303 | B116: 90 | C116: 680000 | E116: ="[{exp,"&RC[-2]&"}]" -> [{exp,680000}]
A117: 10301303 | B117: 91 | C117: 690000 | E117: ="[{exp,"&RC[-2]&"}]" -> [{exp,690000}]
A118: 10301303 | B118: 92 | C118: 690000 | E118: ="[{exp,"&RC[-2]&"}]" -> [{exp,690000}]
A119: 10301303 | B119: 93 | C119: 700000 | E119: ="[{exp,"&RC[-2]&"}]" -> [{exp,700000}]
A120: 10301303 | B120: 94 | C120: 700000 | E120: ="[{exp,"&RC[-2]&"}]" -> [{exp,700000}]
A121: 10301303 | B121: 95 | C121: 760000 | E121: ="[{exp,"&RC[-2]&"}]" -> [{exp,760000}]
A122: 10301303 | B122: 96 | C122: 760000 | E122: ="[{exp,"&RC[-2]&"}]" -> [{exp,760000}]
A123: 10301303 | B123: 97 | C123: 760000 | E123: ="[{exp,"&RC[-2]&"}]" -> [{exp,760000}]
A124: 10301303 | B124: 98 | C124: 770000 | E124: ="[{exp,"&RC[-2]&"}]" -> [{exp,770000}]
A125: 10301303 | B125: 99 | C125: 770000 | E125: ="[{exp,"&RC[-2]&"}]" -> [{exp,770000}]

Sheet: pre_condition
A1: 关联编号 | B1: 条件类型 | C1: 条件数据1 | D1: 条件数据2
A2: id | B2: type | C2: v1 | D2: v2
A3: 10300204 | B3: 接任务获得物品 | C3: {1012001,1}
A4: 10300215 | B4: 接任务获得物品 | C4: {1012005,1},{1012006,1},{1012007,1}
A5: 10300223 | B5: 接任务获得物品 | C5: {1012008,1}
A6: 10302001 | B6: 周期任务 | C6: day
A7: 10302002 | B7: 周期任务 | C7: day
A8: 10302003 | B8: 周期任务 | C8: day
A9: 10302004 | B9: 周期任务 | C9: day
A10: 10302011 | B10: 周期任务 | C10: day
A11: 10302012 | B11: 周期任务 | C11: day
A12: 10302013 | B12: 周期任务 | C12: day
A13: 10302014 | B13: 周期任务 | C13: day
A14: 10302021 | B14: 周期任务 | C14: day
A15: 10302022 | B15: 周期任务 | C15: day
A16: 10302023 | B16: 周期任务 | C16: day
A17: 10302024 | B17: 周期任务 | C17: day
A18: 10302025 | B18: 周期任务 | C18: day
A19: 10302026 | B19: 周期任务 | C19: day
A20: 10302027 | B20: 周期任务 | C20: day
A21: 10302028 | B21: 周期任务 | C21: day
A22: 10302041 | B22: 周期任务 | C22: day
A23: 10302042 | B23: 周期任务 | C23: day
A24: 10302043 | B24: 周期任务 | C24: day
A25: 10302044 | B25: 周期任务 | C25: day
A26: 10302051 | B26: 周期任务 | C26: day
A27: 10302052 | B27: 周期任务 | C27: day
A28: 10302053 | B28: 周期任务 | C28: day
A29: 10302054 | B29: 周期任务 | C29: day
A30: 10302061 | B30: 周期任务 | C30: day
A31: 10302062 | B31: 周期任务 | C31: day
A32: 10302063 | B32: 周期任务 | C32: day
A33: 10302064 | B33: 周期任务 | C33: day
A34: 10302071 | B34: 周期任务 | C34: day
A35: 10302072 | B35: 周期任务 | C35: day
A36: 10302073 | B36: 周期任务 | C36: day
A37: 10302074 | B37: 周期任务 | C37: day
A38: 10302081 | B38: 周期任务 | C38: day
A39: 10302082 | B39: 周期任务 | C39: day
A40: 10302083 | B40: 周期任务 | C40: day
A41: 10302084 | B41: 周期任务 | C41: day
A42: 10302091 | B42: 周期任务 | C42: day
A43: 10302092 | B43: 周期任务 | C43: day
A44: 10302093 | B44: 周期任务 | C44: day
A45: 10302094 | B45: 周期任务 | C45: day
A46: 10300323 | B46: 接任务获得物品 | C46: {1012101,1}
A47: 10301303 | B47: 周期任务 | C47: day

Sheet: fail_condition
A1: 任务编号
A2: sid

Sheet: taskCarbon
A1: 地图id | B1: 成功条件 | C1: 特殊事件
A2: mapId | B2: vTerm | C2: extraEvents
A3: 30001 | B3: 10300305 | C3: [{{task, 10300338, submit_task}, 1202},{{task, 10300304, submit_task}, 1203}]
A4: 30002 | B4: 10300311 | C4: [{{task, 10300339, submit_task}, 1213}]
A5: 30003 | B5: 10300315 | C5: [{{task, 10300340, submit_task}, 1223}]
A6: 30004 | B6: 10300319 | C6: [{{task, 10300341, submit_task}, 1233},{{task, 10300317, submit_task}, 1231}]
A7: 30005 | B7: 10300347 | C7: [{{task, 10300342, submit_task}, 1143},{{task, 10300321, submit_task}, 1142},{{task, 10300322, submit_task}, 1243},{{task, 10300344, submit_task}, 1144},{{task, 10300345, submit_task}, 1145},{{task, 10300346, submit_task}, 1146}]
A8: 2000 | B8: 10300337 | C8: [{{task, 10300325, submit_task}, 1261},{{task, 10300326, submit_task}, 1262},{{task, 10300328, submit_task}, 1271},{{task, 10300328, complete_task}, 1273},{{task, 10300329, submit_task}, 1264},{{task, 10300331, submit_task},1265},{{task, 10300332, submit_task}, 1272},{{task, 10300335, complete_task}, 1268},{{task, 10300343, submit_task}, 1270}]
A9: 30011 | B9: 10300354 | C9: [{{task, 10300353, submit_task}, 2201}]
A10: 30012 | B10: 10300358 | C10: [{{task, 10300357, submit_task}, 2211}]
A11: 10061 | B11: 10300366 | C11: []
A12: 10062 | B12: 10300373 | C12: []

Sheet: carbonTrigger
A1: 地图id | B1: 触发器id | C1: 类型 | D1: 参数 | E1: 目标 | F1: 执行类型 | G1: 分组 | H1: 执行参数
A2: mapId | B2: triggerId | C2: type | D2: value | E2: target | F2: actionType | G2: group | H2: actionArg
A3: 30001 | B3: 1101 | C3: 时间 | D3: 0 | E3: 1
A4: 30001 | B4: 1201 | C4: 事件 | D4: 3 | E4: over
A5: 30001 | B5: 1301 | C5: 执行 | D5: 1101 | E5: 1 | F5: 创建NPC | G5: 3 | I5: 迅影龙
A6: 30001 | B6: 1304 | C6: 执行 | D6: 1202 | E6: 1 | F6: 切换状态 | G6: 3 | H6: pre_free | I6: 迅影龙
A7: 30001 | B7: 1302 | C7: 执行 | D7: 1201 | E7: 1 | F7: 创建NPC | G7: 4 | I7: 冰霜食人魔
A8: 30001 | B8: 1303 | C8: 执行 | D8: 1201 | E8: 1 | F8: 创建NPC | G8: 5 | I8: 希德2
A9: 30001 | B9: 1305 | C9: 执行 | D9: 1203 | E9: 1 | F9: 切换状态 | G9: 4 | H9: pre_free | I9: 冰霜食人魔
A10: 30002 | B10: 1111 | C10: 时间 | D10: 0 | E10: 1
A11: 30002 | B11: 1211 | C11: 事件 | D11: 6 | E11: over
A12: 30002 | B12: 1212 | C12: 事件 | D12: 4 | E12: over
A13: 30002 | B13: 1311 | C13: 执行 | D13: 1111 | E13: 1 | F13: 创建NPC | G13: 2 | I13: 黑暗巫师
A14: 30002 | B14: 1318 | C14: 执行 | D14: 1111 | E14: 1 | F14: 创建NPC | G14: 6 | I14: 黑暗巫王
A15: 30002 | B15: 1317 | C15: 执行 | D15: 1213 | E15: 1 | F15: 切换状态 | G15: 2 | H15: pre_free | I15: 黑暗巫师
A16: 30002 | B16: 1319 | C16: 执行 | D16: 1213 | E16: 1 | F16: 切换状态 | G16: 6 | H16: pre_free | I16: 黑暗巫王
A17: 30002 | B17: 1312 | C17: 执行 | D17: 1211 | E17: 1 | F17: 创建NPC | G17: 1 | I17: 村长2
A18: 30002 | B18: 1313 | C18: 执行 | D18: 1211 | E18: 1 | F18: 创建NPC | G18: 3
A19: 30002 | B19: 1314 | C19: 执行 | D19: 1211 | E19: 1 | F19: 创建NPC | G19: 4
A20: 30002 | B20: 1315 | C20: 执行 | D20: 1212 | E20: 1 | F20: 移除NPC | G20: 1
A21: 30002 | B21: 1316 | C21: 执行 | D21: 1212 | E21: 1 | F21: 创建NPC | G21: 5
A22: 30003 | B22: 1121 | C22: 时间 | D22: 0 | E22: 1
A23: 30003 | B23: 1221 | C23: 事件 | D23: 2 | E23: over
A24: 30003 | B24: 1222 | C24: 事件 | D24: 3 | E24: over
A25: 30003 | B25: 1321 | C25: 执行 | D25: 1121 | E25: 1 | F25: 创建NPC | G25: 2 | I25: 暗影龙兽
A26: 30003 | B26: 1325 | C26: 执行 | D26: 1223 | E26: 1 | F26: 切换状态 | G26: 2 | H26: pre_free | I26: 暗影龙兽
A27: 30003 | B27: 1322 | C27: 执行 | D27: 1221 | E27: 1 | F27: 创建NPC | G27: 3 | I27: 黑袍人分身2
A28: 30003 | B28: 1323 | C28: 执行 | D28: 1222 | E28: 1 | F28: 创建NPC | G28: 4 | I28: 黑袍人
A29: 30004 | B29: 1131 | C29: 时间 | D29: 0 | E29: 1
A30: 30004 | B30: 1232 | C30: 事件 | D30: 3 | E30: over
A31: 30004 | B31: 1331 | C31: 执行 | D31: 1131 | E31: 1 | F31: 创建NPC | G31: 1 | I31: 小恶魔
A32: 30004 | B32: 1332 | C32: 执行 | D32: 1131 | E32: 1 | F32: 创建NPC | G32: 2 | I32: 巴尔大叔2
A33: 30004 | B33: 1338 | C33: 执行 | D33: 1233 | E33: 1 | F33: 切换状态 | G33: 1 | H33: pre_free | I33: 小恶魔
A34: 30004 | B34: 1333 | C34: 执行 | D34: 1231 | E34: 1 | F34: 创建NPC | G34: 3 | I34: 冰霜恶魔
A35: 30004 | B35: 1334 | C35: 执行 | D35: 1232 | E35: 1 | F35: 创建NPC | G35: 4 | I35: 黑暗传送门
A36: 30004 | B36: 1335 | C36: 执行 | D36: 1232 | E36: 1 | F36: 创建NPC | G36: 5 | I36: 村长4
A37: 30004 | B37: 1336 | C37: 执行 | D37: 1232 | E37: 1 | F37: 创建NPC | G37: 7 | I37: 恶魔护卫
A38: 30004 | B38: 1337 | C38: 执行 | D38: 1232 | E38: 1 | F38: 创建NPC | G38: 8 | I38: 唤魔大师
A39: 30005 | B39: 1141 | C39: 时间 | D39: 0 | E39: 1
A40: 30005 | B40: 1241 | C40: 事件 | D40: 1 | E40: over
A41: 30005 | B41: 1242 | C41: 事件 | D41: 2 | E41: over
A42: 30005 | B42: 1341 | C42: 执行 | D42: 1141 | E42: 1 | F42: 创建NPC | G42: 1 | I42: 精灵龙
A43: 30005 | B43: 1382 | C43: 执行 | D43: 1143 | E43: 1 | F43: 切换状态 | G43: 1 | H43: pre_free | I43: 精灵龙
A44: 30005 | B44: 1342 | C44: 执行 | D44: 1241 | E44: 1 | F44: 创建NPC | G44: 3 | I44: 英勇斗士1
A45: 30005 | B45: 1343 | C45: 执行 | D45: 1241 | E45: 1 | F45: 创建NPC | G45: 4 | I45: 猎魔神射1
A46: 30005 | B46: 1344 | C46: 执行 | D46: 1241 | E46: 1 | F46: 创建NPC | G46: 5 | I46: 毁灭魔导1
A47: 30005 | B47: 1345 | C47: 执行 | D47: 1142 | E47: 1 | F47: 创建NPC | G47: 2 | I47: 食人花妖
A48: 30005 | B48: 1346 | C48: 执行 | D48: 1142 | E48: 1 | F48: 移除NPC | G48: 3 | I48: 英勇斗士1
A49: 30005 | B49: 1347 | C49: 执行 | D49: 1142 | E49: 1 | F49: 移除NPC | G49: 4 | I49: 猎魔神射1
A50: 30005 | B50: 1348 | C50: 执行 | D50: 1142 | E50: 1 | F50: 移除NPC | G50: 5 | I50: 毁灭魔导1
A51: 30005 | B51: 1349 | C51: 执行 | D51: 1142 | E51: 1 | F51: 创建NPC | G51: 13 | I51: 英勇斗士4
A52: 30005 | B52: 1350 | C52: 执行 | D52: 1142 | E52: 1 | F52: 创建NPC | G52: 14 | I52: 毁灭魔导4
A53: 30005 | B53: 1351 | C53: 执行 | D53: 1142 | E53: 1 | F53: 创建NPC | G53: 15 | I53: 猎魔神射4
A54: 30005 | B54: 1352 | C54: 执行 | D54: 1242 | E54: 1 | F54: 创建NPC | G54: 7 | I54: 英勇斗士2
A55: 30005 | B55: 1353 | C55: 执行 | D55: 1242 | E55: 1 | F55: 创建NPC | G55: 10 | I55: 猎魔神射2
A56: 30005 | B56: 1354 | C56: 执行 | D56: 1242 | E56: 1 | F56: 创建NPC | G56: 11 | I56: 毁灭魔导2
A57: 30005 | B57: 1355 | C57: 执行 | D57: 1242 | E57: 1 | F57: 移除NPC | G57: 13
A58: 30005 | B58: 1356 | C58: 执行 | D58: 1242 | E58: 1 | F58: 移除NPC | G58: 14
A59: 30005 | B59: 1357 | C59: 执行 | D59: 1242 | E59: 1 | F59: 移除NPC | G59: 15
A60: 30005 | B60: 1358 | C60: 执行 | D60: 1243 | E60: 1 | F60: 创建NPC | G60: 16 | I60: 哥布林村长
A61: 30005 | B61: 1359 | C61: 执行 | D61: 1243 | E61: 1 | F61: 创建NPC | G61: 17 | I61: 疯狂的哥布林
A62: 30005 | B62: 1381 | C62: 执行 | D62: 1243 | E62: 1 | F62: 创建NPC | G62: 19 | I62: 哥布林统领
A63: 30005 | B63: 1383 | C63: 执行 | D63: 1144 | E63: 1 | F63: 切换状态 | G63: 17 | H63: pre_free | I63: 疯狂的哥布林
A64: 30005 | B64: 1384 | C64: 执行 | D64: 1144 | E64: 1 | F64: 切换状态 | G64: 19 | H64: pre_free | I64: 哥布林统领
A65: 30005 | B65: 1360 | C65: 执行 | D65: 1145 | E65: 1 | F65: 创建NPC | G65: 18 | I65: 吸血蝙蝠
A66: 30005 | B66: 1388 | C66: 执行 | D66: 1146 | E66: 1 | F66: 切换状态 | G66: 18 | H66: pre_free | I66: 吸血蝙蝠
A67: 2000 | B67: 1161 | C67: 时间 | D67: 0 | E67: 1
A68: 2000 | B68: 1263 | C68: 事件 | D68: 5 | E68: over
A69: 2000 | B69: 1266 | C69: 事件 | D69: 7 | E69: over
A70: 2000 | B70: 1267 | C70: 事件 | D70: 16 | E70: over
A71: 2000 | B71: 1269 | C71: 事件 | D71: 3 | E71: over
A72: 2000 | B72: 1361 | C72: 执行 | D72: 1161 | E72: 1 | F72: 创建NPC | G72: 9 | I72: 断桥1
A73: 2000 | B73: 1362 | C73: 执行 | D73: 1161 | E73: 1 | F73: 创建NPC | G73: 13 | I73: 断桥2
A74: 2000 | B74: 1363 | C74: 执行 | D74: 1161 | E74: 1 | F74: 创建NPC | G74: 4 | I74: 虚空猎犬
A75: 2000 | B75: 1378 | C75: 执行 | D75: 1261 | E75: 1 | F75: 切换状态 | G75: 4 | H75: pre_free | I75: 虚空猎犬
A76: 2000 | B76: 1364 | C76: 执行 | D76: 1262 | E76: 1 | F76: 移除NPC | G76: 9 | I76: 断桥1
A77: 2000 | B77: 1365 | C77: 执行 | D77: 1273 | E77: 1 | F77: 创建NPC | G77: 5 | I77: 虚空魔眼
A78: 2000 | B78: 1379 | C78: 执行 | D78: 1271 | E78: 1 | F78: 切换状态 | G78: 5 | H78: pre_free | I78: 虚空魔眼
A79: 2000 | B79: 1366 | C79: 执行 | D79: 1263 | E79: 1 | F79: 创建NPC | G79: 1 | I79: 魔纹战魂1
A80: 2000 | B80: 1367 | C80: 执行 | D80: 1264 | E80: 1 | F80: 移除NPC | G80: 1 | I80: 魔纹战魂1
A81: 2000 | B81: 1368 | C81: 执行 | D81: 1264 | E81: 1 | F81: 创建NPC | G81: 6 | I81: 虚空行者
A82: 2000 | B82: 1369 | C82: 执行 | D82: 1265 | E82: 1 | F82: 移除NPC | G82: 13 | I82: 断桥2
A83: 2000 | B83: 1370 | C83: 执行 | D83: 1265 | E83: 1 | F83: 创建NPC | G83: 7 | I83: 虚空魔影
A84: 2000 | B84: 1377 | C84: 执行 | D84: 1265 | E84: 1 | F84: 创建NPC | G84: 16 | I84: 虚空魔颅
A85: 2000 | B85: 1386 | C85: 执行 | D85: 1272 | E85: 1 | F85: 切换状态 | G85: 7 | H85: pre_free | I85: 虚空魔影
A86: 2000 | B86: 1390 | C86: 执行 | D86: 1272 | E86: 1 | F86: 切换状态 | G86: 16 | H86: pre_free | I86: 虚空魔颅
A87: 2000 | B87: 1372 | C87: 执行 | D87: 1267 | E87: 1 | F87: 创建NPC | G87: 2 | I87: 黑袍人
A88: 2000 | B88: 1373 | C88: 执行 | D88: 1268 | E88: 1 | F88: 创建NPC | G88: 14 | I88: 断桥3
A89: 2000 | B89: 1374 | C89: 执行 | D89: 1270 | E89: 1 | F89: 移除NPC | G89: 2 | I89: 黑袍人
A90: 2000 | B90: 1375 | C90: 执行 | D90: 1270 | E90: 1 | F90: 创建NPC | G90: 3 | I90: 虚空魔龙
A91: 2000 | B91: 1376 | C91: 执行 | D91: 1269 | E91: 1 | F91: 创建NPC | G91: 17 | I91: 英勇斗士
A92: 2000 | B92: 1380 | C92: 执行 | D92: 1269 | E92: 1 | F92: 创建NPC | G92: 18 | I92: 毁灭魔导
A93: 2000 | B93: 1389 | C93: 执行 | D93: 1269 | E93: 1 | F93: 创建NPC | G93: 19 | I93: 猎魔神射
A94: 30011 | B94: 2101 | C94: 时间 | D94: 0 | E94: 1
A95: 30011 | B95: 2202 | C95: 事件 | D95: 4 | E95: over
A96: 30011 | B96: 2301 | C96: 执行 | D96: 2101 | E96: 1 | F96: 创建NPC | G96: 1 | I96: 圣光城卫1
A97: 30011 | B97: 2302 | C97: 执行 | D97: 2101 | E97: 1 | F97: 创建NPC | G97: 2 | I97: 圣光城卫2
A98: 30011 | B98: 2304 | C98: 执行 | D98: 2201 | E98: 1 | F98: 移除NPC | G98: 1
A99: 30011 | B99: 2305 | C99: 执行 | D99: 2201 | E99: 1 | F99: 移除NPC | G99: 2
A100: 30011 | B100: 2306 | C100: 执行 | D100: 2201 | E100: 1 | F100: 创建NPC | G100: 4 | I100: 圣光城卫3
A101: 30011 | B101: 2307 | C101: 执行 | D101: 2202 | E101: 1 | F101: 创建NPC | G101: 1
A102: 30011 | B102: 2308 | C102: 执行 | D102: 2202 | E102: 1 | F102: 创建NPC | G102: 2
A103: 30011 | B103: 2309 | C103: 执行 | D103: 2202 | E103: 1 | F103: 创建NPC | G103: 3 | I103: 猎魔神射6
A104: 30012 | B104: 2111 | C104: 时间 | D104: 0 | E104: 1
A105: 30012 | B105: 2212 | C105: 事件 | D105: 5 | E105: over
A106: 30012 | B106: 2311 | C106: 执行 | D106: 2111 | E106: 1 | F106: 创建NPC | G106: 1 | I106: 侍卫长1
A107: 30012 | B107: 2312 | C107: 执行 | D107: 2111 | E107: 1 | F107: 创建NPC | G107: 2 | I107: 坚岩卫1
A108: 30012 | B108: 2313 | C108: 执行 | D108: 2111 | E108: 1 | F108: 创建NPC | G108: 3 | I108: 坚岩卫2
A109: 30012 | B109: 2314 | C109: 执行 | D109: 2211 | E109: 1 | F109: 移除NPC | G109: 2
A110: 30012 | B110: 2315 | C110: 执行 | D110: 2211 | E110: 1 | F110: 移除NPC | G110: 3
A111: 30012 | B111: 2316 | C111: 执行 | D111: 2211 | E111: 1 | F111: 创建NPC | G111: 5 | I111: 坚岩卫3
A112: 30012 | B112: 2317 | C112: 执行 | D112: 2212 | E112: 1 | F112: 创建NPC | G112: 2
A113: 30012 | B113: 2318 | C113: 执行 | D113: 2212 | E113: 1 | F113: 创建NPC | G113: 3
A114: 30012 | B114: 2319 | C114: 执行 | D114: 2212 | E114: 1 | F114: 创建NPC | G114: 4 | I114: 微风剑士
A115: 10061 | B115: 2121 | C115: 时间 | D115: 0 | E115: 1
A116: 10061 | B116: 2221 | C116: 事件 | D116: 1 | E116: over
A117: 10061 | B117: 2321 | C117: 执行 | D117: 2121 | E117: 1 | F117: 创建NPC | G117: 1 | I117: 灾厄巨鼠1
A118: 10061 | B118: 2322 | C118: 执行 | D118: 2121 | E118: 1 | F118: 创建NPC | G118: 2 | I118: 大魔导师1
A119: 10061 | B119: 2324 | C119: 执行 | D119: 2121 | E119: 1 | F119: 创建NPC | G119: 4 | I119: 裂爪鼠魔1
A120: 10061 | B120: 2325 | C120: 执行 | D120: 2221 | E120: 1 | F120: 创建NPC | G120: 3 | I120: 蓝魂草
A121: 10062 | B121: 2131 | C121: 时间 | D121: 0 | E121: 1
A122: 10062 | B122: 2331 | C122: 执行 | D122: 2131 | E122: 1 | F122: 创建NPC | G122: 1 | I122: 结界1
A123: 10062 | B123: 2332 | C123: 执行 | D123: 2131 | E123: 1 | F123: 创建NPC | G123: 2 | I123: 大魔导师3

Sheet: taskEvent
A1: 事件类型 | B1: 事件参数 | C1: 添加任务 | D1: 删除任务 | E1: 删除任务道具
A2: eventType | B2: eventArg | C2: addTask | D2: removeTask | E2: removeItem
A3: level_up | B3: 30 | C3: [10304000]
A4: level_up | B4: 40 | D4: [10302001,10302002,10302003,10302004,10302011,10302012,10302013,10302014] | E4: [1012010,1012011]